user_detail_name,text,text 2,text 3,text 4,text 5,content_wrap,iplocation,,,,,attraction_name
baijing-bj,5分,超棒,景色5,趣味5,性价比5,山顶可以俯瞰香港景色，很漂亮，但山顶风很大，很冷，需要多穿衣服，我们是2月初去的。山顶缆车真是等不起，排队排了快两个小时，真不如坐公交车省时方便。,,,,,,太平山顶好评
234****646,5分,超棒,景色5,趣味5,性价比5,到了香港真的应该去这个地方，香港港湾的美景一览无余，我们是晚上去的，那天还有薄雾，比天晴时多一分别的韵味吧，在网上订好缆车往返票比现场买便宜很多。,,,,,,太平山顶好评
_WeCh****79247,5分,超棒,景色5,趣味4,性价比5,值得一游，无可替代的景色不止是到此一游，更多是情怀和体验及回忆！,IP属地:浙江,,,,,太平山顶好评
唯一YayA,5分,超棒,景色5,趣味5,性价比5,第二次来山顶看夜景了 一如既往的美丽 再回首尽然已经是15年前的事情,IP属地:上海,,,,,太平山顶好评
EdwinvanderSar,5分,超棒,景色5,趣味5,性价比5,太平山就是很多明星住的地方，刘德华成龙张学友等等，当然了这里也只是他们的一处豪宅罢了，山顶上还有个蜡像馆，里面还有很多美食。,,,,,,太平山顶好评
M36****0249,5分,超棒,景色5,趣味5,性价比5,"到太平山的时候是两点五十，让我们万万没想到的是工作日的中午排缆车的人也多到超乎想象。
看夜景排队仨小时吐血总结。我是真的晕菜，没想到会有这么多人。",,,,,,太平山顶好评
格格巴,4分,满意,景色4,趣味4,性价比3,已经是很久远的缆车上山了。刷八达通可直接排缆车，但价格与现场买票一样。网上购票还需排队换票，但有优惠很多。上缆车后，坐右边的位置观窗景要好很多。,,,,,,太平山顶好评
一泓茗茶,5分,超棒,景色5,趣味5,性价比5,香港太平山顶是香港富人区，许多名人都在这有别墅。坐大巴车一路盘旋向上，在山顶腑瞰这国际化大都市，维多利亚港湾就象一颗大蓝宝石镶嵌其中，璀璨夺目。,,,,,,太平山顶好评
迈伦文成公主,5分,超棒,景色5,趣味5,性价比4,来回缆车挺有意思，斜度很大，感觉就是蜗牛版过山车。山顶有个免费的三D拍照馆，可以玩啊玩的好开心。其实景色一般，排队的人太多了，八达通可以快一点。,,,,,,太平山顶好评
小马恒恒,5分,超棒,景色5,趣味5,性价比5,从山上看香港好美，能看到整个香港岛最繁华的地区和维多利亚港以及对面的九龙地区。可以坐缆车啦，不过排队真的时间好长啊，在网上买票可以节约很多时间。,,,,,,太平山顶好评
huan****u2006,5分,超棒,景色5,趣味5,性价比5,"呵呵呵爬的脚都快要断了，，，下次等人少再去坐缆车。。。。
嗯嗯十分不错，，风景还是挺好的，，半山上的住宅区着实让人羡慕哇啊啊",,,,,,太平山顶好评
贝小贝193,5分,超棒,景色5,趣味5,性价比5,特地买了红钻通道，结果去的早，没用上，如果人多又带着老人的话，还是很有必要买的，可以免排队，节省体力。凌霄阁要去，虽然就是看一眼，拍张照，但是很值得，可以俯瞰香港的高楼大厦，很壮观。,IP属地:江苏,,,,,太平山顶好评
拾壹     11        　?,4分,满意,景色4,趣味4,性价比4,太平山顶是俯瞰香港全景的最佳地点，尤其是维多利亚港和九龙半岛的景色，白天和夜晚各有特色。夜晚的灯光璀璨,IP属地:北京,,,,,太平山顶好评
M33****3621,5分,超棒,景色5,趣味5,性价比5,挺好的风景，舒服，缆车体验感很好。就是太多人科，要排队很久很久,IP属地:广东,,,,,太平山顶好评
莫莫,5分,超棒,景色5,趣味5,性价比5,到了香港游玩，这是必玩经典，俯瞰维多利亚港，看看富人住的地方。,IP属地:北京,,,,,太平山顶好评
LikeGor,5分,超棒,景色5,趣味5,性价比4,香港必去景点之一，可以看到整个香港的美景，令人流连忘返、心旷神怡。得先坐地铁到中环然后步行几百米，现场买票的话138港币。,IP属地:新疆,,,,,太平山顶好评
爱旅游的小伙伴吖,5分,超棒,景色5,趣味4,性价比5,我去的时候是白天，虽然美丽的夜景没看到，但是坐小火车去山顶的感受还是挺新奇的，一路可以欣赏到美丽的景色,,,,,,太平山顶好评
M36****5512,5分,超棒,景色5,趣味5,性价比5,"如果要去太 平山 一定要早点，5,6点人最多，大家都是想在上面看夜景。感受香港夜色，最适合的，便是太平山顶。居高临下，吹着海风，俯瞰这座繁华之都。",,,,,,太平山顶好评
ann_ywang,5分,超棒,景色5,趣味5,性价比5,香港太平山半山区，俯瞰可以看到浅水湾，继续向上可以通往山顶，海洋公园就在半山区。据说这里是香港中产阶级奋斗的第一个目标，只有先到达这里才有可能继续向太平山顶前进！,,,,,,太平山顶好评
埃米莉蒂的旅行,5分,超棒,景色5,趣味5,性价比5,首先，上山的小火车就很好玩了。很刺激。到了山顶，俯瞰高楼大厦，尽收眼底，感觉一切烦恼都没了。去了六次香港，只去了一次太平山顶，毕竟排队太累了。,,,,,,太平山顶好评
M29****8527,5分,超棒,景色5,趣味5,性价比5,建议提前携程网上买票，到了可以有单独的网上购票通道排队，会快一点。人非常多，建议早点去，需要足够耐心排队。坐小火车统一上山，风景很美，选个风和日丽的日子，我们去的时候有大雾看不太清楚,,,,,,太平山顶好评
很久很久很久以前,5分,超棒,景色5,趣味5,性价比5,位于香港岛西北部，是香港的标志性景点之一，由上往下俯瞰维多利亚港湾，欣赏香港高楼林立的城市风景与海上船只渡轮穿梭，在摩天台看的全景，很不错视线开阔，坐缆车要等，山上的餐厅也是各种爆棚,,,,,,太平山顶好评
自由的风,5分,超棒,景色5,,,总之，来到香港必须要去的景点。景点不大，人很多。缆车、杜莎夫人蜡像馆都打卡一下吧。下次再来可以搭公交车上山，不需要买缆车，蜡像馆也去一次足矣。,,,,,,太平山顶好评
齐齐齐齐齐,5分,超棒,景色5,,,不错。走团队通道确实比普通排队省很多时间。山顶风景美。还是晚上来比较好。后悔没在网上定阿甘虾餐厅。我们自己去点的。花了900多块。不过很值了。,,,,,,太平山顶好评
yangduoduo17,5分,超棒,,,,从上面看香港夜景非常不错，很好看，要坐缆车上去，价格还不错。,IP属地:广东,,,,,太平山顶好评
新-云,4分,满意,景色4,趣味3,性价比3,太平山顶是香港的最高点，据说海拔554米，在香港岛的西北部，这里一直是香港的标志，也是香港最受欢迎的名胜景点之一。山顶凌霄阁也是香港的一座特色建筑，位于香港岛太平山与歌赋山之间的炉峰峡上，亦是山顶缆车的终点站。它坐落于海拔396米高之处而非山顶最高处，设计突出却不破坏山景线，而凌霄阁最高处达海拔428米，在塔上能俯览维港两岸的香港的景致，是香港主要旅游景点之一。,,,,,,太平山顶好评
无语的风16,5分,超棒,景色4,趣味4,性价比4,香港真的是个寸土寸金的地方，山上都是30层以上的高楼，看着有点心慌慌呀，不知道这地基是怎么打的，难度看上去很高啊，盘山而上，风景不错，就是冬天去的，总是灰蒙蒙的，雾霾也是相当厉害的,,,,,,太平山顶好评
T-聆听,4分,满意,景色4,,,网上购票真的很方便，而且比当地购买优惠多了，就是去到太平山下，排队排得有点久，而且是室外排队的，比较热，排队2.-3个钟，坐缆车感觉只是最多10分钟希望能改善，合理缩短排队时间…另外，山顶的风景还是可以的，想去看香港夜景的，还是不错的选择…,,,,,,太平山顶好评
我是最坏滴,5分,超棒,景色5,,,携程购买很方便，在香港临时订的，大陆手机不能接收短信，携程发了邮箱，而且还有专门的导游微信群，有任何问题都可以咨询，回复很快很耐心，很不错，而且比现场买便宜很多。当时12点多上山，人很少，十多分钟就取了票了，摩天台风很大哦，吹的头疼，没等到晚上看夜景就下来了。个人觉得还是坐巴士比较好，坐缆车感觉头晕。下山直接在山顶坐的15路巴士直接坐到中环码头，坐天星小轮到尖沙咀。,,,,,,太平山顶好评
里朴岛元琛,4分,满意,景色4,趣味4,性价比4,我们是坐缆车上去的。票是在太子大厦买的，导游（香港的旅客游人如织，如果时间不是很充裕可以让导游带你过去。当然，导游还是很靠谱的）带队途中经过皇后大道红绿灯后左拐，就是香港首富李嘉诚的长江实业有限公司的正门。再右拐100米左右刘看到啦。（香港地狭人稠，很多建筑都是在山坡上）,,,,,,太平山顶好评
M86****12,5分,超棒,景色5,趣味5,性价比5,爬得最舒服的山了，很多不是阶梯就是平坦的路，到山顶可以喝奶茶吃麦当劳，三面环海，千岛耸立，人间仙境,,,,,,太平山顶好评
M36****7502,5分,超棒,景色5,趣味5,性价比5,从缆车的终点站凌霄阁出来，视野更好的卢吉道才是我们此行的目的地。此时落日的余晖已经将天际染上了金边，维港的百万景致已然浮现眼前。非常美丽！,,,,,,太平山顶好评
e00****02,5分,超棒,景色5,趣味4,性价比5,"免费的啊。

赴港过关，团签可以直接出关，不用再跟团什么的了，很方便。

赶上七一去的，见识了港人的热情。",,,,,,太平山顶好评
mmzzdd,5分,超棒,景色5,,,中环站k出口集合，然后随导游去山顶，需要排一小会儿队。虽然只是简单带路行程，但当地导游热情，仔细介绍了太平山景点的最佳观景时间，并推荐了周边的摩天轮和天星小轮景点，很实用。太平山,,,,,,太平山顶好评
e31****47,5分,超棒,景色5,趣味5,性价比5,我们在当地参团，能减少排队时间，山顶夜景很美，维多利亚港净收眼底。很多人在山顶拍照留念，如果想拍最佳取景点，那就让工作人员拍，价格也很贵。,,,,,,太平山顶好评
旅行博主小张,5分,超棒,景色5,趣味4,性价比4,走了近两个小时，才到，虽说太平山顶的夜景更值得一看，但是我认为白天的太平山有白天的美，晚上的则是另一种感受。晚上就是去维多利亚港看夜景了！,,,,,,太平山顶好评
一只77仔,5分,超棒,景色5,趣味5,性价比5,香港岛最高峰，是俯瞰香港及维多利亚港景色的绝佳地点。山顶一带更是官绅名流的官邸所在。至于喜欢郊游的人士，可以由此起步，漫步小径古道或挑战港岛径。交通是做缆车上来，看到此景很震撼,,,,,,太平山顶好评
天生哥,5分,超棒,景色5,趣味5,性价比5,太平山顶值得一去 山顶缆车体验45度上升俯瞰城市 去太平山顶俯瞰维多利亚港的夜，将红|码头，万家灯火尽收眼底。山顶吹凉风才最舒服，然后坐着小火车一路之下 风景宜人 感觉TVB再现的场面,,,,,,太平山顶好评
_WeCh****79334,5分,超棒,景色5,趣味5,性价比5,带孩子们乘缆车登上太平山顶，非常有意思的体验，说是缆车、其实是两节车厢的小火车，上的时候直上、下来是倒退着的，和在别处乘坐过的缆车都不一样。山顶可以俯瞰到整个儿维港，风景独好。,,,,,,太平山顶好评
匿名用户,5分,超棒,景色5,趣味4,性价比4,很值得去 景色很独特 很美 推荐在卢吉道散步，和在狮子亭拍照,IP属地:中国台湾,,,,,太平山顶好评
320****987,5分,超棒,景色5,趣味5,性价比5,地铁中环站出来，步行到山顶缆车站大约10分钟，排队坐缆车的人真的好多好多，我们拍了将近2个小时。缆车大约几分钟就可到达山顶，个人感觉坐在右手边风景比较好。,,,,,,太平山顶好评
旅行博主小张,5分,超棒,景色5,趣味5,性价比4,费了好大的劲，花了两个小时才登上太平山，真的也算蛮幸苦了，缆车的排队排到了半山腰，真的太可怕了，山顶的凌宵阁也算是一个商业广场，一般！,,,,,,太平山顶好评
331027486,5分,超棒,景色5,趣味5,性价比5,"傍晚时分前往太平山顶，看山顶日落，看华灯初上，看维港夜景，再乘坐缆车下车，一路上维港的灯光好似星光点点，梦幻，繁华，美丽，震撼。缆车的坡度很大，刺激好玩。
山上有很多好吃的。",IP属地:北京,,,,,太平山顶好评
匿名用户,5分,超棒,景色5,趣味5,性价比5,绝对值得一次体验的项目，每天有限制的时间！最高处可以俯瞰整个维港的景色，简直太舒服了，山顶除了热了一点，风吹着也舒服，整个山顶关键全方位无死角，在哪儿拍都能拍出大片的感觉。,IP属地:江苏,,,,,太平山顶好评
十月欣欣,4分,满意,景色4,趣味4,性价比4,去的时候看好天气 我是五月中去的 赶上了大雾 什么也看不见 等了一个多小时因为一直不刮风 雾根本散不开 拍照拍不了什么 肉眼看着都看不清底下的城市,IP属地:北京,,,,,太平山顶好评
天意,5分,超棒,景色5,趣味5,性价比5,太平山顶是香港的最高点，想上山顶只有两种办法，一种是徒步上去，这要耗费大量的体力，还有一种简单方便的方法，就是乘坐小火车，很快就到了，就是我上去那天阴天，看不清下面的景色。,,,,,,太平山顶好评
旅行博主小张,5分,超棒,景色5,趣味4,性价比4,太平山顶是香港的地标之一，也是香港的最高点，在这里可以俯瞰香港全景。其实在山顶设有多座观景台，有收费的，也有免费的。凌霄阁不是最高点，还要再爬二十分钟才能到！能看南湾景色！,,,,,,太平山顶好评
Kevin,4分,满意,景色4,趣味4,性价比4,香港人俗称的山顶，坐缆车上去，可以看到香港全景，山顶有一个不错的餐厅，还是米其林的，傍晚的时候还可以在山顶看日落哦，这个风景位很好。,,,,,,太平山顶好评
天意,5分,超棒,景色5,趣味5,性价比5,香港太平山顶是香港的最高点，一般游客来到香港都会到这个地方转转，到太平山顶要不走上去，要不就乘坐小火车上去。我上去这天正好赶上阴天，整个山顶都是云雾蒙蒙的，别有一番情调。,,,,,,太平山顶好评
M30****8811,5分,超棒,景色5,趣味5,性价比5,山顶缆车是来往中环花园道和太平山顶的交通工具，听说坐缆车上山很刺激，坐着夹角呈30度的缆车向山顶进发时，感觉就像飞起来。非常刺激。,,,,,,太平山顶好评
M37****5265,5分,超棒,景色5,趣味5,性价比5,山顶的游客之多是可想而知的，尤其经典角度，更是围个水泄不通。我们还算幸运，没多久便找到一个自认为经典的角度，开始各种拍。非常美丽。,,,,,,太平山顶好评
素素77,5分,超棒,景色5,趣味5,性价比5,很幸运在中秋节这一天，在太平山顶度过了一个难忘的夜晚。这晚的夜色迷人、月色太美，至今难以忘怀。圆圆的明月挂在山顶一侧，另一侧则是灯光璀璨的维多利亚港，此情此景，永世难忘。,,,,,,太平山顶好评
苏打小V,5分,超棒,景色5,趣味5,性价比5,太平山顶坐拥香港最棒的观景点，是香港最有名的景点之一。这里环境很好，也是豪宅区。建议从傍晚开始往山上走，傍晚到晚上的风景非常迷人。,,,,,,太平山顶好评
_WeCh****631538,5分,超棒,景色5,,,挺不错的美食，而且去的时候就餐人数不算多可以要求安排靠窗的位置，可惜那天雾气比较大，窗外风景欣赏不到太多，美食味道不错，主题餐厅布局完美，很多阿甘相关的事物都可以一一看到,,,,,,太平山顶好评
图拉州米娅,4分,满意,景色4,,,排队两小时 拍照五分钟 夜景很漂亮 但是晚上去的人超级多，也有可能是周五晚上的缘故。电子票换票需要排队，缆车也需要排队，香港的八达通地铁卡倒是可以直接刷卡进。建议不要周末去，一起买上蜡像馆的门票。,,,,,,太平山顶好评
130****5097,4分,满意,景色4,趣味4,性价比4,傍晚乘缆车上的山，买的是加观景台的联票。山下天是好好的，山上却是毛毛细雨。因为下雨的关系，所以看出来总是朦朦胧胧的，没有想象中的漂亮。楼下有个三维立体的场馆倒是值得一去。,,,,,,太平山顶好评
M30****2777,5分,超棒,景色5,趣味5,性价比5,一定要去的。只能感叹香港地理的得天独厚啊。华灯初上，到灯火全开，绝对是最经典的香港景色。而且基本看到七点就可以走了，也不会太晚。,,,,,,太平山顶好评
M37****9426,5分,超棒,景色5,趣味5,性价比5,太 平山 顶是 香港 的地标之一，也是 香港 的最高点，在这里可以俯瞰 香港 全景。山顶的游客之多是可想而知的，尤其经典角度，更是围个水泄不通。,,,,,,太平山顶好评
楼小楼梦非梦,5分,超棒,景色5,趣味5,性价比5,太平山顶是看香港全景的最佳位置，游客非常多。从这里可以把整个香港尽收眼底，蓝色的香江蜿蜒在众多高楼大厦之中。夜晚在香港的夜景也非常好看，灯光明媚，是非常适合出大片的地方,,,,,,太平山顶好评
khcc,4分,满意,景色4,趣味4,性价比4,太平山顶是香港著名旅游景点，这里拥有无敌的景色，可以100[%]观看整个香港岛的景色，加上附近豪宅林立，吸引了不少游客慕名前来。,,,,,,太平山顶好评
特斯尔沃周瑜,5分,超棒,景色4,趣味4,性价比4,坐巴士途中的感受和风景比较好，山上还行，主要是雾太大，所以风景一般。,,,,,,太平山顶好评
Sandy1017,4分,满意,景色5,趣味4,性价比4,哈哈，在太平山f勰恪Ｒ咕胺浅２诲e，值得欣p的香港景c之一。不^就是周末的排的人非常多，40分左右，上次好碰到突罟，非常多人排坐|。,,,,,,太平山顶好评
星野弥生,5分,超棒,景色5,趣味5,性价比5,从下午6点多排队，到几乎八点半才上车，虽然很热很累，但是晚点排队的人都排不上了，人实在是太多，景色很美，一片繁华景象，值得一去～,,,,,,太平山顶好评
M41****846,5分,超棒,景色5,趣味5,性价比5,买的套票，人很多排了很长的队。去了蜡像馆很好玩，太平山顶俯瞰维多利亚港夜景很美值得一去！一定要是晴天才看得到哦！建议买套票提前买好，不然排队时间更长，暑假人非常非常多！,,,,,,太平山顶好评
Andy1617,5分,超棒,景色4,趣味4,性价比3,景色还是很好的，听说晚上看风景很美。我去的时候是白天，而且太阳很大，很多外国友人的聚集地,,,,,,太平山顶好评
92808,5分,超棒,景色5,趣味5,性价比5,风景怡人，值得推荐！从缆车的设计，复古的内饰，到观景台的绝美景致：一览港岛美景及周边半山别墅的奢华……游览蜡像馆更是不可错过的环节，一众明星栩栩如生，游客争相合影留念,IP属地:广东,,,,,太平山顶好评
320****212,5分,超棒,景色5,趣味5,性价比5,12月底，山上还是有点凉的，所以最好多穿点衣服。凌霄阁还是一起买，比较划算。到顶上一看，整个香港夜景尽收眼底，香港就算没白来。,IP属地:上海,,,,,太平山顶好评
Ibo0622,5分,超棒,景色5,趣味5,性价比5,很可惜，跟妈妈去的时候山上起大雾，而且排队排了很久，但是不管怎样，这段美好的经历一直定格在我的内心深处，无法忘怀，美丽的你最棒,,,,,,太平山顶好评
阿里巴第二代,5分,超棒,景色5,趣味5,性价比5,香港山顶是很不错的观光点，特别是坐山顶缆车有种复古的感觉，慢慢悠悠的爬上山顶去看最美都市夜景，天气好的时候可以看到维港很不错。,,,,,,太平山顶好评
享受生活2013,5分,超棒,景色5,趣味5,性价比4,太平山是香港地区的地标，到香港旅游必去的景点之一，山上可参观的景点颇多，比如杜萨夫人蜡像馆，但最为有特色的还是俯瞰整个香港岛屿，无论是白天景观还是夜色，都很值得欣赏。,,,,,,太平山顶好评
M42****299,5分,超棒,景色5,趣味5,性价比5,中环排队近40分钟乘缆车上山，香港最高峰，从山顶俯瞰整个香港，美丽的维多利亚港，中环层叠的高楼大厦尽收眼底。山上的那些高级住宅会住着谁呢？环山小径绿树成荫，清凉宜人。,,,,,,太平山顶好评
lucyli9116,4分,满意,景色4,趣味4,性价比4,终于到了港剧中经常看到的太平山顶，人很多，我们上山下山都是打车，免去了排队之烦恼。个人认为山上的夜景没有维多利亚港的夜景漂亮。,,,,,,太平山顶好评
匿名用户,5分,超棒,景色5,趣味4,性价比5,香港必去的太平山顶，非常值得去，最好傍晚到山顶，白天和晚上的景色都可以看到，灯亮起的时候太漂亮了，香港的美景尽收眼底。坐小火车和巴士都行，体验不同，沿途景色也不同。,IP属地:中国香港,,,,,太平山顶好评
匿名用户,5分,超棒,景色5,趣味5,性价比5,从中环地铁站出来，沿着指示牌即可到达乘坐缆车的地方；缆车+蜡像馆+太平山顶都在一处，买票的话在手机上买套票也很方便，在闸机口扫二维码即可进入景点,IP属地:江苏,,,,,太平山顶好评
湖西的天空,5分,超棒,景色5,趣味5,性价比5,这里空间不是很大，但布置很集中，灯光渲染也很有氛围，和好朋友相聚真的太适合来这了，每年都会来两三次，已经成为我的聚会必备了。,IP属地:广东,,,,,太平山顶好评
M37****8764,5分,超棒,景色5,趣味5,性价比5,看夜景排队仨小时吐血总结。我是真的晕菜，没想到会有这么多人。此时落日的余晖已经将天际染上了金边，维港的百万景致已然浮现眼前。,,,,,,太平山顶好评
黄小囡Mila,5分,超棒,景色5,趣味5,性价比5,太平山顶真的是！！太港剧风了啦！风景也太好了，分分钟感觉在港剧现场，太平山顶位于香港的西北部，也是非常标志性的景点，必打卡！,,,,,,太平山顶好评
天意,5分,超棒,景色5,趣味5,性价比5,太平山顶是去香港必到的一个景点，坐着小火车上去，非常的有意思，就是那天天气不是太好，阴天，而且雾非常的大，现在山顶基本上看不见山底下的景色，下次有机会一定再去一次！,,,,,,太平山顶好评
微微一行,4分,满意,景色4,趣味4,性价比4,太平山顶远眺维多利亚港很漂亮，海港两边的城市都可以看到，最佳的观赏位置是沿着卢吉道走的观景平台，沿着道路走，可以明显的感受横看成岭侧成峰的感觉。,,,,,,太平山顶好评
onamaehasuki,5分,超棒,景色5,趣味5,性价比5,傍晚去小火车排队人很多，可以早点上去，七点钟就开始灯亮了，夜中环和维多利亚港尽收眼底,,,,,,太平山顶好评
Cerbers,5分,超棒,景色5,趣味5,性价比5,小火车很有特色，坡度比较大，尤其夜晚下山时。山顶能俯瞰香港，就是人多。可以免费领取导览器听取介绍。不乘车的话，也可以爬上山。,,,,,,太平山顶好评
匿名用户,5分,超棒,景色5,趣味4,性价比4,香港这个山顶广场的摩天台还是值得第一次去的，摩天大楼尽收眼底。对于多山的城市，可以坐缆车上山，不用爬上去，简直省了很多力气。大大的丰富了自己行程，提高了出游自由度,IP属地:广东,,,,,太平山顶好评
_M13****6699,4分,满意,景色4,趣味4,性价比5,看香港夜景必去的地方，傍晚的时候去最好，有轨道车、交通大吧、出租车都可以直达山顶，华灯初上时的维多利亚港十分迷人，远处的高楼霓虹闪耀，太平山是香港必去打卡的地方。,,,,,,太平山顶好评
aileenzhang,5分,超棒,,,,"10年的时间来往香港不下5-6次，
每次匆匆来急吼吼的走[尴尬]
这次总算可以兜兜转转[调皮]
坐着夹角呈30&#176;的缆车向太平山顶进发时，
感觉就像飞起来[偷笑]",,,,,,太平山顶好评
麻麻爱甜馨,4分,满意,景色4,趣味4,性价比4,太平山顶的缆车我在山下等了一个多小时，人实在太多啦，而且还是7、8月份去的，最热的时候，但是想着难得来一次，不体验不行啊还是很推荐的。从缆车上看下去景色很不错的。,,,,,,太平山顶好评
爱旅游的星星?,5分,超棒,景色5,趣味5,性价比5,香港的制高点，我是晚上去的，已经不错，但估计白天去拍照会更好看！直接在山下坐小火车上去，很不错，跟坐过山车似的，有点小激情,,,,,,太平山顶好评
