user_detail_name,text,text 2,text 3,text 4,text 5,content_wrap,iplocation,,,,,attraction_name
_WeCh****000506,5分,超棒,景色5,趣味5,性价比5,"从权臣和|的私宅，变至庆王永U的府邸，最终以恭亲王奕D的名字载入史册，再到民国辗转几经倒手。鼎盛时九亿两白银，衰落时宅邸变卖，终究逃不过“功名利禄逝如风，人死云散皆为空”，种种过往不过是为他人造梦，从贪婪到权谋，恭王府的一砖一瓦都在倾诉那个王朝的荣辱兴衰
	
??? 王府的变迁与清王朝的衰落
?  和|府邸时期：和|的权势滔天，府邸的奢华无度，映射了清朝中期的繁荣
?  安王府时期：和|倒台后，府邸转手庆王永U，见证了皇权的更迭
?  恭王府时期：奕D的入住，标志着恭王府名号的确立，也是清朝晚期的写照
?  民国时期：随着清王朝的灭亡，恭王府也经历了从私产到公管的转变，为一个时代画上了句号",IP属地:黑龙江,,,,,恭王府好评
M56****437,5分,超棒,景色5,趣味5,性价比5,恭王府，这座昔日皇家府邸，如今成为游客探秘清代文化的绝佳去处。步入其中，仿佛穿越回那个辉煌的年代。银安殿的庄严、后花园的雅致、大戏楼的独特，每一处都让人流连忘返。特别是福字碑，更是镇府之宝，让人感受到历史的厚重与文化的深邃。,IP属地:北京,,,,,恭王府好评
M35****7262,5分,超棒,景色5,趣味5,性价比5,恭王府是清朝规模最大的一座王府，曾是和|，恭亲王奕?的宅邸，景区面积较大，其中锡晋斋很有名，一根金丝楠木27亿，在门口可以闻到淡淡的金丝楠木香味。藏宝楼规模巨大十分震撼，花园中可以摸摸福字。总体来说十分值得参观。,IP属地:湖北,,,,,恭王府好评
张毓轩,5分,超棒,景色5,趣味5,性价比5,"恭王府游玩评价

恭王府，这座昔日皇家府邸，如今成为游客探秘清代文化的绝佳去处。步入其中，仿佛穿越回那个辉煌的年代。银安殿的庄严、后花园的雅致、大戏楼的独特，每一处都让人流连忘返。特别是福字碑，更是镇府之宝，让人感受到历史的厚重与文化的深邃。",IP属地:天津,,,,,恭王府好评
旅行体验人生,5分,超棒,景色5,趣味4,性价比4,"第一，恭王府值得一去。建筑留在那，历史就写在那。
第二，恭王府里后罩楼、福字碑、大戏楼、锡晋斋必去，不用文字讲解，直接看实物就很震撼。
第三，后罩楼11月底才会重新开放，目前正在装修，去了也看不到。",IP属地:广东,,,,,恭王府好评
a爱旅行的小琪～,5分,超棒,景色5,趣味5,性价比5,王府之秋｜一座恭王府，半部清代史||恭王府嘉乐堂的两颗两百多年银杏开始步入秋色。但下午的人群不是一般的多啊，有那么几刻，真的连站的地方都没有，后面跟保安大哥打听，据说一般周二人会相对较少,IP属地:广东,,,,,恭王府好评
大老张哥,5分,超棒,景色5,趣味5,性价比5,恭王府是国内目前保存最完整规模最大的王府。几经易手和坤被处后，恭亲王弈忻居住故名恭王府。假山太湖石，湖水小桥，辉煌古建无不让人赞叹！,IP属地:北京,,,,,恭王府好评
会吐泡面的小妖,5分,超棒,景色5,趣味5,性价比5,值得一看，经过修缮，建筑格局完整，是现存清王府最大，最全的一座。加上和|住过，有一些传奇的经历，本身也是旅游热点。住宅加上花园，保守要用半天时间游玩。,IP属地:北京,,,,,恭王府好评
老刘一直在路上,5分,超棒,景色5,趣味5,性价比5,"一起穿越回清朝，揭开恭王府的神秘面纱。这座位于北京什刹海北岸的皇家府邸，不仅是中国现存规模最大、保存最完整的王府，更是一段历史的见证者。为了对它有更好的了解我选择秀才说作为这次的向导！
?? 初入恭王府，就被它宏伟的建筑群所震撼。在导游的带领下，我们穿过府门，仿佛穿越了时空隧道，来到了一个充满故事的地方。
?? 银安殿是恭王府的正殿，这里曾是举行盛大仪式和庆典的地方。导游细致地讲解了殿内陈列的珍贵文物，每一件都承载着厚重的历史和文化。
?? 后花园则是另一番景象，这里亭台楼阁、小桥流水，美不胜收。导游告诉我们，这里被誉为“京师园林之冠”，每一处设计都充满了匠心独运。漫步在后花园，仿佛置身于一幅流动的山水画中。
?? 葆光室是恭王府的藏书阁，这里曾是恭亲王家族的学术中心。如今，虽然历经沧桑，但依然保留着大量的古籍善本。这里不仅是知识的宝库，更是文化传承的象征。
?? 整个游览过程中，导游不仅讲述了恭王府的历史变迁，还穿插了许多生动的故事。从和|的贪腐到恭亲王的廉政，每一个故事都让我对这座府邸有了更深的了解。
?? 恭王府的每一处都是拍照的绝佳背景，无论是宏伟的建筑还是精致的园林，都能让你的朋友圈瞬间提升格调。
?? 小贴士：游览恭王府最好选择一个阳光明媚的天气，这样拍出来的照片更加美丽。另外，跟团游可以更深入地了解恭王府的历史和文化，千万不要错过导游的讲解哦！跟团真的很方便不用自己约票，还可以对这里有更加深刻的了解。",IP属地:辽宁,,,,,恭王府好评
郭润龙浪迹天涯,5分,超棒,景色5,趣味5,性价比5,"20230523上午：
1、“恭王府”是现存规模最大、保存最完整的清代王府建筑群，先后作为和|、庆亲王永U、恭亲王奕?的府邸，见证了清王朝从鼎盛到衰亡的历史，故有“一座恭王府，半部清代史”的说法。王府是《还珠格格》、《铁齿铜牙纪晓岚》、《宰相刘罗锅》等影视剧的拍摄地，由府邸（三路五进院）和花园“萃锦园”两部分组成，门口可租电子讲解器。
①地址：北京市西城区前海西街17号。
②交通：公交直达，开车很好停。
③旺季：无。
④用时：3小时。
2、恭王府始建于清乾隆四十二年（1777年），原址是明代旧园，3年后御赐此地给和|，和|用时4年建成此府；嘉庆四年（1799年）和|被赐死抄家，宅邸赐予庆王爱新觉罗?永U，共传承5代；道光三十年（1850年），恭亲王爱新觉罗?奕?被御赐此府，2年后搬入，传承2代；民国元年（1912年）清帝退位后，恭王府及府内资产归属王公；民国二十六年（1937年），王府主人爱新觉罗?溥伟（奕?之孙）病逝后，王府被拍卖给辅仁大学；新中国成立后王府先后被多座院校使用，1962年重修后对外开放。
3、中路是王府主轴，是礼仪路不住人，自南向北为：
①一、二宫门：9×7=63颗门钉的规制仅次于皇室规制9×9=81颗。
②银安殿：举行重大仪式庆典的正殿，民国十年（1921年）元宵节烧香时失火烧毁，与东西配殿一同复建于2007年。殿内目前是“清代王府文化展”，用图文、文物、道具展示了北京60多座王府的分布及其文化。
③嘉乐堂：和|所建并留有《嘉乐堂诗集》，是举行满族传统宗教萨满教仪式的场所，与紫禁城“坤宁宫”职能相同。堂东侧房间是王爷或继承人的婚房。堂内目前是古建筑研究保护展览，有很多木制古建筑模型和构件。
④后罩楼：最后一排的连体二层建筑，中部小门通往花园，共50多间分3楼，俗称“99间半”。最西是“宝约楼”，楼内是“曾获良驹”绘画展，展示了恭王府收藏的部分字画，以马为主；中间是佛堂；东侧的“瞻霁楼”是“曾佑和教授捐赠家具展”，陈列7件明代黄花梨家具（只能隔窗看），由德国汉学家古斯塔夫?艾克于民国期间在中国任教时收藏，2006年由他夫人、美国夏威夷大学教授曾佑和捐赠给景区，曾佑和就读辅仁大学时住在恭王府宿舍内，他丈夫也曾是辅仁大学教授，此婚事1945年轰动北平。
4、东路是和|儿子的住所，古代“东为上、西为下”…

字数超限，在最后一张图片里继续。",IP属地:山东,,,,,恭王府好评
小星星201908,5分,超棒,景色5,趣味5,性价比5,"一、前期攻略
有恭王府时间，建议全程控制在3个小时，这样不会太赶，可以乘坐地铁6号线到北海北下车，从B口出来左转，沿着胡同一直走大概10分钟，左侧便是恭王府出口和入口。门票是40元，可以随买即进，切记一点现在去需要72小时核酸。进门后建议请个讲解，单人请200，可以找几个人拼，6人以上40一个人。
二、游览攻略
恭王府是清代规模最大的一座王府建筑群，历经了清王朝由鼎盛而至衰亡的历史进程，承载了极其丰富的历史文化信息，故有了“一座恭王府，半部清代史”的说法。恭王府府邸建筑清晰地分为东路建筑、中路建筑、西路建筑、后罩楼，各路建筑严谨地按照轴线对称方式由南向北贯穿于整个住宅与院落，布局分明。
府邸建筑
中路建筑
中路主要有银安殿和嘉乐堂两大建筑。

银安殿，俗称银銮殿，是王府中的主体建筑，也是王府的正殿，主要用于举办府内重大礼节性的活动，只有重大事件或节日才会使用。1921年，因主人烧香不慎失火，大殿同东西配殿一起焚毁，但此殿高大的气魄仍然可以让我们感受到当年威严肃穆的王府气派。银安殿面阔五间，歇山顶，正殿用绿色琉璃瓦。其建筑上的彩绘不能使用皇帝专用的和玺彩画，但可以用旋子彩画中等级最高的，如金琢墨石碾玉，龙锦枋心，套殿可用墨线小点金，大殿井口天花可用坐龙。
嘉乐堂位于银安殿后面，是恭王府中路建筑的最后一进正厅，前出廊，五开间，硬山顶。大门正上方悬“嘉乐堂”匾额。
东路建筑
东路的前院是多福轩，后进院是乐道堂。
前院多福轩是穿堂客厅，次厅主要作用是接待客人、亲戚或来回禀事物的下属，还可以存放皇帝送来的礼物等。当时厅内四周挂满福寿字匾，屋内摆设都是根据历史照片，按照原来情况布置的 ，陈列着许多有关恭王府的历史照片。
后进院落正房名“乐道堂”，是东路建筑中最大的一间。在恭亲王时代，这里是他日常居所。恭亲王奕D皇子在此时，道光帝曾赐予“乐道堂”匾额，所以此处或许也是因此而得名。
西路建筑
西路建筑与庭院相对中路与东路更为雅致，主体建筑为葆光室和锡晋斋。
葆光室位于府邸西路，在和|与庆王时期为客厅，在恭亲王时期是秘密客厅，接待王爷至亲所用。其中最精致的是葆光室，其里外屋檐都是绘制彩画，最让人惊叹的是中外屋檐的彩绘，都是当时全国最高水平的彩画技术师绘制，同样内檐的彩画也是美轮美奂，“府里面廊檐下的金色图案都是镀的真金”。早在清朝，这里是道光皇帝祭奠先人之后的休憩地。",IP属地:北京,,,,,恭王府好评
yangnizi,5分,超棒,景色5,趣味5,性价比5,"恭王府（Prince Kung&#39;s Mansion），位于北京市西城区柳荫街，为全国重点文物保护单位，中国国家一级博物馆，国家AAAAA级旅游景区，是清代规模最大的一座王府建筑群，曾先后作为清乾隆时期权臣和|、清嘉庆时期庆僖亲王永U的宅邸，咸丰元年（1851年）清廷赐封此宅邸于恭亲王奕D，恭王府的名称也因此得来。
恭王府规模宏大，总占地面积6万平方米，分为府邸和花园两部分，拥有各式建筑群落30多处，历经了清王朝由鼎盛而至衰亡的历史进程，承载了极其丰富的历史文化信息，故有了“一座恭王府，半部清代史”的说法。",,,,,,恭王府好评
ca****y,5分,超棒,景色5,趣味5,性价比5,"朋友来了北京，当然要带着游览一下恭王府。现在是保存最完整的王府建筑，很齐全。相比较其他的王府，要么是四分五裂的变成了大杂院，要么被各个单位占据，要么没落的不成样子。这里的建筑群落有30多处，布局讲究，气派非凡。
原本是和|的府邸，历经了清王朝由鼎盛至衰亡的历史进程，所以说有“一座恭王府，半部清代史”的说法。",,,,,,恭王府好评
9049,5分,超棒,景色5,趣味5,性价比5,很遗憾，去的时候恭王府没开门，看看简介吧。这里是清代规模最大的一座王府建筑群，曾先后作为清乾隆时期权臣和|、清嘉庆时期庆僖亲王永U的宅邸，（1851年）清廷赐封此宅邸于恭亲王奕D，恭王府的名称也因此得来。,,,,,,恭王府好评
吖包-开心,5分,超棒,景色5,趣味4,性价比5,"4-10月开放时间 8：00-17：00（停止售票）
11-3月 开放时间 9:00-16:00（停止售票）
周一闭馆哦~合理安排出行

票价40元

交通
乘坐公交3路、13路、42路、107路、111路、118路、612路、701路或观光3线至北海北门站下车。
地铁
乘坐地铁6号线，北海北站下车，B东北口出。线路1：沿三座桥胡同前行200米；线路2：沿龙头井街前行300米。

热门景点，人数肯定不少，想要认真研究历史建筑还是要找个周一到周五的时间，先看好资料再前往观赏。建筑保护的很好，每一处都有故事。周边也是很有特色的胡同，可以一起参观。府内亭台楼阁，水榭楼台应有尽有，是了解历史和中国建筑的好地方。

喜欢点个赞~",,,,,,恭王府好评
萱仔Bee,5分,超棒,景色5,趣味5,性价比4,"我是散客自由行，出发前买的讲解，到地方现扫码买票，买40块钱那个就行。遇到好多旅行团，年纪大的人为主，乌央乌央的，吵的头有点大，听不清耳机里的讲解...我买的那个自动讲解不好，不带地图自动定位功能，一开始曾一度我把自己逛懵圈了里面景色非常漂亮，就是有一少部分房屋和走廊真的需要重新漆一下了，都斑驳的快看不清了。里面能拜佛的地方很多，大概有四五处～很喜欢大戏楼那个地方。福字碑那里只让隔着玻璃摸一下，不允许照相，我也随大流摸了一下，有种麻麻的感觉不知道是不是人太多产生了错觉...福字碑上面的揽月阁是整个王府的制高点，感觉不错，就是人太多。在湖心亭里坐着吹会小风儿，闭上眼，好像还真有点贵族的感觉～哈哈哈～总之，虽然电子讲解我这次弄得比较屎，但是还是蛮好玩的！强烈推荐～
对～这次还碰见了博山琉璃展，有些作品真的很棒，很有童趣，很有意境，也有很美的。出来之后大门正对一家卖秘制酸梅汤的，10块一杯，这才真的是正宗酸梅汤，没有什么乱七八糟香精味或者陈皮味或者其他什么玫瑰味之类乱七八糟的味道，就是梅子味，很清爽也很解渴，墙裂推荐来一杯～",,,,,,恭王府好评
随性的小心,5分,超棒,景色5,趣味5,性价比5,到北京一定要去趟恭王府，&quot;一座恭王府，半部清代史&quot;，在这里你可以亲手触摸康熙御笔――秘云洞里的福字碑，可以到锡晋殿见识下用贵比黄金的楠木建造的楠木殿，可以游览到保存最完整的清代王府。。。。而且这座王府建造在什刹海旁，交通及其方便，周围景点众多，还可以顺便逛逛极有特色的北京胡同！,,,,,,恭王府好评
He＿zhihong,5分,超棒,景色5,趣味5,性价比5,恭王府还是很值得一看的，据说里面有9999只蝙蝠，是利用木雕，石雕或铸件等装饰在建筑的各个地方，你可要细细查找哦！另外天下第一福源的福字可是大有讲究，一个字里竟有多，才，田，福，寿这么多的字意，你说神奇不神奇？人们都有手在福字上摸上一圈，然后抓在手里，再送给你的亲人朋友和你要祝福的所有人。,IP属地:山西,,,,,恭王府好评
小刚刚?,5分,超棒,景色5,趣味5,性价比5,"半天的行程，去故宫是来不及了。
恭王府是个很不错的选择，恭王府位于北京市西城区前海西街，曾是大贪官和坤的宅邸，后被赐予恭亲王奕新，由此得名恭王府，并沿用至今。恭王府的地理位置绝佳，古人修宅建园很注重风水。",IP属地:河北,,,,,恭王府好评
so楠,5分,超棒,景色5,趣味5,性价比5,"位置
恭王府位于前海西街17号,是清代规模最大的一座王府
交通
地铁：乘坐北京地铁6号线，北海北站下车，B东北口出。
公交：乘坐北京公交3路、4路、13路、42路、107路、111路、118路、612路或观光3线至北海北门站下车。
 门票：成人40   学生票老人票20

认真看的话，3个小时左右就看完了。里面展厅很多，人最多的地方大概就数那个福字碑哪里了，高峰期得排队。
一座恭王府，半部清朝史”。恭王府经历了康乾盛世到清朝灭亡，跨越了两百年的历史。恭王府也是现存王府中保存最完整清王府，王府内有一座被称为“天下第一福”的石牌更是让许多游客慕名而来。
恭王府萃锦园内有一座太湖石假山，山脚下有个秘云洞，洞府正中央石壁上有一座康熙御笔的福字碑。每天来这里请福的人络绎不绝，人人都想亲手摸一下这公认为“天下第一灵验”的福字，好“沾一沾福气”。",,,,,,恭王府好评
栊笑爻,5分,超棒,景色5,趣味5,性价比5,"值得去的有俩处，一个是假山下的看康熙手书福字，一个是周汝昌手稿。
出府后胡同里有很多拉生意的黄包车类，沿着后海西海前海绕一圈，经过很对胡同和四合院。四人200元（从300块砍下来）。",,,,,,恭王府好评
new2000th,5分,超棒,景色5,趣味5,性价比5,备课恭王府，历经半年修葺，今天第一天重新营业，人不多。十年前恭王府刚刚对外开放，我来游览，只觉好大一个宅子尔尔。如今再次走进这所宅子，已经明白了她不同寻常的过往。时间，才是一面镜子，它能清晰的让人看见变与不变。,,,,,,恭王府好评
与神同行abc,5分,超棒,景色5,趣味5,性价比5,恭王府是一处融合了历史文化与美丽景色的古典园林，具有极高的趣味性。这里不仅有精美的建筑群和别具一格的庭院布局，还能通过展品了解清朝王府的生活。景色上，恭王府的园林设计别致，绿树成荫，湖泊、假山错落有致，令人流连忘返。性价比方面，门票相对合理，参观时能获得丰富的历史文化体验，绝对值得一游。恭王府既适合历史爱好者，也适合喜欢园林景观的游客。,IP属地:日本,,,,,恭王府好评
yjw2000,5分,超棒,景色5,趣味5,性价比5,"恭王府，为清代规模最大的一座王府，也是唯一一座对公众开放的清代王府。曾先后作为和|、永U的宅邸。1851年恭亲王奕D成为宅子的主人，恭王府的名称也因此得来。
恭王府是位于风景秀丽的北京什刹海的西南角的一座王府，坐落于一条静谧悠长、绿柳荫荫的街巷之中，它就是现存王府中保存最完整的王府。“月牙河绕宅如龙蟠，西山远望如虎踞”，这是史书上对恭王府的描述。就其选址而言，它占据京城绝佳的位置。古人修宅建园很注重风水，北京据说有两条龙脉，一是土龙，即故宫的龙脉；二是水龙，指后海和北海一线，而恭王府正好在后海和北海之间的连接线上，即龙脉上，因此风水非常的好。古人以水为财，在恭王府内“处处见水”，最大的湖心亭的水，是从玉泉湖引进来的，而且只内入不外流，因此更符合风水学敛财的说法。我国十大元帅和郭沫若等人、均在恭王府的附近居住，而且都非常长寿。据说，北京长寿老人最多的地方就是在恭王府附近，这个地方真是一块风水宝地。
府邸建筑分东、中、西三路，每路由南自北都是以严格的中轴线贯穿着的多进四合院落组成。中路最主要的建筑是银安殿和嘉乐堂，殿堂屋顶采用绿琉璃瓦，显示了中路的威严气派，同时也是亲王身份的体现。东路的前院正房名为多福轩，厅前有一架长了两百多年的藤萝，至今仍长势甚好，在京城极为罕见。东路的后进院落正房名为“乐道堂”，是当年恭亲王奕欣的起居处。西路的四合院落较为小巧精致，主体建筑为葆光室和锡晋斋。精品之作当属高大气派的锡晋斋，大厅内有雕饰精美的楠木隔段，为和|仿紫禁城宁寿宫式样。府邸最深处横有一座两层的后罩楼，东西长达156米，后墙共开88扇窗户，内有108间房，俗称“99间半”。",IP属地:河北,,,,,恭王府好评
峰行天下第一,5分,超棒,景色5,趣味5,性价比5,“一座恭王府，半部清朝史”。恭王府作为一处历史文化名胜古迹，它曾先后是和|、永U、奕?的宅邸。恭王府目睹了清王朝自鼎盛到衰亡的全过程，也留给我们后人很多关于清朝历史的故事与文化。而它本身也随着王朝的覆灭而迅速衰落。这座历史上曾显赫一时的王府，历经了大清王朝乾隆、嘉庆、道光、咸丰、同治、光绪、宣统凡七代皇帝的统治，见证了清朝由鼎盛而至衰亡的历史，现在作为文化古迹供世人参观，也仍向后人述说着关于它的历史故事。,,,,,,恭王府好评
XY_Shirley,5分,超棒,景色5,趣味5,性价比5,"逛完南锣鼓巷
地铁六号线一站到北海北
步行约500米穿一条胡同就来到恭王府
恭王府是清朝规模最大的一座王府
先后作为和|、永U的府邸
而后恭亲王奕?成为宅子的主人
恭王府的名称也由此而来
据说恭王府历经了清王朝由鼎盛而至衰亡的历史进程
极具历史文化意义
也因此有了“一座恭王府，半部清代史”的说法
我曾经在十几年参观过一次
印象中还在这里喝过大碗茶
看过大戏
恭王府规模弘大
建筑布局规整
楼阁交错
将皇室奢华的贵族风范和清新雅致的风韵相结合
非常值得细细品味
时值旅游旺季
游人如织
纷纷扰扰
略有小失望",,,,,,恭王府好评
cycat20,5分,超棒,景色5,趣味5,性价比5,位于故宫的西北方向，什刹海附近。最早是和|的府邸，抄家后又被传过几个贝勒爷。虽然没有故宫那么大气，但是作为一家王府那也是无出其右了（和|的身家不用怀疑吧）。整体风格融合了皇家宫殿+苏州园林，值得一看。,,,,,,恭王府好评
胖乎乎福哒哒,4分,满意,景色4,趣味4,性价比4,两月份去的，从地铁出来，往餐厅边上小路一直走就能看到大指示牌了。恭王府是以前大臣和|的府邸，民间有句话叫“和|跌倒，嘉庆吃饱”。也就是说嘉庆皇帝抄和|家时，抄出来的财宝让国库都不用发愁了。里面的开放的房间几乎都有玻璃隔断，隔着玻璃往里面看，家具、装修等真的极尽豪华。就是有一个叫大戏院的不开放，大门紧闭，上面只写接待系列游团客，每人70元，也没看到售票点。很多慕名而来的人只能失望站在外面，不知道为什么不能也像其他房间一样用玻璃隔断，票价再涨点，好让更多人欣赏呢。,,,,,,恭王府好评
苦海无边，望不到岸,5分,超棒,景色5,趣味5,性价比5,"恭王府的前身是“和府”，顾名思义就是和|的府邸。
它的第一代主人就是大贪官和|，也唯有如此财力的人才能建造出如此的惊世之作。
“和府”被嘉庆收回后，作为礼物赏赐给爱新觉罗永鳞。
爱新觉罗永鳞，能在诡谲云涌的时局下全身而退，可见其才能卓越，在他的使用维护下，“和府”更名庆王府，而且添置了不少好东西。
后来因为子孙后代爵位不够，庆王府又被咸丰帝收了回去，转而赐给了自己的弟弟恭亲王奕诉，庆王府更名“恭王府”自此再无改变，此时清王朝已处在风雨飘摇的乱世之中。",,,,,,恭王府好评
卜一样的旅行,5分,超棒,景色5,趣味5,性价比5,恭王府是全国重点文物保护单位，为清代规模最大的一座王府，曾先后作为和|、永U的宅邸。1851年恭亲王奕D成为这所宅子的第三代主人，改名恭王府。恭王府规模宏大，占地约6万平方米，分为府邸和花园两部分，拥有各式建筑群落30多处，布局讲究，气派非凡。,,,,,,恭王府好评
excaliburfairy,5分,超棒,景色5,趣味5,性价比5,坐地铁6号线在北海北站下车。估计是疫情期间吧，需要提前买票，如果没有买到票，那么就在门口刷官网小程序，刷别人是不是有退换票，我没有提前订票，在门口刷了半个多小时刷到了，恭王府是和|，庆王，恭亲王的府邸，有人推测也是曹雪芹的故居，因为后面的园子有大观园的雏形。总的来说，差不多要玩3-4个小时吧,,,,,,恭王府好评
小小导游爱旅游,5分,超棒,景色4,趣味3,性价比4,踏入恭王府，仿佛穿越回清朝贵族的奢华生活。府内雕梁画栋，精致典雅，每一处细节都透露着主人的品味与权势。漫步其中，不仅感叹于建筑的精美，更对那段历史充满了好奇与遐想。,IP属地:江苏,,,,,恭王府好评
