user_detail_name,text,text 2,text 3,text 4,text 5,content_wrap,iplocation,,,,,attraction_name
左右居中,5分,超棒,景色5,趣味5,性价比5,"恭王府是清代规模最大的一座王府，乾隆时期曾是大贪官和|的宅邸，晚期时恭亲王奕D成为宅子的主人。王府规模宏大，气派非凡，分为府邸和花园两部分，拥有各式建筑群落30多处。
恭王府承载着丰富的历史文化信息，有“一座恭王府，半部清代史”的说法。",,,,,,恭王府好评
更行更远的我,5分,超棒,景色5,趣味5,性价比5,保存完好的王府，三路五进的建筑，恢宏大气。后面的花园精致优雅。西洋门，福字碑，大戏楼等等，值得一看。此时三月末，府内的桃花已谢，海棠，迎春开的正好。老榆树上挂满了榆钱，银杏树也绽出新芽。特别是有两棵银杏树的枝桠连到一起很帅。,,,,,,恭王府好评
散香MKII,5分,超棒,景色5,趣味5,性价比5,路过北京一天，就决定去和大人家看看。恭王府在什刹海，从北海站下车穿过古朴的老胡同就到了。门票不贵，麻麻还可以打对折，性价比忒高。关注了恭王府的公众号，可以点选景点讲解，对于我们这种来看稀奇的人足够了。逛了大半天都没有逛完，和大人家太大了，富可敌国不是盖的，抄家的清单都那么长，据说很多连皇宫都没有或者数量上少于和大人，说明和大人真能哈钱啊乾隆皇帝真是看重他，这么好风水的地，这么贪都容忍了，必然是非常厉害的人物咯。虽然游人众多，还是耐不住和大人家面积大，还是找得到清净一点的院落坐，YY一下古代土壕的生活～,,,,,,恭王府好评
反正闲着也是闲着呀,5分,超棒,景色5,趣味5,性价比5,恭王府，还珠格格一二部拍摄地。作为著名的风水宝地，恭王府以“福”字贯穿始终，如今游人如织，都想来沾一沾恭王府的福气，甚至不惜重金请福回家。,,,,,,恭王府好评
心内的一首歌,5分,超棒,景色5,趣味5,性价比5,到北京恭王府是一定要去的，景色宜人，设计精巧，有时间的可以坐在湖心亭好好欣赏美景。买了带导游的门票，结果导游带着100多号游客浩浩荡荡的，啥也听不见，也跟不上，不如自己买门票进去，租个听讲器好一些。,,,,,,恭王府好评
快乐的小飞哥啊,5分,超棒,景色5,趣味5,性价比5,北京恭王府及花园，位于前海西沿、什刹海南岸，是清代规模最大的一座王府，曾先后为为和|、庆王永U的府邸。清咸丰元年（1851年）恭亲王奕D成为宅子的主人，恭王府的名称也因此得来。,IP属地:北京,,,,,恭王府好评
匿名用户,5分,超棒,景色5,趣味5,性价比5,了解历史，恭王府是北京保存最完整的清代王府，堪称“什刹海的明珠”。“月牙河绕宅如龙蟠，西山远望如虎踞。”这是史书上对恭王府的描述。鉴于三代主人的关系，恭王府也有“一座恭王府，半部清代史”的说法。,IP属地:贵州,,,,,恭王府好评
lindsayfan,5分,超棒,景色5,趣味5,性价比5,个人认为除故宫外，恭王府是北京最值得去的一个景点。所谓“一座恭王府，半部清朝史”。“小小”的一座王府，却是清朝历史变迁的一个缩影。一砖一瓦，一草一木都有它的故事。一步一景，每次去都会有新的体验。,,,,,,恭王府好评
红糖泡泡,5分,超棒,景色5,趣味5,性价比5,恭王府是我国保存最为完整的王府建筑群，拥有各式建筑群落30多处，布局讲究，气派非凡。很值得一去。恭王府本是和|的府邸，历经了清王朝由鼎盛至衰亡的历史进程，故有“一座恭王府，半部清代史”的说法。,,,,,,恭王府好评
sunshinewhy,5分,超棒,景色5,趣味5,性价比3,前面的宫殿全是展览，被改的面目全非，后花园倒是让我兜兜转转了个遍，封闭式的大戏院没看到里面的装潢有点遗憾。福字碑有点声势过大。。。。其他还是不错的看得出王府家的别具一格。过年有个年画展还不错看,,,,,,恭王府好评
T邑f,5分,超棒,景色5,,,精致 不愧是王爷府 不愧是中堂府,,,,,,恭王府好评
jkidd28,5分,超棒,景色5,趣味5,性价比5,"一年四季，四景色，这里就是恭王府，春花，夏树，秋叶，冬雪，你来到拍照就是最美的画面！
了解清王朝历史，就从恭王府开始，“一个恭王府，半个清朝史”说它很重要一点不为过！",,,,,,恭王府好评
家在辽北,5分,超棒,景色5,趣味5,性价比5,来京多年，一直想看看有钱人的生活，想看看有钱人到达住着什么样的房子，正好周末无事，带着媳妇去前世界首富和|家去看看。去恭王府建议绿色出行，因为周边停车实在是困难，已经没有专属停车场，我也是找了好久，最后把车停在后海处。因为是5A级景点，所以游客较多，现场有点混乱，请保管好随身携带的物品。整个王府占地面积较大，有前厅、中厅、佛堂和后花园等，真的是应有尽有。不清楚现在的恭王府是否全部对游客开放，总觉得有一些地方没有看到。因为能住的房子太少了，不可能就你们几十间，这不正常。恭王府里的团队导游多、网红导游也不少，团队导游都是讲解大概、节奏快，网红导游说的更详细、节奏慢，看大姐实际，其实是没有必要租赁讲解设备的。整个景区错落有致、环境整洁、引导细心，没什么其他问题。总体来讲，特别推荐的一处旅游景点，门票好像才40元，还是5A级景点。,IP属地:北京,,,,,恭王府好评
羚羚羊2023,5分,超棒,景色5,趣味5,性价比5,"建议提前了解一下再来，不然真的像是走马观花。历史上的和|与影视剧差别还是挺大的。
恭王府位于西城区前海西街，乾隆年间始建，多次变更主人，是清代规模最大的一座王府建筑群，见证了清王朝从鼎盛到衰亡的过程。

恭王府起初叫“和第”。乾隆年间，和|权倾一时。他得知京城前海西岸有一块被“蟠龙水”环抱着的好地方，于是花重金买下并修建了“和第”。整体以后罩楼为界分为府邸和花园两部分。府邸气宇轩昂，花园景致变化无常，是中国园林建筑的典范。

嘉庆四年，乾隆驾崩后十天，嘉庆皇帝抄家和|，将府邸的西半部赐给庆郡王永U。同治时，慈禧太后将此宅赠予恭亲王奕忻，府邸更名为恭王府。恭亲王过世后，王府几经转手，在1982年被列为全国重点文物保护单位。2008年，恭王府完成修缮工程后，全面对外开放。",IP属地:山东,,,,,恭王府好评
西西是我,5分,超棒,景色5,趣味5,性价比5,"??详细地址：北京市西城区前海西街17号

??交通攻略：不适合自驾，附近停车位非常稀缺。建议地铁出行，六号线北海北站B口出来，步行2分钟就到恭王府了。

??开放时间：周二到周日，8:30-17:00，最晚入园16:00。

??门票价格：成人门票40元，学生门票20元。可以在携程或者微信公众号上预定，直接刷身份证入园，简单方便。

??亮点特色：恭王府是清代规模最大的一座王府建筑群。乾隆年间大学士和|奉旨建此府，后来咸丰皇帝赐封此宅邸于恭亲王奕D，恭王府的名称也因此得来。它历经了清王朝由鼎盛而至衰亡的历史进程，故有“一座恭王府，半部清代史”的说法。

?推荐理由：恭王府是前府邸后花园的建筑格局，府邸分为东路、中路、西路，各路建筑严谨地按照轴对称方式分布。中路主要有银安殿和嘉乐堂，东路是多福轩和乐道堂，西路建筑为葆光室和锡晋斋。佛楼/后罩楼在府邸和花园的连接处，是一座二层楼。后罩楼后檐墙上每开间都有形式不同的什锦窗。据说，和绅为了记住各类宝物在哪，就给每间屋子都做了记号，看到窗户的形状就知道藏了什么宝物。

?必体验：王府的地理位置在北京的水龙脉上，主财运。花园的入口西洋门是一座石质建筑，也是北京唯一一座保留下来的石质建筑，另外一处圆明园的远瀛观已经被毁。一进门有蝠池，后面有福字辈，最后面是蝠厅，可谓是步步是福。整个府邸有很多蝙蝠型状，门廊上有，床户上有，据说有一万只蝙蝠，被称为万福。福字碑值得一看，据说是康熙御笔，上面有宝印，福字包括了多子多才多田多寿，称为天下第一福。

??小Tips：推荐请个导游，一边听讲解，一边看王府。讲解主要集中在花园，可以仔细了解这个多财多福的府邸。5个人内一共200元，6人以上，每人40元。夏天的时候有文创冰棍，福字造型和后罩楼窗户造型，大家可以拍照留念。",,,,,,恭王府好评
休闲小浩哥,5分,超棒,景色5,趣味5,性价比5,"百年历史看天津,千年历史看北京――――夏天，12日暴走津京
北京第一天18-恭王府60
去过恭王府的游客都会被府内的布置所叹服，它集成了我国古代对风水宅院的传统文化，既有江南庭院的秀美，庭院楼阁、假山流水、碧莲翠竹，又有北方建筑的大气，在这里你能感受到我国建筑文化的底蕴。",,,,,,恭王府好评
在奔跑中,5分,超棒,景色5,趣味5,性价比5,恭王府是清朝时期最大的王府。占地6万O，是和坤的王府，他花3五年时间，数万金银珠宝而建成，占用了半部清代财富，可以和故宫相比美。恭王府以“一宝三绝＂而著名。一宝即金丝楠木柱，有68根，每根现价28亿人民币。三绝：一是花园大戏楼；二是西洋门；三是福字碑。还有藏金楼，存有各种玉佩，钟表，金冠，黄金，白银等数亿两。,,,,,,恭王府好评
M25****5054,5分,超棒,景色5,趣味4,性价比5,"王府文化值得一去，老北京的标配建筑群，地理位置，离北海公园不远，若是内蒙古来的朋友，坐高铁在清河站下车，坐13号地铁在霍营换乘8号地铁，然后在南锣鼓巷站出来，骑小蓝车或者小黄车8分种就到了。
【景色】王府文化的代表。
【趣味】可以",,,,,,恭王府好评
时光步旅,5分,超棒,景色5,趣味5,性价比5,恭王府是北京三环之内的一处古色古香的景点，也是我国清代规模最大的一处王府。虽然整体规模达到了6万平方米，但整体而言就是宅院和花园两大部分，走马观花地看不到一个小时就可以逛完，景点距离什刹海等景点的位置不远，适合下午逛完直接在附近体验市井和酒吧文化。,,,,,,恭王府好评
Karen晓喵,5分,超棒,景色5,趣味5,性价比5,恭王府位于北京市西城区柳荫街，是清代规模最大的一座王府，曾先后作为和|、永U的宅邸。1851年恭亲王奕D成为宅子的主人，恭王府的名称也因此得来。恭王府规模宏大，占地约6万平方米，分为府邸和花园两部分，拥有各式建筑群落30多处，布局讲究，气派非凡。,,,,,,恭王府好评
扶疏子,5分,超棒,景色5,趣味5,性价比5,恭王府始建于清朝乾隆年间，初为大学士和|的私邸。同治初年，这里的第三代主人恭亲王奕D，身兼议政王、军机领班大臣等要职，重权在握，显赫一时，乃大筑邸园，同时也对府邸部分进行了修缮与改建。我们看到的恭王府的建筑规模与格局，就是在那个时候最后形成的。,,,,,,恭王府好评
201****891,5分,超棒,景色5,趣味5,性价比5,"恭王府
北京的后海地区，坐落有很多王府。其中的恭王府，又因为它著名的两任主人，和|和奕?，而被世人所知，整个王府的结构和建筑也被保存的非常完好。
王府占地面积很大，前面一半似乎是的王府办公建筑，横平竖直、整整齐齐的排列，标准的几进院落，有走廊连接。后面则是有池塘、假山、亭台楼榭组成的后花园，面积差不多和前半部分一样。这里面最著名的是藏在假山山洞中的石刻福字，据说是康熙皇帝写的。差不多每个游客都会来参观，都会抹上一把，沾沾福气。
如果说前半部分建筑是庙堂般的中规中矩，则后面花园部分就是生动活泼了。
有条件的话，跟着导游走，听讲解，会了解很多。",,,,,,恭王府好评
只想做一只旅行青蛙,5分,超棒,景色5,趣味5,性价比5,恭王府在什刹海附近，是著名贪官和|的家，想去一睹豪宅真容，以及那块出名的印有“福”字的石头。进去之后感觉这简直就是缩小版的故宫嘛，前面是庭院后面是花园，我还意外发现了还珠格格香妃找蝴蝶的地方！真佩服我自己的眼力！,,,,,,恭王府好评
微言有信,5分,超棒,景色5,趣味5,性价比5,"恭王府前半部是富丽堂皇的府邸，后半部是古典园林，府邸建筑堂皇庄重，明廊通脊，府后的萃锦园则衔水环山，古树参天，曲廊亭榭。
恭王府最后主人是清末的恭亲王，故而得名恭王府，是大清鼎鼎巨贪和|和大人的府邸，所以也有人称之为和坤花园。看恭王府一定要听导游讲解，故事繁多。
联想和坤权顷朝野，敛财无度，富可敌国，终落得抄家灭门的下场，警醒世人知足常乐，钱财终是身外之物，不如跟随携程游山玩水，领略地球村无限风景。",,,,,,恭王府好评
老虬,5分,超棒,景色5,趣味5,性价比5,恭王府坐落在北京市区，王府面积很大，前门进去是王府院落，后面是王府花园，按照江南园林格局，假山，池塘，林木，花卉，门洞，亭台，楼阁。。。样样具备，精致，奢华，园内戏台，建筑的雕刻，都极尽奢靡，假山里的“福”字，池塘边的杨柳，透过杨柳，隐约可见建筑在池塘里的倒影，风吹杨柳，略过池塘，吹皱一池春水，泛起涟漪，犹如一曲曲乐谱。恭王府交通便利，门票不贵，是一处值得一游之地。,,,,,,恭王府好评
卡夫卡-01,5分,超棒,景色5,趣味4,性价比4,"恭王府是中国现在唯一保存毕竟完整的一座清代王府。住过两个历史名人，一个是和|，一个是咸丰皇帝六弟恭亲王。
        门票现在40元，老人半价，军人和1.2以下的儿童免门票费用。
        因为是暑假，人超级多，都是家长带着孩子来感受实地文化历史的，比书本上鲜活的实景。
        在这里其实可以跟一个导游给你讲解一下，很多历史典故，听听很有意思，你会知道和|有十几个妻妾，知道一个超级大的雕塑是送子观音，还有福字碑，有福有寿，开过光的。
       总之听听不错，感受一下古代亲王的历史",,,,,,恭王府好评
独孤雅剑,5分,超棒,景色5,趣味5,性价比5,作为北京比较有名的一个景点，人非常的多，傍晚的时候去的，可惜的是已经关门了，非常遗憾的是没有能进去，从外面观望了一下，也看不出什么来，下次去北京的时候一定会补上的，就差了没几分钟就能进去了，出口处还有很多人在,,,,,,恭王府好评
陌默111,5分,超棒,景色5,趣味5,性价比5,清朝大贪官和坤府邸，康熙的“天下第一福”就在后花园的太湖石里。福字碑是恭王府的镇宅之宝，康熙玉笔，真的叹为观止！后花园前的一个大阁楼，各种不同形状的窗框是和|的不同的珍宝收藏标志。,,,,,,恭王府好评
nanke2006,4分,满意,景色4,趣味4,性价比4,恭王府在故宫博物院的北面，距离不远，曾经是乾隆年间大贪官和|的府邸，后来被咸丰皇帝赐给弟弟恭亲王奕?做为王府，所以称之为恭王府。恭王府占地面积很大，最大的特色应该是“福”，府内有“蝠”池、“蝠”厅，最大特色还是康熙皇帝手书的“福”字碑，藏于蝠厅前的假山洞中，去恭王府游玩的人们一定要去亲手触摸，沾沾皇家的福气。我去的时候是大年初二，要沾福气的队伍好长，希望年旺到福到！,,,,,,恭王府好评
,5分,超棒,景色5,趣味5,性价比5,恭王府，这个隐藏在小巷中的地方。曲径通幽。在这里能够感受到古代王爷的生活，雕梁画栋，真是古色古香！,IP属地:黑龙江,,,,,恭王府好评
虾米浪浪浪,5分,超棒,景色5,趣味5,性价比5,摸摸秘云洞里康熙御宝天下第一福祈求福运， 穿梭于宝气不散的王府官邸里了解半部大清历史，再去看看那个藏了大贪官和|万贯家财的藏宝楼，在这钟灵毓秀园林风雅的亲王府里，拥抱最美的老北京。,,,,,,恭王府好评
jade1223,5分,超棒,景色5,趣味5,性价比5,一座恭王府，半部清代史，作为当年首富和|和清代末年权臣的宅邸，其奢华自不必说，看点是承载的历史文化信息和藏在亭台楼阁中的历史文化故事。,IP属地:上海,,,,,恭王府好评
老少皆宜（程世荣）,5分,超棒,景色5,趣味5,性价比5,北京的恭王府是什刹海旁的一处景点，清朝时期是和|的宅邸，现在是很受欢迎的网红景点，我们来时看到游客比较多。恭王府是很有内容的游览景点。,IP属地:北京,,,,,恭王府好评
limin6789,5分,超棒,景色5,趣味5,性价比5,来北京恭王府值得一游，旅游时间2-3小时吧，最好事先做好攻略，了解了解建筑特点，历史典故，再到恭王府里一一验证，近距离看看富可敌国的和|的故居，让人无法想象人能贪婪的程度，惊叹于和|揽财的能力。,IP属地:北京,,,,,恭王府好评
xiaohei5678,5分,超棒,景色5,趣味5,性价比5,恭王府规模宏大，总占地面积6万平方米，分为府邸和花园两部分，拥有各式建筑群落30多处，历经了清王朝由鼎盛而至衰亡的历史进程，承载了极其丰富的历史文化信息，故有了“一座恭王府，半部清代史”的说法。,,,,,,恭王府好评
郝云莱,5分,超棒,景色5,趣味5,性价比5,来这里是对清代历史，特别是和坤个人以及其所做为的一清二楚的了解！特值得！特有意义！如果你有时间或者可以说挤点时间也要来看看，好感受一下，收获一定会很大的！,,,,,,恭王府好评
great妞小妞,5分,超棒,景色5,趣味5,性价比5,"大名鼎鼎的恭王府，曾住过两位名人，即乾隆宠臣和|和恭亲王弈?，所以有“一座恭王府，半部清朝史”的说法。
恭王府分为府邸和后花园，印象最深的要数大戏楼，四周画满紫藤，仿佛坐于紫藤架下听戏享受。",,,,,,恭王府好评
butterfly2013,5分,超棒,景色4,趣味4,性价比4,"恭王府位于北京前海西沿、什刹海南岸，是清代规模最大的一座王府。占地约6万平方米。
曾为和|宅邸。清咸丰元年恭亲王奕?成为宅子的主人，故现得名恭王府。",IP属地:北京,,,,,恭王府好评
呆萌柒柒吖,5分,超棒,景色5,趣味5,性价比5,还不错??自己看可能看不懂，历史也不了解，不过可以租讲解那玩意，其实还可以关注微信公众号有讲解的好像还免费，因为我本身只喜欢溜达看景，对历史没那么感兴趣，就自顾自的到处逛，挺壮观的哈哈哈,,,,,,恭王府好评
kongyaoji,5分,超棒,景色5,趣味5,性价比5,由于没有预约到故宫的门票，只能退而求其次，选择了恭王府去参观。作为曾经的清朝大贪官和|的府邸，极尽奢华之能事。附中人气最高的当属乾隆御笔的福字。,,,,,,恭王府好评
老头Online,5分,超棒,景色5,趣味5,性价比5,大名鼎鼎的恭王府  和大人的府邸  40的门票真的是业良了  就是停车比较难  建议地铁前去  三绝一宝名不虚传   能摸到福字碑一定要去摸一下  参观的话最好还是跟着导游听听讲解 很有意思   非常值得一去的景点  强烈推荐,,,,,,恭王府好评
白猫警长,5分,超棒,景色5,趣味5,性价比5,游玩故宫，必来恭王府，门头不是那么阔气，但是里面大有乾坤，相比故宫这里要凉快很多，树木葱茏绿意盎然，大贪官和|的府邸，大宅子呀，精雕细琢，藏宝楼太大了，还有康熙爷亲笔写的福字碑，一定要去摸下，寓意福气满满。,IP属地:北京,,,,,恭王府好评
休闲小浩哥,5分,超棒,景色5,趣味5,性价比5,"百年历史看天津,千年历史看北京――――夏天，12日暴走津京
北京第一天18-恭王府67
如果说恭王府中其他景点都没记住的话，那么这块镇府之宝“福字碑”就必须要看了，在后花园的假山之中，穿过不算太长的小路，便可到达，只可以这里不允许拍照，而且可以停留的时间很少，所以基本只能有一面之缘。
观看福字碑也是很有将就的，石碑外面覆盖了一层厚厚的玻璃，玻璃之外可供游人抚摸。摸福字要用右手从福字上方康熙大印这里开始，一路向下。寓意接福到家，全家安康",,,,,,恭王府好评
LHCY,5分,超棒,景色5,趣味5,性价比5,恭王府位于北京市西城区前海西街，乾隆四十五年（1780年），大学士和|奉旨建此府，咸丰元年（1851年）清廷赐封此宅邸于恭亲王爱新觉罗・奕D，恭王府的名称也因此得来。恭王府是清代规模最大的一座王府建筑群，历经了清王朝由鼎盛而至衰亡的历史进程，承载了极其丰富的历史文化信息，故有了“一座恭王府，半部清代史”的说法。,,,,,,恭王府好评
休闲小浩哥,5分,超棒,景色5,趣味5,性价比5,"百年历史看天津,千年历史看北京――――夏天，12日暴走津京
北京第一天18-恭王府41
把自家花园修得堪比皇家园林，兼具当时传统苏式园林和一点西洋特色，印象最深的就是进入花园的一东一西的两个入口，一个是西洋风格的，一个是曲径通幽，可惜来的时候时间赶，没时间排队去摸“福”字碑，有点遗憾。",,,,,,恭王府好评
休闲小浩哥,5分,超棒,景色5,趣味5,性价比5,"百年历史看天津,千年历史看北京――――夏天，12日暴走津京
北京第一天18-恭王府37
恭王府是我国保存最为完整的王府建筑群，拥有各式建筑群落30多处，布局讲究，气派非凡。
原本是和|的府邸，历经了清王朝由鼎盛至衰亡的历史进程，故有“一座恭王府，半部清代史”的说法。
整体分为府邸和花园两部分，西洋门、大戏楼和后罩楼是恭王府内的“三绝”，一定不要错过。
秘云洞也非常值得一看，里面摆放着和|从宫中偷出的康熙御笔“福”字碑。",,,,,,恭王府好评
休闲小浩哥,5分,超棒,景色5,趣味5,性价比5,"百年历史看天津,千年历史看北京――――夏天，12日暴走津京
北京第一天18-恭王府20
恭王府之大，跟山西的皇城相府有的一比，但一个是在京城皇宫边上，另一个则在晋城郊区，且两个府邸的奢华程度完全不同。和|用于存放赃物的房间一共有108间，长长的一字排开，非常壮观，号称皇宫里有的我有，皇宫里没有的我还有。
恭王府地理位置非常优越，四面环水，在周易学上是上等的风水宝地，恭王府在八国联军侵华和抗日战争中军没有受到任何破坏，如今还源源不断地接待各地参观的游客。",,,,,,恭王府好评
休闲小浩哥,5分,超棒,景色5,趣味5,性价比5,"百年历史看天津,千年历史看北京――――夏天，12日暴走津京
北京第一天18-恭王府12
如果说故宫代表的是雍容华贵的皇家贵气，恭王府则代表的是五福临门的王府福气。恭王府是清朝大贪官和|住的府邸，据说当年和|被抄家查出来的收入，是当时嘉庆年间15年的朝廷财政收入总和。虽然当时清王朝已经开始走下坡路了，但瘦死的骆驼比马大，清王朝在当时的东方还是首屈一指的存在，恭王府清晰地记录了清王朝由盛转衰的这一段历史，看点还是相当丰富的。",,,,,,恭王府好评
我在咖啡,5分,超棒,景色5,趣味5,性价比5,"恭王府，位于北京市西城区前海西街，占地面积6.112公顷。乾隆四十五年（1780年），大学士和|奉旨建此府，咸丰元年（1851年）清廷赐封此宅邸于恭亲王爱新觉罗・奕D，恭王府的名称也因此得来。

恭王府是清代规模最大的一座王府建筑群，历经了清王朝由鼎盛而至衰亡的历史进程，承载了极其丰富的历史文化信息，故有了“一座恭王府，半部清代史”的说法。",,,,,,恭王府好评
休闲小浩哥,5分,超棒,景色5,趣味5,性价比5,"百年历史看天津,千年历史看北京――――夏天，12日暴走津京
北京第一天18-恭王府3
恭王府是清代规模最大的一座王府，先后作为和|、庆亲王永U的宅邸，后被赐予恭亲王奕D，由此得名恭王府，并沿用至今，也是唯一完整保留的王府，也只有它和故宫归文物局管，其他都是旅游局管，可见意义重大。",,,,,,恭王府好评
