user_detail_name,text,text 2,text 3,text 4,text 5,content_wrap,iplocation,,,,,attraction_name
猪小肥同学,5分,超棒,景色5,趣味5,性价比5,清明假期去的，人太多，本来想请个讲解员结果没请上，只能自己跟着人群走，蹭讲解了！讲解器比故宫贵，30/个！5人以里的讲解员是200！5人以上是40/人！人多走不起来，体验不太好，只转了一半，就出来了！“天下第一福”不让拍照！1987太难吃了！不推荐！,,,,,,恭王府好评
小小的旅记,5分,超棒,景色4,趣味3,性价比4,"杨花落尽子规啼&#183;记《闻王昌龄左迁龙标遥有此寄》。从小喜欢古风，觉得古建筑+现代美别有一番风味。
【言归正传&#183;走进恭王府】
恭王府被称为京城第一宅，为何这么说呢，因为除了皇帝住的地方，这里无论风水还是装修程度都很“高大上”
_
【小故事】
北京据说有两条龙脉，一是土龙，即故宫的龙脉；二是水龙，指后海和北海一线，而恭王府正好在后海和北海之间的连接线的龙脉上，因此风水非常好。古人以水为财，在恭王府内“处处见水”，湖心亭的水是从玉泉湖引进来的，而且只内入不外流，符合风水学敛财的说法。恭王府历经了清王朝由鼎盛而至衰亡的历史进程，有了“一座恭王府，半部清代史”之说。
__
【介绍】
恭王府由府邸和花园两部分组成。
王府南北长约330米，东西宽180余米，分中东西三路，每一路各有三个院落。恭王府的建筑是王府中的最高规制，明显的标志是门脸五间，正殿七间，后殿五间，后寝七间，左右有配殿，门钉竖九梗七。低于亲王等级的王公府邸决不能多于这些数字。房屋的形式、屋瓦的颜色也是不能逾制的。
内有108间房，俗称“99间半”，取道教“届满即盈”之意，据说这是和|的藏宝楼。
_
【门票】
40元。  1.2米以下免费
_
【建议旅游时间】
1小时听讲解+2~3小时自己逛逛拍拍。
_
【景点故事】
(福字碑)原碑，摸碑一定要从康熙御印起从上到下;找找前面的太湖石山最高点上的龙头; 恭王府也可说是 -万福之地。
(邀月楼)百度说的，认真地跨过一开头的两级台阶再沿着平滑的路向上走，寓意跨过坎坷平步青云”,往下走的时候要走旁边的小路;
（墙砖头）
墙上的砖头装饰是和|自己独有的银行卡密码，福字碑要从上到下，快速一摸攥紧拳头，把福气放到包里或口袋里，不让福气外流。

爱传统文化，也欢迎各国朋友来中国。
惟愿我泱泱中华传统文化再现不一样的精彩，从而走向更大更广的天地去翱翔去展现。 Welcome to China ??",,,,,,恭王府好评
白天里的星光,5分,超棒,景色5,,,恭王府真的是名不虚传，那叫一个气派，雕梁画栋！我们在去恭王府之前先坐人力三轮车绕着前海后海走了一圈，有宋庆龄故居，主要听人家讲一下，也学习一下！两个人360元，大约30分钟！感觉讲的不错，人家说讲的不错打点赏钱，我就给了20元，也就是说这一圈下来得400块钱！恭王府附近也有不少可以去的地方，北师大就在附近，人们都很热情，我们在北师大宿舍门口照相的时候，有人告诉我们可以进去吃饭！摸了天下第一福字，非常开心！就是天太热，孩子有些受不了！,,,,,,恭王府好评
哈哈320,5分,超棒,景色4,趣味5,性价比4,网上的票买晚了，没买到！去了现场买的，同时租了电子导游，电子导游40块，比故宫还贵20块，但是自由行的话，还是租一个比较好，边听讲解边看景才会比较有意思，不然光看建筑看不出什么，听历史听观景要点，不然都弄不明白要看些什么。最主要的就是看一看摸一摸天下第一福，也是觉得是沾沾福地的福气来的。,,,,,,恭王府好评
M34****1656,5分,超棒,景色5,趣味5,性价比5,这位导游真的是太棒了！他非常耐心、友好，还有趣味十足，让我们的旅行变得更加美好。ここは立派いですね、うちの旅行はいいです！,IP属地:北京,,,,,恭王府好评
HhSOUL,5分,超棒,景色5,趣味4,性价比5,"公园的新奇玩法??第三季恭王府
沉浸式实景RPG剧本杀风水局《王府迷阵》

准备好了吗？一起穿越吧~??
不请导游讲解，也能get到各个院落布置的精妙之处
线上+线下的游戏解密模式，欣赏美景的同时，在趣味游戏中增进了同伴之间的感情，掌握天干、地支、八卦等小知识。

游戏玩法??
购买游戏套装，在WX小程序上激活游戏后，跟着内容提示和谜题设置穿越历史，深入了解探寻恭王府风水的精妙设计
历史事件结合公园实景，设置了很多谜题，每题的设置都是不同的解法，仔细读题，仔细看文字，基本都可以找到答案，跟着小程序提示即可

游戏路线??
提前熟悉故事背景―&gt;根据提示：“请检票进门”购票进入恭王府―&gt;府邸部分―&gt;花园部分

适宜人群???????????????????
喜欢解密、喜欢历史、喜欢风水八卦、喜欢新奇体验等人群
可增进亲子关系，促进友谊或进行公司团建

游戏亮点?
知识点满满，零基础也能变身风水大师，破解王府谜题

Tips
1??游戏每人有100次提示，绝对够用，每题提示次数不等，谜题难度逐渐降低，仔细阅读题目，??自己多思考，多尝试，才能体会到游戏的乐趣
2??天气炎热??，注意防蚊、补水和防晒
3??游戏有语音配音，佩戴耳机??会有更佳的体验，可以边听边看景，不然就要一直盯着手机看大段大段的文字
4??游玩时间约4小时，屏幕会常亮，??比较耗电，备充电宝会保险一些

游戏价格??
游戏套装：288元（可供1-3人使用，玩后不用归还）
公园门票：40元（不可用北京公园年卡，周一闭馆）
公园开放时间：8:30-17:00，16:10停止入馆",IP属地:北京,,,,,恭王府好评
秀才说（跟着秀才游北京）,5分,超棒,景色5,趣味5,性价比5,"都说“一座恭王府,半部清代史”，恭王府是北京保存最为完好的王府之一,位于北京市西城区前海西街，乾隆四十五年，和|奉旨建造此府，咸丰元年，被赏赐给恭亲王奕?，恭王府的名称也因此得来，北京春暖花开，游览恭王府会给人带来不一样的感觉，浓厚的历史与浪漫色彩融合起来，到处繁花似锦，让人有一种厚重美好感觉，感叹古人的智慧！到恭王府一定要沾沾福气，把福气带回家哟~",,,,,,恭王府好评
秀才说（跟着秀才游北京）,5分,超棒,景色5,趣味5,性价比5,"恭王府有着?“一座恭王府，半部清代史”，的号称，位于北京西城区前海西街，是北京规模最大、保存最完整的清代王府。恭王府见证了清王朝由盛到衰的历史进程，承载了极其丰富的历史文化信息，恭王府是目前北京唯一一座完整对外开放的王府， 恭王府花园内建筑大致分为中、东、西三路，中路景区：西洋门、独乐峰、蝠池、安善堂、滴翠岩、秘云洞、福字碑、蝠厅，西路景区：龙王庙、榆关、妙香亭、诗画廊、方塘水榭，东路景区：沁秋亭、垂花门、竹子院、大戏楼、听雨轩，藏有恭王府镇府之宝――福字碑的秘云洞，就位于“滴翠岩”下。福字碑，碑高1米，宽0.6米，是由清康熙皇帝的御笔刻成。
恭王府不但风景秀丽,建筑别具一格,而且每一个建筑在建造时 都蕴含着独特意义,真是令人佩服。",,,,,,恭王府好评
139****1217,5分,超棒,景色5,趣味5,性价比5,只有走进恭王府，才能对和|的贪婪和才华有更加深刻的认识和不一样的了解。他的聪明才智，让他三年时间就从一个赶车的侍卫变成了一品大员；他的贪婪无度，让他成为清朝第一大贪（也为清朝积蓄了财富），最终也葬送了他的性命。,,,,,,恭王府好评
132****2560,5分,超棒,景色5,趣味5,性价比5,恭王府，国家重点文物保护单位，为清代规模最大的一座王府，曾先后作为和|、永U的宅邸。1851年恭亲王奕D成为宅子的主人，恭王府的名称也因此得来。恭王府历经了清王朝由鼎盛而至衰亡的历史进程，承载了极其丰富的历史文化信息，故有了“一座恭王府，半部清代史”的说法。,,,,,,恭王府好评
日夕回味,5分,超棒,景色5,趣味5,性价比4,"从北海公园绕巷子里走不远就到了恭王府。我是冬天下午挺晚去的，所以没有多少游客。所谓“和|跌倒，嘉庆吃饱”，曾经的巨贪和|居然拥有如此多的财产，富可敌国，难怪会被嘉庆一上位就扳倒，曾经被乾隆庇护的和|的府邸被查抄。
        其布局也是恰到好处，前为府邸，后为幽深秀丽的古典园林，庄严又豪华大气。后来的和|府邸又沦落成了恭亲王的王府，所以在参观恭王府的时候，展览的很多东西都是和铁帽子王息息相关的。冬季也有不好的就是，园林池塘塘水都是结冰的。
       恭王府主要的看点有府邸的“银安殿、嘉乐堂、乐道堂、锡晋斋、抱厦”等和园林的“西洋门、独乐峰、邀月台、福字碑、蝠厅”等。",,,,,,恭王府好评
M47****8971,5分,超棒,景色5,趣味5,性价比5,今日的恭王府游程中，曾老师的讲解，真的是太生动了！她既亲切又好听。我们都很开心。都说以后朋友来北京玩都介绍给她。,IP属地:北京,,,,,恭王府好评
M22****8275,5分,超棒,景色5,趣味5,性价比5,在携程网预约的恭王府订单，并由京状元曾老师做的导游非常好，导游很漂亮服务周到谢谢。给个5星好评下次来还要约携程网的订单。,IP属地:北京,,,,,恭王府好评
阿歪609,5分,超棒,景色5,趣味5,性价比5,"还是第一次有时间来恭王府好好逛逛。天气很好，游人也不算少。不愧是中国第一豪宅，占地面积够大，布局讲究，非常气派。整体分为府邸和花园这两部分。
到了恭王府一定要沾沾喜气，据说恭王府里有一万个福字，所以又称万福园。印象最深的是大戏楼，建筑是全封闭式的，据说扩音效果特别好。",,,,,,恭王府好评
Monimika,5分,超棒,景色5,趣味5,性价比5,"??闻名遐迩的恭王府值得一去，该府曾为和|宅邸。

??恭王府规模宏大，占地约6万平方米，前半部是富丽堂皇的府邸，后半部为幽深秀丽的古典园林，布局讲究，气派非凡。

??花园水雾漫岸，荷花垂柳，仙桥鹊路，透出一股人间仙境般的惬意和小桥流水一样的恬淡。

??康熙一生酷爱书法，虽然他的书法极佳，却很少题字，一字千金。康熙御书的福字碑藏在花园的假山内。游客排队摸福字，我不但摸了一下，还抓拍了一张。

??恭王府实在太大了，一个下午感觉逛不完，游客也络绎不绝，想要在标志性景点拍一张没有游客的照片实在太难了，只能下次再来了。",,,,,,恭王府好评
小小的旅记,5分,超棒,景色5,趣味5,性价比5,"恭王府位于中国北京前海西街17号，是清朝后期恭亲王奕?的府邸及花园，现在是全国重点文物保护单位。恭王府花园现作为旅游景点对外开放。
和|的花园儿果然气势非凡不同凡响分为三路。中路是西洋门，独乐峰，蝠池安善堂及左右配殿明道堂，棣华轩，福字碑，邀月台，蝠厅。东路是怡神所垂花门，大戏楼，芭蕉院，西路是湖心亭，澄怀撷秀。此外还有龙王庙、榆关、妙香亭、流杯亭、艺蔬圃。",,,,,,恭王府好评
_wb3****392,5分,超棒,景色5,趣味5,性价比5,带着老爸老妈游的恭王府，真的是太值得一去啦！与故宫相比，院落精致小巧，细节处可见和|的大智大慧，通过导游的讲解，也改变了电视剧中对和|的固有印象。虽说是贪官，但是23岁就成就了一人之下，万人之上，文武全才的他拥有了70多家商铺，可见不是简单的贪能实现的！,,,,,,恭王府好评
M67****7216,5分,超棒,景色5,趣味5,性价比5,京状元恭王府的讲解员宁老师，历史讲的真好，我们都喜欢听，下次还选京状元报名。,IP属地:北京,,,,,恭王府好评
l****99,5分,超棒,景色5,趣味5,性价比5,好久没去过恭王府了。上一次去恭王府开放的只有花园部分，现在前面也开放了。因为带了孩子，请了门口的导游，门口找的10几个一起攒的。因为是假期，园子里的人还是比较多的，最后1800元还买了个福字字帖。,,,,,,恭王府好评
strumgeist,5分,超棒,景色5,趣味5,性价比5,"恭王府有几处值得参观的地方: 1.和|建造府邸时采用的金丝楠木;2.康熙御赐的福字碑;3.府中的参天古木;4.屋脊六兽还有原始的琉璃瓦

恭王府的福字碑旁边的石头都盘出来包浆了…真是太厉害了",,,,,,恭王府好评
Stanley_Lee18,5分,超棒,景色5,趣味5,性价比5,恭王府历任主人的人生经历是一部恢宏的教科书，可以给当代人特别是各级领导启迪甚有力！,IP属地:北京,,,,,恭王府好评
『 yangyang 只是一只咩』,5分,超棒,景色5,趣味5,性价比5,"恭王府个人觉得还真的是不错！此次是清明小长假来北京，上午天坛下午恭王府，没有雇讲解，蹭了一路的讲解，每个讲解的各不同，却都很精彩，蹭着讲解，逛着和|的府邸，感觉还真的很特别！
精美的内饰摆设，全庭院的风水布局，暗藏玄机的藏宝的地方，各种名贵物件、饰品、珍贵的药材，不得不佩服和|的头脑，真是头子！
也是这次才知道和|是个大个子，女生像的一个有才能的人，精通好几种应该叫方言，十分有才华！如果你想去，又对历史十分感兴趣，真的可以找个精讲，细致一点的溜达溜达，身临其境的感受下古代的建筑环境和特色，碰到着装的漂亮格格们，就更是好像穿越回到了那个朝代！
本人才疏学浅，没有太多言语，个人很喜欢游玩此处，而且面积之大，真的是逛了一个下午！
赶着四月的北京，不冷不热的天气刚刚好适合旅游，人也不是那么多，先简单的就说到这里吧！个人意见，仅供参考！还有就是这周边吃的还不少，不用担心饿，有小店！",IP属地:北京,,,,,恭王府好评
信马有疆,5分,超棒,景色5,趣味5,性价比5,恭王府，皇家宫殿园林格局，精美绝伦，叹为观止。只是疫情过后，旅游活动报复性增长，后海周边和恭王府内外举小旗子的旅游团一个接一个，府内府外，游客济济一堂，摩肩接踵，呜呜泱泱，实在不太好观赏景致，也不太方便拍照留念。,IP属地:北京,,,,,恭王府好评
秀才说（跟着秀才游北京）,5分,超棒,景色5,趣味5,性价比5,"恭王府位于北京内城西北部什刹海的北岸，风水俱佳的宝地，距离南锣鼓巷，北海，景山公园，都比较近，恭王府始建于清乾隆年间，拥有两百多年的历史，是清代规模最大的也是中国现存保存最完整的一座王府建筑，它历经了清王朝由鼎盛而至衰亡的历史进程，承载了极其丰富的历史文化，故有“一座恭王府，半部清代史”的说法。恭王府第一绝：后罩楼位于府邸和花园的衔接处，111间房屋连成一排，达180多米长，后罩楼是国内王府类建筑中最长的楼，被形容为“99间半房子”，为恭王府三绝之一。第二绝：西洋门，恭王府花园又称“萃锦园”，进入园内参观，首先要经过一道汉白玉石拱门，又称西洋门。这道门并不是和坤建园子时留下的，而是恭亲王建造的。这座具有西洋建筑风格的汉白玉石拱门处于花园的中轴线上，是花园的正门。门额上外刻“静含太古”四字，内刻“秀挹恒春”四字，意为享太古之幽静，拥满园之春色，体现了深邃浑厚沉雄苍古的意境，蕴涵着道家的思想理念，据说这种门当时在北京只有3个，如今却只有此门流传下来，因此成为恭王府的一处“绝妙之笔”，堪称一绝。
第三绝：大戏楼，位于邀月台东部，占地面积约700平方米，可以容纳200余人，据说是清朝南方的官员为讨恭亲王的欢心，特聘请南方的能工巧匠精心建造的。
一宝：这块福字碑本是紫禁城的镇城之宝，老谋深算的和|不知用何手段将其从紫禁城中偷了出来，藏于自家的山洞中，作为镇宅之宝。福字碑位于秘云洞内，福字碑是由清圣祖康熙皇帝的御笔刻成的福字碑。康熙帝书法造诣颇深，但很少题字，所以此“福”字极其珍贵。而且此福字苍劲有力、颇具气势，可分解为多田多子多才多寿，构思巧妙，堪称天下第一“福”。因此常聚集不少游客用手触摸，都希望沾点福气把福气带回家！！！
游览路线：一宫门→二宫门→多福轩→银安殿→葆光室→嘉乐堂→锡晋斋→后罩楼→西洋门→独乐峰→福池→沁秋亭→垂花门→大戏楼→蝠厅→升官发财路→邀月台→秘云洞→澄怀撷秀→秋水山房→出口
交通路线：恭王府博物馆位于北京市西城区前海西街17号。恭王府博物馆周边地区停车位极为有限，建议您选择公共交通出行乘坐地铁6号线，北海北站下车，B东北口出",,,,,,恭王府好评
闲来有趣,5分,超棒,景色5,趣味5,性价比5,恭王府是我国保存最完整的清代王府代表作，是我国王府文化的最高水准，恭王府顾名思义是恭亲王奕忻居住过的地方，最早的主人是和|，恭亲王只不过是第三代主人，和|被嘉庆皇帝打到后，恭王府给了其胞弟僖亲王永U，所以历史学家曾评价说，一座恭王府，半部清朝史。这里拍摄过宰相刘罗锅，雍正王朝和还珠格格。恭王府名声很大，这座北京最大的四合院位于后海边上，门票40元。,,,,,,恭王府好评
BandBian,5分,超棒,景色5,趣味5,性价比5,来京旅游，恭王府好像应该是必须到此一游的，因为这座王府是中国现存王府中保存最为完整的一座王府。大家都知道此府是大名鼎鼎的和|和大人的府邸（庆郡王府），咸丰年间咸丰帝将王府给恭亲王奕?做为府邸，恭王府因此得名,,,,,,恭王府好评
yolanda_y,5分,超棒,景色5,趣味5,性价比5,去过北京诸多知名景点，却一直没有去过就在后海边上的恭王府，这次也算是补上了。时间关系，有些仓促，也没有请讲解，所以看的还是有些粗。总感觉和一般的古宅故居格局不大一样，而且清朝时期的建筑，尤其是有钱有地位的人，总能看到一些西洋的影子，恭王府也不例外。大还是很大的，有时间还是应该请个讲解，还是应该细细看看的。,,,,,,恭王府好评
呵呵而后,5分,超棒,景色5,趣味5,性价比5,"来恭王府就是来感受皇家王府那古典魅力，探秘和|是如何成为巨富。。
在恭王府内后花园太湖石假山中有一座“福字碑”，被称为“天下第一福”。
据导游解释，得到此“福”字便能“鸿运当头，福星高照。”和|的巨富便和这个“福”字有着很大的关系。但我们知道和|的“发福”离不开他的博学，可是这个“福”字却是来此游玩的人们的祈望。",,,,,,恭王府好评
真诚7577,5分,超棒,景色5,趣味4,性价比4,恭王府不愧是三个大臣居住过的，其府邸建筑庄重肃穆，气宇轩昂，萃锦园则衔水环山，古树参天，曲廊亭榭，富丽天然，实为中国园林建筑的典范。是北方园林景观的代表作品，与江南园林有得一比,,,,,,恭王府好评
zinnia_615,4分,满意,景色5,趣味4,性价比4,"北京！故宫旁！四合院体验?1
老四合院！！沉沉的古色古香北京特色！
离那些景点都很近，还有地铁去哪都方便
以后来北京就锁死这家四合小院?
.",IP属地:北京,,,,,恭王府好评
爱跳虎的土豆妈咪呀,5分,超棒,景色5,趣味5,性价比5,恭王府还是很值得一去的，距离中轴线也很近，很适合花上半天去看一看，恭王府有保存完好的大戏院，王府的院落，当然对于了解北京的历史也是很有帮助的。,IP属地:北京,,,,,恭王府好评
可爱宝贝苗苗的爸爸,5分,超棒,景色5,趣味5,性价比5,"恭王府及花园，国家5A级旅游景区，位于前海西沿、什刹海南岸，是清代规模最大的一座王府，曾先后作为和|、庆王永U的宅邸。清咸丰元年（1851年）恭亲王奕D成为宅子的主人，恭王府的名称也因此得来。 恭王府及花园历经了清王朝由鼎盛而至衰亡的历史进程，故有“一座恭王府，半部清代史”的说法。新中国成立后，在周恩来、谷牧和李岚清等国务院领导人的关心下，恭王府腾退修缮工作历28年完成，成为完全对外开放的清代王府。 
王府占地约6万平方米，拥有各式建筑群落30多处。其花园位于王府后，又名萃锦园，建于清乾隆四十二年（1777年），据考证是在明代旧园上重修的。全园占地面积2.8万平方米。园区建筑分东、中、西三路，每路由南自北以严格的中轴线贯穿着的多进四合院落组成。
王府中路主要为银安殿和嘉乐堂，主为祭祀之用；东路主要为多福轩和乐道堂，多福轩厅前有一架长了两百多年的藤萝，在京城极为罕见。东路的后进院落正房名为“乐道堂”，是当年恭亲王奕D的起居处。西路的四合院落较为小巧精致，主体建筑为葆光室和锡晋斋。锡晋斋即为恭王府“楠木殿”，殿内雕刻皆为楠木所成，是和|仿紫禁城宁寿宫式样。府邸最深处建有两层的后罩楼，又称藏宝楼，其后墙一共有44个什锦窗，相传和|可以根据窗户的形状，来对应宝物的种类。园区内“西洋门”、“福字碑”、“大戏楼”合称恭王府三绝。府内满园“福”字。多达一万多个，与康熙“福字碑”共同组建恭王府“福”文化",IP属地:河南,,,,,恭王府好评
柿子炒鸡蛋！,5分,超棒,,,,恭王府，这座位于北京心脏地带的古宅，是清朝时期著名的贵族府邸之一。踏入其中，仿佛穿越回了那个繁华的王朝。府内的建筑精美绝伦，每一砖一瓦都透露出历史的厚重感。漫步在曲折的回廊和幽静的庭院中，可以感受到古代贵族的生活气息。此外，恭王府还收藏了大量珍贵的文物和艺术品，让人大开眼界。总之，这里是一处不容错过的历史文化遗产，值得每一位游客细细品味。,IP属地:湖南,,,,,恭王府好评
匿名用户,5分,超棒,景色5,趣味5,性价比5,"恭王府是我想要去看看的景色 而且还可以了解一下历史文化 小学文化的我特别想好好学习 现如今在历史文化我很缺失 看见电视上古诗词非常吸引我 现在孙女长大有时间好好补充一下历史！
我还买很多书水浒旧书1975年 相信 杨苡 古诗词吴鹏飞的有声音解说及各种各样的我喜欢的书！谢谢你们有机会接触！",IP属地:北京,,,,,恭王府好评
shmily当时光以你为歌,5分,超棒,景色5,趣味5,性价比5,"携程上订票非常方便，到了恭王府直接扫身份证进入。大概是疫情的原因，第一次看到人少的恭王府，简直太完美了??福气


【性价比】恭王府是清代规模最大的一座王府，曾先后作为和|、永U的宅邸。1851年恭亲王奕D成为宅子的主人，恭王府的名称也因此得来。布局讲究，气派非凡。?

恭王府历经了清王朝由鼎盛而至衰亡的历史进程，承载了极其丰富的历史文化信息，故有了“一座恭王府，半部清代史”的说法。",IP属地:北京,,,,,恭王府好评
圣热尔韦昂瓦列尔周勃,5分,超棒,景色5,趣味5,性价比5,一座恭王府，半部清朝史。恭王府由府邸和花园两部分组成，总占地面积六万余平方米，占地3.2万余平方米的府邸为三路五进院落，建筑规模精湛而宏伟。花园占地2.8万余平方米，大于故宫御花园。我上一次来是到戏楼看京剧演出；游客排队为了摸福字。最后一张的墙是里面是空的，当年用来藏和|收罗的各种珍宝。,,,,,,恭王府好评
博士小美女,5分,超棒,景色5,趣味5,性价比5,"对比了一些买票的APP，还是携程比较方便，提前在携程买了票，进门无阻碍。
恭王府位于北京市西城区柳荫街，是清代规模最大的一座王府建筑群，曾先后作为清乾隆时期权臣和|、清嘉庆时期庆僖亲王永U的宅邸，清廷赐封此宅邸于恭亲王奕D，恭王府的名称也因此得来。
恭王府规模宏大，分为府邸和花园两部分，拥有各式建筑群落，历经了清王朝由鼎盛而至衰亡的历史进程，承载了极其丰富的历史文化信息，故有了“一座恭王府，半部清代史”的说法。使之成为当时中国唯一一座对公众开放的清代王府。",,,,,,恭王府好评
