user_detail_name,text,text 2,text 3,text 4,text 5,content_wrap,iplocation,,,,,attraction_name
勇猛十温柔,5分,超棒,景色5,趣味5,性价比5,"亚特兰蒂斯水世界是中国国内首家全年开放的水上乐园，占地20万平方米，为所有人带来惊喜体验。
体验各类反重力水滑道，感受令肾上腺素飙升的极致滑行；或挑战遍布园内的湍急水路；或探索沿河迂回的水底隧道；或与鲨鱼、鳐鱼亲密接触。",,,,,,三亚亚特兰蒂斯水世界好评
_ucwe****458513,5分,超棒,景色5,趣味5,性价比5,绝对值得去，住在亚特兰蒂斯酒店可以无数次进出，小孩的天堂，简直赖着不肯走了。有的项目太刺激不敢玩，有的还行，鲨鱼池和热带风暴都是不错的选择。除了稍贵，其他没毛病,,,,,,三亚亚特兰蒂斯水世界好评
东方森,4分,满意,景色4,,,游乐设施没的说个个精彩，就连几乎每个水世界都有的漂流都让人感觉与众不同！景区不大，游玩项目离的很近走的也不是很累！最值得关注的就是网红海神之跃和水上跳楼机了，建议心理素质不是十分好的就别尝试了……最后说下唯一美中不足的地方就是里面东西的价钱有点让大多数人难以接受，普通饮料25一瓶，鲜榨果汁62，餐一晚面78饭量大的根本不够吃……不过总的来说还是很值得去的,,,,,,三亚亚特兰蒂斯水世界好评
开耳朵的冉宝宝,5分,超棒,景色5,,,挺好的，3月又是女性打折月，超级划算，在玩那个过山车的时候体重不够，工作人员谭源海特别敬业，服务也特别好，对游客特别热情，让人觉得宾至如归，最后我们问了他的名字，希望评论的时候能给他，他应得得好评！很开心的旅程！,,,,,,三亚亚特兰蒂斯水世界好评
秦添Sunning,5分,超棒,景色5,趣味5,性价比5,"占地20万平方米，
拥有“海神之跃”、“放手一搏”、
“飓风之眼”等一系列
让人肾上腺素飙升的水上游乐项目
在海神塔“放手一搏”还是“海神之跃”？这是个问题。
放手一搏让你在全封闭滑道中，随着脚踏板的突然打开而急速摇摆下坠，在自己的惊声尖叫中迅速落入水道，给你带来瞬间失重的强烈刺激感。",,,,,,三亚亚特兰蒂斯水世界好评
M59****870,5分,超棒,景色5,趣味5,性价比5,一次非常好的体验，值得大家来玩，每一个项目都很刺激，工作人员的服务非常到位，尤其是卢雯倩为我们服务的很周到！非常开心！,IP属地:海南,,,,,三亚亚特兰蒂斯水世界好评
M33****793,5分,超棒,景色5,趣味5,性价比5,特别好玩，刺激，大小喇叭，过山车等等,IP属地:海南,,,,,三亚亚特兰蒂斯水世界好评
M33****4801,5分,超棒,景色5,趣味5,性价比5,非常不错，可以玩一整天，太快乐了??,IP属地:海南,,,,,三亚亚特兰蒂斯水世界好评
M63****68,5分,超棒,景色5,趣味5,性价比5,无敌超级超级快乐！！！下次还要来，玩了两天没玩够！！！！,IP属地:海南,,,,,三亚亚特兰蒂斯水世界好评
君君娃哈哈,5分,超棒,景色5,趣味5,性价比5,五星好评！前台小姐姐知道了我要求婚之后主动给我们升级了最大的顶层套房，还全程配合我们的求婚，给我打掩护，最后给了女主角大大的惊喜！求婚成功！谢谢红树林酒店！景色不错，有趣好玩，性价比高，总体超赞，,,,,,,三亚亚特兰蒂斯水世界好评
M47****4686,5分,超棒,景色5,趣味5,性价比5,9月份淡季人特别少，玩项目不用排队，这是第二次来这里，以后还会来的，就是小孩子没有1米2只能玩鲨鱼 漂流 其他也玩不了,IP属地:海南,,,,,三亚亚特兰蒂斯水世界好评
赶海的旅客,5分,超棒,景色5,趣味5,性价比5,非常不错，值得推荐。酒店也很不错。,IP属地:海南,,,,,三亚亚特兰蒂斯水世界好评
M10****701,5分,超棒,景色5,趣味5,性价比5,水族馆里面的海洋生很丰富，很喜欢里面的海洋生物，尤其是狮子与小朋友很喜欢狮子，因为他长得很特别，白金表演也很好看,IP属地:海南,,,,,三亚亚特兰蒂斯水世界好评
M22****1515,5分,超棒,景色5,趣味5,性价比5,亚特兰蒂斯酒店无限制进出水世界宝宝们的福音，大宝宝喜欢的放手一搏，海神之跃，小宝宝们喜欢的造浪池泡泡派对，鲨鱼穿梭连续5次玩儿，早去了就可以减少排队时间,IP属地:海南,,,,,三亚亚特兰蒂斯水世界好评
蛉啊子,5分,超棒,景色5,趣味5,性价比5,位于三亚亚特兰蒂斯酒店内，非常好的一个水上乐园，每个项目都比较精致，设施也豪华安全，虽然面积不大，但玩个半天还是没问题的。住酒店的客人可以免费无限次数畅玩，算下来非常实惠。,,,,,,三亚亚特兰蒂斯水世界好评
_WeCh****990819,5分,超棒,景色5,趣味5,性价比5,"【景色】环境很好
非旺季来游玩，很方便，不用怎么排队
漂流适合老人小孩玩",IP属地:海南,,,,,三亚亚特兰蒂斯水世界好评
h****nx,5分,超棒,景色5,趣味5,性价比5,服务态度很好 过山车刺激 大小喇叭还玩 漂流小宝宝很开心 可以领浴巾比较方便,IP属地:海南,,,,,三亚亚特兰蒂斯水世界好评
_WeCh****434920,5分,超棒,景色5,趣味5,性价比5,"【景色】
【景色】很好 天气不错 适合旅游
【趣味】
【性价比】性价比很高很高
【性价比】很高 好玩
【趣味】有意思 很好玩",IP属地:海南,,,,,三亚亚特兰蒂斯水世界好评
随遇而安丶123,5分,超棒,景色5,趣味5,性价比5,超级满意，还好人少，不用排队，孩子们玩得很开心，就是太晒了，哈哈,IP属地:海南,,,,,三亚亚特兰蒂斯水世界好评
M29****612,5分,超棒,景色5,趣味5,性价比5,这边环境非常好 救生员工作人员都非常热情 表演节目非常好看 工作人员曾雪芳小姐姐非常的有礼貌 对待游客很有耐心,IP属地:海南,,,,,三亚亚特兰蒂斯水世界好评
M43****8037,5分,超棒,景色5,趣味5,性价比5,现在门票两百多，总的来说还可以，主要今天天气也比较好，没有那么凉，人也很少，基本不用排队，就是第一次来，不太熟悉里面的项目位置，何金龙小哥很耐心给我们介绍游玩项目和顺序，很是感谢??,IP属地:海南,,,,,三亚亚特兰蒂斯水世界好评
,5分,超棒,景色5,趣味5,性价比5,漂流超级推荐，大小孩儿有不同的项目，0.9-1.3都可以玩儿。,IP属地:海南,,,,,三亚亚特兰蒂斯水世界好评
,5分,超棒,景色5,趣味5,性价比5,"大喇叭超级刺激好玩！小心尿裤子哦！
有小朋友的家庭一定要去喂鱼哦",IP属地:海南,,,,,三亚亚特兰蒂斯水世界好评
吕不韦吕不韦,5分,超棒,景色5,趣味5,性价比5,带家人游玩亚特兰蒂斯酒店水世界，工作人员米东阳小姐姐给我做了水世界的详细介绍，减少了我自己了解摸索的时间，和家人游玩的非常开心，水世界值得推荐,IP属地:海南,,,,,三亚亚特兰蒂斯水世界好评
,5分,超棒,景色5,趣味5,性价比5,非常不错，大小孩子都玩得开心。服务人员特别专业友好。下次还来！,IP属地:海南,,,,,三亚亚特兰蒂斯水世界好评
,5分,超棒,景色5,趣味5,性价比5,海神之跃，放手一搏，还有大喇叭小喇叭，值得体验，点赞????,IP属地:海南,,,,,三亚亚特兰蒂斯水世界好评
,5分,超棒,景色5,趣味5,性价比5,"刺激非凡！亚特兰蒂斯水世界滑道超多样，海神之跃近乎垂直俯冲，瞬间心跳狂飙，感受风与水的极速冲击，胆量大的来这绝对值回票价，爽翻！

氛围超绝，以神秘亚特兰蒂斯为蓝本打造，雕塑、建筑细节拉满，漫步其中像闯进失落王国，造浪池浪花有节奏，伴随音乐灯光，惬意又欢乐。

亲子友好度满分，有专为孩子设的浅水区、迷你滑道，安全保障足，工作人员贴心守护。还能全家同玩漂流河，赏景享清凉，共享温馨时光。",IP属地:海南,,,,,三亚亚特兰蒂斯水世界好评
_WeCh****392265,4分,满意,景色5,趣味5,性价比5,1月20号去的，水有些凉。玩完了一个项目出来风一吹特别冷，自己带了毛巾，潜水服。泳装也是可以不过游玩还是穿着自然舒适一些。牛仔短裤什么的拖鞋都是不能穿着游玩的。。柜子是出租的有大有小，以为是收费的，后来好像退回来了押金，就是免费提供。排队时间半个小时左右。有两个恐怖的没敢尝试。带着一岁半宝宝去的，孩子什么都玩不了，儿童区域也是最好五岁以上孩子玩不危险，不让大人陪着。所以孩子要自己完全能掌握好自己身体协调各方面等等……吃的比较贵啦，薯条28是最便宜的。因为玩完了要去吃自助餐就没有吃什么东西。自助餐还是可以的。除了服务态度不好。也都可以。跟在北京吃的298一位的比起来这个划算很多。,,,,,,三亚亚特兰蒂斯水世界好评
,5分,超棒,景色3,趣味5,性价比4,很好玩，自带毛巾，涉水鞋，进门就是急速漂流，转完一圈下来，大人玩顺着右手边开始，公主塔，一个大喇叭一个小喇叭，大喇叭最刺激，小喇叭要自己去拿游泳圈扛到楼顶，都可以带手机，往前就是连环转，发游泳圈机器带你上去，也可以带手机，在往前就是海神塔，网红打卡地海神之跃，放手一搏，不可以带手机玩，下面是鲨鱼穿越和章鱼竞速都在海神塔，可以带手机，在往前就是儿童乐园，在往前人造浪，玩完就结束了！一圈下来4到5小时，一般大喇叭玩完，后面的就不要害怕了，包括网红的海神之跃和放手一搏，因为失重感觉大喇叭最强烈，而且连环转失重，尖叫声不绝！,,,,,,三亚亚特兰蒂斯水世界好评
,5分,超棒,景色5,趣味5,性价比5,寒假时带女儿去玩儿了一天，非常好，景色好，游乐项目也很刺激，女儿胆子比我大多了，大喇叭和小喇叭都玩儿了两次，在有就是园内服务好，服务人员都非常友善，漂流时过激流都有工作人员提示，园区内卫生很好。非常不错的度假胜地，下次去三亚还会去,,,,,,三亚亚特兰蒂斯水世界好评
M64****3210,5分,超棒,,,,小朋友玩的很开心，淡季各种刺激项目无限刷，员工服务满意??,IP属地:海南,,,,,三亚亚特兰蒂斯水世界好评
魔人小豆,5分,超棒,景色5,趣味5,性价比5,亚特兰蒂斯是目前我们玩的最好玩的水上乐园，项目多，乐园大。大人和小朋友都有各自最喜欢的项目，我最喜欢放手一搏和漂流。这里服务态度也特别好。推荐买快速通道，一天所有项目可以刷几遍,IP属地:海南,,,,,三亚亚特兰蒂斯水世界好评
M36****455,5分,超棒,景色5,趣味5,性价比5,"大喇叭超级推荐??????
怒海过山车，特别推荐
游玩上午中午最佳??????
卢雯静，员工服务不错",IP属地:海南,,,,,三亚亚特兰蒂斯水世界好评
zho****gqi,5分,超棒,景色5,趣味5,性价比5,水世界整体环境不错，游乐项目丰富，趣味性强，值得推荐，服务人员Anna服务好，下次还会再来！,IP属地:海南,,,,,三亚亚特兰蒂斯水世界好评
Sunnes,5分,超棒,景色5,趣味5,性价比5,非常好玩，特地和朋友来亚特兰蒂斯酒店入住就是为了来尝试水世界的，很推荐大家来游玩，五星推荐！,IP属地:海南,,,,,三亚亚特兰蒂斯水世界好评
Aiu__,5分,超棒,景色5,趣味5,性价比5,非常愉快的一次旅游，导游很热情，娱乐项目也很有意思。,IP属地:海南,,,,,三亚亚特兰蒂斯水世界好评
_m13****9295,5分,超棒,景色5,趣味5,性价比5,"太好玩，下雨了更刺激，但是打雷有些设备会暂停。
另外小tips，双人票更优惠。我携程一成人一学生，结果后来发现双人票还更便宜五十块。",IP属地:海南,,,,,三亚亚特兰蒂斯水世界好评
M13****644,5分,超棒,景色5,趣味5,性价比5,非常超值，连住酒店，可以玩水世界和水族馆，下次还来,IP属地:海南,,,,,三亚亚特兰蒂斯水世界好评
ivytam,5分,超棒,景色5,趣味5,性价比5,设施齐全的水上世界，如果橡皮艇有升降机运送便更好。,IP属地:海南,,,,,三亚亚特兰蒂斯水世界好评
205****705,5分,超棒,景色5,趣味5,性价比5,"桨板教练热心负责。连环小喇叭孩子喜欢儿
玩儿的很开心",IP属地:海南,,,,,三亚亚特兰蒂斯水世界好评
M25****8168,5分,超棒,景色5,趣味5,性价比5,亚特兰蒂斯酒店，好玩好吃也好贵！人美水美，钱更美！,,,,,,三亚亚特兰蒂斯水世界好评
猫头兔,5分,超棒,景色5,趣味5,性价比5,喂食鳐鱼 鲨鱼穿越 很适合小朋友 很干净很舒服 还会再来,IP属地:海南,,,,,三亚亚特兰蒂斯水世界好评
sunnyFGR,5分,超棒,景色5,趣味5,性价比5,超级好玩，性价比超高，玩了一整天，值得来一趟??,IP属地:海南,,,,,三亚亚特兰蒂斯水世界好评
远行鸢,5分,超棒,景色5,趣味5,性价比5,大家一定要玩一下放手一搏，不刺激的，我80岁奶奶玩的都还可以，年轻人都来试试，不骗你们！,IP属地:海南,,,,,三亚亚特兰蒂斯水世界好评
_WeCh****384614,5分,超棒,景色5,趣味5,性价比5,环境很好，安全员很多，带小朋友很放心！还会再来！,IP属地:海南,,,,,三亚亚特兰蒂斯水世界好评
288****891,5分,超棒,景色5,趣味5,性价比5,水世界里的项目都体验过了非常的刺激，游玩项目晚上八点半停止排队，夜间人还是非常少的，大小喇叭几乎没有人排队，临关门前刷了五六次，努海过山车排队人较多，感觉还是很刺激的。,IP属地:海南,,,,,三亚亚特兰蒂斯水世界好评
M34****9525,5分,超棒,景色5,趣味5,性价比5,非常好，人员服务非常好。孩子玩儿的不亦说乎！推荐！本来入住三天两晚，准备续住。祝一切顺利,IP属地:海南,,,,,三亚亚特兰蒂斯水世界好评
E10****88,5分,超棒,景色5,趣味5,性价比5,第二次来，鲨鱼穿越超刺激，来海南必来打卡的景点,IP属地:海南,,,,,三亚亚特兰蒂斯水世界好评
M26****9131,5分,超棒,景色5,趣味5,性价比5,项目很好玩 景色很好 服务也很到位 孩子玩的很开心 合适各种大小孩都适合玩 真是孩子们的游玩天堂,IP属地:海南,,,,,三亚亚特兰蒂斯水世界好评
幸福的小猪0831,5分,超棒,景色5,趣味5,性价比5,好玩好玩，酒店客人无限次体验，吃好饭继续过来玩,IP属地:海南,,,,,三亚亚特兰蒂斯水世界好评
M15****118,5分,超棒,景色5,趣味5,性价比5,亚特兰蒂斯水世界太好玩了，适合大人和孩子玩，符昌妃小姐姐态度太赞了??推荐大家来玩哦！,IP属地:海南,,,,,三亚亚特兰蒂斯水世界好评
_WeCh****68901,5分,超棒,景色5,趣味5,性价比5,棒棒的选择，因为是老公的公司项目，前后造了三年，非比寻常的美丽，孩子以及家长父母，全家都很开心的玩耍快去快去吧不要犹豫啦啦啦啦,,,,,,三亚亚特兰蒂斯水世界好评
M40****4155,5分,超棒,景色5,趣味5,性价比5,"【景色】很好
【趣味】很有意思
【性价比】还不错",IP属地:海南,,,,,三亚亚特兰蒂斯水世界好评
M77****0977,4分,满意,景色5,趣味5,性价比5,这里有许多好玩的水上项目，其中冲浪少年，还有小旋风，大旋风等，其中我最喜欢的项目就是霹雳小旋风和旋转小旋风，推荐来这里游玩。,IP属地:海南,,,,,三亚亚特兰蒂斯水世界好评
M48****5142,5分,超棒,景色5,趣味5,性价比5,"很好玩体验感很好 有些刺激又不缺趣味性 景色也很好看 性价比也很高值得再来
【景色】
【趣味】",IP属地:海南,,,,,三亚亚特兰蒂斯水世界好评
M30****3048,5分,超棒,景色5,趣味5,性价比5,因为自己的不小心使我的眼镜点到水里，感谢梁聪伟先生给我在诺大的泳池不辞劳苦的给我找眼镜，也感谢工作人员的热情，还有这里的水世界很好玩，项目也多,,,,,,三亚亚特兰蒂斯水世界好评
M79****7954,5分,超棒,景色5,趣味5,性价比5,"带小孩来的  宝宝玩的很开心
三亚亚特兰蒂斯水世界是中国唯一一个全年开放的水世界乐园，在这里可以体验各类反重力水滑道，感受令肾上腺素飙升的滑行，可以挑战遍布园内的湍急水路；可以探索沿河迂回的水底隧道；亦可以与鲨鱼、鳐鱼亲密接触这里是全年龄段游客的乐园，时而悠闲自得、时而惊起水花四溅，亚特兰蒂斯水世界均能令您享受到无穷妙趣。",IP属地:海南,,,,,三亚亚特兰蒂斯水世界好评
赵十一1001,5分,超棒,,,,"- 水世界真的太棒了！从进门的那一刻起，就被它的规模和设施震撼到。整个园区干净整洁，环境优美，仿佛置身于一个水上童话世界。各种游乐项目应有尽有，无论是刺激的大喇叭、高速滑道，还是适合小朋友的儿童戏水区，都让人玩得不亦乐乎，强烈推荐！
 
- 这次来水世界玩得太开心了！这里不仅有超多好玩的水上项目，还有精彩的表演和活动。在造浪池里随着波浪起伏，感受着音乐和水花的双重冲击，仿佛所有的烦恼都被抛到了九霄云外。而且园区的布局合理，指示牌清晰，很容易就能找到自己想去的地方，下次一定还要再来。",IP属地:海南,,,,,三亚亚特兰蒂斯水世界好评
Luuii^,5分,超棒,景色5,趣味5,性价比5,特兰蒂斯水上世界，玩水欢乐天堂。这里有惊险刺激的滑道，能让你尽情释放压力；也有舒缓惬意的造浪池，仿佛置身于大海之中。无论是亲子游玩还是朋友聚会，都能在这里找到属于自己的欢乐，是不可错过的水上游玩胜地。,IP属地:海南,,,,,三亚亚特兰蒂斯水世界好评
M32****0338,5分,超棒,景色5,趣味5,性价比5,"开心
这次海南之旅我基本没操心，所有行程都是马老师安排的，机票酒店什么时候到哪住哪里都被安排好了～我只需要到了之后看看附近有什么好吃的就行
这次我俩拖老带小，简直不是来度假的.?中间我还来了一个组会汇报课题进展.....太难了
步入正轨，说说我们的亚特兰蒂斯一日之旅~
马老师下了血本定了个皇家俱乐部，我们那天12点多到的，问了一下可以入住了，于是有管家领我们去了房间，景色灰常好，房间超级大！各种物品超级齐备，特别贴心周到，真的是没有花钱的不是～
放下行李先去了失落的世界水族馆，刚好赶上美人鱼大赛，真好看！拍拍照看看鱼，孩子们特别开心。然后2点半去48层吃下午茶，建议早去，有窗边位置～自助餐很好吃
然后换了泳衣就去水世界了！娃儿们已经迫不及待了！直接刷脸入门～穿着酒店的浴袍和拖鞋直接去，第一次领浴巾是免费的哦
这个时间还是有点冷了，造浪池特别嗨，有泡沫枪，还有乐队演唱，孩子们超开心～然后我们就只玩了个漂流，6点要关门了…..晚上还有个灯光秀～",IP属地:海南,,,,,三亚亚特兰蒂斯水世界好评
Joshua SS・叟TORONTO,5分,超棒,景色5,趣味5,性价比5,"三亚亚特兰蒂斯水世界简直太棒了！这里的游乐设施丰富多样，从刺激的“海神之跃”，近乎垂直的滑道让人瞬间心跳加速，体验自由落体的极致快感；到“放手一搏”，在封闭管道中飞速穿梭，那种未知与速度带来的紧张感令人欲罢不能；还有“旋风大喇叭”，在巨大喇叭中旋转摇摆，尽享离心力的奇妙。

园区工作人员认真负责，无论是在排队处耐心解答疑问，还是在设施旁仔细检查安全，都让人无比安心。水质清澈干净，环境整洁有序，四处洋溢着欢乐的度假氛围。在亚特兰蒂斯水世界，每一刻都是难忘的欢乐时光，强烈推荐给所有热爱水上娱乐的朋友们！",IP属地:海南,,,,,三亚亚特兰蒂斯水世界好评
O大旭,5分,超棒,景色5,趣味5,性价比5,亚特兰蒂斯水世界以其刺激的水上项目而著称，尤其是海神之跃和放手一搏两个项目，给游客带来了强烈的失重感和刺激体验 。海神之跃是一个近乎垂直的水滑道，从25.1米的高度极速下落，而放手一搏则是在一个全封闭滑道中突然下坠，给游客带来瞬间失重的强烈刺激感！,IP属地:海南,,,,,三亚亚特兰蒂斯水世界好评
妖妖小11,5分,超棒,景色5,趣味5,性价比5,这是一个亚洲顶级的水上乐园，规模宏大，设施齐全。一进入园区，就被其新颖而神秘的建筑风格所吸引，仿佛进入了一个童话世界。园区内人山人海，热闹非凡，我迫不及待地换上泳裤，加入嬉水的行列。首先体验了儿童池的乐趣，池中的水枪和滑梯让我和朋友们玩得不亦乐乎。,IP属地:海南,,,,,三亚亚特兰蒂斯水世界好评
M47****6771,5分,超棒,景色5,趣味5,性价比5,体验开心的一次  玩了鲨鱼穿越和最高的那个项目真的好玩 工作人员曾雪芳服务好细心给我们指引了一些更值的打卡的 和朋友都很开心??,IP属地:海南,,,,,三亚亚特兰蒂斯水世界好评
M85****0509,5分,超棒,景色5,趣味5,性价比5,是一个比较喜欢旅游的人，刚从海南三亚回来，三亚去过几次了，算经验丰富了，这次花了五六天的时间把，蜈支洲岛、分界洲岛、南海观音、槟榔谷、这些景点好好的逛了一下，特别是一些水上项目也深深的体验一把像游艇出海冲浪、潜水、水上摩托艇、水上滑翔伞、真的让我这个内陆人体验感超级棒。回来后朋友说带家人也想去三亚玩一玩让我介绍一下，所以我写下了这篇攻略，也是为了分享给想去海南旅游给想去三亚的朋友看看，花点时间把这篇攻略看完，去海南旅游完美避坑！,IP属地:河南,,,,,三亚亚特兰蒂斯水世界好评
_WeCh****830492,5分,超棒,景色5,趣味5,性价比5,小朋友玩嗨啦，Anna服务非常好哈，带小朋友来有必要租个凉亭，很划算，不用找座位,IP属地:海南,,,,,三亚亚特兰蒂斯水世界好评
M33****0413,5分,超棒,景色5,趣味5,性价比5,"失落的空间水族馆	亚特兰蒂斯C秀	也可按顺时针游玩	根据排队时间项目灵活安排	
...

我悟了!原来亚特兰蒂斯应该这样玩不踩雷上个星期和家人去了亚特兰蒂斯玩，本来以为做足了攻略，结果还是踩了不少坑啊，真的很想笑自己。为了不让姐妹们踩雷，我特地整理了一份避雷攻略，有需要来亚特兰蒂斯玩的姐妹可以看看，能帮助你少踩一些坑

来亚特兰蒂斯有哪些好玩的!
水世界:海洋帝国/鲨鱼穿越/怒海过山车/海神之跃/放手一搏/旋风大喇叭/造浪池/海底漫步/喂食鳐鱼/鲨鱼池浮潜
海豚小岛:海狮拍照/海狮浅滩邂逅(和海狮一起玩)/海狮泛舟嬉戏/海豚拍照/海豚海狮探秘之旅/海豚浅滩邂逅(和海豚一起玩)水族馆:看海洋动物大型剧场演出:C秀
其他:潜水探险/白鲸之泳水下互动/探班白鲸明星/水晶船之旅/夜宿水族馆/复游雪/直升机/迷你营
游玩介绍:
di一站:失落的空间水族馆
高占:姐妹们可以近跖离接触海洋动物还有",IP属地:海南,,,,,三亚亚特兰蒂斯水世界好评
M49****3330,5分,超棒,景色5,趣味5,性价比5,"亚特兰蒂斯水世界，堪称水上乐园的梦幻仙境！

当我踏入这片充满奇幻色彩的水世界时，仿佛置身于一个神秘的海底王国。

首先，其游乐设施丰富多样，令人目不暇接。“放手一搏”带来心跳加速的自由落体体验，“鲨鱼穿越”让你与鲨鱼近距离接触，感受刺激与新奇的完美融合。

水世界的环境营造更是一绝。精美的装饰、逼真的海洋元素，让人仿佛真的遨游在亚特兰蒂斯的神秘海域。

水质清澈透明，干净卫生，让游客可以毫无顾虑地尽情畅玩。

服务方面也值得称赞，工作人员热情友好，总是在需要的时候提供及时的帮助和引导。

餐饮选择丰富，能满足不同口味的需求，让您在游玩间隙补充能量。

安全措施也十分到位，随处可见的救生员让人倍感安心。

总之，亚特兰蒂斯水世界不仅是一个娱乐的好去处，更是一次令人难忘的梦幻之旅。无论是寻求刺激的冒险家，还是享受亲子时光的家庭，这里都能带来无与伦比的欢乐体验。强烈推荐给所有热爱水上活动的朋友们！
希望这份评价能符合您的需求，您也可以给我提供更多关于您在亚特兰蒂斯水世界的具体感受和经历，以便我为您生成更贴合您想法的内容。",IP属地:海南,,,,,三亚亚特兰蒂斯水世界好评
M45****7923,5分,超棒,景色5,趣味5,性价比5,"1. 亚特拉蒂斯水世界，清凉一夏的首选！
2. 拥抱水世界，体验无限快乐，亚特拉蒂斯带你飞！
3. 探索未知，尽享清凉，亚特拉蒂斯水世界，让夏天不再炎热！
4. 亚特拉蒂斯水世界，家庭欢乐的海洋，共享清凉时光！
5. 玩水新去处，亚特拉蒂斯水世界，让每一天都充满惊喜！",IP属地:海南,,,,,三亚亚特兰蒂斯水世界好评
