user_detail_name,text,text 2,text 3,text 4,text 5,content_wrap,iplocation,,,,,attraction_name
耶梅勒芳,5分,超棒,景色5,趣味5,性价比5,一进水世界就来学冲浪啦??可以学习半个小时，半小时下来掌握基础的冲浪技巧。郑七红教练一对一教学，还有李诗文小姐姐科普一些游泳知识和三亚游玩好地方。整体是个不错滴体验，想学冲浪的可以来体验体验??,,,,,,三亚亚特兰蒂斯水世界好评
wan****e333,5分,超棒,景色5,,,七彩晶餐厅自助餐菜品很丰盛，服务员Frank 很细心，赞,,,,,,三亚亚特兰蒂斯水世界好评
M82****5796,5分,超棒,景色5,趣味5,性价比5,早上十点半入园的 当时水还是有点冷的 但也玩了四个项目 鲨鱼??穿越 漂流有点慢 过山车很刺激章鱼??竞速也很适合小盆友玩,IP属地:海南,,,,,三亚亚特兰蒂斯水世界好评
_M13****7321,5分,超棒,景色5,趣味5,性价比5,水世界非常好玩，非常刺激，玩得很开心，冬天天气也不冷，建议有空儿过来玩！,IP属地:海南,,,,,三亚亚特兰蒂斯水世界好评
M26****7922,5分,超棒,景色5,趣味5,性价比5,"海南省三亚市海棠湾镇海棠北路8号亚特兰蒂斯度假区
挺好的，我是复游会会员，所有有免费的柜子和毛巾
完美??
【性价比】",IP属地:海南,,,,,三亚亚特兰蒂斯水世界好评
M14****582,5分,超棒,景色5,趣味5,性价比5,10月的亚特兰蒂斯 人少 景好 天气暖,IP属地:海南,,,,,三亚亚特兰蒂斯水世界好评
158****0312,5分,超棒,景色5,趣味5,性价比5,小朋友玩的很happy，还会二刷,IP属地:海南,,,,,三亚亚特兰蒂斯水世界好评
107****517,5分,超棒,景色5,趣味5,性价比5,【景色】非常好 还干净 孩子非常喜欢,IP属地:海南,,,,,三亚亚特兰蒂斯水世界好评
M17****534,5分,超棒,景色5,趣味5,性价比5,漂流太好玩了、和孩子一起玩了三遍,IP属地:海南,,,,,三亚亚特兰蒂斯水世界好评
淡予默尘,5分,超棒,景色5,趣味5,性价比5,"超级快乐??
【趣味】项目多多
【性价比】无限畅玩，还有直通票不需要排队呦！",IP属地:海南,,,,,三亚亚特兰蒂斯水世界好评
M22****2214,5分,超棒,景色5,趣味5,性价比5,超级好玩，孩子最爱泳池泡泡扒，住在这里最好了，无限次进出......推荐,IP属地:海南,,,,,三亚亚特兰蒂斯水世界好评
M32****1337,5分,超棒,景色5,趣味5,性价比5,项目非常多，孩子喜欢玩儿。就是有的孩子有的项目限制孩子身高1米2，孩子太小还玩不了。老大到达身高了，非常喜欢玩。,IP属地:海南,,,,,三亚亚特兰蒂斯水世界好评
M33****218,5分,超棒,景色5,趣味5,性价比5,最开心的一次水世界之旅，玩了海神之跃超级刺激，非常安全，大喇叭也很爽，总之是非常推荐大家过来来玩，以后还要再来。,IP属地:海南,,,,,三亚亚特兰蒂斯水世界好评
胜利佛爷,5分,超棒,景色5,趣味5,性价比5,非常好玩的水世界乐园，紧张刺激。,IP属地:海南,,,,,三亚亚特兰蒂斯水世界好评
_ucwe****128512,5分,超棒,景色5,趣味5,性价比5,一定要来看亚特兰蒂斯的表演非常的丰富，时间安排的很好，石头鱼非常的可爱。,IP属地:海南,,,,,三亚亚特兰蒂斯水世界好评
诺森伯兰李斯,5分,超棒,景色5,趣味5,性价比5,"漂流，鲨鱼穿越，章鱼竞速，好玩。建议购买快通票，省去排队的时间，做好防晒。建议卫生间指示牌再明显点。
【性价比】高",IP属地:海南,,,,,三亚亚特兰蒂斯水世界好评
芸芸0924,5分,超棒,景色5,趣味5,性价比5,有体验喂食还有摸海星活动，很赞！,IP属地:海南,,,,,三亚亚特兰蒂斯水世界好评
M23****3359,5分,超棒,景色5,趣味5,性价比5,好评 ，玩的大喇叭和海浪骑士，现在手都是抖的，太刺激了，每个都完了两三次，陈丰亮员工人热情，接待都很开心，水很清澈，很干净，没有消毒水的味道，值得大家来。,IP属地:海南,,,,,三亚亚特兰蒂斯水世界好评
M50****0334,5分,超棒,景色5,趣味5,性价比5,"里面的空间也很大。还有船长和水手
尾波冲浪和摩托艇，真的太刺激了。玩尾波
的时侯还喝了好多海水才站起来的。凤凰岛这边
也很漂亮，很适合拍照",,,,,,三亚亚特兰蒂斯水世界好评
Fiona-2009,5分,超棒,景色5,趣味5,性价比5,亚特兰蒂斯水世界非常适合大点的孩子，身高超过1.22基本所有项目都能玩了，项目虽然刺激，但玩完不难受，感觉很爽！,,,,,,三亚亚特兰蒂斯水世界好评
kaiyanggg,5分,超棒,景色5,趣味5,性价比5,不愧是闻名世界的水上乐园，垂直的滑梯我是不敢试的了，但是大喇叭那些还是很不错的，不知道冬天来票价可不可以便宜一点！(??ω??)??,,,,,,三亚亚特兰蒂斯水世界好评
201****598,5分,超棒,景色5,趣味5,性价比5,很美的酒店，环境很好，性价比高。,,,,,,三亚亚特兰蒂斯水世界好评
M58****150,5分,超棒,景色5,趣味5,性价比5,亚特兰蒂斯水世界，孩子们的天堂,IP属地:海南,,,,,三亚亚特兰蒂斯水世界好评
M30****2019,5分,超棒,景色5,趣味5,性价比5,带小朋友游玩非常棒，就是最近几天三亚的天气不太热，天气热的话就非常棒了,IP属地:海南,,,,,三亚亚特兰蒂斯水世界好评
M41****2395,5分,超棒,景色5,趣味5,性价比5,漂流玩了4次，每次都不一样角度，激起的浪花，飞扬的心跳，呐喊释放，挺不错的，冲浪也不错，配合着DJ音乐，嗨起来,IP属地:海南,,,,,三亚亚特兰蒂斯水世界好评
_WeCh****36539,5分,超棒,景色5,趣味5,性价比5,住酒店游玩，海神之跃75度角度，2s失重感，俗称冲马桶。大喇叭和小喇叭，个人最喜欢大喇叭，四人一组，超速感受。,IP属地:海南,,,,,三亚亚特兰蒂斯水世界好评
M49****070,5分,超棒,景色5,趣味5,性价比5,"水世界项目比较多, 住店客人可以提前拿门票入园
游玩。这次带孩子过来玩,体验一下海狮互动、喂
食鳍鱼 , 她玩得很开心.",IP属地:海南,,,,,三亚亚特兰蒂斯水世界好评
M43****0119,5分,超棒,景色5,趣味5,性价比5,放手一搏比较刺激，骇浪骑士玩了两次，很阔以，过山车也不错，哈哈哈哈哈哈,IP属地:海南,,,,,三亚亚特兰蒂斯水世界好评
_WeCh****60982,5分,超棒,景色5,趣味5,性价比5,水族馆里面还有狮子鱼狮子，他在二楼还有美人鱼表演白金表演也是特别精彩的,IP属地:海南,,,,,三亚亚特兰蒂斯水世界好评
186****8643,5分,超棒,景色5,趣味5,性价比5,"【景色】非常好，目光所及都是绿色
【趣味】孩子很喜欢玩，流连忘返
【性价比】物超所值，十分推荐",IP属地:海南,,,,,三亚亚特兰蒂斯水世界好评
龙卷风,5分,超棒,景色5,趣味5,性价比5,嘻嘻，亚特兰蒂斯水世界，刺激好玩，水上游乐巅峰，欢乐满满，不容错过！(R?Q) / 摇摆身体，眼中放出兴奋的光芒！,IP属地:海南,,,,,三亚亚特兰蒂斯水世界好评
winter333,5分,超棒,景色5,趣味5,性价比5,"【景色】泳池很美
【趣味】海神之跃很刺激，鲨鱼穿越很有意思
【性价比】很高",IP属地:海南,,,,,三亚亚特兰蒂斯水世界好评
M50****7582,5分,超棒,景色5,趣味5,性价比5,鲨鱼穿越，骇浪骑士，连环小喇叭等等都很好玩，，适合10岁以上的孩子玩。,IP属地:海南,,,,,三亚亚特兰蒂斯水世界好评
M66****6667,5分,超棒,景色5,趣味5,性价比5,亚特兰蒂斯水世界暑假游玩首选。,IP属地:海南,,,,,三亚亚特兰蒂斯水世界好评
密琳,5分,超棒,景色5,趣味5,性价比5,非常好玩，除经典两个项目，没有长隆刺激，晚上水上表演结合无人机也不错。,IP属地:海南,,,,,三亚亚特兰蒂斯水世界好评
300****985,5分,超棒,景色5,趣味5,性价比5,每一位 员工都非常热情，服务周到耐心。我们漂流还把眼镜丢了，他们员工满池子找，最后找到了。有机会一定要再来这边。,IP属地:海南,,,,,三亚亚特兰蒂斯水世界好评
M47****7957,5分,超棒,景色5,趣味5,性价比5,第一次来亚特兰蒂斯，建议还是住酒店包水世界和水族馆门票比较划算，单买这两项也不便宜，体验感很好，小朋友超开心。,IP属地:海南,,,,,三亚亚特兰蒂斯水世界好评
_ZFB****09066,5分,超棒,,,,亚特兰蒂斯水世界巨好玩，有很多好玩的水上项目，有适合情侣玩的水上漂流也叫养生流，可以悠闲的欣赏水世界的风光，还有很多刺激的项目，比如说放手一搏，不一样的体验，比跳楼机还刺激。非常推荐大家过来,IP属地:海南,,,,,三亚亚特兰蒂斯水世界好评
M49****2835,5分,超棒,景色5,趣味5,性价比5,漂流河特别好玩，特别适合小朋友玩小朋友玩的都不想走，下次会在带小朋友来玩的，感兴趣的朋友们可以过来玩，很开心，鲨鱼穿越也特别好玩哦,,,,,,三亚亚特兰蒂斯水世界好评
_WeCh****011662,5分,超棒,景色5,趣味5,性价比5,非常不错去之前吃饱去 带瓶水 不然里面东西够的可怕 矿泉水18一瓶 玩的很不错 开学 不喜欢排队的还可以买免排票有趣好玩，景色不错，总体超赞，,,,,,,三亚亚特兰蒂斯水世界好评
紫色袭人,5分,超棒,,,,漂流小朋友特别喜欢，有缓有急流，有点小刺激，鲨鱼穿越大人小孩都觉得海玩，就是时间有点短，可以玩很多遍，赞??,IP属地:海南,,,,,三亚亚特兰蒂斯水世界好评
M93****64,5分,超棒,景色5,趣味5,性价比5,体验感很好，服务也很热情，工作人员全程有陪伴，大喇叭和骑士很值得游玩，太刺激了，玩完还想玩，来三亚一定要来玩,IP属地:海南,,,,,三亚亚特兰蒂斯水世界好评
M55****6814,5分,超棒,景色5,趣味5,性价比5,好玩的，带孩子很有意思，玩了好几天，值得来！好玩的很，值得来！好玩的很！值得来！好玩的很！值得来！好玩的很！,IP属地:海南,,,,,三亚亚特兰蒂斯水世界好评
mis奇,5分,超棒,景色4,趣味4,性价比4,亚特兰蒂斯水世界太好玩了，鲨鱼穿越玩了2次，淡季来刷不用排队，超爽！,IP属地:海南,,,,,三亚亚特兰蒂斯水世界好评
M83****3673,5分,超棒,景色5,趣味5,性价比5,水世界适合一家人来玩，这里的环境优美，服务质量特别好，而且设施非常齐全，我们已经都来过一次了，还想来第二次！,IP属地:海南,,,,,三亚亚特兰蒂斯水世界好评
yoyo,5分,超棒,景色5,趣味5,性价比5,"海神之跃打卡，5秒…
极速漂流，大喇叭，挺好的，工作人员很热情很贴心。",IP属地:海南,,,,,三亚亚特兰蒂斯水世界好评
M22****4276,5分,超棒,景色5,趣味5,性价比5,大小喇叭非常刺激，项目非常多，特别是放手一搏值得体验，来亚特兰蒂斯水世界真的值得！还有过山车连环小喇叭等等！,IP属地:海南,,,,,三亚亚特兰蒂斯水世界好评
M50****8381,5分,超棒,景色5,趣味5,性价比5,今天带孩子过来的，是她在所有水世界玩的最开心最刺激的一次，勇敢挑战了放手一搏，是勇气与力量的较量，非常给力！,IP属地:海南,,,,,三亚亚特兰蒂斯水世界好评
ning??????,5分,超棒,景色5,趣味5,性价比5,院区非常有特色，值得一玩，特别推荐大喇叭和小喇叭，其他的海神之跃没玩，其他的项目还是比较推荐的，建议做好防晒,IP属地:海南,,,,,三亚亚特兰蒂斯水世界好评
M45****4395,5分,超棒,,,,把海棠湾酒店住了个遍，玩得最久的还是亚特兰蒂斯，物超所值，无限次出入乐园，非常好玩，点名表扬海神塔的Sam大哥，热心又有耐心????????????,IP属地:海南,,,,,三亚亚特兰蒂斯水世界好评
M35****0740,5分,超棒,,,,第二次来水乐园了，话说，我今年的暑假除了读福书，听听课，其余就是带娃了。这几天去上轮滑课，旁边有个水上乐园，深深吸引了小宝的注意力。于是，今天就去了水上乐园。服务评价，邹利玲水世界值得推荐,IP属地:广东,,,,,三亚亚特兰蒂斯水世界好评
Jane 郭,5分,超棒,景色5,趣味5,性价比5,水世界很好玩，然后当时去玩水世界的时候，小孩子就可以去玩那些稍微不是那么刺激的游乐设施，而大人就可以去玩什么“海神之跃”“放手一搏”之类的，很好玩～,,,,,,三亚亚特兰蒂斯水世界好评
_WeCh****17874,3分,不错,景色3,趣味3,性价比1,性价比最低的水族馆没有之一，千万别去，全家人花了900多门票，半个小时不到就完事了，门头最吸引人的一张上传了,,,,,,三亚亚特兰蒂斯水世界好评
陪你看海6668,5分,超棒,景色5,趣味5,性价比5,非常好玩，孩子们很喜欢！水很干净，里面好玩的地方很多，推荐大家来玩,IP属地:海南,,,,,三亚亚特兰蒂斯水世界好评
M32****0531,5分,超棒,景色5,趣味5,性价比5,水世界项目很多很刺激，非常好玩，推荐！卢雯倩服务周到帮我们指引路线,IP属地:海南,,,,,三亚亚特兰蒂斯水世界好评
M34****5320,5分,超棒,景色5,趣味4,性价比3,带大小朋友来首选哦～小孩子的天堂。适合12月份哦～天气刚刚好，环境非常好。美中不足就是里面的吃的有点小哦～,IP属地:海南,,,,,三亚亚特兰蒂斯水世界好评
M36****2752,5分,超棒,景色5,趣味4,性价比4,游玩场馆项目中规中矩，不是特别的大，通常用一天到两天可完成游览。提前购买泳裤及手机防护套，场馆内有点小贵。,IP属地:海南,,,,,三亚亚特兰蒂斯水世界好评
小百合呀,5分,超棒,景色5,趣味5,性价比5,玩了两天很喜欢，小朋友也很开心～看了好几场美人鱼表演棒棒哒，狮子鱼,IP属地:海南,,,,,三亚亚特兰蒂斯水世界好评
呼呼哈哈哈,5分,超棒,景色5,趣味5,性价比5,不错喔，现在人不是特别多，玩项目不用排队，项目有刺激和小朋友玩的哦,IP属地:海南,,,,,三亚亚特兰蒂斯水世界好评
M48****628,5分,超棒,景色5,趣味5,性价比5,酒店环境非常棒，服务也特别好，游乐设施也很好玩，下次还会带家人过来,IP属地:海南,,,,,三亚亚特兰蒂斯水世界好评
M14****361,5分,超棒,景色5,趣味5,性价比5,体验感非常棒，游戏很好玩，力推过山车和大喇叭，带着孩子来玩的很开心,IP属地:海南,,,,,三亚亚特兰蒂斯水世界好评
M46****3063,5分,超棒,,,,来三亚一定要来亚特兰蒂斯水世界，特别好玩。住在酒店可以无限次入园。,IP属地:海南,,,,,三亚亚特兰蒂斯水世界好评
M44****07,5分,超棒,景色5,趣味5,性价比5,非常推荐这个水世界，环境优美，设施齐全，水质特别干净，而且工作人员特别热心，工作人员特别专业敬业，值得一来,IP属地:海南,,,,,三亚亚特兰蒂斯水世界好评
_cft0****6930,5分,超棒,景色5,趣味5,性价比5,"【景色】不错很好，也好看。水上世界项目很刺激很好玩。也有一些不错的，
【性价比】性价比不错，很好游玩项目很多",IP属地:海南,,,,,三亚亚特兰蒂斯水世界好评
M42****3055,5分,超棒,景色5,趣味5,性价比5,玩得很好，风景很好，孩子很喜欢，推荐给大家，可以住亚特兰蒂斯酒店哦,IP属地:海南,,,,,三亚亚特兰蒂斯水世界好评
M23****8330,5分,超棒,景色5,趣味5,性价比5,天气很热，玩得人还是蛮多的，正好住在酒店里，可以无限次刷项目，基本上排排队都可以玩，小孩子玩得都不想回去了,IP属地:海南,,,,,三亚亚特兰蒂斯水世界好评
M29****1567,5分,超棒,景色5,趣味5,性价比5,水世界老少皆宜。游玩有趣。有刺激的有舒缓的。很棒呀，带孩子好去处。,IP属地:海南,,,,,三亚亚特兰蒂斯水世界好评
M51****7427,5分,超棒,景色5,趣味5,性价比5,非常好玩，大喇叭，怒海过山车都比较喜欢，最喜欢海神之跃，强烈推荐。,IP属地:海南,,,,,三亚亚特兰蒂斯水世界好评
honeau,5分,超棒,景色5,趣味5,性价比5,环境不错，心旷神怡，有不少免费玩耍的项目，试试啊，已经附了编码，对勾的是含在门票里的呦。圆圈的是刺激的项目，可以去感受一下啦。,,,,,,三亚亚特兰蒂斯水世界好评
M26****937,5分,超棒,景色5,趣味5,性价比5,在携程上订的夜场特价票209元，现场买要300多，里面的项目挺好玩的，特别是漂流小朋友很喜欢，还有一些刺激的项目胆子小不敢玩，下次再来三亚还回去，总体好评。强烈推荐。,,,,,,三亚亚特兰蒂斯水世界好评
M49****8741,5分,超棒,景色5,趣味5,性价比5,园区好玩项目挺多的，黄良欢小哥哥细心的给我介绍了游玩攻略，非常棒,IP属地:海南,,,,,三亚亚特兰蒂斯水世界好评
M38****555,5分,超棒,景色5,趣味5,性价比5,服务非常nice，工作人员都很客气我，游玩项目也很不错，推荐！~,IP属地:海南,,,,,三亚亚特兰蒂斯水世界好评
M26****1383,5分,超棒,景色5,趣味5,性价比5,"水世界刺激又有趣，孩子们玩得超级开心。
放手一搏，姐姐??敢挑战。",IP属地:海南,,,,,三亚亚特兰蒂斯水世界好评
_WeCh****771375,5分,超棒,景色5,趣味5,性价比5,和爱人一起游玩，冲浪区，海神之跃，放手一搏，非常棒的体验，而且服务人员非常贴心，耐心的讲解，以后还会来。,IP属地:海南,,,,,三亚亚特兰蒂斯水世界好评
M25****5470,5分,超棒,景色5,趣味5,性价比5,看到了两只可爱的大白鲸看了半天不舍的离开！其他的动物们也很可爱。,IP属地:海南,,,,,三亚亚特兰蒂斯水世界好评
M28****420,5分,超棒,景色5,趣味5,性价比5,来到三亚亚特兰蒂斯水世界玩的东西挺多的，下次应该还会带小孩来玩吧,IP属地:海南,,,,,三亚亚特兰蒂斯水世界好评
205****233,5分,超棒,景色5,趣味5,性价比5,水世界很好玩，一拖二毫无压力，小朋友玩得很开心，是放电的好机会。,IP属地:海南,,,,,三亚亚特兰蒂斯水世界好评
M25****6589,5分,超棒,景色5,趣味5,性价比5,非常好玩 大人小孩都可以玩的很好 非常的推荐 有意思的66666666,IP属地:海南,,,,,三亚亚特兰蒂斯水世界好评
M16****834,5分,超棒,景色5,趣味5,性价比5,玩了两天了，孩子们很开心，进进出出好几趟，玩的很嗨，不错不错??,IP属地:海南,,,,,三亚亚特兰蒂斯水世界好评
_WeCh****120289,5分,超棒,景色5,趣味5,性价比5,项目很多，设施齐全，惊险刺激，非常好玩，非常值得一来，大家冲啊！,IP属地:海南,,,,,三亚亚特兰蒂斯水世界好评
M47****7083,5分,超棒,景色5,趣味5,性价比5,非常好玩，下次还来，安全刺激非常棒，孩子高兴，光玩浅水平就很开心,IP属地:海南,,,,,三亚亚特兰蒂斯水世界好评
M49****8480,5分,超棒,景色5,趣味5,性价比5,非常的好玩，水质很干净，推荐漂流，这个项目感觉非常的悠闲，又很刺,IP属地:海南,,,,,三亚亚特兰蒂斯水世界好评
M31****220,5分,超棒,,,,非常好玩，活动价划算，包含了大部分项目，飞跃很棒，画面感和空中感都做得很好，虽然刺激但不惊险，适合大人孩子。演出也很棒。园区内餐厅、洗手间、休息座位都充足，环境干净，管理有序，值得推荐,IP属地:海南,,,,,三亚亚特兰蒂斯水世界好评
Fan ? ?? ???,5分,超棒,,,,"今天非常好，儿子第一次玩水世界，特别喜欢漂流和??竞速，连续玩了好几次，我自己强推怒海过上车。刺激！
儿童泳池的滑梯也很丰富！就是有些有身高要求！",IP属地:海南,,,,,三亚亚特兰蒂斯水世界好评
M24****5630,5分,超棒,景色5,趣味5,性价比5,亚特兰蒂斯水世界很好玩！鲨鱼穿越里各种小鱼特别漂亮 ，可以在外面拍照和鱼合影。大喇叭稍微刺激点，有小小失重感，整体很有意思，赵虹阁小哥哥服务很热情,IP属地:海南,,,,,三亚亚特兰蒂斯水世界好评
柚茶z,5分,超棒,景色5,趣味5,性价比5,真的是一个很好的游玩的地方，也可以带小孩子去，东西非常的好吃，让人欲罢不能，干净卫生，色香味俱全，吃的种类也非常多，价格也不贵，下次还回来游玩。,,,,,,三亚亚特兰蒂斯水世界好评
M30****1113,5分,超棒,,,,很不错哦，哈哈哈，海神之跃和放手一搏网红不用说啦，最好玩的竟然是过山车，6刷过山车飞一样的体验！美丽～带娃来也可以玩的很好，漂流带娃可以玩的不错,,,,,,三亚亚特兰蒂斯水世界好评
135****7298,5分,超棒,景色5,趣味5,性价比5,下大雨，等雨停了去玩，几乎没人，一小时玩遍所有项目，有几个还二刷三刷！本来打算了用一天排队的，太开心了。鲨鱼餐厅几个服务员态度都很好，而且食物份量大，云吞味道不怎么样，其他看着都可以。,,,,,,三亚亚特兰蒂斯水世界好评
噼里啪啦,4分,满意,景色4,趣味4,性价比4,"酒店里的海洋世界！
【趣味】dolphin??！你是不是从来没有亲过这么好亲，这么肉肉感的脸吧??亲的如此认真。
【性价比】不错",,,,,,三亚亚特兰蒂斯水世界好评
天下的无双,5分,超棒,景色5,趣味5,性价比5,"值得去玩的，非常舒服，点评一下：
1、周末人会有点多，建议早点去。如果住酒店可以提前入园
2、各个项目都不错、非常刺激而且很安全",,,,,,三亚亚特兰蒂斯水世界好评
M28****6253,5分,超棒,景色5,趣味5,性价比5,鲨鱼穿梭很好玩，还有鲨鱼可以看，小朋友很开心！造浪池也很好玩。,IP属地:海南,,,,,三亚亚特兰蒂斯水世界好评
M33****2960,5分,超棒,景色5,趣味5,性价比5,里面的海神之跃非常刺激，还有放手一搏，有点可惜孩子太小1.22以下的不让玩的项目有好几个，总体感觉不错,IP属地:海南,,,,,三亚亚特兰蒂斯水世界好评
aididr,5分,超棒,景色5,趣味5,性价比5,里面特别好玩，服务很周到热情。以后还会来。,IP属地:海南,,,,,三亚亚特兰蒂斯水世界好评
M45****388,5分,超棒,景色5,趣味5,性价比5,水上漂流值得玩儿一下，一大一小乘坐漂流筏，服务也好??，有躺椅,IP属地:海南,,,,,三亚亚特兰蒂斯水世界好评
M22****3042,5分,超棒,景色5,趣味5,性价比5,哇～好大好玩好……累??????节目表演氛围超好，能玩儿一整天,IP属地:海南,,,,,三亚亚特兰蒂斯水世界好评
M45****249,5分,超棒,景色5,趣味5,性价比5,"环境：环境很好，适合所有人群
游玩感受：游玩项目很刺激，特别有趣",IP属地:海南,,,,,三亚亚特兰蒂斯水世界好评
_M13****8339,5分,超棒,景色5,趣味5,性价比5,早上人比较少不太晒，服务很好，环境很好，推荐亲子出游选择这里。,IP属地:海南,,,,,三亚亚特兰蒂斯水世界好评
毛毛虫,5分,超棒,景色5,趣味5,性价比5,亚特兰蒂斯，一定要领孩子来一趟，真的特别好玩，赶到淡季还不贵。,IP属地:海南,,,,,三亚亚特兰蒂斯水世界好评
D12****738,5分,超棒,景色5,趣味5,性价比5,孩子很喜欢，玩的不想走了，一些项目也适合大人玩。订的套票，玩了两天，实在没力气了，下次有机会还会再来。,IP属地:海南,,,,,三亚亚特兰蒂斯水世界好评
幼稚的青年呐,5分,超棒,景色5,趣味5,性价比5,住酒店期间可以免费无限次进出水世界 现在这个季节玩水也刚刚好 不错,IP属地:海南,,,,,三亚亚特兰蒂斯水世界好评
M23****90,5分,超棒,景色5,趣味5,性价比5,超级好超级好，下一次还要来。超级好，超级喜欢下一次还要来这儿。,IP属地:海南,,,,,三亚亚特兰蒂斯水世界好评
M56****094,5分,超棒,景色5,趣味5,性价比5,"玩了海神之跃，鲨鱼穿越，感觉很刺激
晚上看了水幕表演，性价比很高",IP属地:海南,,,,,三亚亚特兰蒂斯水世界好评
M47****0589,5分,超棒,景色5,趣味5,性价比5,第一次来，小朋友们很开心下次还来，冬天来，公司团建首选嗯好更好,IP属地:海南,,,,,三亚亚特兰蒂斯水世界好评
ytt****521,5分,超棒,,,,"热闹的水世界，开启快乐之旅了，亚特兰蒂斯太适合带娃了
【性价比】
【景色】
【景色】????????????",IP属地:海南,,,,,三亚亚特兰蒂斯水世界好评
M28****121,5分,超棒,景色5,趣味5,性价比5,好玩，可惜跟团来的，玩不过瘾就要走啊！还有很多刺激项目不敢尝试,IP属地:海南,,,,,三亚亚特兰蒂斯水世界好评
小羊洁洁,5分,超棒,景色5,趣味5,性价比5,怒海过山车特别好玩！排队不用晒太阳 也不用自己拿东西 排队少很风凉,IP属地:海南,,,,,三亚亚特兰蒂斯水世界好评
186****8047,5分,超棒,景色5,趣味5,性价比5,孩子的游乐场特别好玩，拍浪的也很不错，飘着飘着就走远了，很舒服,IP属地:海南,,,,,三亚亚特兰蒂斯水世界好评
M37****903,5分,超棒,,,,游玩非常棒，不仅有大人的刺激项目，也有小孩的娱乐项目，亲子项目,IP属地:海南,,,,,三亚亚特兰蒂斯水世界好评
_CFT0****5982,5分,超棒,景色5,趣味5,性价比5,造浪池可以冲浪??，很适合夏天，很凉快呢，玩了好多项目可以二刷,IP属地:海南,,,,,三亚亚特兰蒂斯水世界好评
