user_detail_name,text,text 2,text 3,text 4,text 5,content_wrap,iplocation,,,,,attraction_name
_WeCh****91213,5分,超棒,景色5,趣味5,性价比5,我们住在爱必侬公寓酒店，走过去五分钟，从亚特兰蒂斯酒店穿过，经过水族馆和餐厅，里面食物比较贵吧，当然有钱不会觉得贵，一个汉堡薯条82元，披萨饭之类的都是82元一份，水世界不大，但是项目还算齐全，下午三点玩到晚上八点多才出来，女儿比较喜欢,,,,,,三亚亚特兰蒂斯水世界好评
恰似您的温柔,5分,超棒,景色5,趣味5,性价比5,三亚亚特兰蒂斯水世界有34条水上滑道，多种多样的玩法等你解锁，挑战自我，看你的勇气有多少。25.1米高的海神之跃，给你极速失重体验。大喇叭，和好朋友一起，在摇摆中放声尖叫。除此之外，你还可以带上特制头盔，置身鲨鱼池中漫步。还可以在水族馆海洋动物专家的协助下，完成喂食鳐鱼的体验。,,,,,,三亚亚特兰蒂斯水世界好评
ourlove99,3分,不错,景色3,,,今天是在酒店的第四天，硬件设施不错，唯独老婆和闺女晚上被虫咬了，老婆腿上、手臂第一天来就被咬了三十几个包，涂了青草膏，花露水，都没什么效果，几天都不消。女儿也未幸免，今早上被咬肿了，而且非常痒。我就去找前台，向前台说明情况后，值班经理--林浩天出来轻描淡写得和我说了一句，这很正常，还告诉我这是xxx虫，这句话让我我很诧异，我说“我是来度假的，不是来喂虫的”，在沟通的过程中这位经理没有表示一点歉意，也没有说将采取任何除虫措施来杜绝此类事件再次发生，我问这位经理:遇到顾客此类诉求，都这么处理吗？他漠不关心的表情让我很心凉，这让我切实理解了这位经理得忠告--被咬成这样真的很正常！这是酒店度假独家赠送！,,,,,,三亚亚特兰蒂斯水世界好评
荔枝红了-,5分,超棒,景色5,趣味5,性价比5,"1．可以从中高难度开始体验比如激流过山车飓风之眼然后体验较低难度项目比如章鱼竞速或者鲨鱼漂流然后_刺高等难度比如霹雳旋风或者放手一搏最后慢享环园漂流。
2．放手一搏或者海神之跃失重感就在一瞬间保持安全姿势时最好要捏住鼻子下冲时水流太强容易呛到
3．中午太阳虽烈但是做好防晒还是比较适合进行水上项目的下午3点以后感觉一起风高处的项目排队时都会觉得比较冷。
园内用餐＃中西式简餐都有
着装＃大部分项目有划垫或者橡皮圈工具如果体验海神之跃或放手一搏等没有工具的极限项目男女生最好都着件⌒涞挠疽路阑し郎苟且不会磨。
亲子＃有专门的儿童园区
1．感觉儿童区也比较大更适合4、5岁以上孩子。
2．刺激类的项目普遍都有122m和35kg的低限大点的孩子可适项目更多些。
配套＃国际接轨
1．二月底去的人不少但并没有影响整体体验除了过山车和鲨鱼漂流排队时间10min左右其他项目排队时间都不长基本都在5min以内。
2．很干净无论洗手间浴室还是更衣室。浴室都是独立单间水压足水温热有偿提供浴巾和储物柜设施完备。更衣室里边的工作人员覃愫小哥哥很热情进门就是热情微笑的打招呼，还给我们讲解了游玩攻略。服务非常赞
3．入门拍照时带好手环每个项目前有刷手环的环节可以刷下方便后期找照片不过水中运动的表情一般都比较一言难尽                                                           4.  入口客服中心可以免费寄存物品行李，我寄存了食品，客服人员晏佳佳，陈宏艺还热心询问我需不需要放入冰箱，态度亲切！带着疑问的问题咨询她们都能很专业的解答，很周到！这一套服务流程让我们这些远到而来的宾客感到很暖心！整体体验很",,,,,,三亚亚特兰蒂斯水世界好评
M30****3496,5分,超棒,景色5,趣味5,性价比5,我非常推荐这里，小孩也可以玩，1.22以上，所有游乐项目都可以，门票钱也很值，只是里面的吃的，那不是贵一点点了，有钱人当然不在乎，我建议经济条件较差的可以自己准备午餐，设施很齐全，游乐项目也很多，而且还在继续建造。还要感谢宋桂燕，谢金立 白维几个人服务非常好，态度好很热情，还有就是大喇叭小喇叭真的好玩,,,,,,三亚亚特兰蒂斯水世界好评
M43****5420,5分,超棒,景色5,趣味5,性价比5,服务好、耐心解释，项目很好玩，孩子更是很喜欢！不错，推荐给朋友也是感觉很不错！,IP属地:海南,,,,,三亚亚特兰蒂斯水世界好评
M22****949,5分,超棒,景色5,趣味5,性价比5,过山车特别好玩，我们玩了好几次，漂流比较适合老人，小喇叭也好玩，发喇叭有点吓人,IP属地:海南,,,,,三亚亚特兰蒂斯水世界好评
M76****9837,5分,超棒,景色5,趣味5,性价比5,孩子很开心，很适合一家人来！明年继续！,IP属地:海南,,,,,三亚亚特兰蒂斯水世界好评
M47****1395,5分,超棒,,,,放手一搏，体验感，进入舱门后，脚交叉站好，双手抱肩，脚底挡板落下，你自由下落，1-2秒的失重感，然后背部会贴到挡板，下落2秒左右一个上升，最后感受到咕噜咕噜的感觉，站起来，就结束了。全程体验相当哇擦,IP属地:海南,,,,,三亚亚特兰蒂斯水世界好评
嘻嘻啦啦哈,5分,超棒,景色5,趣味5,性价比5,三亚亚特兰蒂斯水世界太棒了，完的项目太多了，有董东托小哥哥介绍我们项目，太棒了，有大喇叭，小喇叭，小朋友害怕的有小朋友玩的区域哟根本不用担心小朋友玩的，玩的太开心，我们下次还要来呦，谢谢董东托小哥哥,IP属地:海南,,,,,三亚亚特兰蒂斯水世界好评
M34****5070,5分,超棒,,,,亚特兰蒂斯水族馆，水世界，适合旅游度假，风景优美，气候宜人，海风阵阵，沁人心脾，性价比高，不需要离开酒店，就可以有一个愉快的度假感受，有机会大家来玩吧，带着孩子来比较好，全家一起欢乐享受，就是有点晒,IP属地:海南,,,,,三亚亚特兰蒂斯水世界好评
M52****4997,5分,超棒,景色5,趣味5,性价比5,体验感非常好，亚特兰蒂斯很好玩，项目很多，很适合小朋友来玩。游乐设施也很全。,IP属地:海南,,,,,三亚亚特兰蒂斯水世界好评
_M13****1123,5分,超棒,景色5,趣味5,性价比5,打卡亚特兰蒂斯水世界，做了最刺激的海神之跃、放手一搏等项目，非常过瘾！赞??,IP属地:海南,,,,,三亚亚特兰蒂斯水世界好评
M44****9563,5分,超棒,景色5,趣味5,性价比5,"全国第一家七星酒店、服务、景色、环境极佳.
里面非常干净、人多、玩的东西也刺激",IP属地:海南,,,,,三亚亚特兰蒂斯水世界好评
M43****244,5分,超棒,景色5,趣味5,性价比5,适合带小朋友来玩，水上漂流，鲨鱼潜水,IP属地:海南,,,,,三亚亚特兰蒂斯水世界好评
M24****1063,5分,超棒,景色5,趣味5,性价比5,好玩。刺激，值得体验，放手一搏很不错,IP属地:海南,,,,,三亚亚特兰蒂斯水世界好评
杨杨杨,5分,超棒,景色5,趣味5,性价比5,人很少，值得快冲，不用排队，房间很美,IP属地:海南,,,,,三亚亚特兰蒂斯水世界好评
夏之愉悦,5分,超棒,,,,今天的亚特兰蒂斯是粉色的，冒着粉色泡泡的亚特兰蒂斯和小白鲸最配了，可爱到爆！今天玩造浪池和泡泡party，小朋友很开心，大鱿鱼和八爪鱼也超级好吃，每次来都吃。过山车坐了三次了！,IP属地:海南,,,,,三亚亚特兰蒂斯水世界好评
M14****589,5分,超棒,景色5,趣味5,性价比5,超级好玩！非常有趣，适合一家大小！,IP属地:海南,,,,,三亚亚特兰蒂斯水世界好评
_WeCh****102946,5分,超棒,景色5,趣味5,性价比5,很好玩哦，来三亚必打卡亚特莱帝斯水世界，真的很好玩哦，喜欢玩水的不容错过！,IP属地:海南,,,,,三亚亚特兰蒂斯水世界好评
妮小颖,5分,超棒,景色5,趣味5,性价比5,很棒，项目都很还玩。人员也很好啊。,IP属地:海南,,,,,三亚亚特兰蒂斯水世界好评
M23****7482,5分,超棒,景色5,趣味5,性价比5,"【景色】太哇塞了，十分豪华
【趣味】孩子们游玩最爱
【性价比】错峰来玩性价比高",IP属地:海南,,,,,三亚亚特兰蒂斯水世界好评
迷人的旅途580204,5分,超棒,景色5,趣味5,性价比5,我觉得可以不用花288门票去水族馆里边看，在外面拍照打卡都特别有效果，在外面拍了很多照，又在水族馆最大的那面观赏墙对面喝了点东西，很美,IP属地:河南,,,,,三亚亚特兰蒂斯水世界好评
M24****6464,5分,超棒,景色5,趣味5,性价比5,早上一定要十点堵门进，这样的话，可以很少人 可以刷很多项目，体验感会超棒的,IP属地:海南,,,,,三亚亚特兰蒂斯水世界好评
M49****6054,5分,超棒,景色5,趣味5,性价比5,鲨鱼漂流很美，小孩子情侣推荐推荐,IP属地:海南,,,,,三亚亚特兰蒂斯水世界好评
150****8356,5分,超棒,景色5,趣味5,性价比5,"简直是小朋友的天堂 
进去根本不愿意出来
连刷两天 怒海过山车四刷
很不错的体验",IP属地:海南,,,,,三亚亚特兰蒂斯水世界好评
118****349,5分,超棒,景色5,趣味5,性价比5,太好玩了，小朋友泡在这个水池就不肯走，漂流还没去玩，还有好多水上项目玩,IP属地:海南,,,,,三亚亚特兰蒂斯水世界好评
M58****324,5分,超棒,景色5,趣味5,性价比5,"【景色】很美
【趣味】漂流很刺激，也很过瘾，中间的几个弯也玩的很好，大浪子也很好玩，里面也还有表演和还可以听歌，海神之跃看着别人玩很好玩，自己不敢上去。",IP属地:海南,,,,,三亚亚特兰蒂斯水世界好评
_WeCh****24495,5分,超棒,景色5,趣味5,性价比5,王利小姐姐超可爱哈哈哈哈 可爱的图案 喜欢?? 亚特兰蒂斯好棒 下次还来嘿嘿嘿,IP属地:海南,,,,,三亚亚特兰蒂斯水世界好评
ang****jyw,5分,超棒,景色5,趣味5,性价比5,漂流很好玩，造浪池很棒。很好玩,IP属地:海南,,,,,三亚亚特兰蒂斯水世界好评
慕容落天,5分,超棒,景色5,趣味5,性价比5,特别开心，小朋友特别喜欢??住在亚特酒店连续玩了2天了！最喜欢鲨鱼穿越,IP属地:海南,,,,,三亚亚特兰蒂斯水世界好评
小魔女 lulu,5分,超棒,景色5,趣味5,性价比5,美丽的亚特兰蒂斯，美丽的水族馆，还有很多表演，暑假带孩子来玩，很开心。,IP属地:海南,,,,,三亚亚特兰蒂斯水世界好评
我的超值旅行微店1234,5分,超棒,景色5,趣味5,性价比5,体验感非常不错，适合带小朋友刷,IP属地:海南,,,,,三亚亚特兰蒂斯水世界好评
pekingwang,5分,超棒,景色5,趣味5,性价比5,三亚的亚特兰蒂斯水世界是三亚的一个网红景点，亚特兰蒂斯水世界不仅有全家老少皆宜的娱乐项目，也有“海神之跃”、“放手一搏”、“飓风之眼”等一系列让人肾上腺素飙升的刺激体验。,,,,,,三亚亚特兰蒂斯水世界好评
189****3138,5分,超棒,景色5,趣味5,性价比5,管家Leo服务不错，还帮我们升级了房间。很适合亲子游，一家子吃喝玩乐都有了，水世界不需要排队哦！就是小贵，不虚此行，有机会一定还会去的，推荐给朋友们！,,,,,,三亚亚特兰蒂斯水世界好评
_WeCh****53343,5分,超棒,景色5,趣味5,性价比5,同期去了三亚两个水上乐园，亚特兰蒂斯确实好很多  无论是硬件还是服务质量  我们玩的是晚场  夏天还觉得冷  建议要带浴巾  就是晚场交通不太便利  回大东海打车160多元。,,,,,,三亚亚特兰蒂斯水世界好评
M26****790,5分,超棒,景色5,趣味5,性价比5,美人鱼的表演非常的精彩哦，一天表演的场次非常的多，喜欢的都可以过来观看，我非常喜欢石斑鱼，他们很肥美，很可爱,IP属地:海南,,,,,三亚亚特兰蒂斯水世界好评
M34****7983,5分,超棒,景色5,趣味5,性价比5,带娃好去处 特别好玩 玩的很开心,IP属地:海南,,,,,三亚亚特兰蒂斯水世界好评
司思宝宝,5分,超棒,景色5,趣味5,性价比5,亚特兰蒂斯水世界，非常适合一家四口出来游玩，两个孩子玩的超级开心。,IP属地:海南,,,,,三亚亚特兰蒂斯水世界好评
M24****676,5分,超棒,景色5,趣味5,性价比5,景色真的是绝美，环境也很整洁，里面的更工作人员也很友好，小朋友玩的泳池很安静，泡泡浴也特别嗨，十分建议来玩,IP属地:海南,,,,,三亚亚特兰蒂斯水世界好评
Smile萱,5分,超棒,景色5,趣味5,性价比5,项目刺激好玩，排队很快，小朋友玩的很开心，下次再来，何金龙服务很好,IP属地:海南,,,,,三亚亚特兰蒂斯水世界好评
M76****4824,5分,超棒,,,,三亚亚特兰蒂斯水世界真的超好玩，可玩的项目很多，很刺激，强推！！！,IP属地:海南,,,,,三亚亚特兰蒂斯水世界好评
M41****1322,5分,超棒,,,,大喇叭体验感，带着气垫船上楼梯，2人，前轻后重，然后开始下落，第一个大的落差会有点紧张，然后进入一接通道，第二个落差就不会紧张了，然后背朝后进入一个通道，不要紧张应为这时已经快要结束了。,IP属地:海南,,,,,三亚亚特兰蒂斯水世界好评
宋小天使,5分,超棒,景色5,趣味5,性价比5,亚特兰蒂斯水世界是不能错过的一站，喜欢过山车，章鱼竞速，连环小喇叭，霹雳小喇叭，造浪池，鲨鱼穿越等，不但适合孩子玩，也适合成年人去找回童年的乐趣。,,,,,,三亚亚特兰蒂斯水世界好评
茉莉 ^_^Emily,5分,超棒,景色4,趣味3,性价比3,个人感觉就是豪华酒店带的水族馆，并没有说的那么高端，规模不是很大，可能没有正式营业，期待正式营业后的完善。,,,,,,三亚亚特兰蒂斯水世界好评
星星当空照,5分,超棒,景色5,趣味5,性价比5,非常有意思，特别适合带小朋友，小丑给的气球很有意思，下次还要来！,IP属地:海南,,,,,三亚亚特兰蒂斯水世界好评
M25****9756,5分,超棒,景色5,趣味5,性价比5,玩的很爽，好久没来水上世界了，亚特兰蒂斯绝对是可以的，很适合带娃，对年轻人来说项目少了点，但是也足够了。,IP属地:海南,,,,,三亚亚特兰蒂斯水世界好评
M80****2096,5分,超棒,景色5,趣味5,性价比5,风景很好，非常好玩，游玩项目也很多，小孩子很适合，而且限制不多。,IP属地:海南,,,,,三亚亚特兰蒂斯水世界好评
_WeCh****876946,5分,超棒,景色5,趣味5,性价比5,真的是很开心的一次体验！！因为是自己一个人来玩的，韦建侦和符伟东教练一路带着玩，帮忙拿手机毛巾，帮忙安排线路带路，真的太贴心了！呜呜 男友力Max！！决定加入粉丝团！！绝绝子 体验感太好了,,,,,,三亚亚特兰蒂斯水世界好评
320****699,5分,超棒,景色5,趣味5,性价比5,怒海过山车好玩，鲨鱼穿越也好玩，下次还会来二刷，孩子们玩的很开心，大人看的也开心，适合亲子活动，安排~,IP属地:海南,,,,,三亚亚特兰蒂斯水世界好评
M40****2433,5分,超棒,景色5,趣味5,性价比5,游玩项目很多也很好，而且酒店顾客不用排队，人也不是特别多没一般得水世界那么拥挤，体验最好的一次水世界了,IP属地:海南,,,,,三亚亚特兰蒂斯水世界好评
_WeCh****578741,5分,超棒,景色5,趣味5,性价比5,大喇叭 过山车 海神真的很好玩 来三亚必来亚特兰蒂斯 鲨鱼餐厅的牛腩饭真的巨好吃 很少在游乐园能吃到这么好吃的餐,IP属地:海南,,,,,三亚亚特兰蒂斯水世界好评
M46****4584,5分,超棒,,,,亚特兰蒂斯水世界超出了对水上游乐场的预期，蕊宝超爱玩章鱼竞速，3天水世界行程下来大概玩了20次，漂流也还不错，另外造浪池也适合儿童在大人陪同下玩耍，还自费玩了卡丁车， 回忆满满、难忘！,IP属地:海南,,,,,三亚亚特兰蒂斯水世界好评
320****924,5分,超棒,景色5,,,新开的水上乐园，人少不用排队。就是有些项目都没开放。其它都还好,,,,,,三亚亚特兰蒂斯水世界好评
M80****0157,5分,超棒,景色5,趣味5,性价比5,亚特兰蒂斯是一所极具创意，富有想象力的大型国际化水族世界??Jason等讲解员专业知识十分丰富，点赞,IP属地:海南,,,,,三亚亚特兰蒂斯水世界好评
浪人-佳明.K,4分,满意,景色4,趣味4,性价比3,"明天就要离开三亚了。最后一天来玩一下，我买的10号机票，但是看到10号的亚特票是199
很刺激，把所有的能玩的都玩，下午2点来。阴天，不晒。6点左右都玩了。排队少，
一开始玩的放手一搏。海神跃，真刺激，根本睁不开眼睛。呛水简直了带劲。玩一遍想玩第二遍。但是后来想去玩别的了。
接着是鲨鱼穿越和章鱼竞速。这两个需要排队等会，因为都可以两个人。可以小孩玩的原因。
接着是霹雳小喇叭和连环小喇叭。爬楼梯都爬累了，可以一个人玩，也是带劲。又呛水了。大同小异。
接着大喇叭，骇浪骑士，这个地方不需要自己拿泳圈，但是因为4个座位。只能2个或者4个人，不能1个和3个。只能在外边搭伙，一开始和一个男的搭伙，玩了骑士，他就走了。我还想玩大喇叭，后来又跟三个女的，搭伙，没想到她们玩的骑士，然后下来了，他们还说要不要一起玩旁边那个，上去之后他竟然又玩了一遍骑士，我说刚才玩的不就这个嘛！然后完事了他们走了，我在下面又等了一会，来了个女的，好巧，这个女的竟然和一开始跟我搭伙的男的是两口子，都过了半个小时了，竟然还能碰到，然后跟她合作玩了大喇叭，然后又玩了一遍骑士。玩了四遍骑士。
骑士和大喇叭，某种程度上还不如小喇叭，因为他只有一个很大的弯，那个地方感觉很带劲。而且都没有呛水。
跟她一起去玩了最后的过山车，这个过山车也是带劲，我跟玩了两遍。这个也是呛水了。
最后来到造浪池看看dj，呆了会就走了，现在人少，也没有什么水幕秀无人机烟花了。挺可惜的。
游玩时间4-5小时。就够了如果加上漂流河的话。算上排队，加躺椅休息。我真要是知道这么快。我就该买10号的还省100。
总结，值得一去，刺激好玩，不排队，但12-2月份一定排队，但是什么都开了，水幕秀烟花表演无人机等。会涨价358。其他时间是298，周三是198，但很多项目关了。
价格还是偏贵，如果平常就是198，周三158会更合适。
里面吃的，就更贵了，随便的水，和肠，薯条，都是25起步，最好自带。
最后还忘了，不要进门存包押金20，租金80换衣那个柜子，就算你放了，到后来游玩项目那还是要存手机，你还得花钱，建议直接把随身物品存到项目旁的储物柜，因为这个押金20。租金5元一天不限次数拿取。注意的是，拿取的时候看好是结算还是继续存。我就点错了结算了一次，然后又存了一遍多花了5块。
就说到这吧，Dj小姐姐还好看，我好喜欢。",IP属地:海南,,,,,三亚亚特兰蒂斯水世界好评
M55****5517,5分,超棒,,,,亚特兰蒂斯水世界超出了对水上游乐场的预期，蕊宝超爱玩章鱼竞速，3天水世界行程下来大概玩了20次，漂流也还不错，另外造浪池也适合儿童在大人陪同下玩耍，还自费玩了卡丁车。恰逢五一还遇到了亚特兰蒂斯的五周年庆，观看了一场盛大的烟花秀。如果一定要找不足之处、那就是乐园里面的餐饮确实很一般、而且性价比也低、体验一般。 回忆满满、难忘！,IP属地:海南,,,,,三亚亚特兰蒂斯水世界好评
M49****0487,5分,超棒,,,,嗯，亚特兰蒂斯水世界，风景优美，具有独特的亚热带树植。游乐项目丰富，尤其是霹雳小喇叭旋风、旋风大喇叭让人印象深刻，值得体验。嗯，亚特兰蒂斯水世界，风景优美，具有独特的亚热带树植。游乐项目丰富，尤其是霹雳小喇叭旋风、旋风大喇叭让人印象深刻，值得体验。嗯，亚特兰蒂斯水世界，风景优美，具有独特的亚热带树植。游乐项目丰富，尤其是霹雳小喇叭旋风、旋风大喇叭让人印象深刻，值得体验。,IP属地:海南,,,,,三亚亚特兰蒂斯水世界好评
M30****3761,5分,超棒,,,,"陈奕君小姐姐很热情，服务特别好
去玩的，9:30等在门口，人还不是很多。10:00入园，租储物柜小的30元，押金20元，换好衣服冲进园，先称体重，数字写在手背上，每个项目都需体重在范围内才能玩。个人觉得，这个步骤还是挺有必要的，但是后面入园人数众多，排队称重不免急躁。

趁上午人少，玩了几个大的项目，下午就休闲点的项目玩玩。很多人买了快速卡，看评论里价格是288，当天去是328，为啥还会涨价?有快速卡的确快很多，爱刷项目的只能下点血本
了。
海神之跃:刺激度5星，趣味性4星，看着特别的恐怖，从高空垂直落下，据娃反应，实际还好，毕竟122cm就可以玩放手一搏:刺激度5星，趣味性5星，前面几米是完全悬空，失重落入滑道
鲨鱼穿越:刺激度2星，趣味性2星，以为会边漂流边欣赏海底鲨鱼，结果很快就结束了，通道里特别闷热，玻璃上都是水汽，看不清有什么鱼。
章鱼竞速:刺激度3星，趣味性4星，取一张蓝色滑垫，趴在垫上从滑道上滑下。
旋风大喇叭:刺激度4星，趣味性5星，高度很高，在大喇叭里左右滑行摇摆，很有意思。
霹雳小喇叭、连环小喇叭:刺激度3星，趣味性5性，相比而言，连环小喇叭刺激度低一些，更有意思一点
怒海过山车:刺激度3星，趣味性5星，很好玩，想再玩一次极速漂流:刺激度2星，趣味性4星，刺激度刚刚好，很有意思，可惜河水很冷，不然可以玩多次，还有一个问题，人多的。话，很难拿到皮筏，最好有工作人员统一管理
造浪池:刺激度1度，趣味性5星，特别好玩，每逢整点和半点造浪，水是暖的，特别舒服。15:00有泡泡派对，娃特别喜欢。
嬉水童趣:适合小娃玩的地方(90-122cm)海洋帝国:每个水乐园都有的，也挺好玩的。",IP属地:海南,,,,,三亚亚特兰蒂斯水世界好评
300****213,5分,超棒,,,,今天天气不错，跟家人来亚特兰蒂斯水世界游玩，带小朋友玩了漂流河，还有儿童区的滑梯项目，有大喇叭，小喇叭，小喇叭，过山车，还有海神塔的海神之跃鲨鱼，鲨鱼，张逸俊放手一搏嗯，项目排队的人都很少，很多项目可以玩两三遍项目都很刺激好玩，水世界值得推荐。酒店也很有特色。,IP属地:海南,,,,,三亚亚特兰蒂斯水世界好评
M33****3577,5分,超棒,,,,"冬季值得一玩的地方 三亚亚特兰蒂斯水世界，现在去玩的人挺少，有一个好处就是玩项目的时候不用排队，天气虽然有点凉水但是一点也不影响我玩好几次海神之跃和放手一搏的心情，天气有点凉但是在三亚这一点都不影响，今天的天还特别蓝，还有大太阳这一点凉都不是大问题，第一次来玩海神之跃和放手一搏还是需要一些心理建设的，挺刺激。胆子大的强烈推荐『放手一搏』『海神之跃』，比较缓和的推荐『鲨鱼穿越』『极速漂流』，如果人多的话推荐『章鱼竞速』因为可以6个人一起玩比赛看谁先到终点。
玩海神之跃的时候在楼顶做了很久的心理建设，上边的工作人员黄进忠服务态度??????????，操作安全讲解指数?????????? 黄进忠的讲解太标准了，简单易懂。安全指数?????????? ??",IP属地:海南,,,,,三亚亚特兰蒂斯水世界好评
320****533,5分,超棒,景色5,趣味5,性价比5,"第一次来三亚，第一次来亚特兰蒂斯，天气有点凉，服务很暖心，入住酒店下载了托迈酷客，无限次入园，刷脸就可以，服务太贴心了，全程有这三位韦建侦 黄增端 王少南贴心服务，有太多的项目可以玩怎么玩，我们蒙叉叉,韦建侦总是会提前告诉我们去哪里做什么，还有什么项目是可以体验的，天气冷，总是在我们玩玩项目，从水下上来的时候，贴心的送上毛巾，和矿泉水。在同伴准备要海神一跃而瑟瑟发抖，不敢向前时，他们各种鼓励各种想办法，让她克服恐惧，吓跑了好几个女生，40分钟后，同伴终于挑战海神一跃成功。
去参观的地方开场时间有变动也会提前通知，免去了很多麻烦，酒店的目该玩的都玩到了。
亚特兰蒂斯的服务真的超级让我满意谢谢三位，还会再来的，带着朋友们",,,,,,三亚亚特兰蒂斯水世界好评
