user_detail_name,text,text 2,text 3,text 4,text 5,content_wrap,iplocation,,,,,attraction_name
M37****7570,5分,超棒,景色5,趣味5,性价比5,"2024.5.21
一天下来刷了6个项目，飞跃地平线排了1个半小时的样子，其他几个排的时间都不长，飞跃地平线和加勒比海盗也二刷了，几场花车都看到了，见到了漫威英雄，晚上烟花很精彩，其中还有漫威元素，可以考虑以后再来",IP属地:江苏,,,,,上海迪士尼好评
天津安静的海,5分,超棒,景色5,趣味5,性价比5,上海旅行打卡迪斯尼，酒店位置选对了打车才十几块。提前一天晚上先来小镇先体验了一下，问了当天工作人员和游客的感受，为转天进园做好准备。决定买早享卡确实买对了。虽然六点四十多才到，安检进园七点十分，但依然快速刷了地平线，雷鸣漂流，加勒比海盗船，排抱抱龙花了五十分钟，早享卡已经超值了。十点半人多天气热，去室内看了爱莎和米奇的表演，还赶上巡游。中间吃了点东西，又去小镇喝了喜茶休整了四十多分钟，时间很快已经两点多了。再回来刷了喷气背包和巴斯光年，排队时间都在四十分钟有点热，老套路又去刷了加勒比海盗的表演，挺精彩的，出来已经五点半了。海盗游船就在旁边排队40分钟果断二刷，已经晚上六点半了，最关键的疯狂动物城显示排队135分钟以上，还是硬着头皮去了，不能留遗憾。结果只用了一个多小时就排上了，太出乎意料了，这样可以去刷想要放弃的七个矮人了，排队时正巧看了烟花，出来已经九点七分，最后一个项目，快速赶到光速轮，九点四十三刷完。十点零五分赶到停车场上了酒店的班车，9项必玩+3场演出+2次巡游都刷到，太完美的一天。这是两个大龄中年带着十岁孩子的特种兵暑假之旅。,IP属地:上海,,,,,上海迪士尼好评
等风来，不如寻风去～,3分,不错,景色5,趣味3,性价比1,"1.论景色，真的是超棒。打卡会非常的出片。毕竟是电影主题的造景。那必然是错不了的。但是不能好几百的只为了拍几张照片取个景呀。
2.游玩的项目不少，但是能玩的愉快的不多，因为哪哪都排大长队，而且局域内人员密集，网络卡的想打发时间都不行。站的的太久疲惫不堪…
3.最喜欢的是花车游行，热闹，轻松舒适。同样是站着，同样是人多，但是站着愉快的看着各各种迪士尼形象互动，和五脊六兽的站着排队等项目的心情可是大不相同的。
4.景区里的食物就是那些，无所谓好吃不好吃，贵是常见的，别遇到拿游客当待宰羔羊的就好～

总而言之，只要自己不嫌累的，觉得很充实就可以。见仁见智～",IP属地:北京,,,,,上海迪士尼好评
周秦美阳,5分,超棒,景色4,趣味4,性价比4,"入住迪士尼酒店的早享入园特权，从7点20左右进选购就开始游玩。有过港迪游玩的两次经验，这次专程带娃并没有以打卡完乐园项目为终极目标，买了乐拍通和迪士尼护照，主要以拍照打卡、迪士尼朋友见面会和集满护照章为此次游玩的主要目标，任务感满满全程游玩全充实享受。
购物:12月份去的，购物的地方年卡可以打8折，感觉优惠很大，买了不少的毛绒玩具手机壳和一个Shelliemay的棉坎肩，特别喜欢。最推荐的后续商店是入园后右手边的奇妙记忆屋里面很大，而且种类齐全，也是乐园里面经常看到门口有大排队的商店之一。
游玩项目: 热门项目里面的热力追踪、飞跃地平线(身高102cm以上)和加勒比海盗我个人很推荐。之前没做过胡迪牛仔嘉年华，但是排队时长在当天园区所有的项目里面算是等待时间最长的几个项目之一。",IP属地:甘肃,,,,,上海迪士尼好评
tudesign,5分,超棒,景色5,趣味5,性价比5,上海迪士尼乐园让人拥有一整天的快乐！要好好玩一定要买年卡！从开业到现在，这么多年已经去了28次，最喜欢加勒比海盗沉船之战，视觉效果实在是太棒了！迪士尼乐园非常适合遛娃，梦幻的乐园太出片了！热门的项目排队时间比较久，要玩全项目一天是不可能完成的。,IP属地:上海,,,,,上海迪士尼好评
,5分,超棒,景色5,趣味5,性价比5,"在繁华的上海，迪士尼度假区如同一颗璀璨的明珠??，闪耀在现代都市的璀璨星河中。这里不仅是一个游乐场??，更是一处梦想与幻想交织的乐土??。



一踏入迪士尼度假区，色彩斑斓的城堡??便映入眼帘，高耸入云，尖顶闪耀着梦幻的光芒，宛如从童话故事中走出一般。走在米奇大街上，可爱的迪士尼朋友们热情地迎接每一位游客，他们的笑容如同阳光般温暖??，让人瞬间忘却一切烦恼。



这里的每一条街道都似乎流淌着童年时光的气息??，让人尽情追逐那份久违的纯真??。飞跃地平线??、加勒比海盗?????、创极速光轮???等游乐项目让人热血沸腾，每一个瞬间都充满了刺激与欢乐。特别是飞跃地平线，带你领略世界的壮美风光??，仿佛身临其境；而加勒比海盗则利用尖端的机器人、动画、布景及多媒体技术，将水载乘坐项目变为惊险刺激的大冒险???♂?，让人流连忘返。



当然，这里的演出更是精彩绝伦??！《狮子王》音乐剧的震撼??、花车巡游的绚丽多彩??、夜晚烟花秀的璀璨夺目??，每一个瞬间都成为了难忘的回忆。特别是晚上的烟花秀，绚丽的烟花在夜空中绽放??，如同星辰陨落?，伴随着悠扬的旋律回荡在心间??，点燃了每一个人的梦想与希望??。",IP属地:贵州,,,,,上海迪士尼好评
二月初一??,5分,超棒,景色5,趣味5,性价比5,"新年快乐的迪士尼第一弹，舞台剧之类的真是棒棒哒，喜欢各种秀，今次去了之后漫游童话时光仿佛升级了，上次以三角星阵对齐了月亮和灯光，这次的话对齐了太阳的机缘，金色童话在舞台上有对到太阳的机缘，可以配合舞台剧进行升级，运用的方式是三角星阵的一点设置为太阳，一点设置月亮，还有可以设置和舞台或者灯光对齐，这样的话，可以经由编排进入机缘的升级。??
真是太有趣了！！！！！
三角星阵的基本图形是等边三角形外接正圆。",IP属地:江苏,,,,,上海迪士尼好评
二月初一??,5分,超棒,景色5,趣味5,性价比5,"新年氛围的迪士尼又来拍拍了，回到最初的月亮，从宇宙大乐园计划里去到更远的世界和地方，三角星阵会带来更和谐的宇宙和秩序，进入时间的点的世界，在+1的规则下你会看到更多有趣的世界和机缘，经常看看世界发现更多可能??
祝你拥有神奇的一天?",IP属地:浙江,,,,,上海迪士尼好评
M36****6432,5分,超棒,景色5,趣味5,性价比5,“十里洋场烟花地，纸醉金迷上海滩” 上海・迪士尼度假区 公主 请看烟花… 短暂的逃离这个世界，请永远相信童话！上海迪士尼?现在寒假模式已经开始，迪士尼安检门口不到6点就有五六千人在安检门口排队了，可以想一下春节期间来迪士尼排队的人数会更多,IP属地:上海,,,,,上海迪士尼好评
七游记,5分,超棒,景色5,趣味5,性价比5,在上海迪士尼圣诞季拍出了人生照片|||圣诞季的迪士尼也太好拍了！超大米奇圣诞树??太有氛围感了！迪士尼小镇也是圣诞气息满满，有各大P的圣诞树，还可以集章，每一个都很好拍！疯狂动物城一比一还原动画，每一步都是景。超大板凳、路灯、北极熊，就连热力追踪排队区域也十分沉浸！拍照大家也都白发自觉的在排队，真的感受到来迪士尼的姐妹都太可爱了！晚上还有圣诞冬日巡游，有七宝、冰雪奇缘、疯狂动物城、超人总动员、老板跟老板娘、唐老鸭黛丝、奇奇蒂蒂和现在冬日限定小雪人。米奇大道还有飘雪活动，超级浪漫,IP属地:安徽,,,,,上海迪士尼好评
七游记,5分,超棒,景色5,趣味5,性价比5,在上海迪士尼圣诞季拍出了人生照片|||圣诞季的迪士尼也太好拍了！超大米奇圣诞树??太有氛围感了！迪士尼小镇也是圣诞气息满满，有各大P的圣诞树，还可以集章，每一个都很好拍！疯狂动物城一比一还原动画，每一步都是景。超大板凳、路灯、北极熊，就连热力追踪排队区域也十分沉浸！拍照大家也都白发自觉的在排队，真的感受到来迪士尼的姐妹都太可爱了！晚上还有圣诞冬日巡游，有七宝、冰雪奇缘、疯狂动物城、超人总动员、老板跟老板娘、唐老鸭黛丝、奇奇蒂蒂和现在冬日限定小雪人。米奇大道还有飘雪活动，超级浪漫,IP属地:安徽,,,,,上海迪士尼好评
二月初一??,5分,超棒,景色5,趣味5,性价比5,"美丽的城堡??在冬日里依旧是非常美丽的～
外环是可以放烟花??的，新的工作人员在那里广播还挺意外的，可能是什么奇怪的人混进去了吧～是不是程序改的，因为去了迪士尼又遇到了奇怪的定点的卖国贼设计的时序，就是抄书和做圈的人，十分有趣的是，龙华寺的时间不是顺序的，从时间节点的发生来看，不按顺序，这些人和宇宙大爆炸的反面的爆炸叠在一起了，有些人等的就是恶贯满盈，??D连一下去往自己的时间和世界吧??

艺术里的盗贼在点的圈的时间里，正义必胜??D??",IP属地:江苏,,,,,上海迪士尼好评
熊熊飞行官,5分,超棒,景色5,趣味5,性价比5,上海迪士尼度假区」??准备工作 ！!???买票?成人439??，提前10天??399??【退改】改签需要至少提前3天◇，一般?不退【建议】确定好时间再买，改日期也很麻烦???提前下载【迪斯尼度假区app】项目预约、排队信息、演出时间、地图、餐厅及洗手间可随时查看！???必备物品：??身份证D（忘带了有身份证照片就行）??迪斯尼发箍（某宝很便宜，个人觉得没必要去迪斯尼里买）??一次性雨衣鞋套（雷鸣山漂流可用上）??水杯（景区卫生间附近都有直饮水，可以节省一部分费用）??取票入场???入场时间：早上8点到晚上8点???地址：上海市浦东新区川沙镇黄赵路310号???交通： 坐地铁11号线直达迪士尼，或者公交50、51、52路到上海国际旅游度假区南。???入园方式：凭身份证原件到乐园主入口验证入园。??Tips：??花车巡游起点在玩具盒欢宴广场旁边的红色大门，可以跟着花车一起游行，也可以马上排队玩项目，避开高峰时段。??烟花秀在晚上8点30分开始，记得提前去占位，找好拍照角度哦！??想看玲娜贝儿的互动，可以在部落丰盛堂排队等待，或者看花车巡游。??想和星黛露、饼饼合影的话，可以在米奇大街甜心糖果屋排队哦！??吃饭可以去迪士尼小镇的大食代，价格实惠又美味！??创极速光轮是必玩项目，车子前边有行李格子，记得提前放好手机等贵重物品哦！??推荐必??表演???冰雪奇缘歌舞剧这一定是孩子们喜欢的舞剧，爱莎公主???花车巡游12:00和15:30，起点在明日世界???晚上的夜光幻影秀（必看烟花灯光秀??）??20:00和21:15（假期的时候一定要早点过去占个观赏比较好的位置，没一会人就爆满）,IP属地:江苏,,,,,上海迪士尼好评
云儿看世界,5分,超棒,景色5,趣味5,性价比5,上海迪士尼乐园，童话与梦想的交汇点。从奇幻城堡到明日世界，每个角落都充满惊喜。游乐设施刺激又安全，适合全家共享。服务人员热情周到，餐饮选择多样。不过，旺季时人潮汹涌，建议提前规划行程，避开高峰时段。总体来说，是一次难忘的梦幻之旅。,IP属地:山东,,,,,上海迪士尼好评
林小弦,5分,超棒,景色5,趣味5,性价比5,"期待很久，终于来到了上海迪士尼乐园a。
交通:我们坐高铁晚上11点多到了上海火车站，打车去的民宿。第二天坐车10分钟就到了。门口也有地铁，很方便。

环境:还没有进大门就感受到了气氛，到了门口特别激动。一看到小时候就看的米老鼠唐老鸭，好感动。度假区里的各种设施和装修都像在童话世界里，好漂亮好美。

推荐项目:我这次来主要是为了加勒比海盗和疯狂动物城。真的太棒了吧。真的好像在电影里。疯狂动物城的夜景超级美，好激动。就算下雨也不能影响那种感受。冰雪奇缘的舞台剧好好看，歌曲好听，服装特别还原。灯光效果特别漂亮，最后还下了雪。好喜欢!

tips:上海天气多变，最好提前查好做好准备。",IP属地:北京,,,,,上海迪士尼好评
超喜欢仰望星空,5分,超棒,景色5,趣味5,性价比5,"??上海迪士尼度假区，梦幻王国的璀璨明珠。
 
在繁华的魔都上海，有一个充满奇迹与欢乐的地方――上海迪士尼度假区。这里是童话成真的梦幻之地，是每一个人心中的奇幻乐园。
 
步入上海迪士尼度假区，仿佛踏入了一个全新的世界。色彩斑斓的城堡高耸入云，尖顶闪耀着梦幻的光芒，宛如从童话故事中走出一般。米奇大街上，可爱的迪士尼朋友们热情地迎接每一位游客，他们的笑容如同阳光般温暖，让人瞬间忘却一切烦恼。
 
刺激的游乐项目让人热血沸腾。飞越地平线，带你领略世界的壮美风光；创极速光轮，体验风驰电掣的快感；七个小矮人矿山车，在欢快的节奏中感受冒险的乐趣。而精彩绝伦的演出更是让人沉浸其中，《狮子王》音乐剧的震撼、花车巡游的绚丽多彩、夜晚烟花秀的璀璨夺目，每一个瞬间都成为了难忘的回忆。
 
上海迪士尼度假区，不仅是一个游玩的胜地，更是一个充满爱与希望的地方。在这里，无论是孩子还是大人，都能找到属于自己的那份童真与快乐。让我们一起走进上海迪士尼度假区，开启一段梦幻之旅，创造属于自己的美好回忆。??",IP属地:广东,,,,,上海迪士尼好评
_WeCh****77855,5分,超棒,景色5,趣味5,性价比5,全家出动 却赶上了台风  中秋节特意提前请了一天假从济南过去 住在了总动员酒店 结果刚办好入住手续 乐园发通知说只开园到五点 烟花秀肯定是看不了了 想着看个花车玩玩项目也行了 第二天中午的花车因为下雨也取消了  下午两点多陆陆续续好多项目也关了 ??,IP属地:山东,,,,,上海迪士尼好评
厚德载福福,5分,超棒,景色5,趣味5,性价比5,"上海虹桥火车站乘坐地铁??十号线到交通大学站换乘地铁??十一号迪士尼终点全程7块钱。每天的人流都是超多，最好错峰前去一天基本上玩的完。
温馨提示:迪士尼园外卖的萌宠与童车千万不要去租卖，不要听他们野导游瞎忽悠到时候人都找不到上当受骗，影响游玩心情，切记切记切记……
晚上看完灯光秀出迪士尼园外一定看好标牌地铁站与停车场方向，走错在回来很累的……迪士尼票一天内可以出园在进来,迪士尼票绑定迪士尼APP可以参与抽奖有几率得到萌宠。
迪士尼里面吃喝很烧钱的，可以带一些吃喝进入。
喜欢玲娜贝儿的提前去排队，在雷鸣山漂流附近，??排队至少四五个小时甚至八个小时才能排得到哦！??排队时候是不让来开的哦，只能离开20分钟然后必须得回来的有人员限制的，有工作人员看着的。??
极速光轮，七个小矮人过山车，飞跃地平线，冲天抱抱龙在玩具兵那边，古迹探索营一般占时间，雷鸣山漂流很好玩 注意??加勒比海盗设施维护关闭了到十一月二十六号开始??，去的朋友注意喽。小型的游乐不要去玩，小朋友出外。
两场演出不错，冰雪奇缘，风暴来临有兴趣朋友去看看吧！
杰克船长随机出来喜欢拍照朋友到加勒比海盗对面等着需要排队……",IP属地:河北,,,,,上海迪士尼好评
巴加克孟国公,5分,超棒,景色5,趣味5,性价比5,早上六点半起床，七点半从酒店出发，排队进园，八点十五分进到园区往右边开始刷项目。 飞跃地平线，七个小矮人矿山车，三刷加勒比海盗，创极速光轮，巴斯光年营救，米奇妙游童话书，探索阿凡达，爱丽丝梦游仙境迷宫，迪士尼街头派对，探险家独木舟，旋转木马，旋转蜂蜜罐，喷气背包飞行器，创界，雷鸣山漂流记，几乎刷了全部项目，下载官网看等位时间，人少赶紧去冲，对了，还要提前预约童话奇妙书，不预约没法进去的，这一次出行太值了，娃们很开心，虽然身高都没到1.2,IP属地:浙江,,,,,上海迪士尼好评
辰小鬼小鬼辰,5分,超棒,景色5,趣味5,性价比5,买了初二初三的两日票?第一天的早享票，初二早晨六点二十到检票口已经排队很多人，七点多入园跑着去飞越地平线，排队二十分钟，然后海盗船和雷鸣山，基本没排队。第一天下午，带着娃，三点出园补觉。第二天睡了午觉两点进园，玩了创极速光轮，晚点刷了三次海盗船，燃放烟火的时间基本不排队。两场花车和两场烟花都非常不错，花车分了常规和冬日巡游，两场烟花是一样的，烟花最后五分钟的新年场，赞！,IP属地:四川,,,,,上海迪士尼好评
??郭乐乐??,5分,超棒,景色5,趣味5,性价比5,快乐老家！！！我可太喜欢这里了～大小朋友的天堂！虽然很多人说他不好，但是我依旧很喜欢。去过各地大迪士尼，这比香港的强太多了好么！有，就珍惜！总比没有强吧～总比要出国给好几个小时去日本去大米国强吧～,IP属地:北京,,,,,上海迪士尼好评
Sandy-90,5分,超棒,景色5,趣味5,性价比5,去的时候算是淡季，但人依然很多，每个项目大约排到1个半小时，疯狂动物城，七个小矮人过山车，是必去的项目，建议早上08：00就去排到 先把热门项目完了，下午再玩其他的项目旭，建议玩1-2天,IP属地:浙江,,,,,上海迪士尼好评
大元脸葡萄,4分,满意,景色4,趣味5,性价比4,"我和老公请假，带女儿玩儿了18个项目，除了女儿身高不够的和有几个没开的，几乎全都玩了个遍。攻略和经验分享网上实在太多了，但我还是想分享一下属于自己的经验和感受。

9:55，我和老公带着女儿进了迪士尼的大门，3分钟内，两旁穿着各异的工作人员一直热情地跟我们打招呼，嘴里喊着“欢迎回家！”每个人脸上都堆满了笑容（见图1）～

1??10:15 体验了小飞象（见图2）

我们是顺时针玩儿的，一进大门直奔左手边，花园中间就是小飞象，特别适合全家一起玩儿，小朋友很喜欢。整体也就2、3分钟，前面有个摇杆，可以自己上下动小飞象上下。

语音说小飞象是世界第八大奇迹，声音还特别大，第一次听到这个说法我觉得很新奇有趣。

10:30，我们进了“奇幻童话城堡”，据说它是是全世界最高、最大的迪士尼城堡，进来之后比较吸引我的是气派的“皇家宴会厅”和城堡上的迪士尼壁画，女儿很喜欢跟壁画合影，拍了一些照片～

2??10:33 体验了小飞侠天空奇遇（见图3）

还原梦幻岛的样子，乘着“飞船”，和小飞侠、奇妙仙子一起遨游天际，速度很慢、特效很足、剧情丰富、调动五感，孩子会觉得特别有梦幻感，女儿做完说还想再玩儿一次。

3??11:30 体验了冰雪奇缘欢场盛会（见图4）

这是个需要进迪士尼乐园后，在APP上点“获取预约等候卡”提前预约的项目，虽然人少，但是如果想要视觉体验好，也要提前去排队30-50分钟。

因为女儿是排队等候的的第一个小朋友，所以工作人员在门口送我们一些礼物，并拍照留念。

舞台剧表演一共20分钟，我没看过《冰雪奇缘》，对于安娜、艾莎、雪宝那些角色也都感受一般，但当全场跟着一起唱《let it go》的时候，我感觉很燃，不过唱的是中文版。最后人工降雪小朋友们也都很激动，纷纷跑到前面去。

4??12:08 体验了胡迪牛仔嘉年华

旋转型轨道项目，每片区域里有三个相切的大圆圈，我们坐在马车里，伴随着欢快的音乐，小马带着我们旋转奔跑。因为离心力，我们被甩来甩去，有几个角度转得特别快，不惊险刺激但挺嗨。（见图5）",IP属地:北京,,,,,上海迪士尼好评
Chiikawawa,5分,超棒,景色5,趣味5,性价比5,"上海迪士尼，这座梦幻般的童话王国，无疑是无数人心中的欢乐圣地。一踏入园区，仿佛穿越到了另一个次元，色彩斑斓的建筑、活泼可爱的卡通人物、惊险刺激的游乐设施，无一不激发着游客的童心与激情。

米奇大街的热闹繁华，奇幻童话城堡的宏伟壮丽，让人瞬间沉浸在梦幻氛围中。游乐项目如“飞跃地平线”、“加勒比海盗”，利用高科技手段，带来身临其境的震撼体验。而夜晚的烟花秀，更是将整天的欢乐推向高潮，璀璨烟火照亮夜空，美得令人窒息。

此外，迪士尼的服务品质也是一大亮点，工作人员的热情与专业，让每一位游客都能感受到宾至如归的温馨。总之，上海迪士尼不仅是一个游乐场所，更是一次关于梦想、勇气与爱的奇妙旅程。",IP属地:上海,,,,,上海迪士尼好评
携小达,4分,满意,景色5,趣味5,性价比3,"【景色】上海迪士尼谈不上什么景色，只不过是这里将荧屏搬到现实，坐上朱迪的警车，乘上海盗的木船，生动的画面和声效让人身临其境，感受非凡。
【趣味】创极速光轮的推背刺激，让我们心甘情愿玩了3次，一次比一次娴熟。疯狂动物城的白天与黑夜拥有不一样的感觉。加勒比海盗、热力追踪、弹簧狗、小飞象……很多项目都非常有趣。
【性价比】这是最让人头疼的一件事了，68的雪糕、158的汉堡薯条、700多的门票、3000左右的酒店，这里根本不是工薪阶层的天堂。
【总结】上海迪士尼度假区不是工薪阶层的度假区，而是“富人”的度假区，你若很闲又有钱，那可以尽情享受，我们一次就好！",IP属地:天津,,,,,上海迪士尼好评
M36****6432,5分,超棒,景色5,趣味5,性价比5,2.7白天零下3度到6度，晚上体感温度都要零下 度，这需要多大的勇气在上海迪士尼里排队游玩，童话世界里走一遭，项目都玩过来了，加勒比海盗和疯狂动物城都二刷了，就是冷暴了，这半年刷了港迪和上海迪士尼，还是玩不腻。,IP属地:上海,,,,,上海迪士尼好评
Aima3125,5分,超棒,景色5,趣味5,性价比5,上海迪士尼乐园位于上海市浦东新区川沙新镇，于2016年6月正式开园，是中国内地首座迪士尼主题乐园，是一座具有纯正迪士尼风格并融汇了中国风的主题乐园。乐园占地1.16平方公里，主题园区分为米奇大街、奇想花园、探险岛、宝藏湾、明日世界、梦幻世界、迪士尼・皮克斯玩具总动员。拥有迪士尼城堡、漫威英雄总部、巴斯光年星际营救等游乐项目。,IP属地:上海,,,,,上海迪士尼好评
枫原没有万叶,5分,超棒,景色5,趣味5,性价比5,"上海迪士尼是一个充满奇幻与欢乐的主题乐园，它完美融合了迪士尼的经典元素与中国的传统文化，为游客带来了前所未有的游玩体验。

乐园内的设施丰富多样，从惊险刺激的过山车到温馨浪漫的旋转木马，满足了不同年龄层游客的需求。同时，各种精彩的演出和巡游活动，如“夜光幻影秀”和“迪士尼花车巡游”，更是让人目不暇接，流连忘返。

此外，上海迪士尼的服务也值得称赞。工作人员热情友好，乐于助人，为游客提供了周到的服务和帮助。园区的卫生状况也保持得非常好，让游客能够在干净舒适的环境中尽情游玩。

总的来说，上海迪士尼是一个值得一游的好地方。它不仅能够让人们享受到快乐与刺激，还能让人们感受到迪士尼所传递的勇敢、善良与梦想的力量。无论是家庭出游还是朋友结伴，都能在这里留下美好的回忆。",IP属地:江苏,,,,,上海迪士尼好评
路人,4分,满意,景色5,趣味5,性价比2,此生必去系列！迪士尼乐园真是2岁到80岁都会开心的地方，除了贵一点真是没啥缺点，维护的非常棒！项目都很用心，氛围营造到位，真是极致体验！唯独漫月商店赠品涉嫌欺诈行为，和工作人员交涉无果，每个工作人员说辞都不同，400电话客服称不在现场无法核实。就这一点印象打折了，无法满分评价。,IP属地:江西,,,,,上海迪士尼好评
