user_detail_name,text,text 2,text 3,text 4,text 5,content_wrap,iplocation,,,,,attraction_name
Vera__Gao,5分,超棒,景色5,趣味5,性价比5,"来上海怎能不打卡迪士尼呢
虽然好多人吐槽 但是请问这些吐槽的人们你们都来过吗

位置
郊区
建议头一天晚上坐地铁前往
可以选择附近的迪士尼民宿
周边的民俗客栈已经成型
提前定，住的好不说 还可以早上七点送到门口

排队是必须的
但是在排队期间刷刷网 聊聊天时间会过得很快

推荐游玩：
Top1 创极速光轮
这也是许多人都会首先排队或者去拿快速通行证的地方
玩一次 票价都回来了
很爽很刺激！

小镇内物价有一点高：
玉米一个20
冰淇淋一个40
发箍一个120
火鸡腿一个80

所以，重在体验。?????
粉色的少女心是不需要考虑那么多东西的！",,,,,,上海迪士尼好评
小小????,5分,超棒,景色5,趣味4,性价比4,上海迪士尼去一次就够了，虽然等于六个香港迪士尼那么大，但是游乐设施很分散，走好远才到下一个游乐设施。尽管不是节假日，游客也是非常的多，性价比真的不高，没有景色可言，每一样游乐设施都排队等很久。米奇大剧院当天还暂停开放，明日世界电影播放室也暂停开放，有点坑的感觉……,,,,,,上海迪士尼好评
suakery,5分,超棒,,,,with姐姐去的上海迪士尼，地铁11号线终点站，附近酒店也有车送嗒！门口要检查的，水可以带一瓶，吃的就看啦！票是APP上买的，拿到票要绑定就能拿到快速通行证，建议早点去，我们拿到的是极速光轮，有指定时间一定要看好。先去的雷鸣山漂流，早点去人还好。美食上觉得冰淇淋和火鸡腿还可以，p.s火鸡腿下午2点才买！,,,,,,上海迪士尼好评
孟孟Meho,5分,超棒,景色5,趣味5,性价比5,"门票直接在网上购买，刷身份证入园，门票当天可多次出入。院内餐饮都比较贵，人均80吧。
4.19去迪士尼，不巧碰上了漫威十周年，人暴多，只好从游玩之旅临时改成拍照之旅。
出一份迪士尼春夏穿搭&amp;拍照指南，希望大家也可以在迪士尼留下美美的回忆！
头饰：米奇头箍现场买可能要贵个十倍左右，建议提前在网上买好。另外也可以带个帽子去轮换戴，又能遮阳，又能换造型。
服装：通常出去玩，我会建议穿鲜艳一点，拍照好看。但迪士尼不一样在――迪士尼已经非常鲜艳了！五彩缤纷的童话世界，所以选黑白灰的衣服拍出来更有对比！
选景：作为一个独立王国，迪士尼处处都是景，迪士尼小镇、海盗宝藏湾餐饮区、玩具总动员门口的黑红大门都是非常适合拍照的。
拍照：尽量开大光圈，模糊掉其他游客，突出主体，手机拍摄的话选择人像模式，或者后期使用app虚化掉背景也是ok的。
玩具总动员区域已经于4.26开放了，快快走起吧！",,,,,,上海迪士尼好评
猜想未知旅程,5分,超棒,景色5,趣味5,性价比3,单论游乐设施和环境、趣味性，上海迪士尼可谓是最佳亲子、情侣旅游胜地。真心喜欢！但是论人，那也是所有迪士尼人最多的一个。就是买两日票，也不可能玩完所有项目。我说怎么也得办个周卡、月卡啥的。开园前一个小时就等在外面，才可能玩好。最值得玩的项目是翱翔.飞跃地平线，要玩。必须的必玩。,,,,,,上海迪士尼好评
D12****36,5分,超棒,景色5,趣味5,性价比5,真的很赞！本次上海行最有收获的地方。早上不到7点赶到，晚上9点离开，一天竟然完了17个项目！（有一个刷2遍）。感谢攻略，和官方app，在此基础上自己又创新了一些玩法，收获不小，意犹未尽，希望以后找个非假期再去一次，假期的人实在是太多了,,,,,,上海迪士尼好评
浪漫北极星,5分,超棒,景色5,趣味5,性价比5,趁着淡季，带着家人一起去上海迪士尼玩了一天，之前在携程买的打折票，比较划算。游玩当天人还是比较多的，完全超出想象，关键还有大人玩的比较多。有几个项目是值得玩的，特别是长时间排队，飞跃地平线，加勒比海盗，七个小矮人矿山车，极速光轮，都是非常不错的，期待下次再去。,,,,,,上海迪士尼好评
小仙乐日,4分,满意,景色5,趣味5,性价比4,晚上看灯光秀＋烟花感觉还是不错的，除节假日外的工作日去人流会略少一点点。八点开始的秀，如果想靠前，建议七点左右就可以候场，只要你愿意等，其实后面点也是看得到的，设计的时候已经把视线问题都考虑进去了。秀很美很梦幻。,,,,,,上海迪士尼好评
向日葵的花语,5分,超棒,景色5,趣味5,性价比5,向往很久的迪士尼，玩了一整天，海盗湾的项目都很好玩，明日世界的项目比较刺激，我的最后一个项目是创极速光轮，玩的我要吐了，可能个人身体问题吧。冬天的上海还是有点冷的，穿风衣好冷，担心会感冒所以提前回去了，没有等到烟火表演,,,,,,上海迪士尼好评
202****576,4分,满意,景色4,趣味5,性价比2,太挑战脚力了，从停车场走到入口有足足2站路，不排队都已经累个半死了，上海迪士尼也太搞了，入园为什么要浪费人那么多的脚力。贵也是贵了些，1大1小2天，买了2份快通，要3000+，是因为我太穷，一个人嫌价格贵吗！,,,,,,上海迪士尼好评
妖怪.王哪跑,4分,满意,景色4,,,总的来说超赞，尤其晚上的城堡烟火表演，圆了我和爱人童年的梦想，这次带着孩子一起去的。个人几点建议希望能帮助到各位：1、建议如果有经济条件的一定要去玩一周，因为人超多玩每个项目都需要排1个小时左右的时间，甚至大项目两三个小时也很正常。如果没有条件建议周二到周四这段时间去，因为周五和周末人超多。2、早上建议7点就到园区排队，我们以为8点多开园8点去排队结果已经是人山人海了，排到9:40才进园。越早进园你抢大项目的FP几率越大。3、一定要下载迪士尼官方APP软件绑定门票，进去后一定要抢火热项目的FP，记住你绑定的票只能抢一个项目，一次机会，切不要妄想两个小时后还能抢到FP，因为根本不会有你抢到的机会了，绑定多个手机号也没用，一张票只能抢一次（个人认为），我们一家三口绑定了一个手机号码抢到了个大项目极速光轮，但是老婆和孩子都坐不了只有我自己坐了，比较可惜，有FP后按照规定时间去玩，排队还需10分钟左右，进去检查两次核实是本人才能让进，所以不要妄想你抢到的FP借别人使用。4、个人建议千万不要吃那个网红火鸡腿，超难吃不说还要排1个小时左右的队伍购买，而且还挺贵80一只。5、中午12点和下午3点的花车表演千万不要错过非常好。总体来说人超多玩啥都需要排队，累并快乐着。,,,,,,上海迪士尼好评
G-G巫_,5分,超棒,景色5,趣味5,性价比5,挺好的，明日世界极速光轮好玩儿，飞跃地平线和加勒比海盗题材呈现效果特别棒！园里吃的东西不多，晚上烟火也还不错，就是！人！太！多！一定要早去！,,,,,,上海迪士尼好评
fly_me_to_the_moon,4分,满意,景色4,趣味4,性价比4,"既然办了季卡那游玩就不需要攻略了哈。
不管出去旅游还是啥，凭着感觉走，走到哪里玩到哪里，迪斯尼也是如此。
昨天激活了季卡，没想到一入园亲戚就来了，所以就玩了四个项目吃了顿饭就回去了哈。
入了园后第一件事就是在app上绑定季卡抢fp，抢到了tron的fp，下午三点05~四点05的。
然后去排队加勒比海盗沉落宝藏之战。说说排队50分钟，其实也没很久。就是中途有卖米妮头箍的大爷在队伍中穿梭也是吓到我了，10块钱一个，还真有人买了。话说这大爷哪里来的？
接着去看了个很傻的晶彩奇航，出来后无意看了个花车，出场的全看齐了，就去吃了花间美味的鸡腿和花茶，然后去了巴波萨吃了午餐。
季卡吃饭真的划算，打8折的说，但是摊头是不享受这个优惠的，一定要去餐厅吃，水也去餐厅买，都可以有优惠，每人还有三张30块钱代金券，能和8折一起享受的，还是很爽的。
吃太饱了走到tron那里准备玩去了，结果一圈下来感觉要吐了，下次还是玩好再吃吧……
然后去看了冰雪奇缘，4点15的场次三点半就要排队了……最后陪老公吃个冰淇淋～
昨天天气不怎么好都没好好拍照，期待下二刷哈~
话说昨天在迪斯尼里消费60+79+30，还是挺实惠的！",,,,,,上海迪士尼好评
_CFT0****0170,5分,超棒,景色5,趣味5,性价比5,"今天天气暖暖哒～7点取票立马抢到了飞跃地平线和加勒比海盗的FP卡 [胜利]
海盗船最后倒开极速冲刺简直惊呆了
八零后的儿时回忆 美妙的奇幻之旅
晚上等烟花Happy Valentine&#39;&#39;s Day[玫瑰]",,,,,,上海迪士尼好评
M22****3412,5分,超棒,景色5,趣味5,性价比4,每个小孩子，尤其是小女孩，心中都有一个公主梦，在这里，可以让她们梦想成真。漫步在城堡中，和白雪公主一起游玩，还为白雪公主的遭遇揪心，在迎宾阁，多位王室公主与小朋友见面合影，更是小朋友的梦想。还有城堡前的大型歌舞剧演出特别精彩，不容错过。冰雪奇缘的欢唱会也是一个大热门，还有公主，王子和小朋友互动。因为我们玩了一天，而人超多，需要排队，只选了孩子最喜欢的公主系列，其他还有好多高科技的体验也非常棒，有时间的话大家可以去玩。总体来说，迪士尼是孩子心中的一个情结。,,,,,,上海迪士尼好评
BillTsui,5分,超棒,景色5,趣味5,性价比5,对于一个有恐高症的哟来说，飞越地平线已经让我大饱眼福，Tron三次排队，竟然没有勇气上去，看来必须陪着下一代再去一次…回来把《Let it go》听了至少100遍了，中文版《随它吧》，个人觉得强大的正能量,,,,,,上海迪士尼好评
我爱旅游yy,4分,满意,景色4,趣味4,性价比4,还未正式开业，到园外的小镇逛逛，周边有三个公园，湖心公园挺好，小镇不大，就两条街，人多的话会显得很拥挤。湖对面的迪士尼酒店附近也挺好，有个玫瑰园，虽然不大，香飘千里，由于湖太大，走一圈下来要两小时，当然是走走停停，走到酒店就往回走了。反正人很多，到正式开园就要去数人头了。,,,,,,上海迪士尼好评
匿名用户,5分,超棒,景色5,趣味5,性价比5,项目刺激性略低，比较适合带小孩子体验。园区很大，可玩的项目很多，但旺季排队很费力。最期待的当然还是闭园前的花火大会，搭配经典的迪士尼主题动画，真的是不虚此行。,IP属地:甘肃,,,,,上海迪士尼好评
_M13****5852,5分,超棒,景色5,趣味5,性价比4,迪士尼还是刚建成的时候去的。第一次感受到漂亮国的文化输出。加勒比海盗和花车巡游是最 喜欢的。人也多超级多。物价也贵。不过总要去体验一下这样大型的主题公园。推荐去,IP属地:福建,,,,,上海迪士尼好评
娃娃看天下,5分,超棒,景色5,趣味5,性价比5,迪斯尼不管是小朋友还是大人们，心中都有一个公主王子梦，童话故事的魅力就是对一切事物充满美好期待，行程很完美，每个好玩的项目基本全覆盖，值得,IP属地:山东,,,,,上海迪士尼好评
M31****8291,5分,超棒,景色5,趣味5,性价比4,上海迪士尼乐园不错哦，很值得小孩去玩玩。地方大，活动内容也多，乐园工作人员也很热情，志愿者服务也很热情负责，不愧为大上海，管理水平超一流。,,,,,,上海迪士尼好评
桃花行者,5分,超棒,景色5,趣味5,性价比5,上海迪士尼乐园度假区，园区内游客无论是什么时候各个项目排队的游客都非常之多，特别是一些更好更刺激的项目简直是人山人海，趣味性十足，性价比好，晚上的烟花??真的很漂亮很壮观的场景。,,,,,,上海迪士尼好评
饶孟,5分,超棒,景色5,趣味5,性价比3,走进童话的世界，相信童话所传递的美好。本来最期待的是城堡里皇家宴会厅的晚餐，前两次的体验很好，这次因为疫情，不能和神秘嘉宾合照，不能和迪士尼的小可爱们拍合照。,,,,,,上海迪士尼好评
QE的两小时,5分,超棒,景色5,趣味5,性价比5,"值得一去，疫情之后的限流，增加了体验质量
【景色】沉淀了近百年的动画具象化，几代人童年的记忆，玩具总动员和加勒比海盗的回忆杀势不可挡

【趣味】游戏项目对老少都很友好，就是园区很大，逛完需要大量体力与精力",,,,,,上海迪士尼好评
duffybaby,5分,超棒,景色5,趣味5,性价比5,上海迪士尼真的很好玩，也挺好的，没有网上说的那么不好，我去了几次没有发现什么不好的地方，工作人员很热情。淡季去的话人没有那么多，最火的飞跃地平线排队也就1个小时。但是推荐大家买早享卡，可以提早入园。,,,,,,上海迪士尼好评
M13****674,5分,超棒,景色5,趣味5,性价比5,总有人问迪士尼人多嘛…我的回答是多啊……但是的确值得一去…而且虽然人多，但是我们十一期间根本就没有出现那种说什么排队三四个小时的情况…最长的也就一个小时，另外抢到两张fp，孩子很开心…总体感觉棒棒哒,,,,,,上海迪士尼好评
_WeCh****99233,5分,超棒,景色5,趣味5,性价比5,晚上八点半的烟花表演 太漂亮了 迪士尼的精华所在，加勒比海盗特别震撼 3D效果完美 就和置身海中一样。极速光轮看起来特别酷 可惜我恐高 吓死宝宝了 喜欢刺激的可以尝试一下。迪士尼一个圆梦的地方 圆了多少少女的公主梦,,,,,,上海迪士尼好评
林夏|明,5分,超棒,景色5,趣味5,性价比5,第一次来到迪士尼度假区，真的觉得很荣幸，我觉得那里的鸡腿面很好吃！还有那里的风景宜人，还有晚上的烟花节目都特别的好看(??ω??)??！！,,,,,,上海迪士尼好评
delphian13,5分,超棒,景色5,趣味5,性价比5,大朋友，小朋友的心中乐园，梦想王国。,IP属地:北京,,,,,上海迪士尼好评
??    K??K????,5分,超棒,景色5,趣味5,性价比5,去迪士尼最好早早去！不然人多就要排队！等候时间太长！你可以下载迪士尼APP可以看到各个项目的等受时间！巡游最好早早占位置等候！晚上烟花值得一看！提前占位置！,IP属地:江苏,,,,,上海迪士尼好评
喀布尔省庄贾,5分,超棒,景色5,趣味5,性价比5,工作日来这里性价比真的挺高的了，300块钱可以玩这么多项目，真的挺开心的，而且人还少，排队基本上最多也就是20分钟到半个小时的时间小朋友也比，小朋友也比较少，因为家长都在工作哟,,,,,,上海迪士尼好评
天生哥,5分,超棒,景色5,趣味5,性价比5,这里就是要不停的刷卡 真的值得来好几次 每一次都有惊喜 突然间发现除了玩乐项目 这里的夜景其实也是非常美的！梦幻般的童话世界 说的大概就是这里吧！,,,,,,上海迪士尼好评
笨笨猪1983,5分,超棒,景色5,趣味4,性价比4,上海冬天的气候非常不好，起风、暴雨；游客非常多，从唐老鸭停车场步行进入检票口花了1.5个小时，感叹中国人民强大。里面各种排队、吃饭排队、厕所人山人海。游戏设备在这种热闹的氛围下也觉得挺高、大、上。,,,,,,上海迪士尼好评
_WeCh****317955,5分,超棒,景色5,趣味5,性价比5,带着女儿和老公一起去的，还是比较好玩的，人不多一天也能玩的差不多，我们订了两天的票，时间不会太紧张，好玩的还可以再玩几次。期待的烟火表演，下雨了人太多也没看就走了，总体还不错。,,,,,,上海迪士尼好评
M31****0810,5分,超棒,景色5,趣味5,性价比5,环境很漂亮！游戏项目更好玩！尤其是穿越地平线！就是排队时间太长了！这个项目排了一个半小时！不过完全值得！超级震撼！还有海盗船的那个也值得一去！我们玩了十几个项目！完全值回票价！最后晚上烟花也好看！,,,,,,上海迪士尼好评
GM0703,5分,超棒,景色5,趣味5,性价比5,很花钱的一个地方，因为人太多了，不想排队，建议入园后就买上快速通道的套票，游乐项目还是不错的，小盆友很开心。从早一直玩到烟火结束，灯光秀还是要抢个好位置，视觉效果才好，最好正面看，侧面看效果一般。,,,,,,上海迪士尼好评
行动派,5分,超棒,景色5,,,必须早点排队购票入园，拿到票以后先用下载下载迪士尼乐园APP扫描票上的二维码，迅速进去快速通道验证，这样可以免去普通排队时间，建议先以七个主要游玩项目为主，其他的项目可以有时间的前提下选择性游玩。,,,,,,上海迪士尼好评
m74****9633,5分,超棒,景色5,趣味5,性价比5,先去了疯狂动物城，真是好玩，体验感非常的好，就是赶上雨季，早上下车开始下雨。路边很多卖雨衣的，可以讲价，基本想玩的都玩了。累的不要不要的。穿运动鞋是必须的,IP属地:浙江,,,,,上海迪士尼好评
E04****24,5分,超棒,景色5,趣味5,性价比5,第二次去上海迪士尼，总得来说在周三人还是比较少的，比之前暑期人少太多了。平均排队大半小时又要。宝宝玩的非常开心，冰雪奇缘欢唱会看了两次,IP属地:江西,,,,,上海迪士尼好评
_WeCh****00977,5分,超棒,景色5,趣味5,性价比5,四月一号去的，人非常多，翱翔飞跃地平线排了两小时，观看时间五分钟吧。景区服务人员态度很好。花车贝儿，维尼等等都很可爱～带娃的话晚上备件薄羽绒。烟花挺好看。,IP属地:江苏,,,,,上海迪士尼好评
嘛玩意啊,5分,超棒,景色5,趣味5,性价比5,全世界都在提醒你长大，只有这里才会保留你的童真，不管大人还是孩子都值得一去的地方，晚上的烟花秀看一次还想看第二次，记住不要带吃的...带一点点点可能还行，但是带多了会让在门口吃完再进去.....,,,,,,上海迪士尼好评
陈顺顺,5分,超棒,景色5,趣味5,性价比5,元宵节买了对折票带好身份证排在前面2点准时开放玩了十个项目都非常喜欢折算后每个项目二十元不到太划算了。就是花车巡游及人猿泰山两个没有玩到好的项目都玩齐了。,,,,,,上海迪士尼好评
M24****7617,5分,超棒,景色5,趣味5,性价比5,好玩不仅仅是孩子的乐园，也是我们大孩子的儿童圆梦乐园,IP属地:江苏,,,,,上海迪士尼好评
牛,5分,超棒,景色5,趣味5,性价比5,迪士尼的代入感 是每个女孩都无法抵抗的，一入园真的就像进入了一个个个童话故事，每个项目的设计非常惊艳，环境服务应该算是国内第一的，除了贵了点，但物有所值。,IP属地:上海,,,,,上海迪士尼好评
Veronica?F,5分,超棒,景色5,趣味5,性价比5,提早一个小时入园、没怎么排队、想玩想看的一一实现、小朋友很开心、一点不觉得累、作为家长的我明显体力不足、有点拖后腿了、下次准备下午入园、看晚上的烟花??,IP属地:江苏,,,,,上海迪士尼好评
大K籽,5分,超棒,景色5,趣味5,性价比5,果然是世界上最快乐的地方、带着妈妈一起去的、在妈妈的脸上看到了久违的小女孩的神情、迪士尼是有魔法的、大家除了和恋人来也应该多带带自己父母出来玩一下的哦。,IP属地:辽宁,,,,,上海迪士尼好评
_WeCh****435525,5分,超棒,景色5,趣味5,性价比4,那天早早就去了，七点半这样到的，排队入园其实也挺快的。最喜欢看花车游行和米奇童话书的表演，真的超值！玩项目的话我居然觉得矿山车最好玩,IP属地:浙江,,,,,上海迪士尼好评
_WeCh****79361,5分,超棒,景色5,趣味4,性价比4,十一前一天去的，基本不用排队，玩的很爽，就是园区太大了，走到崩溃，如果恐高没那么严重的一定去做创极速光轮，太刺激了，晚上的烟花去占地的时候占的太早了，一直在那坐了两三个小时，其实在哪看都差不多,,,,,,上海迪士尼好评
挪威森林北辰星,5分,超棒,景色5,趣味5,性价比5,坐高铁到达上海火车站然后坐地铁到了徐家汇站倒地铁坐到头最后一站就是迪士尼站，出了地铁站，然后来到星愿湖畔等轮渡然后来到迪士尼酒店开启美轮美奂的童话世界！,,,,,,上海迪士尼好评
_CFT01****8922748,5分,超棒,景色5,趣味5,性价比4,童话与科技的融合非常到位，翱翔地平线和加勒比海盗简直太有身临其境之感了！极速光轮想坐一百遍，简直飞一般的感觉！里面气氛非常好，很欢乐，排队也不觉得特别累或无聊！就是那个火鸡腿太鸡肋，不建议买！,,,,,,上海迪士尼好评
M26****7752,5分,超棒,景色5,趣味5,性价比5,强烈推荐飞跃地平线，七个小矮人矿山车，加勒比沉船宝藏，雷鸣山漂流，创极速光轮(胆小慎入)，中午的花车游街和晚上的烟花秀也超级赞(/RQ/)。总之性价比超高，拍照也超美哒！,,,,,,上海迪士尼好评
_WeCh****92889,4分,满意,景色5,趣味4,性价比2,不想重要的事情说三遍，但是真的要说...不要节假日去！人挤人！吃的脏乱差！门票也超级贵！真的不是特别好的一次体验！东西卖的不算太贵，但是种类不会很多...吃的也一般....,,,,,,上海迪士尼好评
e20****33,5分,超棒,景色5,趣味4,性价比5,童话世界，真的很美好，玩一大天，恋恋不舍的离开。里面的餐厅，礼品，玩具，饰品价格也是相当美好呀，还得努力赚钱啊。当然攻略一定要做好。,,,,,,上海迪士尼好评
230****218,4分,满意,景色4,趣味5,性价比3,我们到迪斯尼的时间整好遇上高温??非常热，还是暑假旺季，为了节约游完时间，约了一对一导游服务，玩了下来后，觉得请导游的意义不大，官方App有所有游完项目和演出的排队时常。,IP属地:江苏,,,,,上海迪士尼好评
许诺一家,5分,超棒,景色5,趣味5,性价比5,如果不在人多的话，这里很好玩，也适合带孩子玩那个巡回花车演出非常震撼，还有剧场灯光都非常好，还有晚上的烟花秀真的是太棒了，一定要带孩子去玩一次，带孩子在家人真的是很值得的,IP属地:河北,,,,,上海迪士尼好评
M33****3613,5分,超棒,景色5,趣味5,性价比5,临时想去，官网买不到，黄牛价已经达800一张，只有在这里原价买到了。当天人是真的多，抱抱龙排队2小时，别说其他热门项目了，不过一场新春烟花让我觉得票价值了。一天真的逛不完，所以过几天又要去啦,IP属地:江苏,,,,,上海迪士尼好评
M50****1419,5分,超棒,景色5,趣味5,性价比5,很好玩！！！！！！！人比较多排队久，去的时候穿运动鞋会比较舒服，大人小孩都会很开心的一个地方，工作人员真的很细心很可爱！！！！晚上烟花绝美，一定要看！,IP属地:上海,,,,,上海迪士尼好评
慧大哥,5分,超棒,景色5,趣味5,性价比5,"有什么能比这里梦幻的吗 超爱迪士尼每次都能有新发现 真的推荐大家沉浸式去玩一玩.
推荐一个冷门却超好玩的项目就在飞跃地平线旁边叫 探险家绳索挑战 赢了全部设施强烈推荐
所有表演都值得大家去看一下 精彩绝伦",,,,,,上海迪士尼好评
Felixxj,5分,超棒,景色5,趣味5,性价比5,飞跃地平线，排队最长。个人还是觉得加勒比海盗有趣好玩。烟花肯定不容错过。晚上8:15前，明日世界也可以玩，可以腾空看下夜景迪士尼。,,,,,,上海迪士尼好评
文文玫瑰,5分,超棒,景色5,趣味5,性价比5,买了年卡的结果 就是来这里反复的打卡！人真的是超级多啊 我们8点就到门口 然后等开门 进去后狂奔去抢快速 建议去的朋友下载一下app 可以了解到每个项目的排队进程 真的是一天玩不够啊.,,,,,,上海迪士尼好评
_WeCh****662055,5分,超棒,景色5,趣味5,性价比5,迪士尼真的是一个童话镇、上海迪士尼游戏更是很有科技感、里面全是童年的记忆最好看的就是晚上的烟花，根本用手机拍不出看到的震撼感，但是要提前半个或一个小时占位啦！值得去的，加个滤镜就是童话世界了,,,,,,上海迪士尼好评
suezvey,5分,超棒,景色5,趣味5,性价比5,十一去的 去之前觉得票价好贵 但是去了就知道物有所值 城堡演出很震撼 看了两遍 加勒比海盗 飞跃地平线都是裸眼3D项目 给人以全新的体验 唯一遗憾的是没有做好攻略 查好时间和迪士尼人物合影 以后一定要再去玩鸭！,,,,,,上海迪士尼好评
M23****4583,5分,超棒,景色5,趣味5,性价比4,带孩子玩了两天，孩子很喜欢。我嘛，累的半死，热门项目抢不到快速通道一等就是两三个小时，真到了玩的时候时间长的也就一两分钟，短的十来秒。国内唯一没办法，为了孩子。不过还是有收获的，体验很重要。,,,,,,上海迪士尼好评
