user_detail_name,text,text 2,text 3,text 4,text 5,content_wrap,iplocation,,,,,attraction_name
rai****ai,5分,超棒,景色5,,,里面虽然不大 但是很多海洋生物 家人看的很开心 因为从来没有见过的很多。但是对于动物表演还是比较心疼的，国外已经很多杜绝了动物表演，可以用纯观赏来代替。希望别伤害它们，虎鲸是需要活在很大的环境中的，希望可以给足。推荐纪录片（黑鲸）看完后特别伤感,,,,,,上海海昌海洋公园好评
E18****60,5分,超棒,景色5,趣味5,性价比5,"从海昌海洋公园开始建造时就是开始心心念，终于等到营业了，所以迫不及待选择在试运行的时候就去体验了。
海洋公园靠近滴水湖，我们开车过去，跟着导航，还算方便。停车场就在园区入口旁，非常方便，停车还是免费哦。
园区还是挺大的，里面有缆车哦，分为冰山站和火山站，基本是从园区的入口到最深处了，在缆车上可以清楚看到全区全貌。
这次最震撼的还是美人鱼表演，看的是下午两点场次，看表演前先会看到漂亮的海底世界，这个超级大鱼缸就是美人鱼的舞台哦！表演者都是外国美女穿着美人鱼的衣服，在这个超级大的鱼缸里优美得舞动，还摆出各种优美的造型和舞姿，中间有好多各式花样的鱼儿在美人鱼生产不停地穿梭，这场景真是美轮美奂。小朋友看得是目不转睛，大人们看得也是掌声不断，这真是视觉盛宴。
我们还带小朋友玩了游乐场的几个项目，工作人员服务态度非常高。我们问什么，都耐心回答，还会贴心建议我们怎么玩，怎么合理安排好时间，不会错过表演。现场表演的工作人员还会跟小朋友有互动哦～真是要给他们大大的赞。
这次海洋海昌公园真是不虚此行，看到了可爱的企鹅，胖胖的海狮，调皮的小丑鱼，憨态可掬的白鲸，懒洋洋的北极狼，梦幻的水母，漂亮的各种海螺海星，等等等等～不仅小朋友学到了知识，我们大人也受益匪浅。
去的时候，很多地方还在修建，有花车在调试路线等。相信正式营运了，园区内可以玩耍的项目会更加丰富。",,,,,,上海海昌海洋公园好评
_ZHKT****41443,5分,超棒,景色4,趣味5,性价比5,值得一去的地方，现场门票比较贵，但还是买了一张，在进去看了虎鲸、美人鱼和海豚表演后，觉得还是满值得的。建议还是提前在网上购买好票，毕竟现在网络上还是有一定优惠。园区不大，但是因为是新开园，里面的动物还是比较活泼。还看到了雪狼，北极熊，和狐狸。同时，企鹅馆里的企鹅比较好看，因为是近距离观察，所以比海洋公园里的更好看些。攻略建议：入园后可以沿着临近两个馆参观，随后赶11:30分的虎鲸表演。看完后可以坐缆车直达火山馆看12点的美人鱼表演，如果不愿意坐缆车也可以直接走过去，很近。在14:30看海豚表演，随后还可以再看一次15:30看虎鲸表演。最后可以自己再逛完其它没有看完的馆。16:30还有一场光幕电影。,,,,,,上海海昌海洋公园好评
zlh****2002,5分,超棒,景色4,趣味5,性价比5,乐园风格有点卡通，应该更适合小朋友。里面的海洋动物都很可爱，企鹅馆，海狮馆，北极馆都很棒，好像还有的馆我可能没来得及看。最爱玩缆车和雪国列车，另外过山车太刺激不敢玩，还有不少精彩表演，工作人员态度都蛮好的,,,,,,上海海昌海洋公园好评
sallychen1116,5分,超棒,景色5,趣味5,性价比4,"还在试运营中的海洋公园，设施不够完善，一些场馆和游乐设施还在调试中??没有开放 包括4D影院所以造成热门场馆游人如织 。海豚表演很low企鹅萌萌哒美人~表演很敬业?♀??♀??♀?很震撼，四位中外美人鱼齐齐亮相海底。
此行被美人鱼的表演征服被海豚的机智感动被服务人员的微笑和热情打动等正式运营了 还想再去一次呢",,,,,,上海海昌海洋公园好评
艾伦斯,5分,超棒,景色5,趣味5,性价比5,乘着试运营，我们一家人8点半左右就驱车来到了海昌，这个时间段车位已经有点紧张了，不过目前还是免费的！在从停车场到景区正门的路上还能看到好多设施在安装中。由于进博会的缘故，门口多是小朋友，可见海昌对小朋友的魔性！目前安检已经比较严格了，水和干的食品（面包啥的）还是可以带入的，我家带了好多东西，一部分只能寄存（寄存比较坑，40元）。进去后先取一份园区导览图，这个是必须的。大部分场馆已经开放，不过鲸鲨馆，过山车，4D影院都没有开放。个人推荐入园后先去冰山那边的缆车处排队，我们游玩好企鹅馆后去看了下缆车，工作人员说需要排队1.5小时，果断放弃！园区内的各个场馆都有固定时间的喂食活动，自己先去拍一份活动表，便于安排行程。中饭时间貌似只有汉堡王开放了，但是排队有点超出想象，还是早些准备干粮比较好！下午去了水母馆，那是小孩子的天堂，视觉效果很棒！顺便提一下，每个场馆的出口都必须经过购物区，建议最后回家时去出园的地方购买，价格就不用说了，不过集大成！我们是走完了所有开放的场馆，在下午4点左右排了一个多小时乘的缆车，也算圆满，要是等正式开园，估计两日游比较好，一天玩不了所有场馆哦！总体来讲，除了个别项目没有开放，这一天算是玩得比较嗨的！,,,,,,上海海昌海洋公园好评
wendy_panwen,4分,满意,景色4,趣味4,性价比4,"上海海昌海洋公园在备受争议中，也即将开园了~
本人是试营业去的~
尽管有些展馆没有开放，尽管有些设施没有完善，尽管那天下雨地上有些脏~
但能感觉工作人员们满满的热情~
不管是服务咨询人员，还是场馆的工作人员，或者扮演各种角色的表演人员都很NICE，努力为游客服务好~
海洋公园特别适合亲子活动，可以让小朋友们知道更多关于海底的故事~",,,,,,上海海昌海洋公园好评
欢乐随喜,4分,满意,景色4,趣味4,性价比4,围绕海洋文化特色，设有人鱼海湾、极地小镇、冰雪王国、海底奇域、海洋部落五大主题区和极具特色的海洋主题度假酒店。园区内共有3个大型动物互动表演场，包括海豚剧场、虎鲸剧场、海狮剧场，分别上演《海豚奇缘》、《虎鲸物语》、《海狮特快》3大剧目；六个大型动物展示场馆――分别为南极企鹅馆、海兽探秘馆、冰山北极馆、海底世界馆、火山鲸鲨馆和珊瑚水母馆,,,,,,上海海昌海洋公园好评
_WeCh****837611,5分,超棒,景色5,趣味5,性价比5,【景色】海洋动物非常有特色，奇妙的体验，好玩的过山车和缆车,IP属地:上海,,,,,上海海昌海洋公园好评
M42****8795,5分,超棒,景色5,趣味5,性价比5,海昌非常好玩 玩法特别多样 带小孩子来玩小孩特别开心 还办了年卡,IP属地:上海,,,,,上海海昌海洋公园好评
_WeCh****23335,5分,超棒,景色5,趣味5,性价比5,"【性价比】很高
海昌海洋公园特别好玩 过山车很刺激 海洋动物很多",IP属地:上海,,,,,上海海昌海洋公园好评
M36****2938,5分,超棒,景色5,趣味5,性价比5,【景色】优美，场馆超大，节目多，儿童来有很多好玩的性价比高,IP属地:浙江,,,,,上海海昌海洋公园好评
206****692,5分,超棒,景色5,趣味5,性价比5,第一次来上海潮游乐园里面有好几个餐馆，小动物特别多看了虎鲸专业还能表演，特别有意思，工作人员特别热情，值得下次再来玩，特别是带家人一起来玩,IP属地:江苏,,,,,上海海昌海洋公园好评
M30****309,5分,超棒,景色5,趣味5,性价比5,第一次来上海上游乐园工作员特别热情，小动物特别多，设施特别完善，里面玩的东西也很多，值得下次再来玩,IP属地:上海,,,,,上海海昌海洋公园好评
M51****3914,5分,超棒,景色5,趣味5,性价比5,带孩子来玩的，开车过来很方便，停车也很方便，联系特别大，明天小朋友玩的时候也特别多吃的，下次再来玩,IP属地:上海,,,,,上海海昌海洋公园好评
M22****7679,5分,超棒,景色5,趣味5,性价比5,第一次来上海海昌玩，和家人们一起来的，小朋友是免费的，大人的票也很便宜，里面小动物很多，工作人员也很热情，里面小哥哥特别帅，使得下次再来玩,IP属地:上海,,,,,上海海昌海洋公园好评
JaNnyìB,4分,满意,景色4,趣味4,性价比4,中秋特惠票，人山人海，除了人就是人，排队基本都是一个小时以上，太恐怖了，哈哈哈，就表演可以看看，其他的娱乐设施太小了。一轮就只有坐几个人，不是大公园的作风啊，就应该都和旋转木马一样，都多点，就快了！,IP属地:上海,,,,,上海海昌海洋公园好评
M26****1926,5分,超棒,景色5,趣味5,性价比5,第二年年卡了，带娃还是蛮有玩头的。特别是现在有小虎鲸了。,IP属地:上海,,,,,上海海昌海洋公园好评
201****009,5分,超棒,景色5,趣味5,性价比5,今儿环境好，景色好，人还好不算多，食物也挺好，体验感很赞,IP属地:上海,,,,,上海海昌海洋公园好评
186****7244,5分,超棒,景色5,趣味5,性价比5,"【景色】呃，园区里的展馆小动物挺多的，蛮有意思的
【趣味】看了古今表演，还有海豚表演，特别好看，很值得来玩
【性价比】现在买票过来玩，很划算",IP属地:上海,,,,,上海海昌海洋公园好评
M27****7300,5分,超棒,景色5,趣味5,性价比5,带小朋友来上海海船游乐园玩，先去了海底世界馆门口的西门雕塑，特别可爱，然后里面的海底世道特别适合拍照，小朋友玩的很开心，值得下次再来玩。,IP属地:上海,,,,,上海海昌海洋公园好评
_WeCh****20781,5分,超棒,景色5,趣味5,性价比5,海昌员工的服务态度很好，暑假客流量虽然多，但没有拥挤的感觉，游玩舒适，虎鲸表演非常震撼，值得一看,IP属地:上海,,,,,上海海昌海洋公园好评
137****3953,5分,超棒,景色5,趣味5,性价比5,海昌海洋公园真的是太棒了，无论是丰富多彩的海洋生物展示，还是精彩的表演节目，都让人流连忘返。这里的互动体验尤其出宿舍孩孩子们玩的特别开心,IP属地:浙江,,,,,上海海昌海洋公园好评
_WB2****9680,5分,超棒,景色5,趣味5,性价比5,带孩子出来旅行，非常值得去的一个地方，非常棒，体验感很高,IP属地:浙江,,,,,上海海昌海洋公园好评
186****8518,5分,超棒,景色5,趣味5,性价比5,风景优美，表演精彩，热情高涨，尤其是虎鲸的表演，超赞哦！,IP属地:江苏,,,,,上海海昌海洋公园好评
M79****96,5分,超棒,景色5,趣味5,性价比5,很喜欢里面的氛围工作人员非常热情，感受到了美好的一天！,IP属地:上海,,,,,上海海昌海洋公园好评
AmY_LaI??,5分,超棒,景色5,趣味5,性价比5,很好玩很_心好多海洋游铮小朋友玩得好_心????很,IP属地:中国澳门,,,,,上海海昌海洋公园好评
M86****2515,5分,超棒,景色5,趣味5,性价比5,是一次很有趣的旅行，有许多表演，节目，都是非常不错的。,IP属地:上海,,,,,上海海昌海洋公园好评
M26****7711,5分,超棒,景色5,趣味5,性价比5,"【性价比】票很便宜
【景色】园区内景区很多
海洋动物种类多",IP属地:上海,,,,,上海海昌海洋公园好评
M22****4905,5分,超棒,景色5,趣味5,性价比5,客服真的很全面，我买的下午场的门票，在客服听这个小哥哥讲解了半天游玩攻略，再进去玩真的很方便。,IP属地:上海,,,,,上海海昌海洋公园好评
M46****0556,5分,超棒,景色5,趣味5,性价比5,第一次来上海长游乐园，里面设施很完善，水族馆展示了很多珍稀海洋动物，让人大开眼界。游客可以在近距离观察到海龟，虎鲸等动物非常震撼和惊艳,IP属地:江苏,,,,,上海海昌海洋公园好评
_WeCh****419593,5分,超棒,景色5,趣味5,性价比5,很适合带孩子来玩，有可爱多样的海洋动物，有适合小朋友乘坐的游乐设备，还有各种演出和表演，不同的节日来也是不同的装扮和氛围，喜欢+推荐!,IP属地:江苏,,,,,上海海昌海洋公园好评
M78****3283,5分,超棒,景色5,趣味5,性价比5,服务人员态度都非常好，又主动又热情，还有帮忙解决小问题,IP属地:上海,,,,,上海海昌海洋公园好评
zqm1?,5分,超棒,景色5,趣味5,性价比5,上海海昌海洋公园有很多海洋动物，虎鲸表演很精彩，很有趣,IP属地:上海,,,,,上海海昌海洋公园好评
M58****561,5分,超棒,景色5,趣味5,性价比5,表演很棒，很值得带着孩子一起去看，我和我家孩子都很喜欢,IP属地:上海,,,,,上海海昌海洋公园好评
知足的刘小胖,5分,超棒,景色5,趣味5,性价比5,五一放假去的，人特别多，就玩了2个项目，都要排队好久哦！不过虎鲸表演是真的好看，还想去一次的，带我儿子把其他没玩的在玩一遍。晚上的机甲巡游是很不错的，值得等待。就是互动上了点,IP属地:江西,,,,,上海海昌海洋公园好评
Frieda,5分,超棒,景色5,趣味5,性价比5,第一次带小朋友过去 小朋友大朋友都玩得很开心 看到了海豚之恋 白鲸之恋 虎鲸表演 海狮特快等一系列节目 白鲸之恋和海狮特快给人很惊喜的感觉 期待下次再去 期待和他们的互动,IP属地:未知,,,,,上海海昌海洋公园好评
M49****412,5分,超棒,景色5,趣味5,性价比5,年卡会员，时常来玩，今天活动更多些，有很多互动活动。,IP属地:上海,,,,,上海海昌海洋公园好评
M28****2606,5分,超棒,景色5,趣味5,性价比5,园区很干净，动物很丰富，小朋友很喜欢企鹅，有时间再来,IP属地:上海,,,,,上海海昌海洋公园好评
Jason Hero,5分,超棒,景色5,趣味5,性价比5,"【趣味】还是很好玩儿的，值得推荐，很适合小孩子玩儿耍的

【景色】，环境也不错，周末去的，人很多",IP属地:浙江,,,,,上海海昌海洋公园好评
L.sseeaa,5分,超棒,景色5,趣味5,性价比5,很适合小朋友们玩看了虎鲸表演特别好看，值得下次再来玩,IP属地:上海,,,,,上海海昌海洋公园好评
AaaA海纳百川,5分,超棒,景色5,趣味5,性价比5,第一次来上海唱游轮，工作人员特别热情，小动物特别多，嗯，看了虎鲸表演。玩了过山车，缆车特别刺激，车车下次再来玩。,IP属地:上海,,,,,上海海昌海洋公园好评
M31****112,5分,超棒,景色5,趣味5,性价比5,很好玩，火山漂流也很好玩，推荐大家，虎鲸表演也很好看,IP属地:上海,,,,,上海海昌海洋公园好评
无言败的小鹿啊,5分,超棒,景色5,趣味5,性价比5,第三海上花园区特别大，里面有很多小动物，特别有教育，值得下载来玩，但是小朋友来玩，特别有教育,IP属地:上海,,,,,上海海昌海洋公园好评
黎雷,5分,超棒,景色5,趣味5,性价比5,非常完美的一天。即使是暑假人也不是很多。所有的表演都看到了，排队时间也不长，非常适合全家来。,IP属地:上海,,,,,上海海昌海洋公园好评
m29****2189,5分,超棒,景色5,趣味5,性价比5,表演特别的好看，景色特别棒，工作人员特别的热情，推荐,IP属地:上海,,,,,上海海昌海洋公园好评
M32****1397,5分,超棒,景色5,趣味5,性价比5,海昌真的好玩，虎鲸表演，美人鱼表演，白鲸表演超级好看,IP属地:上海,,,,,上海海昌海洋公园好评
Ourslifeline,5分,超棒,景色5,趣味5,性价比5,"直接说一点：虎鲸表演是核心景点！
带孩子感受海洋各种生物，真心值得去看！
【景色】上海东南角，整体空气环境还是可以的，最高自驾去！
【趣味】超级赞，带着孩子大半天感受下！
【性价比】价值和价格对等的！",,,,,,上海海昌海洋公园好评
elsashen0529,5分,超棒,景色5,趣味5,性价比5,海昌海洋公园，内测中，还未正式对外开放呢，真的是难得的空旷啊，非常有童趣的乐园，特别适合小朋友来玩，还有很多海洋动物，可以长见识的啦,,,,,,上海海昌海洋公园好评
M30****4018,5分,超棒,景色5,趣味5,性价比5,带孩子来到这里，活动和表演很丰富，海洋动物们超可爱,IP属地:上海,,,,,上海海昌海洋公园好评
_WeCh****757247,5分,超棒,景色5,趣味5,性价比5,不愧评价这么高，可以算是实至名归了，会推荐给朋友的,IP属地:上海,,,,,上海海昌海洋公园好评
M57****485,5分,超棒,景色5,趣味5,性价比5,一家人过来玩，很值得，玩得很开心，下次继续哦，推荐,IP属地:上海,,,,,上海海昌海洋公园好评
匿名用户,5分,超棒,景色5,趣味5,性价比5,"带孩子去看killer whale但是天空不作美下了一天的雨
但也不影响孩子看killer whale的心情
海狮表演也特别精彩
万圣节即将到来里头也满满的万圣节气息 布置的非常好看",IP属地:马来西亚,,,,,上海海昌海洋公园好评
M49****785,5分,超棒,景色5,趣味5,性价比5,cha第一次上海上游乐园玩里面导演特别好看，工作人员特别热情，小动物特别多，直接下次再来玩,IP属地:上海,,,,,上海海昌海洋公园好评
M30****8775,5分,超棒,景色5,趣味5,性价比5,"没有来过海洋馆的，还是可以带孩子们来的，避开暑假人多和极端高温天气。

喜欢cos的，这里挺多",IP属地:上海,,,,,上海海昌海洋公园好评
M53****4460,5分,超棒,景色5,趣味5,性价比5,有些特别大里面有好几个管理的小动物，特别多吃的，下次再来玩，和我工作人员服务态度也特别好。,IP属地:上海,,,,,上海海昌海洋公园好评
M78****0532,5分,超棒,景色5,趣味5,性价比5,上海海昌海洋公园因其丰富的海洋生物展览、多样化的游乐设施和互动体验。还有海豚和虎鲸表演，以及夜间的灯光秀，公园的环境和服务态度好。,IP属地:上海,,,,,上海海昌海洋公园好评
M31****0728,5分,超棒,景色5,趣味5,性价比5,好玩好看超好玩超好玩超级好看超级好看超级喜欢超级,IP属地:上海,,,,,上海海昌海洋公园好评
M51****0729,5分,超棒,景色5,趣味5,性价比5,海洋生物非常多，海洋表演也非常丰富，非常值得推荐,IP属地:上海,,,,,上海海昌海洋公园好评
M22****8109,5分,超棒,景色5,趣味5,性价比4,工作日来海昌人不多，活动互动也很好玩，体验感很好,IP属地:上海,,,,,上海海昌海洋公园好评
elaine懂懂,5分,超棒,景色5,趣味5,性价比5,棒棒棒！这天气去，正好！不热，不冷！看表演也合适,IP属地:上海,,,,,上海海昌海洋公园好评
M52****0337,5分,超棒,景色5,趣味5,性价比5,"【性价比】无敌
【景色】好看
【趣味】海洋动物多好玩",IP属地:上海,,,,,上海海昌海洋公园好评
M82****8244,5分,超棒,,,,第一次来上海茶游乐园，嗯，朋友介绍来的，带小朋友来玩，很合适，可以认识很多小动物，看了古今表演，很多导演特别好看，值得下次再来玩,IP属地:上海,,,,,上海海昌海洋公园好评
lucycen,5分,超棒,景色5,趣味5,性价比5,第一次上海滩游乐园里面有好几个茶馆，小动物特别多，工资特别热情，设施特别完善，下次再来玩,IP属地:上海,,,,,上海海昌海洋公园好评
M30****4371,5分,超棒,景色5,趣味5,性价比5,这些海洋馆设施齐全，展示内容丰富多样，让人仿佛置身于海底世界。工作人员热情周到，让游客提供优质的导览服务细处。值得一游的旅游景点,IP属地:上海,,,,,上海海昌海洋公园好评
M81****7523,5分,超棒,景色5,趣味5,性价比5,这里可以让我们乐趣非常的充分！韩式凉面十分好吃！,IP属地:上海,,,,,上海海昌海洋公园好评
M29****798,5分,超棒,景色5,趣味5,性价比5,超级好玩，精美有趣的海洋生物表演区，超级棒！！！,IP属地:上海,,,,,上海海昌海洋公园好评
M57****1542,5分,超棒,景色5,趣味5,性价比5,海昌海洋公园，很不错值得来宝宝来玩，棒棒哒！！！,IP属地:上海,,,,,上海海昌海洋公园好评
M42****1176,5分,超棒,景色5,趣味5,性价比5,第一次来海涛玩，连续特别大里面小动物特别多特别带小朋友来这边有教育意义直播，下次再来玩。,IP属地:上海,,,,,上海海昌海洋公园好评
M53****1633,5分,超棒,景色5,趣味5,性价比5,第一次来上海海沧玩开车过来的停车很方便，今天工作人员非常的热情体验感特别好，还是逛得很开心，有很多小动物里面小哥特别帅，下次来玩,IP属地:上海,,,,,上海海昌海洋公园好评
_WeCh****636271,5分,超棒,景色5,趣味5,性价比5,节目非常多，很丰富，游戏好玩，工作人员也很热情！,IP属地:上海,,,,,上海海昌海洋公园好评
bonbon_chen,5分,超棒,景色5,趣味5,性价比5,"在携程上团的优惠票99/人??太划算了！一共有5大场馆，N个表演，餐厅多吃饭不愁。
1.进门记得拿演出时间表。
2.虎鲸表演前8排会湿身，带好一次性雨衣。现场买10/件
3??一定要坐风景独好。",,,,,,上海海昌海洋公园好评
白蓝昵称,5分,超棒,景色5,趣味5,性价比5,性价比高，周末携家带娃必玩项目。园区服务到位，设备人性化。虎鲸，企鹅，北极熊等非常可爱。景点和景点距离不远，够玩一整天，饮食吃饭也方便，人均不高。人和大自然要和睦相处。,,,,,,上海海昌海洋公园好评
M22****6566,5分,超棒,景色5,趣味5,性价比5,夜场的烟火表演和巡游值回票价，非常好看。虎鲸表演陆陆续续看了几年了，这次是五个虎鲸一起表演，有了小宝宝。海豚表演舞美可以，海狮表演比较欢乐。新造的恐龙山没意思，不建议,IP属地:上海,,,,,上海海昌海洋公园好评
M10****567,5分,超棒,景色5,趣味5,性价比5,这里景色非常美，小朋友非常喜欢！下次还会再来！,IP属地:上海,,,,,上海海昌海洋公园好评
M78****5191,5分,超棒,景色5,趣味5,性价比5,虎鲸好看，服务也不错，适合带小朋友一起来逛一下,IP属地:上海,,,,,上海海昌海洋公园好评
M26****7973,5分,超棒,景色5,趣味5,性价比5,第一次上海滩游乐园，里面园区特别大，里面工作人员很热情嗯，小动物特别多，看了人鱼童话特别美，觉得下次再来玩，小朋友玩的也很开心,IP属地:上海,,,,,上海海昌海洋公园好评
M38****3824,5分,超棒,景色5,趣味5,性价比5,第一次上海上游乐园工作人员特别热情，他的虎军表演，海豚表演特别有意思，杰哥下次再来玩。,IP属地:浙江,,,,,上海海昌海洋公园好评
M11****419,5分,超棒,景色5,趣味5,性价比5,在家海洋馆设施齐全，展示内容恢复多样，让人仿佛置身于海底世界工作人员热情周到，为游客提供优质的导览服务，是一处值得由的旅游景点,IP属地:上海,,,,,上海海昌海洋公园好评
_WeCh****132550,5分,超棒,景色5,趣味5,性价比5,这家海洋馆展示精彩动人设施现代齐全，职员服务态度热情周到，让人感受到专业的接待。景点设计独特，适合家庭游玩，不容错过的是游胜地,IP属地:上海,,,,,上海海昌海洋公园好评
立天装饰 徐让 柏唯诺,5分,超棒,景色5,趣味5,性价比5,海昌海洋公园 孩子玩的很高兴 虎鲸很可爱 服务很周到,IP属地:上海,,,,,上海海昌海洋公园好评
M15****663,5分,超棒,景色5,趣味5,性价比5,过山车非常棒，非常刺激，其它游乐设施也很好玩。,IP属地:江苏,,,,,上海海昌海洋公园好评
M49****4340,5分,超棒,景色5,趣味5,性价比5,感觉玩的挺开心的挺满意的，特别是虎鲸演出特别精彩，好喜欢白鲸，企鹅馆里的企鹅大大小小的形态各异每一只都好可爱还有那么大的狗熊这次旅行玩的真的很满意,IP属地:上海,,,,,上海海昌海洋公园好评
M78****0532,5分,超棒,景色5,趣味5,性价比5,动物园出精彩，过山车刺激好玩，工作人员热情。,IP属地:上海,,,,,上海海昌海洋公园好评
M30****8404,5分,超棒,景色5,趣味5,性价比5,非常好看  还有缆车  小朋友很喜欢来这里 看虎鲸表演,IP属地:上海,,,,,上海海昌海洋公园好评
M30****8652,5分,超棒,景色5,趣味5,性价比5,带小朋友去看了奥特曼缤纷剧场嗯，蛮有意思的，蛮值得花这个钱去买这个票的，值得下次再来,IP属地:浙江,,,,,上海海昌海洋公园好评
_WeCh****389505,5分,超棒,景色5,趣味5,性价比5,第1次在上海穿越好的场馆小动物特别多，看了普京发现很多男人特别有意思，特别适合带全家人一起来玩，你们工作人员服务态度特别好。,IP属地:上海,,,,,上海海昌海洋公园好评
M28****6020,5分,超棒,景色5,趣味5,性价比5,嗯，奥沙上海滩游乐园的上次孩子来玩就特别开心，这次来看了虎鲸表演特别开心，玩的特别有意思，有的事是特别多，所以说下次再来玩。,IP属地:上海,,,,,上海海昌海洋公园好评
