user_detail_name,text,text 2,text 3,text 4,text 5,content_wrap,iplocation,,,,,attraction_name
M41****578,5分,超棒,景色5,,,"开业当天去的，虽然天气一般，但大家都很热情。停车场位子很多，就是出口标示有些不清。入口处还有开园纪念卡，不知道有什么用。现在采用的是严格安检，所有的食品都不能携带。
游玩的人不算多，排队都不是很长。所有的场馆和游客设施都弄好了，也没有油漆味，不过有些户外设施因为天气原因没开放，特别是海豚过山车，差评。每个场馆都使用幽暗的蓝色灯光，有些海洋的感觉。表演也很精彩，美人鱼和虎鲸还有海豚都很活泼。美中不足的是有些场馆的入口比较隐蔽，不太容易发现。工作人员倒是都很热情，会手舞足蹈地欢迎你。
里面有好几个餐馆，大部分都是类似的，唯一的例外是汉堡王，不过一到饭点就会有令人绝望的长队，建议错峰吃饭。饭菜的价格也和一般的游乐园差不多，不过都是预制的，不是厨师现场制作，味道也还可以。
总的来说还是值回票价的，希望可以越来越好。",,,,,,上海海昌海洋公园好评
M91****22,5分,超棒,景色5,趣味5,性价比5,我很喜欢这里，已经是二刷了，准备办年卡。这里是上海乃至华东目前为止最好的海洋公园，比上海水族馆，长风海洋世界要好的多的多，尤其是大型的海洋生物，真的很棒！经典节目不要错过海?剧场，美人鱼表演，4D影院，天象影院，水上飞人表演，索道，另外我最期待的过山车，漂流船，雪国列车正式开放后我一定再来，给孩子办年卡，一起玩！最后真的很喜欢白鲸，还有企鹅，火山鲸鲨馆好棒！这么多大型海洋动物―-，最后说一下，对面的冰雪世界也在开建，估计2020年这里会更好玩！,,,,,,上海海昌海洋公园好评
西瓜的乐乐,3分,不错,景色3,趣味3,性价比3,"今天打卡了新开的海洋公园~
有点点小失望呀！和迪士尼或者珠海的海洋公园比都不在一个档次上。公园不大，感觉装修有点粗糙。很大程度上模仿了珠海的长隆，但是真的比不上，差距还不是一点点。游乐设施很少，拿的上台面的估计就一个绕园区的过山车了，其他就是小公园里也会有的小型游艺机。网上评分较高的天幕影院我也觉得并不是很惊艳。火山鲸鲨馆做的还不错，长隆如果10分的话，这里可以评到9分~里面的景观餐厅加分不少~其他各个场馆就无功无过吧。值得一提的是里面工作人员和演职人员都是非常热情的，这点做的很好！但是再多的优点都抵不过一个致命伤就是实在是太远了！！！今天票价180，去去还是可以的，之后399，那就[再见][再见][再见]",,,,,,上海海昌海洋公园好评
202****889,3分,不错,景色3,趣味3,性价比3,"停车?
正门口往前有一个三层停车场，暂时免费

餐饮?
试营业期间可以带食物，正式开业后不可以带，全园暂时只有海豚剧场边上汉堡王营业

游乐设施?
排队人暂时不多，都是低幼版游戏，绕园区一周的过山车没开，缆车倒是开了，排队人较多，看完海豚表演，人鱼表演，就乘缆车去冰山北极馆

珊瑚水母馆?
水母嘛，你们懂得就是这样，水母剧场没开

海豚表演?
娃说：海豚表演我们不是以前都看过？好吧，你说的很对，我无言以对

火山鲸鲨馆?
主角鲸鲨还没来，美人鱼表演倒是有，估计以后是美人鱼和鲸鲨共舞

4D电影?
就是海昌的一个小广告，看不看无所谓

天幕电影?
唯一看了2次的表演，确实震撼

余下的海狮表演没有，虎鲸表演没有！

总的来说，有些地方有装修味道，像工地。园区不大，一整天只有13000步，毕竟迪士尼随随便就是2万步起，从9点半玩到5点闭园，绰绰有余。",,,,,,上海海昌海洋公园好评
M24****4015,5分,超棒,景色5,趣味5,性价比5,第一次来上海昌游乐园，朋友推荐来的嗯去了冰山北极馆，里面的北极狼特别有意思，特别可爱，嗯，像狗一样值得下次再来玩，我们工作人员很热情。′,IP属地:上海,,,,,上海海昌海洋公园好评
仔仔王,5分,超棒,景色5,趣味5,性价比5,性价比可以，就是离市区太远。动物很多，当天下雨室外的过山车和漂流都取消了，但室内的表演才是精华，美人鱼和虎鲸一定要看，太有意思了，尤其美人鱼太美看了两场，真的很推荐，有条件可以在附近住一晚玩两天。,,,,,,上海海昌海洋公园好评
ayabriya,5分,超棒,景色5,趣味5,性价比5,海洋公园还是比较值得去的，里面很多有趣的表演，游乐设施也很适合小朋友，娃娃们玩的很开心。就是时空缆车突然单独收费有点无语，而且要往返一起来买票，很不划算。,IP属地:上海,,,,,上海海昌海洋公园好评
M52****5059,5分,超棒,景色5,趣味5,性价比5,第一次来上海海昌游乐园先去了火山筛管，看到了很多不同的小动物，要去看了，还偷东西的表演，特别好看，值得下次再来玩,IP属地:上海,,,,,上海海昌海洋公园好评
E12****97,3分,不错,景色3,趣味3,性价比3,海昌海洋公园管理有待改进。海豚表演台阶走道坐满了人，严重影响演员表演，这些走道都是演员与观众互动的表演区，现在坐满了人。希望公园管理部门关注，加强管理！,IP属地:上海,,,,,上海海昌海洋公园好评
M80****7124,5分,超棒,景色5,趣味5,性价比5,第一次来上海，冲完跟着家人一起来玩，在看到了很多可爱的小动物，我园区里面也很凉快，没有那么帅，表演也特别多，特别好看，里面小哥哥也是帅的，值得下次再来玩,IP属地:上海,,,,,上海海昌海洋公园好评
M43****413,5分,超棒,景色5,趣味5,性价比5,Lisa上海还有多远我去看了海豚恋曲特别漂亮，里面的演绎特别高超，看到了还去海底世界管你看到了很多珍惜的小动物没有见过特别有意思。,IP属地:上海,,,,,上海海昌海洋公园好评
M42****7177,5分,超棒,景色5,趣味5,性价比5,一次上海滩乐园里面是特别完善元素特别大，有奥特曼主题馆，海贼王商店里面吃的东西也很多，特别是带小朋友全家人一起来玩，值得下次来玩,IP属地:上海,,,,,上海海昌海洋公园好评
M37****4876,5分,超棒,景色5,趣味5,性价比5,第一次来上海潮玩，坐地铁过来很方便，坐1135过来很方便，检票的工作人员特别热情呃，里面小动物也特别多，表演特别好看，过山车特别好玩，值得下次再来玩,IP属地:上海,,,,,上海海昌海洋公园好评
M78****1289,5分,超棒,景色5,趣味5,性价比5,经常来海昌，最近有coser小姐姐和小哥哥可以集邮。今天我们去企鹅馆，有个小姐姐还送了企鹅的羽毛给我们。coser小姐姐很友好。,IP属地:上海,,,,,上海海昌海洋公园好评
205****591,5分,超棒,景色5,趣味5,性价比5,喜欢海洋动物的可以冲，项目海豚过山车和漂流比较刺激，但是漂流最好夏天玩，容易湿鞋子。表演很赞，尤其是虎鲸表演和海豚表演，白鲸表演，还能看到海狮和海象表演，另外海洋生物喂食也比较有意思的。,IP属地:上海,,,,,上海海昌海洋公园好评
M51****6279,5分,超棒,景色5,趣味5,性价比5,"游乐设施也是一大特色。适合不同年龄段的游客，既有适合小朋友的温和游乐项目，也有能让年轻人体验刺激的项目。而且这些游乐设施的主题都与海洋相关，在游玩的同时还能感受到浓厚的海洋文化。
非常推荐",IP属地:上海,,,,,上海海昌海洋公园好评
201****151,5分,超棒,景色5,趣味5,性价比5,场馆很大，一次玩不过来，虎鲸表演很精彩！宝宝餐非常好吃，值得一来！,IP属地:上海,,,,,上海海昌海洋公园好评
M76****7995,5分,超棒,景色5,趣味5,性价比5,来到海昌海洋公园，真的仿佛自己来到了梦幻般的海洋世界。这些动物每一个都那么可爱有趣，特别是与虎鲸，海豚的互动环节，让我感受到了人与动物的奇妙联系,IP属地:江苏,,,,,上海海昌海洋公园好评
M47****8595,5分,超棒,景色5,趣味5,性价比5,去了很多次，这次让我感受比较深刻的是员工的服务，在海昌公园玩的时候，我的包丢了，员工很尽心尽力的帮我找了回来，感觉他们到时候的热情，大大的点赞。,IP属地:浙江,,,,,上海海昌海洋公园好评
赫兹456,4分,满意,景色4,趣味4,性价比3,表演有点敷衍，不够精彩，近距离看虎鲸身上满是伤痕，有点心痛啊！建议别再让虎鲸表演了，让白鲸去虎鲸剧场表演，把虎鲸放了，要真放不了，就建个虎鲸馆吧,,,,,,上海海昌海洋公园好评
梵天舞梦,5分,超棒,景色5,趣味5,性价比5,抢到海昌惠民活动免费双人票，实在是运气爆棚，感觉特别难抢的，每天限流5000人，部分展厅不开，虎鲸表演很生动，溅水区比较欢腾，白鲸也超级可爱，水母也很漂亮，两场巡演非常生动，如果玩漂流一般要排队120分钟，缆车90分钟，过山车非常刺激，园区内服务人员非常专业热情服务态度好，感恩海昌这次的惠民免费活动，度过了非常愉快的一天,,,,,,上海海昌海洋公园好评
醉了刘伶,5分,超棒,景色4,趣味5,性价比4,带着小朋友一起去的。小朋友非常喜欢，我们缆车??坐了三四趟！！进入乐园首先乘坐缆车，然后步行至小朋友游乐区，这个时候人比较少，小朋友游乐区的设施全部玩了一遍，然后再玩其他项目。到下午的时候又带着小朋友到返回到小朋友娱乐区，再玩了一趟，小朋友非常开心。看了好多表演，视觉效果也非常赞，唯一遗憾的就是没有玩到漂流。停车也很方便不不限时，50一次，算是性价比很高了。下次还会再去，小朋友经常问我们什么时候再去海昌乐园呀。,,,,,,上海海昌海洋公园好评
新肉上市,5分,超棒,景色4,趣味4,性价比4,"感谢海昌的医护优惠活动，但是不得不说实在是太远了，自己应该不太会再去了。
去之前以为是水族馆，然后发心都没有很大型的缸，最好看的是水母，“那个海蜇头哪里看？”哈哈哈哈，想起我们的问路方式为工作人员捏了一把汗…
小伙伴们热衷于刷项目，海豚过山车我没敢去，漂流去了，真的是雨衣都没用，因为水是倒灌的，做好湿身准备就是了。
里面演出和小电影也挺多的，但是纪念品一般啊。",,,,,,上海海昌海洋公园好评
心情好好的毛怪,5分,超棒,景色5,趣味5,性价比5,距离市区比较远，建议自驾出行，附近就有停车场！园区充分考虑了距离较远的原因，所以比较好玩的游乐项目都晚于开园，比如9点开园，9.30分过山车才开，10点漂流才开！！表演非常不错，值得去看看，餐厅也不错，构思新颖，值得去吃吃！,,,,,,上海海昌海洋公园好评
dora813,5分,超棒,景色5,趣味5,性价比4,1.园内各种餐厅的标示比场馆清晰，各大场馆出入口不好找，基本先映入眼帘的都是各种餐厅[尴尬]。不过园内的餐食要比迪士尼好吃一些。2.地方不大，可以在公众号里查看表演时间和园区位置以及排队人数，排队人数与实际经常不符哈。3.漂流到现在也还没开…4.花车游行互动很多，向游客喷水，小朋友好开心。5.各个表演都值得一看。6.最喜欢的场馆是海兽探秘馆，有只可爱小海豹一直和我们互动，玩了好久…最后，最重要的是，人比迪士尼少很多，游乐体验很好。总的来说值得来，还会再来。,,,,,,上海海昌海洋公园好评
gn****ing,5分,超棒,景色5,趣味5,性价比5,"选了个周末去的，预报小雨，其实没怎么下，所以人不多，没排队，整个体验不错。

开车去的，车程差不多一小时多一点，停车场就在门口，好几层，非常方便。

游览路线如下: 时光缆车，深海奇航，喂食表演，美人鱼表演，海豚聚场，午餐汉堡王，时光缆车，虎鲸表演，4d电影，北极馆，企鹅馆，天幕剧院，水上表演，水母馆，儿童乐园。缆车上俯瞰了花车巡游。整个过程除了汉堡王排队买午饭其他都没排队。

个人喜欢深海奇航，喂食，美人鱼，虎鲸剧场和天幕。

深海奇航类似迪士尼的杰克船长的漂流那个，内容更适合小孩子。

喂食表演过程中工作人员很专业的为我们讲解每一种海底隧道动物的习性，还能看到鱼海龟们围着潜水员。

美人鱼表演很梦幻，水缸巨大，演员们很敬业，那么冷的天。

虎鲸表演前的互动设计得很好，大人小孩一起参与，寓教于乐，等待一点也不无聊。虎鲸们庞大的身躯游起来可一点都不慢。

天幕剧场是沉浸式的，我们那场人不多，都半躺着看，视觉效果不错

最后还刷了儿童乐园，有个大过山车没敢坐，但是小孩子玩玩儿童乐园还是很开心的，旋转木马亮灯了很有feel.

总之是一次不错的游园，事实证明小雨不影响游园，而且人反而会少，减少排队时间。",,,,,,上海海昌海洋公园好评
_WeCh****654535,4分,满意,景色4,趣味4,性价比4,"海昌海洋公园开到上海了 万众期待的海洋乐园
地铁16号线坐到临港大道站，1号口出来左边超市旁进入停车场坐免费短驳班车
现在园区门口就有个停车场 50元停一天 入园更方便
计划准备先观看几个重要表演 再玩游乐项目 参观海洋动物等
9:30左右入园 过桥先玩个过山车不用排队 坐在车尾也是相当刺激的 忍不住尖叫
走到火山鲸鲨馆 看10:00场梦幻美人鱼 每个整点都有一场 搭配音乐 看美人鱼各种优美的游姿 惊艳动人 值得一看
下一站10:30场海豚奇缘 先是小丑表演 然后主持人介绍 海豚表演少了点
坐时空缆车 从火山鲸鲨馆至冰山北极馆
缆车上俯瞰整个园区然后不紧不慢观看最期待的11:30场虎鲸科普秀
前三排是溅水区 后面座位都很安全
先是虎鲸科普问答 与观众互动环节 然后就开始正式表演 虎鲸就是个吃货 吐舌头动作太搞笑了
这些重要表演看完就可以安心自由活动了 我的游玩流程如下：（注：由于下午下雨，很多游乐设施停运了）
看好虎鲸其实可以去冰山北极馆参观的 本人有点路盲 先去了企鹅馆 经过海狮剧场还未开 
1.&#160;&#160;&#160;&#160;&#160;&#160; 海兽探秘馆 海狮海豹在打架 不愧是战斗的民族 海兽喂食50元/份 海牛是水中美人鱼 肉肉的感觉 是要走到下面一层参观
2.&#160;&#160;&#160;&#160;&#160;&#160; 企鹅馆 隔壁有天幕影院 半小时一场 看好时间整点前把企鹅馆看一圈
3.&#160;&#160;&#160;&#160;&#160;&#160; 过桥又来到过山车这里 就是儿童游乐场 飞天巨鱼、极速企鹅排队有点慢的 旋转木马没排队（因为下雨，木马外面一圈会淋到雨，擦了一下座位坐上去的）过山车雨天停运
4.&#160;&#160;&#160;&#160;&#160;&#160; 这里是个珊瑚水母馆 珊瑚五颜六色 水母品种多样 太漂亮了
5.&#160;&#160;&#160;&#160;&#160;&#160; 深海奇航 在海底世界馆 排队时间久 一次可坐8位 影片大概有10分钟左右 座椅震动强烈 有身高限制 太小的孩子其实也不建议坐 容易撞疼的 影片中间会穿过海底隧道
6.&#160;&#160;&#160;&#160;&#160;&#160; 又坐了一回缆车返回冰山北极馆 4D影院 半小时一场 需要提前排队 一场80人左右 也不建议太小的孩子观看 感觉有点血腥恐怖
7.&#160;&#160;&#160;&#160;&#160;&#160; 冰山北极馆里参观北极狐、北极狼 海豹静静地坐在水里发呆、北极熊孤独一只
走到最里面正好赶上白鲸表演 也是滚动播出的 白鲸又大又可爱
整个乐园基本兜了一圈 还算挺顺利的 差不多晚上5点出园回家",,,,,,上海海昌海洋公园好评
??酒酿小圆子??,5分,超棒,景色5,趣味5,性价比5,"秋高气爽，又到了玩耍的好季节，最近海昌很火，约上闺蜜一起去打卡。

交通还是很方便的，地铁十六号线下来一号口旁边停车场就能看到短驳接送的班车，十五分钟一班直达公园大门口。

不容错过的海豚演出可以早点去，坐前排看的更清楚，主持小哥哥长的很帅，整个剧场设计的水幕真的超美，小海豚表演也很精彩，期间还会和观众有很多互动。

看完海豚表演可以直接去对面的火山鲸鲨馆看美人鱼表演，四位身材婀娜的美人鱼在水中优雅的游弋，惹的大家都纷纷拍起了视频，绝对不容错过的演出。

我最最喜欢的是海豹馆的小可爱们，有一只喜欢把鼻子压扁在玻璃上的小海豹是馆内的小明星，我足足在那里拍了半小时

在这里不得不提的是公园里的工作人员，无论在任何地方碰到他们，马上会给你一个灿烂的微笑并做个可爱的闪闪手势，每一位都很敬业，让整个游园过程都变得特别愉悦。",,,,,,上海海昌海洋公园好评
M41****1601,5分,超棒,景色5,趣味5,,今天去了海洋公园，体验超棒！场馆布置得很用心，既能近距离观察海洋生物，又能了解到很多相关科普知识。工作人员也都热情友好，有问必答。总之，是非常值得一去的好地方，强烈推荐给大家呀！,IP属地:上海,,,,,上海海昌海洋公园好评
丹三丿,5分,超棒,景色5,趣味5,性价比5,能看到四头虎鲸同框，亚洲也就这了。停车费涨价到80元一天（不论小时）。白鲸表演、海牛吃卷心菜、隔着玻璃看企鹅摇摇摆摆走路，这些都特有特色。,IP属地:上海,,,,,上海海昌海洋公园好评
铭记时光,5分,超棒,景色5,趣味5,性价比5,"上海海昌海洋公园
位于上海市浦东新区银飞路166号，围绕海洋文化特色，总占地面积约为29.7公顷。
是一座集海洋生物展示、主题游乐、科普教育于一体的的海洋主题公园。
很好玩的一次体验",IP属地:广东,,,,,上海海昌海洋公园好评
幻想紫色,5分,超棒,景色5,趣味5,性价比5,体验很好，人也不算太多，万圣节活动也很棒，很好的游玩体验,IP属地:上海,,,,,上海海昌海洋公园好评
M31****195,5分,超棒,景色5,趣味5,性价比5,第1次来上海长游乐园，嗯，先去看了虎鲸表演，虎鲸特别可爱，里面的小动物很可爱，饲养员很很专业，然后看到了缆车打算等会去做，直接下次再来。,IP属地:上海,,,,,上海海昌海洋公园好评
M34****6737,5分,超棒,景色5,趣味5,性价比5,【趣味】在家里来海昌游乐园玩，里面虎鲸表演，白鲸表演都特别好看，值得下次再来玩。小明玩的很开心,IP属地:上海,,,,,上海海昌海洋公园好评
M52****848,5分,超棒,景色5,趣味5,性价比5,第一次来上海畅游乐园，工作人员特别热情，看到了虎鲸表演，海豚表演特别有意思，里面小动物特别多，特别适合带小朋友来玩,IP属地:上海,,,,,上海海昌海洋公园好评
M57****5440,5分,超棒,景色5,趣味5,性价比5,天气很热 但是玩得很开心 一天有好几场泼水的活动给我们降温 很好玩 虎鲸表演很好看 工作人员热情负责 可以提前关注公众号看一下表演时间 服务设施很全,IP属地:上海,,,,,上海海昌海洋公园好评
爱情哭了,5分,超棒,景色5,趣味5,性价比5,第一次来上海创乐园，游乐园里面园区很大，嗯，去了冰山北极馆，海豚世界馆，淮安商业馆里面有很多小动物，是我没有见过的，特别有意思，特别适合带全家人一起来玩,IP属地:上海,,,,,上海海昌海洋公园好评
I_Qings,5分,超棒,景色5,,,至少我拍的很开心，鱼都开始发光，水母跟小灯泡一般，一群一群小鱼很有视觉感受，鲨鱼都已经习惯了新环境，大概会显得尤其冷静，最后那条更得瑟，全程微笑服务！等装修完了，值得期待…,,,,,,上海海昌海洋公园好评
图特尔童贯,5分,超棒,景色5,趣味5,性价比5,"非常棒
【趣味】
【性价比】
【景色】都是非常棒，太棒了",IP属地:江苏,,,,,上海海昌海洋公园好评
_wech****995692,5分,超棒,,,,呃，来上海滩游乐园里面设施挺完善的，有好几个场馆先去了海底世界馆，里面有个海底隧道，特别适合拍照，里面小动物也蛮多的，小朋友很喜欢,IP属地:上海,,,,,上海海昌海洋公园好评
m31****9418,5分,超棒,景色5,趣味5,性价比5,第1次上海长游乐园里面园区很大，有很多小动物去了淮阳鲨鱼馆里面鲨鱼特别有意思，值得下次再来玩工作人员提供的很好的咨询服务直接下载。,IP属地:上海,,,,,上海海昌海洋公园好评
118****414,5分,超棒,景色5,趣味5,性价比5,虎鲸的表演非常震撼，好评好评，小朋友玩得也很开心,IP属地:上海,,,,,上海海昌海洋公园好评
孤没有昵称啦,5分,超棒,景色5,趣味5,性价比5,挺好的，给孩子玩还科普海洋知识就是人更少点就不用排队了，哈哈。虎鲸的表演很精彩，然后又遇上了下大雨，然后就没有然后了。有点可惜。,IP属地:浙江,,,,,上海海昌海洋公园好评
M61****721,5分,超棒,景色5,趣味5,性价比5,家庭出团，夏天出行不错的选择，很多室内，不会太热，假期孩子的好去处，值得推荐，园内消费也还可以，不会太高……,IP属地:上海,,,,,上海海昌海洋公园好评
gx2001,4分,满意,景色4,趣味4,性价比4,工作人不多，11月生日的免费，开门就入园到四点出去，园区不大，场馆都逛了还看了三个演出,IP属地:上海,,,,,上海海昌海洋公园好评
158****2376,5分,超棒,景色5,趣味5,性价比5,"特别好玩，
小朋友很喜欢，
虎鲸很有趣
游乐设施丰富",IP属地:江西,,,,,上海海昌海洋公园好评
M29****7939,5分,超棒,景色5,趣味5,性价比5,一次来上海传游乐园，工作人员特别热情，小动物动物特别多，工作人员特别热情，里面好几个场馆嗯，小呃表演特别好看，值得下次再来玩1,IP属地:上海,,,,,上海海昌海洋公园好评
M53****3229,5分,超棒,景色5,趣味5,性价比5,员工都很热情！服务很好！表演很震撼！下次还来玩,IP属地:上海,,,,,上海海昌海洋公园好评
M36****1892,5分,超棒,景色5,趣味5,性价比5,非常适合玩，特别美，海豚，鲨鱼，海象表演非常榜,IP属地:上海,,,,,上海海昌海洋公园好评
202****911,5分,超棒,景色5,趣味5,性价比5,第1次上海插排里面小动物特别多，嗯，坐地铁过来很方便，停车也很方便。嗯，值得下次再来玩，小朋友玩的特别开心，工作人特别热情。,IP属地:上海,,,,,上海海昌海洋公园好评
M61****6689,5分,超棒,景色5,趣味5,性价比5,【景色】去了火山鲨鱼馆，然后里面鲨鱼特别好看，小朋友特别喜欢，然后又去看了海豚恋曲，里面的演员都特别的敬业，值得下次再来玩,IP属地:上海,,,,,上海海昌海洋公园好评
M35****5424,5分,超棒,景色5,趣味5,性价比5,第一次来上海跳游乐园里面收拾特别完善嗯，坐地铁过来的特别方便，特别适合带全家人一起来玩游很好的游玩体验,IP属地:上海,,,,,上海海昌海洋公园好评
somnusyuanfei,5分,超棒,景色5,趣味5,性价比5,很好玩，下次再来，场馆很好看，表演也很好看，里面工作人员很热情，交通便利，环境很好,IP属地:上海,,,,,上海海昌海洋公园好评
M47****9348,5分,超棒,景色5,趣味5,性价比5,海洋馆很大 动物都很可爱 环境很好 下次还会再来,IP属地:上海,,,,,上海海昌海洋公园好评
米米心情好,5分,超棒,景色5,趣味5,性价比5,"推荐，我们去的夜场，特别好，推荐
【景色】",IP属地:辽宁,,,,,上海海昌海洋公园好评
旧城,5分,超棒,景色5,趣味5,性价比5,第一次来上海海沧游乐园里面工作园特别热情，看到了很多有意思的表演小动物特别多，特别适合带小朋友来玩,IP属地:江苏,,,,,上海海昌海洋公园好评
288****478,5分,超棒,景色5,趣味5,性价比5,第一次来上海上游乐园，工作人员特别热情，里面有很多好看的表演，特别有意思，玩的过山车缆车的特别有意思,IP属地:上海,,,,,上海海昌海洋公园好评
M53****7226,5分,超棒,景色5,趣味5,性价比5,"工作人员的服务态度更是无可挑剔。从前台的热情接待，到游乐设施旁工作人员的耐心指导和安全保障，都能让人感受到他们的专业和敬业。特别是在一些比较刺激的项目中，工作人员会不断地鼓励和安慰游客，让人倍感安心。
总之，这次在meland的游玩体验堪称完美。无论是设施、服务还是环境，都让人非常满意。强烈推荐给大家，相信一定会在这里度过一段欢乐难忘的时光！",IP属地:上海,,,,,上海海昌海洋公园好评
