user_detail_name,text,text 2,text 3,text 4,text 5,content_wrap,iplocation,,,,,attraction_name
玛卡巴卡的糖水不等式,5分,超棒,景色5,趣味5,性价比5,"确实非常的不错，加勒比海盗沉落宝藏之战超级推荐，一整个沉浸式体验，完全会沉浸在里面。飞越地平线也比较推荐，虽然有点不符合防疫要求，但是在玩的时候可以让鼻子露出来一些，因为随着飞越不同的地方，会有不同的气味出来，像是气味电影一样。极速光轮也是要打卡的一个项目，不同于其他过山车刚开始的慢速，极速光轮一开始就是最快速度，出去的那一刻真是灵魂出窍的感觉，肾上腺激素飙升的感觉你值得体验。花车巡游也是迪士尼不能错过的一个项目，不用特别早地在大道旁等，花车出来的时候会有音乐的，听见音乐就可以出来看了，不要执着于挤到最前面看花车，可以跟着花车一起走，跟着音乐，跟着玩偶和小姐姐一起跳起来，漂亮小姐姐还会跟你打招呼，真的是会收获一整天的好心情。红皇后的花园，绝对是拍照打卡出片的好地方，感觉到了欧洲私人庄园里的花园一样。记得在玩之前一定要下载迪士尼官方APP，从里面可以看到各个演出的时间，各个项目需等待的时间，还有地图，一定要看准时间去观看演出，观感还是非常棒的。最后，迪士尼最最最具有代表性的，当然是迪士尼的城堡和晚上的烟花秀了。迪士尼的城堡白天拍照可能会普普通通，大概到傍晚天开始微微暗了的时候拍最有感觉，因为城堡是会亮起来的，超级梦幻。然后到天黑了的时候，最最最最最最重点的来了，这时候可以拍出最出片最梦幻的照片，一定一定要在城堡前面的湖边拍，因为天黑了后，湖水里会有城堡的倒影，同时湖里还有会发光的装饰物，这时候拍出来的效果真是绝绝子，我的第六张照片就是这么拍出来的。所有项目最好在白天玩完，天黑了后城堡会变色，真是就光看看就是一种享受。在湖边拍完照后别走，只要你耐心等到九点多，你就能得到一场震撼你一整年的烟花秀，不论你在网上看过多少网友发的烟花秀视频，都不及你亲自在现场看一次，真的是无法用语言形容的震撼和美。
温馨提示：
1.记得穿一双最舒服的鞋子
2.去的前一天可以先到旁边的迪士尼小镇（免费）去熟悉熟悉逛一逛，因为入园是从迪士尼小镇里面进的，不熟悉会入园慢，多多少少有点小吃亏。
3.最好不要暑假去，人又多天又热，最后留下的都是不好的回忆，我就是寒假去的，上海也不会特别冷，天气不错。
4.一定要挑日子去，我特意挑的情人节前一天，因为大多数情侣会选择情人节去迪士尼，会刻意订情人节的票，而情人节前一天则人会少很多，不用排很久的队，票价也会相对便宜一些。",,,,,,上海迪士尼好评
乐逍遥@2007,5分,超棒,景色5,趣味5,性价比5,"迪斯尼，让人向往的地方
春节前往，更有中国年味。
啥时候都人多。无论大人，小孩，都有一个迪斯尼梦。
从每个主题，到游玩，到购物，真是适合不同年龄层。除了吃的方面，不能要求太高了，其他都很好。
米奇大街，糖果屋，既好拍又好玩。
走入每一个主题模块，都想一次性玩个够，不过好累。一大圈兜下来，还是蛮累的。所以大家要慎重，要选择合适自己的路线。
另外有喜欢盖章活动的，可以去打卡哟。",,,,,,上海迪士尼好评
Bonjour23,5分,超棒,景色5,趣味5,性价比4,先说消费，门票价格其实不算太贵，园区里的每样东西或是服务都是贵的，但花多少钱依旧取决于你自己。作为大学生的好处，就是可以赶在淡季了出行嘿嘿。排队时间平均可能只有5分钟，把想玩的项目几乎都玩了一遍，差不多有十几个（当然贝儿的摊前依旧永远人山人海）。个人感觉飞跃地平线除了是真5D之外，体验效果没想象当中好，反而杰克船长的沉落宝藏之战的效果着实惊艳到我了，沉浸感很强。但迪士尼与其他乐园拉开差距的不是项目，而是得益于积淀已久的IP优势，它能让你在表演里寻找童年喜爱的角色，甚至能和童话里的角色对话；让你在花车巡游中用力挥手，感受狂欢的气氛，“我们一起快乐无边，和新的朋友，我们一起亲密无间，欢乐的无极限”；让你在灯光烟火秀时接受米奇的美好祝福（我们还多看了场新年烟花）。在如此氛围里，着实能暂时忘掉现实生活的纷繁复杂，拥有神奇的一天。,,,,,,上海迪士尼好评
羊咩咩??！,5分,超棒,景色5,趣味5,性价比5,"――――迪士尼我的梦―――――

今天才知道&lt;加勒比海盗5&gt;是上海迪士尼出版的，在这里队半个多小时，乘坐海盗船跟着杰克船长一起去冒险，在黑暗的环境中船也会旋转起伏，有些刺激，也有许多尖叫，玩了一次没玩够，体验第二次，视觉感，冲击力极强，身临其境的感觉。又看了一次加勒比海盗舞台剧，感觉是最土豪，最有阵势的舞台剧，在这里，可以一睹为快。


漫游童话??时光
白雪公主和七个小矮人
故事情节一部分[玫瑰][玫瑰][玫瑰]",,,,,,上海迪士尼好评
M11****305,5分,超棒,景色5,趣味5,性价比5,"上海迪士尼3日体验
第一天迪士尼酒店和后花园
下午2点30点到达迪士尼酒店，预订的是行政楼层的房间，入住2晚。行政楼层的人会上7楼单独办理入住。并由专人1V1讲解行政房权益。包含优先入园，1张快速通行证，行政酒廊，出行规划等等。
房间预留的是最佳景观了：乐园景观。晚上回酒店和早上起床，拉开窗帘就可以看到主题城堡和心愿湖。
入住办理完后去酒廊小憩一会，喝杯饮料吃点甜点，便去星愿花园和迪士尼小镇溜达下。
值得一说的是星愿湖的游船酒店住客可免费搭乘，也是一次不错的体验。
当晚在炫景楼美食和烟花 炫景楼订的两人的观景位，可以边吃美食边看烟花表演。
炫景楼每一道美食都会有专人讲解菜品的食材和实用方法，非常赞。
在炫景楼观赏烟花音乐也会同步，可以说和爱的人一起看十分浪漫了。另外当天是父亲节有两场烟花，一场我们是在炫景楼，另一场是在行政酒廊看的。
第二天早上，在行政酒廊（国王贵宾酒廊）国王贵宾酒廊用早餐，菜品很丰富。用餐完毕后乘坐酒店到迪士尼小镇的摆渡车可以优先入园。这个体验非常好，一步先，步步先。在大部队排队进园的时候，你已经不用快速通道卡玩了好多项目了。
当天人比较多，买的两位尊享卡，可以和APP直接绑定，再加上酒店送的快递通行证和优先入园的先天条件。一天基本都已经玩完了。
（另外入园前一定要买梦想护照，和心爱的人一起集齐护照换纪念品可以说是非常有意义的事情了。）
当天玩到下午3点多，项目都玩的差不多了，便坐摆渡车回酒店去行政酒廊休息。行政酒廊提供很多好酒和甜点，并且有调酒师，喜欢喝鸡尾酒的人可以饕餮一番。酒廊下午不仅提供美食，还有正餐，完全可以在里边吃饱。边吃美食，边欣赏迪士尼乐园的景致。
因为晚上订了在皇家宴会厅的晚餐。所以看着这么多美食也没有吃，7点便准时到达了皇家宴会餐厅，里边有冰沙和多种甜品，还有4道式的西餐正餐，菜品很不错，最后的甜品也十分惊艳。
因为在皇家宴会餐厅提前预订了晚间的灯光秀VIP位置，在8点时，酒店工作人员会组织大家，领导提前规划好的观景VIP位置，非常棒的差异体验。
最佳的观赏位置看这次灯光大秀，近距离看真的很惊艳，一个梦幻世界的营造。
当烟花结束后，看到上万人往迪士尼园外走坐地铁，而你却坐摆渡船回到酒店休息，瞬间就知道住酒店多赞了，你的梦幻，在酒店可以继续延续。
第三天，简单玩了剩下的项目，又看了两场表演。轻松而浪漫的3天就结束了。",,,,,,上海迪士尼好评
CikiLee,5分,超棒,景色5,趣味5,性价比5,"33俱乐部|吃饭不排队带娃不心累

整个迪士尼??最佳观赏位置?? 


服务：
服务当然无敌 
点菜一直热心推荐不在话下，而且很热心提醒放烟花时间和雪花机人造雪的时间 邀请你们去外阳台欣赏
儿童餐具，换盘都很积极对得起15%的服务费

??餐食：
「战斧牛排 口味品质都很棒

「餐前小食」如果不是果酒那么真的非常适合1岁以上小朋友了

「蘑菇汤」??闻味浓香 入口奶香

「和牛汉堡」超级巨无霸的size 里面和牛很嫩 拿掉酸黄瓜 用手压扁 咬一大口 相当nice！配餐的薯条也很多 小朋友很喜欢

「西班牙火腿」??这个强烈推荐哦

「餐前面包」一个温馨小提示 可以问服务员要酱瓜 
很好吃！由于太好吃我们要了三四次哈哈哈哈

??景观：

??人造雪时间先到 所以小朋友先出去欣赏了一场冰雪降临的美景

??20:30是烟花时间 早早出去占了位置，小朋友看了半小时烟花都开心疯了 因为整个园区内所有绚丽多彩的灯光配合着缤纷壮观的烟花秀 ，站在33这个位置一览无遗！尽收眼底 比看一场大制作的电影都引人瞩目！

Tips：
去迪士尼如果孩子多都尽量买vip通道，三小时内大项目全部玩遍 还能抽空看花车巡游，各类表演等，不然排队冬天冻死，夏天晒死 绝对叫苦连天体验感会降低",,,,,,上海迪士尼好评
万紫凌,5分,超棒,景色5,趣味5,性价比4,非节日 非周末 天气好 人不多 该刷的都刷到了 城堡打卡 花车游行 川沙妲己（玲娜贝儿真的太可爱了，可惜周边卖得一个都不剩）创极速光轮 加勒比海盗 飞跃地平线 小矮人矿山车 因为冬天怕弄湿衣服 漂流类项目都放弃了 听说园内吃的贵得离谱 不喜欢吃饼干 所以带了小蛋糕 然而三餐要吃主食的我 最终还是在米奇美味集市解决了中晚餐,,,,,,上海迪士尼好评
M30****0302,5分,超棒,景色5,趣味5,性价比5,"第一次去还是2017年6月14 这一次是因为马上又要回德国正好上海起飞那就提前带我麻麻来玩玩吧～ 上次正直暑假人巨多 不过创极速光轮是我两次来都没等过的项目 第一次拿快速通行证第二次错峰来没人，事实证明只要身体够好64岁也能坐创极速光轮和暴暴龙的车，我都坐的有点难受，我妈竟然说很不错??
现在还是5周年和万圣节 看了两场不同花车和晚上的烟花，真的超赞因为回的太晚没赶上10号线的末班车哈哈哈哈哈哈哈 今天有点可惜就差漂流和海盗船没刷其他的都带着我妈刷过啦，等疫情结束我们迪士尼再会",,,,,,上海迪士尼好评
沈福成,5分,超棒,景色5,趣味5,性价比5,迪士尼乐园，这次是5周年了，这个乐园有了较多新的装扮布置，挺好看的，还有不少新项目，特别适合夏天玩爽，城堡前面的大型水表演也是很有意思，可以带件雨披然后去感受一下水的洗礼。自带头箍，款式很多，拍了很多好看的照片，趁着没涨价再去玩一次,,,,,,上海迪士尼好评
wonderful world,5分,超棒,景色5,趣味5,性价比4,5周年的最新体验 暑假叠加周末超多人的一天 入园排队就花了1小时，还有雨水夹杂。但在园区混迹12小时后想玩的项目基本都玩到了：抱抱龙2次绳索挑战2次巴斯3次，其他常规项目各一次。本来飞越地平线想放弃的，结果惊喜5周年抽到了飞跃的乐享卡，白玩一次[胜利]等待时间最长一次60分钟，其他基本20分钟以内，窍门就是利用2次花车2次烟火的时间差玩项目。另外闭园前2小时是玩项目的黄金时间。当然作为保留少女? 的老母来说，表演类项目才是重点，娃怒刷小矮人时我乐得在奇想花园欣赏新的烟花秀，皆大欢喜[好的],,,,,,上海迪士尼好评
Angela??Dong,5分,超棒,景色5,趣味5,性价比5,"四月底来玩，虽然下了一天的毛毛雨，但游客依然很多。正逢五周年，园区内布置得很漂亮，让人瞬间回到了童年。

可以提前下好迪士尼的官方app，上面可以看到每个项目的预计排队时间，非常方便。

工作人员们态度也都很好。晚上的烟花也很绚丽。总之是非常开心的一天！",,,,,,上海迪士尼好评
whoisangel,5分,超棒,景色5,趣味5,性价比5,迪士尼已经去过好多次了，这次趁着刚好有空又带了孩子再次去那里游玩。这次非常幸运，天气非常棒。大家或许从我照片感觉是不是里面人特别少呀，很空荡啊，其实这些照片哈哈都是骗人的，实际情况是人山人海，只是拍摄的角度，让大家产生错觉。关于游玩的小提示，就是大家可以从迪士尼的App里面能够直观的看到每一个场景，当下的排队的现状，大家可以根据自身情况选择相对来讲排队人较少的项目。另外，推荐迪士尼里面的火鸡腿还真的是非常棒呀，里面的美食还是非常值得令人期待的。,,,,,,上海迪士尼好评
Kelly8501,5分,超棒,景色5,趣味5,性价比5,"上海迪士尼5周年年卡用户特别节目，“奇妙灯光幻影秀”年卡鉴赏之夜。
不得不说，对这个鉴赏之夜的活动我感觉蛮失望的，年卡用户周六晚上8:30进园，就看了一场灯光烟火秀，总体感觉这场秀还没有，万圣节、圣诞节、和春节期间的幻影秀漂亮过瘾。",,,,,,上海迪士尼好评
M29****5590,5分,超棒,景色5,趣味5,性价比5,感觉非常棒，游乐设施有刺激的，也有适合小朋友的，烟花秀是真的超赞，我们等了两个半小时，绝对超值，震撼了！园区内充电宝点也很多，而且归还超级方便，晚上散场后大门口附近的点有人工会收取，不用怕没位置还不进，很贴心。,,,,,,上海迪士尼好评
吃货_小伟,5分,超棒,景色5,趣味4,性价比4,"我是小伟，
一个孤独的美食推荐者?
南昌吃货小伟提醒您:
餐饮千万家
安全第一步
不即时排雷
桌上泪两行

迪士尼乐园 上海的一大特色
我身为在香港跟上海都尝试过的人
表示上海的还是可以的
推荐项目：
创极速光轮 极具科技化的一个项目 整体排队人还算可以 不算特别多，比较刺激
飞跃地平线大概排了一半个小时，体验感真的极佳，场景非常逼真，带你穿越全球 特别爽、整体有落差感 身临其境
小矮人矿山车也是一个必须排队的项目 还好吧整体
下午的花车巡游真的必看，真的太快乐啦！
晚上的烟花是必看的，毕竟现在很多地方已经不让放烟花了冲着这个烟花估计都有一大堆人来此地 
另外推荐火鸡腿。好吃呀！
园区吃的东西有点贵 但是现在整体都可以带吃的，还是挺推荐的！
表演一定要看！",,,,,,上海迪士尼好评
亲亲宝贝1234,5分,超棒,景色5,趣味5,性价比5,在迪士尼感受神奇的一天，浓浓的年味儿越来越足，还有无处不在的中国风元素，真爱这样的迪士尼乐园，冬天的迪士尼，寒流过后，白天的太阳下，还是让人觉得很温暖，喜欢下午的花车巡游，晚上的烟花??灯光秀。冬天，就应该去迪士尼感受一下氛围。,,,,,,上海迪士尼好评
KS炎炎,5分,超棒,景色5,趣味5,性价比5,非常值得一去的游乐园！不管是大朋友还是小朋友，总能找到你想要的快乐。迪士尼从来不会催促你长大，下午的花车游行，晚上的烟花，都格外的流连忘返！众多游戏项目，体验感很强，带有互动的乐趣，惊险刺激的项目更是好玩，,,,,,,上海迪士尼好评
qi****nan,5分,超棒,景色5,趣味5,性价比4,去迪士尼一直是孩子的梦想，总体来说从园景的设计、游戏的体验都是很棒的，所有的游戏和场景都与动画片还有电影等等迪士尼出品东东有关，有种置身其中的感觉-你就是主角??孩子们玩的非常嗨，尤其是喜欢小矮人矿车和冰雪奇缘演出，我是感觉极速光轮的体验感超棒！但是在里边卖的吃的、玩具等等都太贵了，不是很值??建议还是根据自己的情况有选择的购买！??,,,,,,上海迪士尼好评
Kelly8501,5分,超棒,景色5,趣味5,性价比5,"2020年11月15日，我第65次进入上海迪士尼乐园。

今天在朋友圈看到了这样一句话，感同身受。
“My mum told me,you should learn to find happy everyday, even very small happy.”（我妈妈告诉我，你应该学会每天找到快乐，哪怕是很小的快乐）

迪士尼―我快乐的源泉[愉快][愉快][愉快]

第二次续迪士尼年卡了，不是因为到期了，而是因为，明天要涨价了，金卡从1599元涨到了1899元[捂脸]。",,,,,,上海迪士尼好评
黯然-终极神伤,5分,超棒,景色5,趣味5,性价比2,上海迪士尼度假区（Shanghai Disney Resort），位于上海市浦东新区申迪北路753号，是中国大陆第一座迪士尼度假区，也是继加州迪士尼乐园度假区、奥兰多华特迪士尼世界度假区、东京迪士尼度假区、巴黎迪士尼乐园度假区和香港迪士尼乐园度假区之后，全球第六个迪士尼度假区。??     上海迪士尼乐园是一座王国风格的迪士尼主题乐园，包含七个主题园区：米奇大街、奇想花园、探险岛、宝藏湾、明日世界、梦幻世界和迪士尼・皮克斯玩具总动员。每个园区都有花园、舞台表演、游乐设施等项目，各个园区都有不同故事里的迪士尼形象，如米奇和他的伙伴们、迪士尼公主们、杰克船长、小熊维尼等??                                                    ??上海轨道交通11号线迪士尼站直达！                             ??停车场超大，一天100元??,,,,,,上海迪士尼好评
哔哩哩哩哩哩,5分,超棒,景色5,趣味5,性价比5,"这里来写一些自己个人的体会 
总体来说是非常棒的 这里有个小提示 去迪士尼玩的时候 记得自己带个水杯 里面有干净的饮用水免费饮用（不然里面一瓶水10元可乐15）完了开始入园排队 检查你的包包 那些自拍杆啊 还有泡面和一些味大的食物不能带入 （可以带些小零食） 进园后第一个项目就是飞跃地平线 进园后右边跑起来 地平线 ?海盗船 ?欢笑聚友会自拍点?独木舟?旋转木马。基本一个早上满满的安排 这个时候你可以选择从入园方向左手边走 有个迪士尼出口 你可以出去 到迪士尼小镇吃饭 因为迪士尼里面的东西太贵了 吃完后可以拿着纸质门票继续回到迪士尼 然后下午的安排是?极速光轮?喷气背包飞行器?抱抱龙冲天赛车?七个小矮人矿山车。 基本今天一天安排的满满当当 其中有时候会有巡演 自己可以注意点 晚上 正常五点开始就在等烟花灯光表演了晚去找不到好位置了 基本这样下来一天结束了 微信步数妥妥2w+",,,,,,上海迪士尼好评
浓浓浓情巧克力,5分,超棒,景色5,趣味4,性价比4,自己出门多做点攻略 省下所谓导游费fp费在里面吃点买点什么不香吗（土豪随意）， 又不愿意早起又不想动脑做功课又不想排队哪有这么好事，毕竟人口基数这么大，随随便便去哪都是看人人人。下好迪士尼度假区app 里面有乐园路线地图，有小箭头导航，根本不用担心迷路！地铁11号线直达也足够方便了，7点过点多到就能赶上第一批入园，热门都能刷到，看到有些打广告的贴写得也太明显了！出门在外该花的钱要花，但是可以自己解决的努努力你会发现自己其实都是可以的！,,,,,,上海迪士尼好评
67****053,5分,超棒,景色5,趣味5,性价比5,元旦去的，那时还没有爆发疫情，真是庆幸。必须说的是，一定一定要买VIP套票！！入园不用排队，还有8个项目的快速通道，基本上别人排三个小时的项目，你只需要排半个小时…最难忘的是那个光速什么的，不记得名字了，就是创战纪里面的飞车，非常刺激！推荐！,,,,,,上海迪士尼好评
Dora―Hi,5分,超棒,景色5,趣味5,性价比5,带孩子去了一次，和爱人又去了一次，心得是一定要住迪斯尼的酒店，第一天入住，玩迪斯尼小镇，惬意；第二天再入园玩一天。个人喜欢海盗，极速光轮，飞跃地平线。近视眼玩飞跃地平线时，记得戴眼镜，不然打折扣啊，哈哈(?ω?)hiahiahia,,,,,,上海迪士尼好评
M46****129,5分,超棒,景色5,趣味5,性价比5,推]O速w，雷Q山漂流，七小矮人V，加勒比海I和旁的海IC子餐d，夏日狂g城堡秀（一定要提前一cc去站前排），wS地平如果有玩^似的3D大曲屏目就很不建h花rg排，我排了小三小r，心情毫o波的看了三分，疫情Y束以後就]有花表演了，艄庑阄看的也]有卡通形象，晚上八c半_始，如果]有卡通形象的艄庑悖人建h可以直接撤退到外面，T口扔懈鞣N小店可以m停留看看，出T右手有一家很大的商 因榭赐艄庑阙s九c的酒店班，只能e^了。合理安排rg去逛逛的，之是很好一次的迪士尼之旅。,,,,,,上海迪士尼好评
202****898,5分,超棒,景色5,趣味5,性价比5,其实疫情期间限流，人已经少了很多，虽然玩项目还是需要排队，时间却可以接受。以前听来过的朋友说不做攻略来，一个项目就要排3.4个小时。我去过的很多游乐园都需要排队，不排队啥都玩不了。这次来，想玩的基本都玩到了，创极速光轮和加勒比海盗二刷，最后不用排队都可以进去，就是太累了，实在走不动，灯光秀也很好看，就是东西太贵??,,,,,,上海迪士尼好评
艮,5分,超棒,景色5,趣味5,性价比5,"身份证验票 入园后迪士尼门票要保留如果预约排队项目随时要用的哦 ：
?飞跃地平线 第一次去没玩 这次第一玩的就是这个 蛮震撼的3D效果超赞 里面各国国家的热门地区拍摄得很美 全程都在哇……还会根据每个地方的主题散发出相当应的香味儿让你感觉身在其中哈哈哈 推荐指数??????????
?极速光轮 这个不多说 必刷的项目 又酷又刺激 我可以刷n遍 这次也是三遍和我的小姐妹一起 出来后可以选择人家给拍摄得照片 如果想打印又觉得拍的不好看可以在玩一遍 挺直腰板和脖几 就ok了 推荐指数??????????
?花街游玩 迪士尼得经典伙伴门都出行了 我们刚刚好玩完极速光轮 打算去吃饭就赶到了*** 太可爱啦它们和我们互动 在花车上跳舞 真心的看着它们你会笑口颜开 忘记所有烦恼 跟随着它们边走边拍照 还是蛮有趣的 我吵喜欢疯狂动物城里面的兔子与狐狸推荐指数??????????
?旋转木马 当然啦这个拍照很漂亮 也很浪漫梦幻 想拍照的玩完下来赶紧抓拍照片因为下来一批后会有一分钟的时间木马是空的拍照超好看 因为灯光很暖 我喜欢刺激的 不多说拍照还是很ok 推荐指数????????",,,,,,上海迪士尼好评
Kristen_-,5分,超棒,景色5,趣味5,性价比5,去之前其实只是听别人说童话世界一定要去之类的，然后就申请了年假踏上了上海迪士尼乐园之旅，因为看之前评价说要早起排队之类的所以准备要早起，但是因为去的前一天玩嗨了第二天睡过了?????♂?等到了迪士尼已经是10多了，不过好在是淡季进去后很多项目都是排队10分钟左右就可以玩了，最遗憾的是没有抢到穿越地平线的卡，最后排队一个多小时终于玩到了，排队的时候心想再也不会排队这么久来玩这个项目了，等玩完之后，真香！！！这个队排的太值了！然后后续玩了很多适合小朋友的项目，虽然我年纪也不小了，但是在玩的时候觉得自己又回到童年的感觉，迪士尼真的是做到了保护你的童真，这个是在任何一个游乐场都体会不到的，不过还是要建议大家来之前先做好攻略不要浪费在迪士尼的每分每秒，我是有点后悔很多项目没有玩，本来想再来一天，但是有其他行程只能下次再来，然后有一点就是我没有在景区找到热水??可能是我比较笨吧，推荐大家玩的有穿越地平线这个必须玩，还有一个加勒比海盗去的时候在维修停了，不过很多人都说好玩，如果大家去的时候开了替我体验一下哈！对啦，8点的烟花秀一定要早点去找个好位置，我们太沉迷于逛等到的时候都是人已经没有好位置看了，所以要早点去哦,,,,,,上海迪士尼好评
