user_detail_name,text,text 2,text 3,text 4,text 5,content_wrap,iplocation,,,,,attraction_name
野枫印象,5分,超棒,景色5,趣味5,性价比5,"上海海昌海洋公园是一个以海洋文化为特色的主题游乐园，这里有三万多只不同种类的动物和海洋生物快乐地生活在这里。
公园分成人鱼海湾、极地小镇、冰雪王国、海底奇域、海洋部落5个主题区。有多个动物剧场分布在公园的不同位置。到海昌公园，动物们的精彩表演很值得一看。在公园的公众号或小程序上，可了解当天的表演时间安排。
在各大动物展示场馆中，许多千奇百怪，美丽惊艳的海洋生物，让人大开眼界。
如果赶上《海洋梦幻花车巡游》等表演，那更是壮观惊艳。
公园也有各种游乐体验，如火山漂流、海豚过山车、时空缆车等等，很是快乐惊险刺激。
公园旁边，有上海海昌海洋公园度假酒店等可以住宿。
公园内提供了多种餐饮服务，停车场也很大。",IP属地:上海,,,,,上海海昌海洋公园好评
山川自在胸,4分,满意,景色4,趣味4,性价比4,儿童玩得特别嗨，动物表演非常萌，演员表演特出彩，各种介绍很详尽，整个环境，欢乐的海洋。,IP属地:上海,,,,,上海海昌海洋公园好评
Aima3125,5分,超棒,景色5,趣味5,性价比5,"上海海昌海洋公园位于上海市浦东新区临港新城，是以围绕海洋文化特色，集海洋生物展示、主题游乐、科普教育于一体的的海洋主题公园。公园水体容量超过7万立方米，含330余种海洋及极地生物，超3万只海洋动物，由近1000人专业团队养护。公园地上建筑面积约为14.7万平方米，分为人鱼海湾、极地小镇、冰雪王国、海底奇域、海洋部落5大主题区；设有南极企鹅馆、海兽探秘馆、冰山北极馆、海底世界馆、火山鲨鱼馆、珊瑚水母馆6大动物展示场馆，内有北极熊、帝企鹅等30000余只珍稀海洋动物。
2020年6月4日，上海海昌海洋公园被评定为国家AAAA级旅游景区。
2021年5月，上海海昌海洋公园被中华人民共和国农业农村部评为“农业农村部长江江豚人工繁育和科普教育基地”",IP属地:上海,,,,,上海海昌海洋公园好评
熊熊飞行官,5分,超棒,景色5,趣味5,性价比5,??N刷上海海昌海洋公园，带娃也能轻松游！|||??经验分享：出发前必看演出时间表，园区gzh上就能查到哦！记得自带食物和水，别带自热食品哈！漂流和虎鲸表演超赞，记得备雨衣！??交通攻略：自驾超方便，停车场就在主入口旁，车位充足，11:30之前入场80/辆，11:30之后入场50/辆。早到更划算！地铁出行16号线临港大道站3号口出，再换乘1135路公交直达！（也可从临港大道打车到海昌海洋公园2点几公里更快哦）??必看演出：√ 虎鲸传奇虎鲸宝宝互动超有爱，位置可选VIP后面，视线好，还不会被淋水√ 海豚奇缘和小丑表演不能错过！要提前排队，位置也可选在VIP后面位置√ 海狮哈哈秀互动多多，记得提前排队哦！位置还是选在VIP后面，互动多多√ 人鱼童话没有座位，需要席地而坐，前面除了中间位置，两侧都看不清，站在后面台子上视野比较宽阔也不错；√ 白鲸之恋，也是席地而坐，表演结束后先别走，白鲸喜欢互动，超可爱???美食推荐：奥特曼、航海王主题餐厅、企鹅餐厅、美人鱼餐厅，选择多多！特别推荐：新年主题，龙宫神仙节年味十足，新春表演精彩不断！16:00的四海龙宫大巡游很精彩，地点在极地小镇和冰雪王国，建议早一点去找个好位置哦!另外14:00在奥特曼电音广场还会有龙宫盛会，时间来得及也可以去看看,IP属地:海南,,,,,上海海昌海洋公园好评
不太空的一棵树,5分,超棒,景色5,趣味5,性价比5,"上海海昌海洋公园作为主题公园，有丰富多彩的游玩体验，主要亮点包括：
??多样化的演出和展览：公园内有多个剧场，如虎鲸剧场、海豚剧场和海象剧场，提供各种海洋生物表演。此外，还有火山鲨鱼馆、海底世界馆等多个展馆，展示不同种类的海洋生物 。
??丰富的游乐设施：公园拥有多种游乐设施，适合不同年龄段的游客。如火山漂流、时空缆车、海豚过山车等。
特色餐饮：公园内设有各类主题餐厅，如美人鱼餐厅、极地餐厅、企鹅餐厅等，提供多样化的餐饮服务。",IP属地:浙江,,,,,上海海昌海洋公园好评
枫原没有万叶,5分,超棒,景色5,趣味5,性价比5,"上海海昌海洋公园，一个让人仿佛置身于海底世界的神奇之地。这里汇聚了世界各地的海洋生物，让人在观赏中增长知识，感受大自然的神奇魅力。
走进公园，首先映入眼帘的是那座巨大的鲸鲨馆，透过巨大的玻璃窗，可以看到鲸鲨等海洋生物在水中悠然自得地游弋，令人震撼。此外，还有北极熊馆、企鹅馆等多个主题展区，每个展区都充满了惊喜和趣味。
除了观赏海洋生物，公园内的游乐设施也非常丰富。你可以乘坐过山车感受速度与激情，也可以和家人一起体验温馨的亲子项目。
总之，上海海昌海洋公园是一个集观赏、娱乐、科普于一体的综合性海洋主题公园，无论是大人还是孩子，都能在这里找到属于自己的乐趣。",IP属地:江苏,,,,,上海海昌海洋公园好评
M69****9556,5分,超棒,景色5,趣味5,性价比5,第一次和朋友来这边玩，整体很不错 。虎鲸和海豚表演是必看的表演，尤其是虎鲸表演，我们坐在第六排，穿雨衣还是被虎鲸甩出的水淋湿了一些，所以前七排一定要穿雨衣，否则一定是落汤鸡。还看了一些其他表演，也陆陆续续去看了一些海洋馆特别是南极企鹅馆的，企鹅都是憨态可掬，是拍照留念的好地方，游玩前记得提前查看表演时间，合理安排行程哦。,IP属地:上海,,,,,上海海昌海洋公园好评
小妮子怕槁楠,5分,超棒,景色4,趣味5,性价比5,"疫情不能离沪，但整天待在家里又心有不甘，所以觉得这个暑假带着小朋友来一次海昌公园。
提前携程上定好了门票??，原本的计划是还要再住上一晚，第二天再去南汇赶个海，但是临出发前几天，上海的疫情又严重了，所以只能把酒店退掉。
早上6点出门，一路前往海昌，8点到达公园门口，已经有人在排队等候，等到工作人员陆续上班，开始安检，安检还是蛮简单的，吃的喝的都能带。等到9点园区正式开门，演职人员会有开门歌舞表演，然后我们一路向左手边入园，先去玩过山车??看了一个海豚??表演，接下去正好去排队漂流，坐个缆车??，然后去企鹅馆??吃个午饭。吃完饭出来正好在虎鲸馆排队占座，前往前往别逞能坐前面，否则你真的会后悔……
去的那天天气比较炎热，反正热了就躲进场馆吹空调，一路走走玩玩，下午3点还有巡游演出，最后看了一场海象剧场表演出来吃个晚饭，打道回府。
总的来说一天时间游玩完全够了，不想带吃的，里面还有汉堡王，饮料有自动贩卖机，矿水8元一瓶，小吃一条街，性价比还算可以的。",,,,,,上海海昌海洋公园好评
爱媛橙橙心,5分,超棒,景色5,趣味5,性价比5,第一次来上海海昌，三大演出很震撼，招牌虎鲸，海豚??，海狮表演都特别精彩，游乐设施很适合小孩子，拍照打卡点位也多，孩子吃喝玩乐都喜欢，周末烟花和无人机表演也不错，就是火山漂流排队人太多，争取下次再来体验。,IP属地:上海,,,,,上海海昌海洋公园好评
139****1347,5分,超棒,景色5,趣味4,性价比4,海昌海洋公园有多场海洋动物表演，非常惊喜好看。有北极熊，企鹅，鲨鱼，火烈鸟，鲸鱼等大型海洋动物，还有非常惊艳的珊瑚礁，热带雨林等。带着小朋友可以玩一天。很值。,IP属地:上海,,,,,上海海昌海洋公园好评
139****1347,5分,超棒,景色5,趣味4,性价比4,海昌海洋公园有多场海洋动物表演，非常惊喜好看。有北极熊，企鹅，鲨鱼，火烈鸟，鲸鱼等大型海洋动物，还有非常惊艳的珊瑚礁，热带雨林等。带着小朋友可以玩一天。很值。,IP属地:上海,,,,,上海海昌海洋公园好评
冰绿茶1985,5分,超棒,景色5,趣味5,性价比5,在网上看到这边有奥特曼主题馆，然后小朋友特别喜欢奥特曼，所以带小朋友来玩的确很好看，里面有很多好看的手办，还有还有奥特曼的表演，特别有意思，还有商店里面也很多周边值得下次再来玩,IP属地:上海,,,,,上海海昌海洋公园好评
M36****5342,5分,超棒,景色5,趣味5,性价比5,年卡用户再次游玩，暑假人多很多，不过演出也和平时有很多不一样，变得精彩很多，还有各种活动，泼水的环节也很有意思，水流非常大，奥特曼广场还有原神的专卖店是没想到的。,IP属地:上海,,,,,上海海昌海洋公园好评
普利茨豪森苏菲,4分,满意,景色4,趣味4,性价比4,"客观的讲下，毕竟今天才去的。
原以为寒假＋周六了会非常忙，结果居然人很少，可能因为家长还没放学旅游大军还没到的原因，所以总的来说玩的是很爽的。
买的一大一小亲子年票太划算了才五百多，而且不像迪斯尼有节假日不可用情况，全年通用。我是非常推荐如果一个大人带一个孩子来的话一定要买这个年卡。
最大的好处，缆车无限次免费坐。
因为人不多，我们玩的佛系。看了虎鲸表演，这里要说下年卡的好处是VIP位置直接八折，这个位置不会淋湿，距离虎鲸特别近。
人鱼表演的每一位人鱼都很棒，挺值得看的。
童趣乐园是一些儿童游乐项目，人不多的时候直接玩还是不错的。
北极熊太棒了，今天的北极熊非常活跃一直游泳。
园内的员工服务态度我说实话我觉得都挺好的，有问必答，很客气，也没有之前刷到的趾高气昂服务态度差的情况。
缺点：吃的东西太不行而且贵，建议自带三明治零食等。",IP属地:上海,,,,,上海海昌海洋公园好评
M51****5533,5分,超棒,景色5,趣味5,性价比5,"这是我第一次去海洋世界，没有想到海洋世界尽然是一个人间仙境，那里有憨厚的白鲸，雄壮的北极熊，可爱的企鹅，还有雄才的鲨鱼。
我们先去了鲸豚表演场，区抢了几个最前排的可以互动的好位置。等了几分钟，表演开始了。两个驯养师分别骑着两只伪虎鲸，划着白浪出现在我们眼前。接着，我们看到驯养师做了个动作，两只鲸便滑上了岸，月牙儿似地尾鳍不停地上下摇摆着，像是和我们打招呼。接着，四条海豚也以同样的方式与它们的驯养师上了场。我第一次真真切地听到了神奇的“海豚音”。接着一条名叫亮亮的海豚突然一个鱼跃，碰到了离地面十几米高的小红球！全场一阵高呼，气氛到了高潮。
我们还去了许多馆，见到了北极熊、企鹅、海龟、鲨鱼。令我们每个人惊喜不已！当然在参观的途中，也精心挑选了一些小纪念品啦！",IP属地:江苏,,,,,上海海昌海洋公园好评
M14****541,4分,满意,景色4,趣味4,性价比4,海昌的海底圣诞树还蛮特别的，浴缸里的鱼加上人在水里的表演，和圣诞树相得益彰。每年都会来一到两次海昌，还是蛮好的寓教于乐的地方，认识海洋生物，而且各种演出，娱乐设施也不少，海豚过山车速度还蛮快，临港这发展的真好，周边玩的参观的地方很多。,IP属地:上海,,,,,上海海昌海洋公园好评
210****919,5分,超棒,景色5,趣味5,性价比5,去过好几次，两次在海昌酒店住的，一次在皇冠假日住的。家住浦东，过去也要60公里＋，感觉一天时间有点仓促，一般就住一晚。公园还是挺好玩的，以前缆车免费，现在收费了。各类动物表演很精彩，非常值得带孩子一起来。,IP属地:上海,,,,,上海海昌海洋公园好评
M55****742,4分,满意,景色4,趣味4,性价比4,"??景点特色：主要就是看各种海洋动物的表演，儿童乐园区域项目不多，就旋转木马不排队其他都是20分钟起步，儿童过山车也得1个小时才行，而且不能一人多排真的会给你哄走
??景点交通：乘坐16号线到达临港地铁站，出来乘坐公交车直接到达公园，打车的话只能到旁边的路口进不去还是需要走
???必去景点：海狮和虎鲸表演会比其他的几个表演更精彩，时间也会更长一点大概20分钟左右，白鲸表演6分钟，人鱼表演
??排队攻略：过山车和激流勇进排队人数实在太多了，一般都是120分钟左右，如果没买120块钱的速通卡光排队就够头疼的
??其他tips：景区里面的物价比较高，跟迪士尼差不多，但是可以自己多带一点吃喝，进门查包的就是略微扫一眼并不会管",IP属地:浙江,,,,,上海海昌海洋公园好评
天之彼方21,5分,超棒,景色5,趣味5,性价比5,"海昌海洋公园绝对是现在上海最火的旅游目的地之一，不能离开上海的情况下，很多人把这里作为了出游的首选。
海昌在全国有很多连锁的主题乐园，上海的这家位于临港，距离市区比较远，我自驾过来超过一个半小时，如果坐地铁最近的是16号线终点站滴水湖站，交通相对不是很方便。
上海海昌最大的亮点或者说招牌项目肯定是虎鲸表演，几头虎鲸真的是太可爱了，如果坐前边一定要穿好雨披，虎鲸互动的时候会往外打水，水量惊人。白鲸特别特别治愈，很适合安安静静陪着他。",IP属地:上海,,,,,上海海昌海洋公园好评
xusinky618,5分,超棒,景色5,趣味5,性价比5,三人票，597性价比很高，白天基本上把所有的剧场都看了一遍，漂流没有去坐，排队永远都很长，然后最短是105分钟，果断放弃。奥特曼主题馆没有什么特特别喜欢，我不是奥特曼迷，我是奥特曼迷的话，去里面可以看到不同时期的奥特曼。最喜欢的还是虎鲸表演，很震撼。吃的东西实在是有些贵，矿泉水八元一瓶。一个小小的鱿鱼串，30元,IP属地:上海,,,,,上海海昌海洋公园好评
五季??影,5分,超棒,景色4,趣味4,性价比4,"上海亲子休闲度假游好去处

停车很方便，就在入口处对面，1次收费50元。

可以先下载一个 上海海昌海洋公园 的 APP了解下园区概况，场馆，演出等重要信息。但是当天演出时刻表还是需要关注 其 公众号 ??更准确，

精华：
??三大剧场：
海象剧场/虎鲸剧场/海豚剧场
??六大场馆：冰山北极馆/南极企鹅馆/海兽探秘馆/珊瑚水母馆/海底世界馆/火山鲸鲨馆
剧场和场馆位于两大块区域，所以想一天演出&场馆&游乐设施全覆盖鸭梨很大，需要有所舍弃好好规划……

??推荐??：
虎鲸科普秀
白鲸之恋
海象嘻游记
海豚??过山车(刺激)
珊瑚水母馆(适合拍照??)
……等等",,,,,,上海海昌海洋公园好评
jiessie666,5分,超棒,景色5,趣味5,性价比5,上海海昌海洋公园游记：早上10.00到海洋公园，先看企鹅馆接着11.00进海象剧场（看11.30海狮表演）结束后在附近吃饭。12.30进冰山北极馆（看13.00白鲸之恋）15分钟结束。（出来前问清楚工作人员不然跑错出口就来不及啦）出口对面进虎鲸剧场（看13.30虎鲸科普秀）这个是“重点全世界只有3个海洋公园有虎鲸表演7年前特地到美国圣地亚哥去看”，千万不能错过。接着过河去东园看“海底世界”看完14.30进海豚剧场（看15.00海豚恋曲）出口真好是15.30花车巡游，然后去珊瑚水母馆。接下来去漂流或各种游戏项目。表演每天只有一场或2场一定要先看不然15.00以后所有表演结束。看完表演后你可以带你儿子玩一行游艺项目。你微信关注一下他们可以下载地图,,,,,,上海海昌海洋公园好评
erin1227,5分,超棒,景色5,趣味5,性价比5,我们是上午11点半到的，根据场馆表演时间，先后去看了11:45海象表演，12:204D电影，13点的虎鲸表演，13:40晶彩奇航，13:45鲨鱼馆的人鱼表演，14:15海豚恋曲（海豚馆），15:00白鲸之恋，15:20水上飞人。看完表演，去了几个场馆看海洋动物，因为基本都是在室内的，所以整个下午都不算太热。4点半左右排队45分钟去了漂流，在漂流门口花10块钱买一次性雨披和鞋套。最后去儿童乐园玩了几个项目，6点半结束，没有看晚上的灯光秀，有点遗憾。,,,,,,上海海昌海洋公园好评
YANGBOSAN,5分,超棒,,,,"真的真的超赞的！做攻略想玩的都玩到啦～

交通：
我们开车去的，实在是太偏了！花了一个多小时去的，宝宝一直在问到了没？回来有些堵车，时间更长。一次50元。九点过一点点到的，停车已经停到3楼了！

游玩路线：
路上先在公众号查了下剧场时间，发现和做的攻略有点出入，稍微调整了一点，先看了海狮、企鹅、天幕影院，穿过鸽子，时间将将好看虎鲸表演！没人敢坐前三排，我们仨勇猛的很，太爽了！下午去喂了斑海豹、花了60买了4条鱼，太亏了，人家海豹都不要吃，哼哼。又时间刚刚好，坐在前排看了白鲸表演，很震撼。看完坐缆车，要等40分钟，我们差不多35分钟排到，宝宝正好睡了一觉。起来在缆车上看风景～之后看了海洋世界馆、珊瑚水母馆、美人鱼表演，垮馆的时候又碰上花车巡游，和美人鱼隔空互动了！哈哈哈。

tips：
带宝宝的话推车和零食水果很重要，看表演后场的时候可以消磨时间～现在的天气，南极北极馆和室外温差大，给宝宝准备件外套吧，看虎鲸表演坐前15排的话的请带好雨具！",,,,,,上海海昌海洋公园好评
旅星人,5分,超棒,景色4,趣味5,性价比4,在去过的海洋公园里算是最好的一档，里面的动物种类很多，状态也非常好，非常推荐动物爱好者过来看看，属于绝对可以呆一天的海洋公园，里面的几个游乐设施个人最推荐漂流，就是等待时间较长。想看动物表演的进园后可以先关注好具体的时间防止错过。,,,,,,上海海昌海洋公园好评
柏拉兔Molly,5分,超棒,景色5,趣味5,性价比5,"宝宝两岁还小，没有带他去比较贵的迪士尼，而是性价比相对高的海昌。
这次是他第二次来，第一次是他17个月的时候。
两次都在携程boss带货直播中抢购了房+两个成人票的套餐，1300左右的价格，玩两天住一晚太核算啦。
而且海昌海洋公园的酒店边门就是乐园的入口，玩累了，拉臭臭了，肚子饿了，衣服出汗湿了，回房间休整一下，不要太方便。
娃小，不懂什么IP，也不能玩刺激的项目。海昌乐园的项目就特别合适，人不多的时候（比如我周日入住酒店次日周一上午）海洋木马、小飞鱼等几乎每个儿童乐园项目的工作人员会让可以连续乘个四五次，让娃玩到自己不要玩要回家为止。
乐园的动物也有很多，有北京熊、虎鲸、白鲸、海豚、企鹅、海豹等等大动物，也有各种好看的热带鱼、珊瑚等等。
总之，娃很开心，老母亲觉得性价比很高。

后续：娃29个月的时间又来了一次，每一次都肉眼可见的进步。",,,,,,上海海昌海洋公园好评
_WB1****779,5分,超棒,景色5,趣味5,性价比5,"我们是前一天就住下了，住在滴水湖附近的民宿，特别好，第二天一大早就开车前往上海海昌海洋公园，很近，周末节假日上午9点开门，最好提前20分钟左右在那等，小朋友超过一米要买票，可以带零食水果和水，进门就是简单得查看一下包。
9点一进门立刻往右走，赶到冰山那里的缆车入口，坐缆车到火山，可以一览整个园区的景色，漂流10点开始，到了火山可以先游览一下附近的海底世界，有海底隧道和深海奇航，小朋友也可以在附近的童趣乐园玩一玩室外游乐场，漂流120cm以上可以坐，一定要带防护好的一次性雨衣和鞋套，10点前提前一点到那排队等，不然要等很久。玩结束可以过桥去看11点的虎鲸表演，早点去，不要做前排，会有惊喜哈哈，坐在vip席位后方，观赏效果好。
看完虎鲸表演，我们来到隔壁的北极馆，来看12点的白鲸表演，没有座位，可以找个合适地方看，时间不长，12点半可以有白鲸互动，现场买票199一大一小，小朋友有点胆小，所以就我来摸摸啦，白鲸软软的摸起来，特别可爱～看完可以在北极馆逛逛，买些吃的。
我们排队坐缆车去火山，排队要半个小时左右，但是就是想想看看风景嘿嘿。
到了火山，开始准备观看14点的海豚表演，提前半个小时到那，选个好位置，这个海豚表演是最精彩的我感觉，有小丑表演等，丰富多彩，互动感很强。
然后来到火山鲸鲨馆观看美人鱼表演，这个要找靠中间的位置，近些也可以，人多到爆。表演10分钟，很唯美。刚好出来看到花车巡演大概15点左右。
看完花车巡演就等着缆车回冰山，也等了半个小时左右，越到下午等得时间越长，后来在圣诞广场上拍了拍照，又去了海兽馆看了海狮，调皮的很。
出来后刚好赶上驯龙骑士维京之战演出，大概16点35分。
接着去了海象馆看海象嘻游记表演，也很有趣，刚好歇歇脚。这个时候天已经黑了，就绕过冰山看了4D电影，还不错。
出来后走到企鹅馆吃了晚饭，隔着玻璃看着小企鹅们。
广场上到处都是万圣节的装饰和百鬼夜游，其实也还好的，不会主动吓人，可以合影??，整体感觉很棒，就是又困又累，天幕电影没看，逛了一整天了，表演都看到了，还是挺开心的，所以一定要把我的攻略分享给大家，这样好开开心心的玩个够。
要看好当天的演出时间，合理安排，靠的近的表演可以先看，毕竟赶来赶去也挺累的??",,,,,,上海海昌海洋公园好评
M35****1902,5分,超棒,景色5,趣味5,性价比5,"十一国庆节去的。家住上海杨浦，一大早7点半出门，坐了两个小时的地铁到临港大道站下来。然后出站就有公交车1135路直达海洋公园，全程10分钟不到。
8点半就开门了，我和女朋友是9点半左右进去的。
这里给几点建议:
1.人其实平时不算多，除了漂流项目要等一个半小时外，其他展馆和项目，排队10到20分钟左右就可以进去了。漂流排队的时间很长，但是值得一玩，所以进去以后要是想一天之内能全部玩一遍，最好把漂流放到一大早的第一个项目或者晚上最后一个项目，否则中间的人最多，等的时间太长，耽误别的项目游玩。其他的项目和表演绕着玩一圈就行了，园区也不是很大。
2.吃的话不能带进去，但是可以放一点小饼干在口袋里什么都，别太明显就好。里面的餐厅都是上百块一份套餐，就连一根烤肠都要15元，不是很划算，但是饿了还是要买的，最划算的可能是汉堡王了吧，几十块一份套餐就可以吃饱……
3.坐极速缆车不要钱，可以来回坐一趟，而且可以看到整个园区的风景，最好是晚上坐，视觉效果更佳！
下面附上我的游玩照啦！",,,,,,上海海昌海洋公园好评
