user_detail_name,text,text 2,text 3,text 4,text 5,content_wrap,iplocation,,,,,attraction_name
_WeCh****689228,5分,超棒,景色5,趣味5,性价比5,值得期待的，每个少女的心中的梦想。值得一去，首先携程预定的门票，预定成功后，检票时候直接身份证换迪士尼门票，很快就进入园区。拿到票后，建议亲们快速扫描迪士尼二维码，抢快速通道门票。省去排队的时间，园区很大，飞跃地平线超级好玩，还有极速光轮，都玩了2次，好过瘾，强烈推荐大家玩下，其次就是孩子玩探险的绳索游戏，一定要穿运动鞋，不然安检人员不让入内孩子玩不了。一定要穿运动鞋，还有在外面买个雨衣可以中午看演出的时候穿，这样可以在最前面看，不怕喷水了。整个园区下来，玩的很嗨，值得一去，很棒很棒。,,,,,,上海迪士尼好评
M26****7531,5分,超棒,景色5,趣味5,性价比4,今天一早去到馆10点多，确实比较晚，但人是超乎想象滴多，排了半个多小时队，才顺利安检入场，幸运滴是拿到了下午5点的小飞侠的快速通行证，然后很顺利看了场冰雪奇缘，出来就是花车巡游，倒也安排滴有条不紊，接下来花了1个钟头时间玩了个加勒比海盗，我个人觉得是非常非常推荐的游玩项目，非常震撼有感染力，排队时间再长也是值得的。接下来是七个小矮人过山车，比较惊险刺激，速度和转弯比较快，不适应的同志们要回避一下。按照预约时间到小飞侠，有了快速通行证就是不一样，很快就排上体验了一把温和型的缆车旅行，总结一下，就是早上一定要早到，最好拿到2次快速通行证，这样大大提高效率。另外园区内东西还是挺贵的，对价格介意慎入。,,,,,,上海迪士尼好评
许佳,5分,超棒,景色5,趣味5,性价比5,本人是小学寒假开学第三天周二从北京到的上海，住的玩具总动员酒店，两天。可以说是性价比极高，除了极速光轮项目小孩害怕外，全部玩到。加勒比海盗刷了4次，还有好几个项目玩了好几遍。重点来了啊！！！每个项目排队不超过10分钟，一点都不吹。诀窍在哪？官方APP玩的必须溜起来！！！快速卡必须抢到。我就不明白有些人不看攻略就去玩，排队好几个小时，有没有脑子。另外补充一下，里面的饭菜极其难吃，极其贵。什么火鸡腿猪肋排饭，难吃又贵。进门安检非常严，苹果都不许带，别说面包了。第二天本人把水果面包全部带入。前提是，藏好了，我们四个人每人衣服里都藏好多（迪士尼小镇有多乐之日面包店）。我个人感觉就连迪士尼小镇餐饮都不行，反正我是连着两天去新茶旺餐厅，人均100左右。餐饮是迪士尼最大败笔！！！！听说过两年还要新建一个玩具总动员游乐区，本人还打算去。为了去迪士尼，俩孩子整整逃课一周。好了，各位看官欣赏美图吧，,,,,,,上海迪士尼好评
放风筝的兔子,5分,超棒,景色5,趣味5,性价比5,"春节前去的，这是第二次去迪斯尼了，携程买的票，正好在打折，所以很划算。

迪斯尼还是很好玩，但这次可能因为天气什么都很好，排队时间很长。创极速光轮还是很好玩，拍了170分钟

总之天气好的时候去呢，玩好玩的项目都要排队，而且排队时间都会很长。

园区内吃东西也比较贵，但是东西都还蛮好吃的。

最好的灯火秀，因为去晚了，没有占到好位置，又有很多家长把小孩抱起来，对于我这种身高不够的小矮子，真的是太不友好了。

反正今后迪斯尼不知道还会去多少次，慢慢玩吧～",,,,,,上海迪士尼好评
古月初夏,5分,超棒,景色5,趣味5,性价比5,"关于门票：
官网价格499，淘宝便宜40。两日联票会稍便宜些，不过小编和另一位行动矫健的小伙伴一天就玩完所有项目~
关于交通
地铁11号线：直达“迪士尼”站，4号口出站到“奇妙路接驳站”有接驳巴士1/2/3路，是园区内的主要交通方式，可以直接带你到各个景点附近。
餐饮购物：
棉花糖25，爆米花365一大桶，鸭腿35，披萨45,请提前做好预算准备，自备干粮以防在排队的时候肚子饿，不然排队时候闻到别人的丽丽薯片鸡腿鸡米花浪味仙的味道，然而包里空空，心情会很咆哮。。。
关于pass card

6个FP项目：飞跃地平线、小矮人矿山车、小飞侠、维尼熊、创极速光轮、巴斯光年星际营救 
划重点！！敲黑板！！
进入园区千万不要被米奇大街和城堡震撼住就停下脚步拍照，相信我，傍晚你有充裕的时间慢慢拍，进来之后，不要犹豫，先去取FP卡。
每个服务区都有FASTPASS机，插入门票，就会出来一张FP（有名额限制，一般晚了就取不到了）。FP上写着返回这个游戏项目的时间，凭这FP不需排队直接进入（大部分直接来买票的旅客都选择直接排队完全不知道可以拿FP~提前做好功课的小编真的省去了很多无聊等待的时间~）

最理想的状态是在入园后第一时间拿到一张FP，然后十二点和两点算准时间再各拿一张，这样你就可以在中午时分手握三张FP，下午剩下时间就可以安安心心的去其他非热门项目排队吃饭看花车巡游了。
烟火幻影秀
推荐指数：★★★★★
一定要看烟花灯光秀！！！一定要看！！！
透过巨大水幕、镭射灯光、火焰等，看着烟火与五光十射的灯光，投射在上海整个星空，小编那天回去发朋友圈想夸它，后来发现真的词穷。那种美和感动没有办法用语言描述，",,,,,,上海迪士尼好评
糯米饭,5分,超棒,景色5,趣味5,性价比4,"总评：到了上海，值得一去再去的景点，特别是亲子游，就是门票太贵了点，人太多了。园区整体都非常干净。

关于节省时间:建议入住度假区内的玩具总动员酒店或迪斯尼酒店，虽然贵，但每天早上6:00-10:00有接驳车直接送到迪斯尼小镇的快速通道入口，免去在大门口排长队进园的时间。此外，务必一定必须下载上海迪斯尼的app，跟门票关联后可以抢快速通行卡，建议同行几人都可下载，分别抢不同的项目，因为一个用户每抢完一个项目的快速通行卡，必须两个小时后才能再抢另外一个，而且只有部分项目能发快速通行卡。最后，建议没携带儿童的游客，排单人通道，快很多，其实所谓单人通道，就是在玩部分项目的时候不一定能与同行的人坐在一起，所以如果没有携带儿童，或者是不需要同伴拍照的话，排单人通道真的快很多。

关于游玩项目:关于这一项，我觉得就要看个人需求了，因为有的是亲子游，有的会是情侣游有的可能是大家庭出游，还携带有老者。除了个别项目之外，大部分项目都是1米2以上的儿童可以参与游玩的。就我个人的体验来说，我觉得飞跃地平线、超极速光轮、宝藏湾沉落宝藏之战、小飞侠、七个小矮人矿工等，这些是必须要去的。孩子还会喜欢晶彩奇航、太空幸会史迪奇、小熊维尼历险记等等大人觉得有点幼稚的游乐项目

关于餐饮：进园时会检查游客随身携带的包袋，只能携带600毫升以下的饮料，因为去的时候是冬天，所以我们携带了一个600毫升的保温杯装满热水，园区里面没有找到可以装热水的地方，但有很多提供自饮水的水龙头。大衣口袋里塞了几块糖，因为我有低血糖，太饿了会头晕，以备不时之需。园区里有很多的餐厅，我们没有特别的需求，就是饿了找吃的，就在游玩景点附近找吃的，也不能算太贵，毕竟是垄断市场，能填饱肚子继续战斗就好。也可以出园到迪斯尼小镇吃饭，选择更多，但我相信对更多的人来说，更愿意把时间留着玩多几个项目吧。",,,,,,上海迪士尼好评
M31****3674,5分,超棒,景色5,趣味5,性价比5,#祝你拥有神奇的一天，欢迎大家来迪士尼，拥有神奇的一天，非常棒呀呀呀呀呀呀呀呀呀呀呀呀呀呀呀呀呀呀,IP属地:江苏,,,,,上海迪士尼好评
小优优酱,5分,超棒,景色5,趣味5,性价比5,"纪念我第一次去迪士尼！2016的夏天！
那个时候光速飞车还没有减速，还有几个项目没有造好。那个时候舞台剧比较多。那个时候正好是我的生日。",,,,,,上海迪士尼好评
crystal姚,5分,超棒,景色5,趣味5,性价比5,小朋友非常喜欢，尤其是爆款的游戏项目，还有花车巡游，一定要站在前排，可以和卡通人物互动。灯光秀感觉一般，等待时间太长了，天也太热了。,IP属地:黑龙江,,,,,上海迪士尼好评
心情好好的毛怪,5分,超棒,景色5,趣味5,性价比5,上海迪士尼，已经换上全新圣诞装扮，迪士尼朋友已经穿上圣诞衣服，处处都有圣诞装饰，连冰雪奇缘人物也全部出动，艾莎，安娜，克里斯托弗，雪宝，驯鹿！！太好看了！！圣诞树真漂亮！！！一切都是那么美好！,,,,,,上海迪士尼好评
天蝎座的小女孩儿,5分,超棒,景色5,趣味5,性价比5,值得去的，孩子很高兴，节假日人多，平时会更好一些,IP属地:上海,,,,,上海迪士尼好评
白开水,5分,超棒,景色5,趣味5,性价比5,在迪士尼的奇妙世界里，会发现时间仿佛变得不再重要。会忘记疲惫和烦恼，沉浸在这个充满魔法的世界里，享受每一个瞬间带来的惊喜和感动。,IP属地:山东,,,,,上海迪士尼好评
M34****7699,5分,超棒,景色5,趣味5,性价比5,迪士尼氛围挺足的，演员人偶都挺热情的，尤其极速光轮，绳索项目都挺刺激的，还有轮番的演出表演，必须得选天气好的日子去，会有烟花，因为下雨没看上，伤心??就是里面物价贵了点,IP属地:上海,,,,,上海迪士尼好评
hijjsj,5分,超棒,景色5,趣味5,性价比5,哇塞简直啦，很棒的体验，飞跃地平线虽然排了一些时间的队，但是很值得，超乎想象的感官体验，矿山小火车和创极光速轮刺激好玩，所有人都在盼着你长大，只有迪士尼在守护你的童年,,,,,,上海迪士尼好评
D79****75,5分,超棒,景色5,趣味5,性价比5,大人小孩都喜欢的景点，就是排队等候时间太长了,IP属地:陕西,,,,,上海迪士尼好评
攻艰克难,5分,超棒,景色5,趣味5,性价比5,上海迪斯尼乐园，值得一游！由上海火车站去迪斯尼乐园可以乘坐地铁11号线。十分便捷。,IP属地:北京,,,,,上海迪士尼好评
月狼1100,5分,超棒,景色5,趣味5,性价比5,"玩一趟迪士尼，真的感觉像被施了魔法，体验感直接拉满！
 
一踏入迪士尼，就像掉进了童话世界，每一处角落都超梦幻，公主城堡在灯光下美得不像话，拍照特别出片！项目也很绝，创极速光轮超刺激，飞越地平线带我环游世界，沉浸感十足。工作人员超热情，花车巡游时他们活力满满，互动超有趣，迪士尼真的太懂怎么让大家快乐了！
 
这次迪士尼之行，简直是我今年最难忘的回忆！园区里的氛围太棒了，到处都洋溢着欢乐与惊喜。每个游乐设施都维护得很好，排队时还有各种小设计打发时间，一点都不无聊。晚上的烟花秀更是把浪漫值拉满，配合着迪士尼经典音乐，感觉所有的美好都在这一刻汇聚，真的太爱迪士尼啦！
 
家人们谁懂啊！迪士尼真的是快乐老家！入园后，可爱的迪士尼朋友随处可见，和他们互动超欢乐，感觉自己也变成了小朋友。美食也超赞，火鸡腿超大个，一口下去超满足。游玩项目丰富多样，不管是刺激的还是温馨的，都能找到适合自己的。这次游玩体验满分，下次还来！",IP属地:江苏,,,,,上海迪士尼好评
M91****54,5分,超棒,景色5,趣味5,性价比5,选择了一个工作日带娃出行，人流量较平常来说要少了将近一半，所以项目排队的时候并没有门口显示的那么长时间。因为带的三周岁以内的娃，有好几个项目受到身高的限制，不过孩子能玩的项目几乎全都玩了……新开的疯狂动物城太值得打卡了，体验感较强……,IP属地:上海,,,,,上海迪士尼好评
匿名用户,5分,超棒,景色5,趣味5,性价比5,"和家人淼鲜磕嵬商欤有免M的C觯迪士尼，班接送，性r比很高，因槲微信加了不群，前台工作人T也是加了我微信，天再提醒我程，服B度很好，有什N}都及r回复，很N心，我定的是套房，房g挺大的，有小客d，附近吃什N的也很方便，c外u的也有C器人可以送到房g，很智能化，出行迪士尼的朋友可以x袼家！ ！ 
真的很推]台尺^去上海玩！",IP属地:中国台湾,,,,,上海迪士尼好评
刘女士的美丽生活,5分,超棒,景色5,趣味5,性价比5,首先，不是从迪士尼小镇走快速通道。跟王晶晶导游沟通了一下，早晨七点走的早入园，带着玩了四个项目，这四个不是快速通道，但是进入很快不用排队。剩下的8个都是快速通道不用排队，王晶晶导游真是太棒了，带着玩的真是又快又爽，安排的时间满满当当一点不浪费。看了冰雪奇缘的表演，也看了花车巡游。看她跑来跑去帮忙安排真的特别感谢。头一天还告诉她不用她跟着，第二天全是靠她。下次来迪士尼还会请王晶晶帮忙，也把她推荐给了所有的朋友。头一天在抖音上订的导游简直神了，到迪士尼告诉我去排队吧人少，又说自己买的高价票没有快速通道，又说孩子小好多项目不能玩手机，直接投诉退钱。到王晶晶这里，孩子不能玩的快速通道帮忙协调换成了小矮人，真的是老感谢了！,IP属地:江苏,,,,,上海迪士尼好评
夜王,5分,超棒,景色5,趣味5,性价比5,今天晚上已经很晚了，上海迪士尼之行已经过去6天了，本人又跑到海南了!但是我觉得我必须给王导点个大大的赞??????王导是一个很地道的东北人，人很实在不吸烟，个子高高的，没什么不好的习惯!如果说有就是有点太负责任了!刚接到携程专员打电话过来说明天要带我们玩就很不爽，因为以前对国内的导游印象很差，所以不想让导游带着玩。我非常庆幸携程能给我们分一个这么好的导游，善良，责任心非常强，幽默，非常专业细心能够很好的给你规划游玩路线，很阳光对人特别好，完全颠覆我对国内导游的认识和认知，你和他相处一段时间后，不管男女老少大小通吃，你会对他有一种莫名的信任感!我已经去了四次迪士尼了一直体验感很差，但这次王导让我上海迪士尼之行体验感拉的满满的让我有一种还想去的冲动!等到6月份去上海迪士尼一定还让王导带!,IP属地:海南,,,,,上海迪士尼好评
M28****1773,5分,超棒,景色5,趣味5,性价比5,迪士尼就是小孩子的天堂，一进门可以先去找工作人员要迪士尼的地图，还有免费的迪士尼贴纸，如果今天是你的生日，就可以到工作人员那里去领生日勋章，这样公主们和工作人员都会给你生日快乐 那里有很多好玩的游乐项目，有的刺激，有的很适合小朋友，极速光轮是我们觉得最刺激的一个项目，如果冬季去玩儿雷鸣山漂流，要先买雨衣，如果想要米妮的发卡，可以先在网上购买，价格会便宜一大半，除了东西特别贵之外，就是排队时间太长了，剩下游乐设施没什么毛病，公主们的表演也十分精彩，特别适合小朋友观看，巡游花车更是十分精彩，迪士尼城堡晚上的烟花表演和喷泉也十分壮观，亮如白昼，如果不想看烟花的话，就可以直接去排队别的项目，这个时间排队的人会大大减少，迪士尼的餐饮可以到迪士尼小镇上去吃，不便宜也不贵，这次迪士尼之旅非常圆满！,IP属地:北京,,,,,上海迪士尼好评
快乐的大米粒儿,5分,超棒,景色5,趣味5,性价比5,"第二次来迪士尼了，看以前都说除夕人会少，所以带爸妈来过年，结果人超级多????
果然放开第一年是我天真了
来之前老爸很不屑说幼稚，结果排了几个项目就上头了，尤其是巡游追着看了三场，最后说真的除非铁石心肠的人，否则来到迪士尼都会被感染到快乐

新年特别烟花超级好看，天气也很给力，除了上海的风真的很凉，迪士尼很人性化，飞越地平线这种大项目都安排室内排队了

最后，迪士尼真的不会让你失望，所有的人都会为你带来欢乐，下次希望有时间可以参加万圣季！",IP属地:上海,,,,,上海迪士尼好评
yccui,5分,超棒,景色5,趣味5,性价比5,"欢乐的冬天自然少不了迪士尼重新开业之后重装上阵，怎么能错过？
虽然是寒冬，但是一边穿着厚厚的羽绒服，一边吃着冰淇淋，感受迪士尼带来的欢乐气氛，绝对会让你眼前一亮哦。
而晚上。虽然寒风阵阵，但是绚丽夺目的烟花表演绝对让你值回票价。",IP属地:上海,,,,,上海迪士尼好评
桃花行者,5分,超棒,景色5,趣味5,性价比5,上海迪士尼乐园，位于上海市浦东新区川沙镇黄赵路310号，于2016年6月16日正式开园，是中国内地首座迪士尼主题乐园，也是中国规模最大的现代服务业中外合作项目之一，是一座具有纯正迪士尼风格并融汇了中国风的主题乐园。 上海迪士尼乐园占地1.16平方公里，主题园区分为米奇大街、奇想花园、探险岛、宝藏湾、明日世界、梦幻世界、迪士尼・皮克斯玩具总动员。拥有迪士尼城堡、漫威英雄总部、巴斯光年星际营救等游乐项目。,,,,,,上海迪士尼好评
小蓝孩想环游世界,5分,超棒,景色5,趣味5,性价比5,"都说全世界都催着你长大 只有迪士尼让你变回小时候
真的是个小公举的天堂 随处可见的卡通人物 每个人脸上都洋溢着大大的笑容 满园放的歌曲 让人的心情莫名愉快
除了人多 真的是没毛病 有适合小朋友玩项目 也有略显刺激的游乐设施 最喜欢那个极速飞车 科技感极强 迪士尼版的速度与激情 飞跃地平线也是好玩的 就是排队太可怕了！

赶上生日月和五周年 买到了五周年的纪念小可乐 从天亮玩到闭园 真是开心的一天～",,,,,,上海迪士尼好评
微笑娟晓,5分,超棒,景色5,趣味5,性价比5,全是童年的记忆，项目玩的很尽兴，最喜欢加勒比海盗和雨淋漂流，大家都很high。各个版块设计的都很美，周二来的，每个项目基本排队1小时，虽然项目没能玩通，留点遗憾下次继续。晚上的烟花秀真的值得看。吃的超级贵（爆米花35.75元），冰淇淋45元，晚餐一人111元。一天走了2万+的步数。,,,,,,上海迪士尼好评
M24****4275,5分,超棒,景色5,趣味5,性价比5,"，什么是Fast Pass？

FastPass直译过来就是快速通行证。这个东西非常好用，利用得当的话可以给你省不少时间呢。FP能够让你不需要排队即可快速进入某个游玩项目，迪士尼乐园里的很多热门项目都有FP功能。先拿一张FP，去玩别的项目时这边也在排队的意思，等到FP上的时间到了，再来这个项目游玩。

我们拿热门项目飞越地平线来距离，阿卷一进门，第一件事除了疯狂拍照，就是去取它的FP，因为这个项目非常火爆，如果站在那里排队，可能2个小时也不一定能进去。

 
但是FP也不是无限领取的。首先，FP必须在卡面上规定的时间去使用，也就是说，卡上规定的时间之前你必须赶到这个项目，不然这张FP也作废了。而且，FP是有领取时间间隔的，间隔时间为2个小时。就像我们玩游戏的冷却时间一样，领取了一次，需要过2个小时才能领取其他项目的FP。

 
其次，一定要准备的手机APP

建议大家在去迪士尼游玩之前，下载一个APP叫做，迪士尼度假区。这个APP的功能很少，但是最关键的是，它有地图。而且，它能够实时更新每一个游玩项目的预计排队时间。这个功能就很有用啦，有了这个APP在手，就能快速选择就近去哪个人少的项目。

 
哪些项目实力推荐？

飞跃地平线

3D大家都知道，裸眼5D体验过没，飞越地平线就是裸眼5D的项目，这个项目虽然只有短短的九分钟，为了这九分钟排队的人可不少，一定记得使用FP。在这个项目中你可以通过球幕感受环游世界的感觉，效果非常好。在阿卷心目中这个项目可以排到前三。

 
创极速光轮

这个项目其实就是一个时速100千米的过山车一般的体验，只不过不是过山车，而是坐摩托车。这个项目的效果非常酷炫，阿卷平时坐过山车都吓得嗷嗷叫，这个项目更害怕，虽然只有1分钟，还是紧张得不行。不过胆子大的男孩子应该会很喜欢这个项目。记得，即使再害怕也不要闭眼睛，因为你会错过很多酷炫的光效。

 
烟火秀

这个烟火秀，讲真的阿卷没看到。因为去的时候下了大暴雨，广播说取消，阿卷就走了，谁知道又天晴了！完美错过了那场烟火。一直想着以后要去补上。烟火秀在晚上八点半开始，在睡美人城堡前，不仅有烟火，还有绚烂的灯光。这场烟火秀持续20分钟左右，但是千万别到点才去，一定要早早到去占个拍照的好位置。

 

以上提到的项目，都非常有意思，但是其他的项目也基本上都非常精彩，只是如果时间有限，就择优去体验啦。其",,,,,,上海迪士尼好评
恰似您的温柔,5分,超棒,景色5,趣味5,性价比5,和孩子一起穿越爱丽丝梦游仙境汇总的迷宫，在魔幻的探险奇境中发现一些隐藏的美好事物。走进皮克斯玩具总动员，“抱抱龙”将邀请大家坐上遥控冲天赛车，在长长的“U”型轨道上开启一段刺激的冒险旅程；还可以在“艾尔玩具店”购买玩具、服饰、徽章等。,,,,,,上海迪士尼好评
138****1997,5分,超棒,景色5,趣味5,性价比5,"少女公主们必去点
虽然都来过，但我还是要说25000人的迪士尼…一定要早来，别被9点开门误导，进来直接抢飞跃地平线FP，然后尽早奔TRON和加勒比，花车巡游提前占坑…人是真不多，排队强制要求戴口罩保持间距1米，项目基本隔排坐，巴波萨烧烤里的拼盘比其他店都要好吃量也够",,,,,,上海迪士尼好评
心情好好的毛怪,5分,超棒,景色5,趣味5,性价比5,迪士尼乐园，记得去体验下徽章文化！徽章非常好看，各个主题都有自己对应的徽章，还有盲盒！盲盒很好玩，完全是考验运气的时候！当打开盒子的刹那，激动万分！！！徽章的第二个文化，就是交换，非疫情时候，可以和工作人员交换他们身上佩戴的徽章！！,,,,,,上海迪士尼好评
心情好好的毛怪,5分,超棒,景色5,趣味5,性价比5,上海迪士尼，我最喜欢的迪士尼，没有之一！这里有美好的梦想，游戏项目虽然需要排队，但是却让小朋友知道，只有耐心等待，才有好的结果！疫情期间，迪士尼做了很多调整，取消迪士尼朋友拍照，但是不妨碍和迪士尼朋友的互动，公主在城墙上向你挥手，长发公主和尤金在城墙上跳舞，一切都是那么的美好！新的时期，新的体验！愿你度过神奇的一天,,,,,,上海迪士尼好评
fly_me_to_the_moon,5分,超棒,景色5,趣味5,性价比5,"上海迪士尼闭园好久了，真心期待它复工的那一天！
比起结伴去蹦迪，更喜欢一个人来迪士尼瞎逛~
?上海迪士尼真的好适合来拍照，分分钟沉溺在童话世界中，这里的一切都好治愈~
推荐拍照打卡点一个个拍过来吧！
一个人玩耍唯一的缺点就是拍照需要工作人员帮忙，照片都有点不尽人意……",,,,,,上海迪士尼好评
流浪的yang小小liu,5分,超棒,景色4,趣味5,性价比4,迪士尼一定不要周末和节假日去！！！我们周末早上7点到门口就已经排起了长队，二话不说，先在app上抢“快速通道”，能抢哪个是哪个。推荐项目：极速光轮（有点刺激）、飞跃地平线、七个小矮人矿山车、加勒比海盗―沉落宝藏之战（强烈推荐啊！全屏3D效果，完全身临其境！） 推荐演出：杰克船长之惊天特技大冒险（宝藏湾）  晚上记得找个好位置看烟花～,,,,,,上海迪士尼好评
