business_id,content
5174,一前期攻略 有恭王府时间建议全程控制在3个小时这样不会太赶可以乘坐地铁6号线到北海北下车从B口出来左转沿着胡同一直走大概10分钟左侧便是恭王府出口和入口门票是40元可以随买即进切记一点现在去需要72小时核酸进门后建议请个讲解单人请200可以找几个人拼6人以上40一个人 二游览攻略 恭王府是清代规模最大的一座王府建筑群历经了清王朝由鼎盛而至衰亡的历史进程承载了极其丰富的历史文化信息故有了一座恭王府半部清代史的说法恭王府府邸建筑清晰地分为东路建筑中路建筑西路建筑后罩楼各路建筑严谨地按照轴线对称方式由南向北贯穿于整个住宅与院落布局分明 府邸建筑 中路建筑 中路主要有银安殿和嘉乐堂两大建筑 银安殿俗称银銮殿是王府中的主体建筑也是王府的正殿主要用于举办府内重大礼节性的活动只有重大事件或节日才会使用1921年因主人烧香不慎失火大殿同东西配殿一起焚毁但此殿高大的气魄仍然可以让我们感受到当年威严肃穆的王府气派银安殿面阔五间歇山顶正殿用绿色琉璃瓦其建筑上的彩绘不能使用皇帝专用的和玺彩画但可以用旋子彩画中等级最高的如金琢墨石碾玉龙锦枋心套殿可用墨线小点金大殿井口天花可用坐龙 嘉乐堂位于银安殿后面是恭王府中路建筑的最后一进正厅前出廊五开间硬山顶大门正上方悬嘉乐堂匾额 东路建筑 东路的前院是多福轩后进院是乐道堂 前院多福轩是穿堂客厅次厅主要作用是接待客人亲戚或来回禀事物的下属还可以存放皇帝送来的礼物等当时厅内四周挂满福寿字匾屋内摆设都是根据历史照片按照原来情况布置的 陈列着许多有关恭王府的历史照片 后进院落正房名乐道堂是东路建筑中最大的一间在恭亲王时代这里是他日常居所恭亲王奕訢皇子在此时道光帝曾赐予乐道堂匾额所以此处或许也是因此而得名 西路建筑 西路建筑与庭院相对中路与东路更为雅致主体建筑为葆光室和锡晋斋 葆光室位于府邸西路在和珅与庆王时期为客厅在恭亲王时期是秘密客厅接待王爷至亲所用其中最精致的是葆光室其里外屋檐都是绘制彩画最让人惊叹的是中外屋檐的彩绘都是当时全国最高水平的彩画技术师绘制同样内檐的彩画也是美轮美奂府里面廊檐下的金色图案都是镀的真金早在清朝这里是道光皇帝祭奠先人之后的休憩地
5174,恭王府Prince Kung39;s Mansion位于北京市西城区柳荫街为全国重点文物保护单位中国国家一级博物馆国家AAAAA级旅游景区是清代规模最大的一座王府建筑群曾先后作为清乾隆时期权臣和珅清嘉庆时期庆僖亲王永璘的宅邸咸丰元年1851年清廷赐封此宅邸于恭亲王奕訢恭王府的名称也因此得来 恭王府规模宏大总占地面积6万平方米分为府邸和花园两部分拥有各式建筑群落30多处历经了清王朝由鼎盛而至衰亡的历史进程承载了极其丰富的历史文化信息故有了一座恭王府半部清代史的说法
5174,朋友来了北京当然要带着游览一下恭王府现在是保存最完整的王府建筑很齐全相比较其他的王府要么是四分五裂的变成了大杂院要么被各个单位占据要么没落的不成样子这里的建筑群落有30多处布局讲究气派非凡 原本是和珅的府邸历经了清王朝由鼎盛至衰亡的历史进程所以说有一座恭王府半部清代史的说法
243,很值得去相比八达岭长城最大的好处就是人少最大的优势外国人多哈哈其实慕田峪真的不错景色秀丽长城内外真的漂亮好汉坡也是很考验的最后很陡登上去也是蛮有成就的总体其实不累很休闲的就转完了
243,在慕田峪巴士买的车票 8点准时到达景区有摆渡车和缆车 2小时爬完收官难度系数较小 景区很完善的慕田峪村 中午正好吃个午饭 还会遇到很多拖家带口的外国友人 长城暴晒崇山峻岭之间 连猫都要中暑了
243,师傅人很好非常准时服务很好提前一天就联络好我们安排时间还建议我们提早出发到慕田峪长城还好我们提早出发一路通常无阻也不用排队省了很多时间回程还特地载我们回酒店放行李了再送我们到吃晚餐的地方非常推荐给不想人挤人的家庭
243,非常开心的一次旅行在携程预订了赞巴士导游很细心前一天就加了微信协商了旅行的细节第二天按照行程出游讲解和游玩时间都很充分玩了轨道和滑道的行程孩子玩得非常开心回程也很准时非常愉悦的一次旅行
243,前期参加北京团队游后火车票改签延后就是为了登慕田峪长城过不期然不虚此行登临长城超越自我长城之巅我与世界同在实现了长城已爬好汉已当一步一个脚印丈量历史的深度
243,慕田峪长城绝对值得一来 人比八达岭少风景不错自己搜的慕巴士来的慕田峪慕巴士服务周到周导解说安排也很好 不用自己研究攻略路线吃喝都有推荐大家一起玩滑道太爽啦
243,慕田峪长城雄关壮丽历史与现代的 结合 国庆节期间天气转凉游客需注意保暖此时的长城上风力较大温度较低游客需根据天气情况增减衣物 由于国庆节是旅游高峰期景区内游客较多尤其是带有儿童的家庭游客在上山游览时需注意安全尤其是要照看好随行的儿童避免他们上蹿下跳发生意外 景区内可能会有较多的马陆等昆虫出没这些昆虫可能会对部分游客造成惊吓或不适游客需提前做好防虫准备 最后慕田峪长城的部分路段台阶较陡对于腿脚不便的游客来说可能不太适合建议此类游客选择乘坐观光缆车或选择其他较为平缓的游览路线 慕田峪长城以其独特的建筑风格坚固的建筑材料和便捷的观光缆车等特点吸引了众多游客前来观光游览在欣赏长城壮丽风光的同时游客也需注意安全问题和景区内的环境保护在旅游高峰期游客需提前做好准备合理安排行程以确保游览的顺利进行 慕田峪长城是一处值得一游的旅游胜地无论是历史爱好者户外运动爱好者还是家庭游客都能在这里找到属于自己的乐趣和收获
243,往返交通 乘坐北斗国旅慕田峪长城一日游国庆预售特惠仅需100 免景区摆渡车省时省心省力早上8点9点双班发车朝阳门地铁A口步行80m就上车下午返程鸟巢水立方散团导游随车讲解还可以让导游帮忙代买缆车滑道索道节省买票时间 路线规划 打卡点20号敌楼好汉坡最高点很难爬但很有成就感高处风景很好4号敌楼正关台1号敌楼大角楼索道和滑道也很好玩 路线1好汉坡路线 缆车上到14号敌楼爬上20号敌楼好汉坡返回14号敌楼缆车下或走到6号敌楼体验滑道 路线2滑道路线 索道上到6号敌楼爬到1号敌楼大角楼返回6号敌楼索道或滑道下 路线3我的特种兵路线 先走路线2再走路线1约大半天时间所有打卡点全部走到但是非常非常累个人觉得最有意思的是好汉坡和滑道可以索道上后直接滑道下大角楼那边不去也没关系没那么累 缆车是一家公司索道和滑道是一家公司缆车单程100元缆车往返140元缆车上下点为14号敌楼缆车是全封闭式的索道和滑道单程100元索道上滑道下或索道上索道下140元索道和滑道上下点为6号敌楼索道和滑道比较有意思但滑道有年龄限制 吃 景区有几家餐厅可以在餐厅用餐也可以自备食物长城上也能买到水冰淇淋等零食. 快来打卡慕田峪长城吧
243,今天从市区的东四十条乘坐慕巴士相比八达岭的雄奇慕田峪显得更加古朴了一些相比八达岭的人多慕田峪显得人少了许多今天车上工作人员小强服务很好很详细的给我们介绍了慕田峪长城的特点和玩法最主要的今天赶上下小雪能够遇到长城的雪景这个是很难得的千里冰封万里雪飘引无数英雄竞折腰雪中的长城令人惊奇
243,一片大美的慕田峪长城我们从东四十条地铁站坐慕巴士过去的起初打算用脚走完这段长城的听完车上小强哥讲解攻略后才知道长城距离地面是有很长距离的主要是难得请假的工作日错峰出来玩一定不能错过景区的招牌地标正关台古建筑还可以看到炮台长城人烟稀少小强哥也提供很优质的服务会推荐朋友来玩
