user_detail_name,user_detail_tags_text,text,text 2,text 3,text 4,text 5,resource_date_text,content_wrap,iplocation,from
游侠半仙,,5分,超棒,景色5,趣味5,性价比5,,一场传统文化与现代艺术交织的跨界文艺活动，将通过情景演绎、深度讲解、文艺演出、光影氛围等多元形式，打造多散点、强体验、新融合的成都文旅新场景。活动中，资深讲解员将化身为“古蜀先民”，带领观众穿越时空，与身着盛装的神鸟“金乌”、乌木精灵等角色相遇，历经“古蜀礼乐、古今交融、希望之声”三个主题篇章，游历古蜀金沙王国。,IP属地:四川,
yuansl,,5分,超棒,景色5,趣味5,性价比5,,金沙遗址博物馆是三星堆博物馆的延续，本来同事说都一样，我也不太想去了，但是因为三星堆的导游说要来看看，我还是抱着试试看的态度订了这个行程，导游知识很渊博，出口成章，虽然人很多，但是孩子还是全程跟了下来，非常感谢导游的讲解。,IP属地:四川,
匿名用户,,5分,超棒,景色5,趣味5,性价比4,,知识性强，还是不错。,IP属地:新加坡,
缘来很近,,5分,超棒,景色5,趣味5,性价比5,,值得去一趟！,IP属地:四川,
mo****awk,,4分,满意,景色4,趣味4,性价比4,,值得。爱好者多次不厌,IP属地:江苏,
M27****5201,,5分,超棒,景色5,趣味5,性价比5,,服务态度好 就是国庆周人太多了,IP属地:四川,
_WeCh****86076,,5分,超棒,景色5,趣味5,性价比5,,还不错，了解古蜀文明,IP属地:江苏,
M28****3634,,5分,超棒,景色5,趣味5,性价比5,,很值得研学游,IP属地:四川,
大飞张汐羽,,5分,超棒,景色5,趣味5,性价比5,,带孩子值得一去,IP属地:河南,
135****2797,,4分,满意,景色4,趣味4,性价比4,,很适合带小朋友去，小朋友可以学到很多东西，如果小朋友比较大建议请一个讲解，这样对古蜀文化会有更加直白的了解。,IP属地:四川,
137****6886,,5分,超棒,景色5,趣味5,性价比5,,老师很不错,IP属地:四川,
两盏,,5分,超棒,景色5,趣味5,性价比5,,张老师讲的太棒了，带着老人全程沉静听完，所有人都很满意,IP属地:四川,
M27****5885,,5分,超棒,景色5,趣味5,性价比5,,很不错，孩子很喜欢。,IP属地:四川,
m72****66,,5分,超棒,景色5,趣味5,性价比5,,导游老师讲解的非常细致入微，让我们了解到成都悠久的历史文化底蕴，而且与三星堆无缝衔接，增添历史的神秘感，让人浮想联翩，身临其境。。,IP属地:天津,
匿名用户,,5分,超棒,景色5,趣味5,性价比5,,大宋老师非常好，不同于以前遇到的讲解，生怕我们没听懂，讲解得很仔细，对小朋友照顾得很好，本来一个半小时的讲解，整整讲就两个半小时，很不错的体验。,IP属地:四川,
海阔天空0726,,5分,超棒,景色5,趣味5,性价比5,,逛完金沙博物馆，感觉到它完全不应该成为因订不到三星堆门票退而求其次的顶替选择。不光有历史、文化，还有园林公园般的环境。从讲解大宋大哥娓娓道来中慢慢了解了金沙文明的知识，两个半小时的时间收获良多。,IP属地:四川,
沛沛1998,,5分,超棒,景色5,趣味5,性价比5,,文创周边很有意思，还有小鹿，白鹿也有！展馆有很多展品，环境也很不错，河边有很多鸟类,IP属地:四川,
137****7903,,4分,满意,景色4,趣味3,性价比3,,金沙博物馆很一般，看下即可。,IP属地:江苏,
匿名用户,,4分,满意,景色4,趣味4,性价比4,,体验感一般般！,IP属地:陕西,
le****206,,5分,超棒,景色5,趣味5,性价比5,,谢谢老师的讲解很详细，整整2小时收获满满,IP属地:四川,
_WeCh****36006,,5分,超棒,景色5,趣味5,性价比5,,巴蜀文化的历史值得看！,IP属地:湖南,
M27****4230,,5分,超棒,景色5,趣味5,性价比5,,非常适合带娃去,IP属地:重庆,
瞿塘侠遇,,5分,超棒,景色5,趣味5,性价比5,,很不错！！！！！！！！！！,IP属地:山东,
M28****8056,,5分,超棒,景色5,趣味5,性价比5,,小而精，还不错,IP属地:四川,
帅弟一号,,5分,超棒,景色4,趣味4,性价比4,,文物很震撼！涨知识了！,IP属地:湖南,
sunyd710521,,5分,超棒,景色5,趣味5,性价比5,,需要请导游，跟着导游感受历史的气息，比较适合带孩子研学，补充历史知识。公园本身也很值得游玩，占地大，除却遗址文物，绿化园林也很值得一游。,IP属地:北京,
匿名用户,,5分,超棒,景色5,趣味5,性价比5,,朱老师讲解详尽，知识渊博，有问必答，非常好,IP属地:四川,
匿名用户,,5分,超棒,景色5,趣味5,性价比5,,小林导游讲解的细致专业,IP属地:四川,
弧度33,,5分,超棒,景色5,趣味5,性价比5,,了解古代蜀国文化的好去处。个人觉得比三星堆好看，而且在成都市内，地铁可达。,IP属地:辽宁,
M31****1443,,5分,超棒,景色5,趣味5,性价比5,,这里不比三星堆差，而且通过好的讲解可以让你很清楚了解古蜀，三星堆，金沙遗址之间的关系，收获满满。而且离市区很近，那个太阳神鸟太漂亮神奇了！,IP属地:四川,
180****7080,,5分,超棒,景色5,趣味5,性价比5,,刘振江老师讲得非常好，人也很nice,IP属地:四川,
匿名用户,,4分,满意,景色4,趣味4,性价比5,,比较小，有太阳神鸟,IP属地:广东,
生活灿烂,,5分,超棒,景色5,趣味4,性价比4,,到的时候16点30，以为19点闭馆，所以还在慢慢游览，没想到17点半突然广播说18点闭馆。很无语。问了工作人员说是暑假才19点闭馆，现在改了。我去的是工作日，也没啥人，本来挺好的，就因为这个闭馆后边也没咋好好看，唉,IP属地:北京,
M87****78,,5分,超棒,景色4,趣味4,性价比5,,去成都的第一站，惊叹古人的智慧，历史文化发展悠远流长，展馆外的风景也不错。,IP属地:上海,
_ccl53****0626304,,5分,超棒,景色5,趣味5,性价比5,,太阳神鸟非常惊艳,IP属地:四川,
匿名用户,,5分,超棒,景色5,趣味5,性价比5,,周老师解说图文实物相结合，让人对古蜀文化有了进一步了解，两个半小时行程干货满满，非常满意,IP属地:四川,
JING,,5分,超棒,景色5,趣味5,性价比5,,甘老师全程干货输出 学到了很多 老师辛苦了！,IP属地:四川,
我爱小小珊,,5分,超棒,景色5,趣味5,性价比5,,人少景美，虽然门票略贵，但是人少的体验感也不错。还有一个很大很大的公园绿地可以坐坐很清幽。文物数量不是太多，不用逛很久，值得一看。,IP属地:四川,
天影之秋,,4分,满意,景色4,趣味3,性价比4,,"在四川金沙博物馆还是很有名气，在三星堆博物馆开馆前应该是四川最大的博物馆吧。
  参观以后觉得还是有些可看的文物，但与三星堆的文物比好像还差点意思。",IP属地:四川,
铁帽王贝勒爷,,5分,超棒,景色5,趣味5,性价比5,,快速出票，方便,IP属地:北京,
暖暖,,5分,超棒,景色5,趣味5,性价比5,,文物很多，个个都是精品，有出土文物地点的展览，更直观感受考古的魅力。看到了金面具，太阳神鸟，象牙，玉琮，还有卜甲，喜欢文物的朋友可以去看看,IP属地:辽宁,
左樱,,5分,超棒,景色5,趣味5,性价比5,,很想看看这个博物馆，终于成行了,IP属地:四川,
M42****769,,5分,超棒,景色5,趣味5,性价比5,,金沙堆博物馆不虚此行,IP属地:四川,
M23****9391,,5分,超棒,景色5,趣味5,性价比5,,成都特色博物馆。值得去。,IP属地:四川,
浙D好几个8,,5分,超棒,景色5,趣味5,性价比5,,简直是，进入科幻世界，没想到中国也有外星文明,IP属地:浙江,
M52****9255,,5分,超棒,景色5,趣味5,性价比5,,非常的不错,IP属地:北京,
涛声依旧6,,5分,超棒,景色5,趣味5,性价比5,,了解古蜀历史首选之地,IP属地:四川,
匿名用户,,5分,超棒,景色5,趣味5,性价比5,,挺好的，金面具和神鸟纹都不错。,IP属地:四川,
匿名用户,,5分,超棒,景色5,趣味5,性价比5,,强烈推荐，学习古蜀文化历史，大开眼界,IP属地:四川,
天马行藏,,4分,满意,景色4,趣味4,性价比4,,金沙博物馆还可以还可以还可以还可以，金沙博物馆还不错还不错还不错还不错。,IP属地:浙江,
匿名用户,,5分,超棒,景色5,趣味5,性价比5,,金沙博物馆值得一去，虽然展品没有三星堆数量多，但是可以看到考古现场，文物质量也很高，而且人不多非常值得一去。预定的讲解非常好，专业又生动。,IP属地:上海,
花开若相惜0524&,,5分,超棒,景色5,趣味5,性价比5,,"丹老师讲解很认真详细，待人很诚恳，是一位值得尊敬的资深好导游。
天气炎热，丹老师衣服都被汗水浸湿了，但还是坚持讲解2个多小时。",IP属地:四川,
hong,,5分,超棒,景色5,趣味5,性价比5,,"（感谢丹丹小姐姐的贴心服务，两天的黄龙九寨沟，时间很短促，但是已经实现了景色的最大最美化，这无不是导游，司机师傅，以及旅行社的全程高能服务。
感谢这次行程，祝福最美四川。",IP属地:四川,
匿名用户,,5分,超棒,景色5,趣味5,性价比5,,不错，镇馆之宝是太阳神鸟金饰，还有很多其他文物，还有挖掘现场。,IP属地:广西,
匿名用户,,5分,超棒,景色5,趣味5,性价比5,,"金沙遗址博物馆，环境优美，适合参观，拍照图片出彩，文创产品种类丰富质量不错

讲解老师细致认真，推荐选择",IP属地:四川,
M30****6055,,5分,超棒,景色5,趣味5,性价比5,,还还还还还不错,IP属地:四川,
M30****7308,,5分,超棒,景色5,趣味5,性价比5,,很震撼的一次,IP属地:福建,
M36****9467,,5分,超棒,景色5,趣味5,性价比5,,非常震撼，中华文明源远流长,IP属地:陕西,
201****582,,5分,超棒,景色5,趣味5,性价比5,,博物馆藏品珍贵，有考古发掘现场，有藏品陈列，对了解古蜀历史很有帮助，讲解的志愿者讲的非常到位，知识渊博，很有激情，博物馆环境也很好，值得花时间游览一次,IP属地:北京,
M69****5337,,5分,超棒,景色5,趣味5,性价比5,,很好很推荐，讲解很棒,IP属地:四川,
M27****6052,,5分,超棒,景色5,趣味5,性价比5,,讲解员很认真，很辛苦，了解了很多古蜀文化,IP属地:安徽,
卡尔斯哈根雪丽,,5分,超棒,景色5,趣味5,性价比4,,来的时候正赶上下雨，雨天的感觉别有一番风味，景色很美，值得一观！服务还有待提高，游览方向导览指示、卫生方面都需要更上一层楼！加油！,IP属地:山西,
糖唐唐,,5分,超棒,景色5,趣味5,性价比5,,谢谢您们支持啦吧饿得🍚,IP属地:四川,
M40****825,,5分,超棒,景色5,趣味5,性价比5,,与三星堆相一致的古蜀文明他们共同的特点都是几千年前从祭祀坑里一点一点将文物挖掘出来既全面弘扬了中华优秀传统文化又满足群众精神文化需要，但不同点在于他全面展现的是金沙遗址有关的古时候生活状况还在外围广场保留当时古人相关的生活痕迹70元的门票还是值得的,IP属地:浙江,
匿名用户,,5分,超棒,景色5,趣味5,性价比5,,"给一个良渚圈子人大大的震撼！
文化风格迥异啊，果然有解说之后能更加理解三星堆文化和金沙遗址的关系。
9月去正好赶上丝路特展，没想到丝路和四川还有一定关联，学到就是赚到。",IP属地:四川,
栋栋,,5分,超棒,景色5,趣味5,性价比5,,人工讲解大概1小时能把所有精华浓缩 学到很多知识 不虚此行,IP属地:四川,
匿名用户,,5分,超棒,景色5,趣味5,性价比5,,非常棒 人非常少 体验感好 太阳神鸟真好看 还是人少的博物馆好逛 文创也很非常好看,IP属地:辽宁,
210****938,,5分,超棒,景色5,趣味5,性价比5,,金沙遗址是三星堆的文化延续，提供了真实的考古现场，可以看到考古探坑，甚至可以看到深埋土中的象牙，个人觉得非常值得一看。导游讲解很到位，博物馆参观有了导游讲解会对文物有个全新的了解。,IP属地:上海,
独家の记忆,,5分,超棒,景色5,趣味5,性价比5,,不错，值得游玩,IP属地:四川,
书海行走,,4分,满意,景色5,趣味4,性价比4,,去的有点儿晚了。到现在还不知道我从哪个门进的但很明确从南门出的。进来直接就是文创。时间有限就只看了五个展示。看见了黄金面具太酷了。这应该属于祭祀文化。走马观花1.5小时，闭关了。,IP属地:四川,
猫太后555,,5分,超棒,景色5,趣味5,性价比5,,值得一去哦！挺漂亮的，时间不够，要不就去三星堆了，有一点点可惜，在在来吧！成都其他地方都转了转，还是挺好玩的，冬天也不冷，下次再来,IP属地:湖北,
M22****5381,,5分,超棒,景色5,趣味4,性价比5,,成都前身，古蜀文明,IP属地:四川,
匿名用户,,5分,超棒,景色5,趣味5,性价比5,,金沙遗址还是值得看的，最好是听导游讲解，不然走马观花就没什么意思了。文创还行吧。,IP属地:吉林,
匿名用户,,5分,超棒,景色5,趣味5,性价比5,,值得一看，古蜀文明还是有点东西的,IP属地:四川,
M40****442,,5分,超棒,景色5,趣味5,性价比5,,讲解得棒极了！,IP属地:北京,
游遍全国的小陆陆,,5分,超棒,景色5,趣味5,性价比5,,宝藏博物馆。,IP属地:广东,
M89****69,,5分,超棒,景色5,趣味4,性价比5,,"大名鼎鼎的金沙遗址博物馆，离开成都前去了下。
大门进去后走一段路就是遗迹馆，是当时的考古现场，可以想象下当时的挖掘现场和几千年前的祖先。
从遗迹馆向后走是陈列馆，挖出来的文物都在这里了，二楼是远古生活的模拟显示，可以简单略过，然后重点文物都在一楼，有铜立人、黄金面具、太阳神鸟金饰，还有好多好多玉器。负一层还有临时展厅，时间有限就没去。
整体大概两三个小时能逛完，会有免费的志愿者讲解，也可以寄存行李，整体还是很值得去的。",IP属地:上海,
匿名用户,,5分,超棒,景色5,趣味5,性价比5,,金沙地处成都市区内，交通方便，大门临马路，很好找，展出内容值得一看，参观人也不多，除了展馆空调不足,IP属地:上海,
匿名用户,,5分,超棒,景色5,趣味5,性价比5,,挺有趣的  但是能去三星堆的话更推荐三星堆,IP属地:陕西,
D78****25,,5分,超棒,景色4,趣味5,性价比5,,大咖说非常棒,IP属地:四川,
M52****671,,5分,超棒,景色5,趣味5,性价比5,,值得一去！,IP属地:陕西,
M27****8157,,5分,超棒,景色5,趣味5,性价比5,,第二次来了，太阳神鸟超级好看,IP属地:四川,
匿名用户,,5分,超棒,景色5,趣味5,性价比5,,还是值得一看的 金沙比三星堆更晚 造型就没那么奇奇怪怪 但还看得出一些联系,IP属地:上海,
杜杜_Dx,,5分,超棒,景色5,趣味5,性价比5,,值得一去的博物馆,IP属地:北京,
匿名用户,,5分,超棒,景色5,趣味5,性价比5,,非常值得去,IP属地:上海,
五濑町柳如是,,5分,超棒,景色5,趣味5,性价比5,,人很多，适合游览,IP属地:江苏,
匿名用户,,5分,超棒,景色5,趣味5,性价比5,,携程购票方便快捷。金沙遗址位于中国四川省成都市城西苏坡乡金沙村，分布范围约5平方公里，是公元前12世纪至公元前7世纪（距今约3200年—2600年）长江上游古代文明中心——古蜀王国的都邑。2006年5月25日被国务院公布为全国重点文物保护单位。,IP属地:广东,
M23****6202,,4分,满意,景色4,趣味3,性价比3,,携程有讲解在门口,IP属地:四川,
320****048,,5分,超棒,景色5,趣味5,性价比5,,讲解员宋老师耐心，负责，表述清晰。非常赞。,IP属地:四川,
M51****700,,5分,超棒,景色5,趣味5,性价比5,,物超所值。宋老师的讲解很精彩，把历史文化讲义的很精彩。,IP属地:四川,
匿名用户,,5分,超棒,景色5,趣味5,性价比5,,宋老师讲的非常精彩，内容丰富，古成都的气息扑面而来～,IP属地:四川,
118****522,,5分,超棒,景色5,趣味5,性价比5,,感受一下古文化，还是不错的！,IP属地:北京,
M15****474,,5分,超棒,景色5,趣味5,性价比5,,宋老师的讲解十分专业，看到我们带了小朋友很细心的问了孩子的年龄然后调整了适合亲子的风格。时间到最后已经超时了，还很耐心的把博物馆最后几个点讲完，没有任何忽略和对付。好评&感谢。,IP属地:四川,
M30****128,,5分,超棒,景色5,趣味5,性价比5,,非常值得一去,IP属地:重庆,
206****537,,5分,超棒,景色5,趣味5,性价比5,,导游很热情，非常感谢,IP属地:四川,
匿名用户,,5分,超棒,景色5,趣味5,性价比5,,"非常不错的演讲服务，准时到达汇合点，而且服务理念非常不错，知识面很广，收益匪浅。
预订便捷，收费合理，而且付款记录等都很正式，值得尝试",IP属地:江苏,
dahuizi66,,5分,超棒,景色5,趣味5,性价比5,,可以带孩子去，很好的给大人也补了一课,IP属地:北京,
颖颖,,5分,超棒,景色5,趣味5,性价比5,,非常值得参观的博物馆。,IP属地:广东,
M25****727,,5分,超棒,景色5,趣味4,性价比4,,一个人去的，没有干扰，好好的看了每一个介绍，介绍历史场合的洗礼，收获满满。满意,IP属地:新疆,
118****547,,5分,超棒,景色5,趣味5,性价比5,,刘老师讲解很细心很全面，让我们很好的了解了金沙遗址的发掘保护和研究，安排展厅参观也很合理，避开了人群，体验感很不错。,IP属地:四川,
M24****7343,,5分,超棒,景色5,趣味4,性价比4,,氛围营造与展品质量就极好，高评价！,IP属地:四川,
E37****40,,4分,满意,景色4,趣味4,性价比4,,金沙博物馆的位置比较好，在成都市区里面很快就能到达，但是性价比稍微低一点。相比较三星对博物馆的话，这里的镇馆之宝就只有一个，单薄许多门票却还挺贵的。,IP属地:四川,
_WeCh****127860,,5分,超棒,景色5,趣味5,性价比5,,很好，再次浏览，值得推荐,IP属地:广西,
Mike525,,5分,超棒,景色5,趣味5,性价比5,,來到成都相當值得一看，加上交通又方便。彤彤老師的講解細膩，有豐富的知識含量，又做足了功課，準備圖片說明，能對展覽文物有更深刻的瞭解。,IP属地:中国澳门,
小明儿,,4分,满意,景色4,趣味4,性价比4,,讲解服务在南门外，大家最好从南门进，拼团讲解。,IP属地:四川,
186****7733,,5分,超棒,景色5,趣味5,性价比5,,值得一看。,IP属地:广西,
NEPTUNO,,5分,超棒,景色5,趣味5,性价比5,,服务热情周到 讲解内容细致 知识面很丰富,IP属地:重庆,
hbqhdwzm,,5分,超棒,景色5,趣味4,性价比5,,历史底蕴很浓,IP属地:四川,
M94****26,,5分,超棒,景色5,趣味5,性价比5,,感觉性价比超高。挺有意思，带孩子去还有一个5D电影，挺真实。玩的很开心。,IP属地:河北,
若即若离lwm,,5分,超棒,景色5,趣味5,性价比5,,值得一游！,IP属地:江西,
匿名用户,,5分,超棒,景色5,趣味5,性价比5,,庄老师讲解的很棒，很有趣味性和历史性结合，引人入胜，很感动！很推荐对三星堆文化有关的朋友～,IP属地:北京,
匿名用户,,5分,超棒,景色5,趣味5,性价比4,,成都真是好地方，三星堆熊猫馆这么热门的景点，60岁以上的都免票入场，值得点赞！,IP属地:广东,
匿名用户,,4分,满意,景色4,趣味4,性价比4,,因为看了三星堆，再来看金沙遗址，小很多，走的时间少很多，东西很多和三星堆一样的，历史差不太多。感觉和三星堆是上下集关系，还可以,IP属地:重庆,
超辣淑女,,5分,超棒,景色5,趣味5,性价比5,,值得一去！太阳神鸟,IP属地:河北,
300****147,,5分,超棒,景色5,趣味5,性价比5,,很棒很不错,IP属地:北京,
M55****656,,5分,超棒,景色5,趣味5,性价比5,,博物馆的绝美文物，加上李导精彩的解说，不虚此行。必须为大咖说点赞。,IP属地:四川,
匿名用户,,5分,超棒,景色5,趣味5,性价比5,,风景挺不错的,IP属地:上海,
M18****502,,5分,超棒,景色5,趣味5,性价比5,,非常棒的博物馆，空间开阔，展陈主体突出，文物地方特色鲜明。,IP属地:重庆,
_wech****39863,,5分,超棒,景色5,趣味5,性价比5,,周老师讲解特别好，专业、严谨，有很多延展的分享，且有自己心得的分享,IP属地:四川,
136****6373,,5分,超棒,景色5,趣味5,性价比5,,值得去，太阳鸟👍,IP属地:广东,
匿名用户,,5分,超棒,景色5,趣味5,性价比5,,感受古蜀文明讲解老师很耐心,IP属地:四川,
M23****8293,,5分,超棒,景色5,趣味5,性价比5,,棒棒棒 非常值得推荐,IP属地:广东,
匿名用户,,5分,超棒,景色5,趣味5,性价比5,,超级值得去，老师讲得很棒很完整，从开始到结束完整行成闭环，很多知识和疑惑都得到解答，很严谨也很幽默，会结合不同地区不同时期联合讲解，一百分给老师,IP属地:四川,
温特弗灵吕蒙,,5分,超棒,景色5,趣味5,性价比5,,观古蜀文化的必去之处,IP属地:四川,
嫌咸鲜,,5分,超棒,景色5,趣味5,性价比5,,园区设计非常有特点,IP属地:山西,
e09****81,,4分,满意,景色4,趣味4,性价比4,,孩子中考完带着他想去附近转转，结果没有想到三星堆那么火爆。感觉三星堆里面的那些青铜文物真的很震撼，值得一看,IP属地:四川,
lee梅,,5分,超棒,景色5,趣味5,性价比5,,讲解师傅很耐心，很专业！彻实的感受到了金沙遗址的震撼和神奇！,IP属地:陕西,
匿名用户,,5分,超棒,景色5,趣味5,性价比5,,很好，适合带孩子前往,IP属地:重庆,
随波逐流_,,4分,满意,景色4,趣味3,性价比3,,没有太惊喜的地方，但也算不上失望。,IP属地:四川,
M30****1774,,5分,超棒,景色5,趣味5,性价比5,,值得一去。,IP属地:四川,
M46****8926,,5分,超棒,景色5,趣味5,性价比5,,不错不错，下次还去！,IP属地:北京,
_WeCh****610859,,4分,满意,景色4,趣味4,性价比4,,还行吧，可以去看看,IP属地:湖北,
ke****oo,,5分,超棒,景色5,趣味5,性价比5,,值得一去的博物馆,IP属地:四川,
205****729,,5分,超棒,景色5,趣味5,性价比5,,沧海桑田，白驹过隙，人类好渺小。,IP属地:浙江,
M53****4956,,4分,满意,景色5,趣味4,性价比4,,挺好的，环境不错。,IP属地:四川,
300****553,,5分,超棒,景色4,趣味5,性价比5,,馆里的导游非常棒,IP属地:上海,
匿名用户,,5分,超棒,景色5,趣味5,性价比5,,还不错😊离市区近出行方便,IP属地:四川,
M35****5301,,5分,超棒,景色5,趣味5,性价比5,,非常值得一去,IP属地:重庆,
匿名用户,,4分,满意,景色4,趣味4,性价比4,,还是值得去的，然后那个解说我个人觉得没必要买哈，虽然不贵，但假日人多的时候完全可以蹭各种讲解！,IP属地:浙江,
匿名用户,,5分,超棒,景色5,趣味5,性价比5,,敬老师的对这次讲解非常认真到位，用她专业的知识让我们对金沙博物馆的历史文化有了更深刻的认识，非常感谢敬老师，会推荐更多朋友过来参观金沙博物馆。,IP属地:广东,
麻辣酱君,,4分,满意,景色4,趣味3,性价比3,,大学生不能在携程上买学生票，有年龄限制，又没有专门的大学生购票选项，但线下在景区门口是可以购买学生票的且没有年龄限制，所以请携程完善一下大学生购票。,IP属地:安徽,
西之岛町法正,,5分,超棒,景色5,趣味5,性价比5,,第一次来成都知道有这个地方进去看了一下，咱们的祖先太伟大了，尤其是太阳神鸟，是我特别喜欢的，还有黄金面具,IP属地:四川,
_M13****8059,,5分,超棒,景色5,趣味5,性价比5,,就是特别特别热。值得一看,IP属地:中国香港,
匿名用户,,5分,超棒,景色5,趣味5,性价比5,,还会再去哒，太喜欢了,IP属地:上海,
wpy1109,,5分,超棒,景色5,趣味5,性价比5,,可以的下，不过乌木不知道为什么不让看了，其实远观也可以不影响实际效果和保护。门票价格稍贵,IP属地:贵州,
珠珠,,5分,超棒,景色5,趣味5,性价比5,,环境蛮好的,IP属地:上海,
鹰隼狂狼,,5分,超棒,景色5,趣味5,性价比5,,算是三星堆的补充版，但镇馆之宝很值得一看。,IP属地:山东,
匿名用户,,5分,超棒,景色5,趣味5,性价比5,,老师的介绍点评很值得,IP属地:上海,
匿名用户,,5分,超棒,景色5,趣味5,性价比5,,值得推荐，以后有需要可以再去。值得推荐，以后有需要可以再去。带娃体验一下,IP属地:北京,
M48****5588,,5分,超棒,景色5,趣味5,性价比5,,值得一看！,IP属地:河南,
威武且猴子66,,5分,超棒,景色5,趣味5,性价比5,,非常值得去，景区的装修非常精美，并且内容非常丰富，游玩体验很好，在里面我们可以看到非常多的文物，非常值得，还有一个非常大的遗址,IP属地:四川,
118****249,,5分,超棒,景色5,趣味5,性价比5,,来成都必须参观的景点之一。里面藏品极为丰富，让人记忆犹新。尤其是“太阳神鸟”，工艺之精美，太让人震撼了！如果时间允许，建议慢慢走慢慢看。,IP属地:北京,
匿名用户,,5分,超棒,景色5,趣味5,性价比5,,非常震撼！尤其是出土的太阳神鸟图，太神奇了！,IP属地:广东,
