user_detail_name,user_detail_tags_text,text,text 2,text 3,text 4,text 5,resource_date_text,content_wrap,iplocation,from
M14****888,铂金贵宾,5分,超棒,景色5,趣味5,性价比5,2025-02-03 发布点评,过年期间一大早就来秦堰楼排队了，还好人不是很多，顺着人流一起走就可以了。特别伟大的水利工程，景色还是不错的，适合带孩子来看看，学习一下的。,IP属地:四川,来自订单
M23****938,黄金贵宾,5分,超棒,景色5,趣味5,性价比5,2025-02-03 发布点评,可以，非常不错,IP属地:四川,来自订单
_WeCh****957917,铂金贵宾,5分,超棒,景色5,趣味5,性价比5,2025-02-03 发布点评,景区挺好的,IP属地:重庆,来自订单
葫芦架上的冬瓜,钻石贵宾,5分,超棒,景色5,趣味5,性价比5,2025-02-03 发布点评,拜水都江堰,IP属地:四川,来自订单
fein****0000,铂金贵宾,5分,超棒,景色5,趣味5,性价比5,2025-02-03 发布点评,超出期待。,IP属地:山东,来自订单
158****7635,铂金贵宾,5分,超棒,景色5,趣味5,性价比5,2025-02-03 发布点评,景色非常美，但是人太多了，排队时间太长了，希望人少的时候再来吧,IP属地:陕西,来自订单
toto8037,,5分,超棒,景色5,趣味5,性价比5,2025-02-03 发布点评,谢谢小邱导游耐心细致的讲解，我们路上堵着到晚了也一直等着我们，孩子们一路边听边走边看，学到了很多都江堰的地理历史知识，收获很大呢！,IP属地:云南,来自订单
_WeCh****812592,铂金贵宾,5分,超棒,景色5,趣味5,性价比5,2025-02-03 发布点评,一个值得去看看走走的地方,IP属地:四川,来自订单
150****1884,铂金贵宾,5分,超棒,景色5,趣味5,性价比5,2025-02-03 发布点评,伟大的工程,IP属地:浙江,来自订单
M30****540,,5分,超棒,景色5,趣味5,性价比5,2025-02-03 发布点评,处理问题比较及时，携程客服很耐心,IP属地:山西,来自订单
M29****075,铂金贵宾,5分,超棒,景色5,趣味5,性价比5,2025-02-03 发布点评,旺季不推荐，淡季慢慢逛不错。我们下午到的，先去的仰天窝广场，灌县古城，回来天黑了去看了蓝眼泪，第二天一早去的都江堰，请的导游300元，打车从二王庙旁边进门，从上至下逛不太累,IP属地:四川,来自订单
M24****020,,5分,超棒,景色5,趣味5,性价比5,2025-02-03 发布点评,服务态度好，景色很优美,IP属地:湖北,来自订单
m30****9965,铂金贵宾,5分,超棒,景色5,趣味5,性价比5,2025-02-03 发布点评,我是在携程网定的房间，一进房间第一感觉真的很干净清晰，各种设施齐全，电子窗帘，卫生间也特别卫生，总体真的很不错，最重要的是早餐很好吃,IP属地:四川,来自订单
M29****3053,黄金贵宾,5分,超棒,景色5,趣味5,性价比5,2025-02-03 发布点评,演出不错，水好看,IP属地:海南,来自订单
meng****978,钻石贵宾,5分,超棒,景色4,趣味4,性价比4,2025-02-03 发布点评,还是值得来的，比较震撼,IP属地:海南,来自订单
118****115,铂金贵宾,5分,超棒,景色5,趣味5,性价比5,2025-02-03 发布点评,值得一去的地方，不虚此行,IP属地:辽宁,来自订单
悠然三寸暖,铂金贵宾,5分,超棒,景色4,趣味4,性价比4,2025-02-03 发布点评,风景很美，人很多，看到的景色都让人觉得不可以思议！还会再去，相信每一次的感受都会不一样,IP属地:云南,来自订单
无敌小铁人,铂金贵宾,5分,超棒,景色5,趣味5,性价比5,2025-02-03 发布点评,很棒的体验。上次来还是十年前，感觉这次更惊喜了。携程的讲解团服务超级好，小曾最棒～，古城的好吃的也吃不过来，太喜欢了。,IP属地:四川,来自订单
无敌小铁人,铂金贵宾,5分,超棒,景色5,趣味5,性价比5,2025-02-03 发布点评,很棒的体验。上次来还是十年前，感觉这次更惊喜了。携程的讲解团服务超级好，古城的好吃的也吃不过来，太喜欢了。,IP属地:四川,来自订单
M43****5214,黄金贵宾,5分,超棒,景色5,趣味5,性价比5,2025-02-02 发布点评,历史悠久功能多样的水利工程，不由感叹古人的的智慧,IP属地:广东,来自订单
匿名用户,黄金贵宾,5分,超棒,景色5,趣味5,性价比5,2025-02-02 发布点评,2000多年前的水利工程，利在千秋，非常有历史价值，值得带孩子参观了解！春节带孩子在成都呆了几天，吃了美食，去了很多景点，当然都江堰也是非常推荐的,IP属地:四川,来自订单
_yt1****765,钻石贵宾,5分,超棒,景色5,趣味5,性价比5,2025-02-02 发布点评,带孩子来都江堰水利工程参观，久仰大名但是第一次来，坐地铁转高铁，方便得很。风景是没的说，美丽十分，美食也是一级棒。加上古代文化和水利治理的智慧，是个难得的多合一景区,IP属地:陕西,来自订单
M22****7629,铂金贵宾,5分,超棒,景色5,趣味5,性价比5,2025-02-02 发布点评,中规中矩吧，没有说特别惊艳,IP属地:重庆,来自订单
耳双雨段,黄金贵宾,5分,超棒,景色5,趣味5,性价比5,2025-02-02 发布点评,还是便宜不错，下次在来,IP属地:四川,来自订单
匿名用户,铂金贵宾,5分,超棒,景色5,趣味5,性价比5,2025-02-02 发布点评,值得一去的地方，老祖宗的智慧真的很牛*！,IP属地:四川,来自订单
匿名用户,铂金贵宾,5分,超棒,景色5,趣味5,性价比5,2025-02-02 发布点评,不错不错，老祖宗真的很智慧！,IP属地:四川,来自订单
M43****505,铂金贵宾,5分,超棒,景色5,趣味5,性价比5,2025-02-02 发布点评,很有意义的一次旅行,IP属地:四川,来自订单
dsw602319851,黄金贵宾,5分,超棒,景色5,趣味5,性价比5,2025-02-02 发布点评,环境优美，出行方便。其实路程倒也不远。惊叹古人的智慧。,IP属地:四川,来自订单
dsw602319851,黄金贵宾,5分,超棒,景色5,趣味5,性价比5,2025-02-02 发布点评,从6号门入，全程不走回头路，从一号门离堆公园处。就进入了游客中心。,IP属地:四川,来自订单
阿立Malik,,4分,满意,,,,2025-02-02 发布点评,"那是一次很好的体验,主要摄影的地方在公园正门的公园外面,所以我觉得进去玩那里不是物有所值。你可以呆在那个地方的门口,河经过,你可以在那里拍照。",IP属地:未知,来自Trip.com
M46****6244,黄金贵宾,5分,超棒,景色5,趣味3,性价比5,2025-02-02 发布点评,景色秀丽，服务到位，虽然人很多，但工作人员安全意识很强，服务态度好，问任何问题工作人员都很有耐心．过索桥时看到老人安保人员主动上前搀扶,IP属地:四川,来自订单
匿名用户,黄金贵宾,5分,超棒,景色5,趣味5,性价比5,2025-02-02 发布点评,成都必打卡景点之一 距离成都80公里左右 交通非常便利 游都江堰也就是直观感受古人的智慧，算是古代最有名的水利工程。最好请导游讲解。,IP属地:辽宁,来自订单
M57****115,铂金贵宾,5分,超棒,景色5,趣味5,性价比5,2025-02-02 发布点评,全程无忧很OK,IP属地:江苏,来自订单
M37****9273,铂金贵宾,5分,超棒,景色5,趣味5,性价比5,2025-02-02 发布点评,张导一路讲解，专业，热情！,IP属地:四川,来自订单
匿名用户,铂金贵宾,4分,满意,景色5,趣味4,性价比4,2025-02-02 发布点评,最惊讶的是山上供奉的各路神仙，人太多了也不限流，出来的时候根本举步维艰很恐怖,IP属地:重庆,来自订单
M56****464,钻石贵宾,5分,超棒,景色5,趣味5,性价比5,2025-02-02 发布点评,导游非常专业讲解，声音甜美，旅途体贴入微地关心，是非常舒服的感受，谢谢导游,IP属地:四川,来自订单
左蓝右红,铂金贵宾,5分,超棒,景色5,趣味5,性价比5,2025-02-02 发布点评,长见识了。。。,IP属地:四川,来自订单
匿名用户,铂金贵宾,5分,超棒,景色5,趣味5,性价比5,2025-02-02 发布点评,长见识了。。。,IP属地:四川,来自订单
Laura华华,钻石贵宾,5分,超棒,景色4,趣味4,性价比3,2025-02-02 发布点评,值得去，环境好,IP属地:广东,来自订单
_gf520****405801,,5分,超棒,景色5,趣味5,性价比5,2025-02-02 发布点评,还好，有礼貌,IP属地:中国香港,来自订单
拉绍德封苏秦,黄金贵宾,5分,超棒,景色5,趣味5,性价比5,2025-02-02 发布点评,漂亮漂亮漂亮,IP属地:四川,来自订单
320****273,黄金贵宾,4分,满意,景色4,趣味3,性价比4,2025-02-02 发布点评,为了过桥要排超级长的队,IP属地:四川,来自订单
M57****348,铂金贵宾,5分,超棒,景色5,趣味5,性价比5,2025-02-02 发布点评,孩子看到了很多书上没有的东西，读万卷书，行万里路！,IP属地:四川,来自订单
M57****348,铂金贵宾,5分,超棒,景色5,趣味5,性价比5,2025-02-02 发布点评,涨了见识，了解了历史！适合孩子学习旅游,IP属地:四川,来自订单
冷静的人,铂金贵宾,5分,超棒,景色5,趣味5,性价比5,2025-02-02 发布点评,适合慢游！,IP属地:四川,来自订单
冷静的人,铂金贵宾,5分,超棒,景色5,趣味5,性价比5,2025-02-02 发布点评,家庭亲子慢游！,IP属地:四川,来自订单
老林老兵,钻石贵宾,5分,超棒,景色5,趣味5,性价比5,2025-02-02 发布点评,景色优美水利工程很伟大,IP属地:四川,来自订单
老林老兵,钻石贵宾,5分,超棒,景色5,趣味5,性价比5,2025-02-02 发布点评,伟大的水利工程优美的景色,IP属地:四川,来自订单
呆呆的猪猪1028,铂金贵宾,5分,超棒,景色5,趣味5,性价比5,2025-02-02 发布点评,川ADJ1577，师傅非常棒，又快又稳！,IP属地:四川,来自订单
LeaderJ,黑钻贵宾,5分,超棒,景色5,趣味5,性价比5,2025-02-02 发布点评,不错，值得一去,IP属地:重庆,来自订单
08yuanyuan,黄金贵宾,5分,超棒,景色4,趣味4,性价比5,2025-02-02 发布点评,非常好！ 当天出发买票都行 不需要提前约，一个人的话我都搭火车到离堆公园，有接驳车（10元）直接送秦堰楼6号出入口，从上面玩下来非常棒！只是80元说实话其实有点小贵..,IP属地:中国香港,来自订单
_ucwe****028554,铂金贵宾,5分,超棒,景色5,趣味5,性价比5,2025-02-02 发布点评,伟大的工程,IP属地:浙江,来自订单
匿名用户,黄金贵宾,5分,超棒,景色5,趣味5,性价比5,2025-02-02 发布点评,酒店服务超级贴心，小哥哥和小姐姐态度超级温柔！,IP属地:福建,来自订单
M42****522,,5分,超棒,景色4,趣味3,性价比4,2025-02-02 发布点评,导游挺耐心 讲解到位 和孩子聊的不错👍,IP属地:四川,来自订单
匿名用户,黄金贵宾,5分,超棒,景色5,趣味5,性价比5,2025-02-02 发布点评,讲解生动详细 服务热情周到,IP属地:四川,来自订单
匿名用户,铂金贵宾,5分,超棒,景色5,趣味5,性价比5,2025-02-02 发布点评,"值得一看，文化和自然景观合二为一，春节人多。
推荐观看上善都江堰演出，演员敬业，还有盖碗茶，这次VIP座位坐到第一排，孩子看得很兴奋。",IP属地:北京,来自订单
西特拉斯多洛雷斯,,5分,超棒,景色5,趣味5,性价比5,2025-02-02 发布点评,杨敏导游娓娓道来，让我们了解了伟大的水利工程都江堰，不虚此行！五星好评！,IP属地:四川,来自订单
_WeCh****39530,铂金贵宾,5分,超棒,景色5,趣味5,性价比5,2025-02-02 发布点评,值得去一趟,IP属地:云南,来自订单
李娜哦,铂金贵宾,5分,超棒,景色5,趣味5,性价比3,2025-02-02 发布点评,带孩子去玩，特别值得一去,IP属地:四川,来自订单
M25****3500,黄金贵宾,5分,超棒,景色5,趣味5,性价比5,2025-02-02 发布点评,小王讲解得非常好，让我们对都江堰有一个全面全新认识，赞！,IP属地:四川,来自订单
M31****3808,铂金贵宾,5分,超棒,景色5,趣味5,性价比5,2025-02-02 发布点评,非常好的体验，向大家推荐。,IP属地:四川,来自订单
138****5528,铂金贵宾,5分,超棒,景色5,趣味5,性价比4,2025-02-02 发布点评,鱼嘴，飞沙堰，宝瓶口印象深刻,IP属地:广东,来自订单
匿名用户,黄金贵宾,5分,超棒,景色5,趣味5,性价比5,2025-02-02 发布点评,景色秀丽自然，适合徒步旅行！,IP属地:云南,来自订单
wj2950,铂金贵宾,5分,超棒,景色5,趣味3,性价比4,2025-02-02 发布点评,都江堰是非常著名的水利工程，它的建成成就了成都平原沃野千里，非常值得去现场一看，建议非节假日过来仔细的游览，节假日过来的话就晓得仓促而且人超级多,IP属地:四川,来自订单
匿名用户,铂金贵宾,5分,超棒,景色5,趣味5,性价比5,2025-02-02 发布点评,不错风景秀丽,IP属地:四川,来自订单
300****509,钻石贵宾,5分,超棒,景色5,趣味5,性价比5,2025-02-02 发布点评,导演讲的很好,IP属地:四川,来自订单
_M13****7137,,5分,超棒,景色5,趣味5,性价比5,2025-02-02 发布点评,除了人多，讲解是非常到位的，韩老师深入浅出的讲解，让孩子们了解了都江堰水利工程的伟大,IP属地:四川,来自订单
M32****37,铂金贵宾,5分,超棒,景色5,趣味5,性价比5,2025-02-02 发布点评,值得去的地方,IP属地:河北,来自订单
M29****7682,黄金贵宾,5分,超棒,景色5,趣味5,性价比5,2025-02-01 发布点评,值得一去，尽量避开节假日出行。,IP属地:四川,来自订单
M22****6338,,5分,超棒,景色5,趣味5,性价比5,2025-02-01 发布点评,值得去，特别好,IP属地:四川,来自订单
288****349,铂金贵宾,5分,超棒,景色5,趣味5,性价比5,2025-02-01 发布点评,还行还行还行还行还行还行,IP属地:广东,来自订单
匿名用户,黄金贵宾,5分,超棒,景色5,趣味5,性价比5,2025-02-01 发布点评,值得一看，对古人先贤的智慧和艰苦的劳动，敬佩不已！！,IP属地:四川,来自订单
淘咪1212,钻石贵宾,5分,超棒,景色5,趣味5,性价比5,2025-02-01 发布点评,小傅导游讲解相当专业，知识储备很渊博，因为是本地人的缘故所以她对都江堰及周边的历史人文风情也能如数家珍般娓娓道来，尤其是非常有耐心，我家孩子特别喜欢这个小姐姐,IP属地:四川,来自订单
_WeCh****416899,黄金贵宾,5分,超棒,景色5,趣味5,性价比5,2025-02-01 发布点评,导游很有耐心，值得支持,IP属地:四川,来自订单
匿名用户,,5分,超棒,景色5,趣味4,性价比5,2025-02-01 发布点评,整体感觉不错，过节人太多了，过安澜桥排队1小时，人挤人。景区小吃重复太多，要的热豆花结果拿到手冰冰凉凉，如果要热的直接微波炉加热。而且不耐烦的样子,IP属地:四川,来自订单
M42****0102,钻石贵宾,5分,超棒,景色5,趣味5,性价比5,2025-02-01 发布点评,普通话标准，讲解到位，知识渊博，热情周到！很幸运遇上这样的导游！下次还会选择！,IP属地:四川,来自订单
M14****677,钻石贵宾,5分,超棒,景色5,趣味5,性价比5,2025-02-01 发布点评,好，内容丰富，非常好,IP属地:四川,来自订单
匿名用户,铂金贵宾,5分,超棒,景色5,趣味5,性价比4,2025-02-01 发布点评,值得去看看,IP属地:湖北,来自订单
匿名用户,铂金贵宾,5分,超棒,景色5,趣味5,性价比5,2025-02-01 发布点评,夜景很好看,IP属地:湖北,来自订单
匿名用户,钻石贵宾,5分,超棒,景色5,趣味5,性价比5,2025-02-01 发布点评,不错不错，导游讲解很细致，小孩也很感兴趣。总的来说不错，卖家可靠。值得推荐！,IP属地:四川,来自订单
D12****595,铂金贵宾,5分,超棒,景色5,趣味5,性价比5,2025-02-01 发布点评,中华熊猫苑风景秀丽，绿树成荫，竹林环绕，宛如天然氧吧。熊猫憨态可掬，悠闲自在，与自然和谐共处。漫步其中，既能感受大自然的宁静，又能近距离观赏国宝，是放松身心的绝佳去处。,IP属地:云南,来自订单
320****327,,5分,超棒,景色5,趣味5,性价比5,2025-02-01 发布点评,都江堰很好，值得一去！,IP属地:四川,来自订单
M57****186,钻石贵宾,4分,满意,景色4,趣味4,性价比4,2025-02-01 发布点评,赞叹古人的智慧,IP属地:湖北,来自订单
匿名用户,黄金贵宾,5分,超棒,景色5,趣味5,性价比5,2025-02-01 发布点评,挺好的，推荐去看看,IP属地:四川,来自订单
傲天海东青,,5分,超棒,景色5,趣味5,性价比5,2025-02-01 发布点评,感谢导游的讲解，讲解很到位，导览很细致。,IP属地:四川,来自订单
M23****4614,铂金贵宾,5分,超棒,景色5,趣味5,性价比5,2025-02-01 发布点评,热情洋溢，讲解清晰，值得推荐！,IP属地:四川,来自订单
M55****295,铂金贵宾,5分,超棒,景色5,趣味5,性价比5,2025-02-01 发布点评,不错不错不错,IP属地:湖北,来自订单
M54****098,黄金贵宾,5分,超棒,景色5,趣味4,性价比5,2025-02-01 发布点评,春节出行到处都是人，不过都江堰景区挺大的，没有出现人挤人的场景，个别地点也是缓慢通行。总体来说还算是不错的景区吧，对得起5A的名头。,IP属地:四川,来自订单
M49****963,黄金贵宾,5分,超棒,景色5,趣味4,性价比4,2025-02-01 发布点评,带娃出去旅游还可以,IP属地:四川,来自订单
快乐的老五,钻石贵宾,5分,超棒,景色5,趣味5,性价比5,2025-02-01 发布点评,佛教圣地，金鼎,IP属地:四川,来自订单
张久财,,5分,超棒,景色5,趣味5,性价比5,2025-02-01 发布点评,导游实在是太好了，等了我将近两个小时，全程讲解非常细致，,IP属地:四川,来自订单
E34***20,,5分,超棒,,,,2025-02-01 发布点评,在trip买票很方便，扫护照就能进园区，我们选的时间点很好没有很多人，自由行让我们饱览每一个景点，很喜欢慢慢走看风景,IP属地:未知,来自Trip.com
M23****4334,黄金贵宾,5分,超棒,景色5,趣味5,性价比5,2025-02-01 发布点评,很宏伟，很壮观，尤其是夜景很美，值得去看看,IP属地:四川,来自订单
匿名用户,铂金贵宾,5分,超棒,景色5,趣味5,性价比5,2025-02-01 发布点评,非常值得游玩。,IP属地:四川,来自订单
Cookie麻麻黑,黄金贵宾,5分,超棒,景色5,趣味5,性价比5,2025-02-01 发布点评,还是很不错的 人挺多 挺热闹的 尤其是蓝眼泪 真心值得一去 很宏大很震撼,IP属地:四川,来自订单
M42****0669,黄金贵宾,5分,超棒,景色5,趣味5,性价比5,2025-02-01 发布点评,非常快，很满意了，下次回来,IP属地:四川,来自订单
M42****0669,黄金贵宾,5分,超棒,景色5,趣味5,性价比5,2025-02-01 发布点评,很喜欢，非常喜欢,IP属地:四川,来自订单
M46****033,黄金贵宾,5分,超棒,景色5,趣味5,性价比5,2025-02-01 发布点评,此生必再来都江堰，太喜欢了，伟大的工程杰作，是我们中华璀宝，/副流动的山水画卷。让人心旷神怡。风景如诗如画，让人陶醉不矢。,IP属地:湖北,来自订单
匿名用户,黄金贵宾,5分,超棒,景色5,趣味5,性价比5,2025-02-01 发布点评,真心不错。此生必来的景区，。都江堰的智慧闪耀着治水文化的光芒，它的历史见证着中华民族的伟大创造力。它不仅是文明的杰作，更是人类智慧璀灿朋诛。,IP属地:湖北,来自订单
135****3739,铂金贵宾,5分,超棒,景色5,趣味5,性价比5,2025-02-01 发布点评,非常不错的体验,IP属地:新疆,来自订单
匿名用户,黄金贵宾,4分,满意,景色5,趣味4,性价比5,2025-02-01 发布点评,因为是春节的原因吃饭的地方关了很多家。找到一家不是很好吃。蜡肉炒青蒜店员推荐的里面的蜡肉为啥全是肥肉一端上来就看到全是白色的大肥肉一点食欲都没了。,IP属地:四川,来自订单
M23****4334,黄金贵宾,5分,超棒,景色5,趣味5,性价比5,2025-02-01 发布点评,还是值得去看看，尤其是夜景很美,IP属地:四川,来自订单
M24****978,,5分,超棒,景色5,趣味5,性价比5,2025-01-31 发布点评,于导热情耐心的讲解深入人心，讲解幽默风趣,IP属地:山东,来自订单
wrj20021010,黄金贵宾,5分,超棒,景色4,趣味4,性价比4,2025-01-31 发布点评,不去遗憾，去了后悔。,IP属地:四川,来自订单
M32****910,钻石贵宾,5分,超棒,景色5,趣味5,性价比5,2025-01-31 发布点评,都江堰很漂亮，11 月去，风景优美，温度适宜，都江堰水利工程到现在都造福人类，实在是太棒了！小朋友第一次听说了都江堰都觉得很厉害。虽然那天停电没有看成演出，但是老板非常大气，直接退费，还邀请我们下午免费观看，但因为行程安排，我们下午没看到演出，下次去一定要看,IP属地:江苏,来自订单
M40****3146,,5分,超棒,景色5,趣味5,性价比5,2025-01-31 发布点评,很雄伟壮观,IP属地:北京,来自订单
匿名用户,钻石贵宾,5分,超棒,景色5,趣味5,性价比5,2025-01-31 发布点评,很好，人太多了！只看了水利工程,IP属地:四川,来自订单
匿名用户,钻石贵宾,5分,超棒,景色5,趣味5,性价比5,2025-01-31 发布点评,很好，非常棒，很棒。………………………………………………………………………………………………………………………………………………………,IP属地:四川,来自订单
匿名用户,黄金贵宾,5分,超棒,景色5,趣味5,性价比5,2025-01-31 发布点评,值得一去，可以学到很多知识,IP属地:四川,来自订单
匿名用户,黄金贵宾,5分,超棒,景色5,趣味5,性价比5,2025-01-31 发布点评,空气好，景色美，值得一去,IP属地:四川,来自订单
匿名用户,铂金贵宾,4分,满意,景色4,趣味4,性价比4,2025-01-31 发布点评,都江堰风景优美，流水呈现碧蓝色，旁边紧连灌县古城，晚上比白天更热闹，灯光璀璨，传说中的蓝眼泪蜿蜒绵长，春节期间的游客很多，蓝桥上八挤人,IP属地:浙江,来自订单
虎虎爱星星,黑钻贵宾,5分,超棒,景色5,趣味5,性价比5,2025-01-31 发布点评,非常好非常好非常好非常好非常好非常好非常好非常好非常好非常好非常好非常好,IP属地:山东,来自订单
赵鹤璇,铂金贵宾,5分,超棒,景色5,趣味5,性价比5,2025-01-31 发布点评,6 号门进，1 号门出。 省时间路线，演出可以看一下，大概了解一下，非常值得来。,IP属地:四川,来自订单
139****1766,铂金贵宾,5分,超棒,景色5,趣味5,性价比5,2025-01-31 发布点评,讲解详细，服务态度好。,IP属地:四川,来自订单
m33****8154,黄金贵宾,5分,超棒,景色4,趣味4,性价比4,2025-01-31 发布点评,方便使用的,IP属地:四川,来自订单
高山流氺遇知音,铂金贵宾,5分,超棒,景色5,趣味5,性价比5,2025-01-31 发布点评,挺好的，风景很美，也感叹古人的智慧。,IP属地:湖北,来自订单
M30****8568,铂金贵宾,5分,超棒,景色5,趣味5,性价比5,2025-01-31 发布点评,必须要来享受一下山城的环境,IP属地:福建,来自订单
努力去玩、努力去生活,,5分,超棒,,,,2025-01-30 发布点评,"都江堰这个地方离成都市区其实蛮近的,搭动车很快就会到了!这边有仰天窝大熊猫然后晚上还可以看蓝眼泪!都江堰这边很像商店街也可以来这里逛逛我在这买了两件外套还不错，提醒一下大家冬天来这里还蛮冷的尤其是日夜温差大所以要注意保暖",IP属地:未知,来自Trip.com
海洋,铂金贵宾,5分,超棒,景色5,趣味5,性价比5,2025-01-30 发布点评,非常好的一次体验,IP属地:安徽,来自订单
M28****1680,铂金贵宾,5分,超棒,景色5,趣味5,性价比5,2025-01-30 发布点评,非常不错哦,IP属地:四川,来自订单
安多弗斯,黄金贵宾,5分,超棒,景色5,趣味4,性价比4,2025-01-30 发布点评,环境景色特别好,IP属地:重庆,来自订单
安多弗斯,黄金贵宾,5分,超棒,景色5,趣味4,性价比4,2025-01-30 发布点评,环境非常好,IP属地:重庆,来自订单
匿名用户,铂金贵宾,4分,满意,景色4,趣味4,性价比3,2025-01-30 发布点评,节假日人太多了，景区管理很OK，就不知道平时如何。古人的智慧在这展现出来。,IP属地:贵州,来自订单
匿名用户,铂金贵宾,4分,满意,景色5,趣味4,性价比4,2025-01-30 发布点评,此行有收获！,IP属地:四川,来自订单
Lijq330,,5分,超棒,景色5,趣味5,性价比5,2025-01-30 发布点评,方便快捷，很满意。,IP属地:四川,来自订单
晚风911,铂金贵宾,5分,超棒,景色4,趣味3,性价比5,2025-01-30 发布点评,司机师傅热情周到。开车平稳，路线熟悉！,IP属地:四川,来自订单
匿名用户,铂金贵宾,5分,超棒,景色5,趣味5,性价比5,2025-01-30 发布点评,小晔讲解详细，热情的照顾每个客人。,IP属地:四川,来自订单
galaxystar,黑钻贵宾,5分,超棒,景色5,趣味5,性价比5,2025-01-30 发布点评,历史人文厚重,IP属地:四川,来自订单
galaxystar,黑钻贵宾,5分,超棒,景色5,趣味5,性价比5,2025-01-30 发布点评,导游耐心讲解，非常棒,IP属地:四川,来自订单
血糯米团子,,5分,超棒,景色5,趣味5,性价比5,2025-01-30 发布点评,讲的很好！谢谢杨导，讲的非常详细！留下来美好的记忆！,IP属地:四川,来自订单
M55****8950,黄金贵宾,5分,超棒,景色5,趣味5,性价比5,2025-01-30 发布点评,值得一游，结合历史人文景观，体现我们祖国历史悠久，创历史科学,IP属地:广东,来自订单
