user_detail_name,user_detail_tags_text,text,text 2,text 3,text 4,text 5,resource_date_text,content_wrap,iplocation,from
lu****97,钻石贵宾,4分,满意,景色5,趣味3,性价比3,,园区很美，建议增加互动环节,IP属地:广西,来自订单
匿名用户,铂金贵宾,5分,超棒,景色5,趣味5,性价比5,,好好好好好,IP属地:广东,来自订单
M51****3746,黄金贵宾,5分,超棒,景色4,趣味4,性价比4,,很好，不错的景点,IP属地:广东,来自订单
M30****8616,铂金贵宾,4分,满意,景色5,趣味4,性价比4,,讲解小姐姐讲的很清楚，很负责,IP属地:河北,来自订单
縩韠,黄金贵宾,5分,超棒,景色5,趣味5,性价比5,,景点体验很好,IP属地:上海,来自订单
老刘一直在路上,,5分,超棒,景色5,趣味5,性价比5,,"杜甫草堂是一处人文景点，不做功课很难领会其中的精髓。
	
❤️杜甫生平
青年游学：放荡齐赵间，裘马颇轻狂
长安求官：朱门酒肉臭，路有冻死骨
安史之乱：国破山河在，城春草木深
流寓秦州：露从今夜白，月是故乡明
成都安居：两个黄鹂鸣翠柳，一行白鹭上青天
滞留夔州：无边落木萧萧下，不尽长江滚滚来
洞庭飘零：飘飘何所似，天地一沙鸥
	
⭐️杜甫草堂介绍
公元759年，48岁的杜甫来到成都，在浣花溪畔建起一座茅屋，“万里桥西一草堂，百花潭水即沧浪”，即后世所称的杜甫草堂。杜甫前后在成都生活了大约4年时间，他离开后，草堂毁弃。唐末五代时，诗人韦庄寻得草堂旧址，重建了杜甫草堂。此后几经损毁，今天的草堂是在清朝的基础上修整的。
	
❤️杜甫草堂的主要建筑
1️⃣大廨：即古代官员的办公室。杜甫44岁才得到一个右卫率府兵曹参军的小官。安史之乱爆发后，他历经艰辛到凤翔，被唐肃宗封为左拾遗，后被天子疏远。他一生做过的最大官职，是在成都期间由严武举荐的检校工部员外郎，从六品。因此，杜甫生前不可能拥有这样一间大廨。后人修建大廨，完全是出于对杜甫的推崇。
2️⃣杜甫老年像：跪坐于一叶孤舟上。公元770年，59岁的杜甫病逝于湖南岳阳的一条船上。正如他自己所写“亲朋无一字，老病有孤舟”。
3️⃣诗史堂：杜甫的诗被称为诗史。他在世时，名声却不大，几部著名诗集都未选他的作品。杜甫无奈慨叹：“百年歌自苦，未见有知音。”中唐以后，社会环境的变化引起了文学风气的变革，元白首推杜诗，继之韩愈称“李杜文章在，光焰万丈长”，将杜甫与李白并列。晚唐，杜诗备受选集青睐，得“诗史”之称，北宋得“集大成”之誉，南宋得“诗圣”之名。而后千家注杜，万古流芳。
4️⃣柴门：“野老篱前江岸回，柴门不正逐江开。”清代重修草堂时，将诗史堂后的建筑命名为柴门。柴门匾额为著名书画家潘天寿所书。柴字上部是一个山字，中间一竖好像一只小鸟。门字的点又形似一只蝴蝶。正是“留连戏蝶时时舞，自在娇莺恰恰啼”。
5️⃣工部祠：北宋吕大防重修杜甫草堂时，在草堂壁上绘了杜甫像，供人瞻仰，使草堂成为纪念性的祠堂。杜甫两侧的陆游、黄庭坚，都曾在蜀为官，他们继承杜甫诗学，发扬光大，自成一派。",IP属地:四川,来自订单
150****8800,铂金贵宾,5分,超棒,景色5,趣味5,性价比5,,值得推荐，很好,IP属地:四川,来自订单
M25****725,黄金贵宾,5分,超棒,景色5,趣味5,性价比5,,携程预订就是方便，边走边定了。,IP属地:贵州,来自订单
M28****338,铂金贵宾,5分,超棒,景色5,趣味5,性价比5,,杜甫草堂很不错,IP属地:海南,来自订单
_WeCh****236218,铂金贵宾,5分,超棒,景色5,趣味5,性价比5,,非常喜欢特别好,IP属地:四川,来自订单
ariel423,黄金贵宾,4分,满意,景色4,趣味4,性价比4,,成都鼎鼎大名的景点，人不多，里面有诗史堂，柴门，工部祠，碑亭等值得一看的地方。茅屋景区则是恢复重建了杜甫的故居，尤其还有一条花径，在茅屋旁，很美。整个景区内商业不多，有一处可以喝茶，体会一下历史的厚重和美好。,IP属地:天津,
M44****0212,黄金贵宾,4分,满意,景色5,趣味4,性价比3,,景色是真的美 但是其他也没什么了,IP属地:四川,来自订单
却春山,铂金贵宾,5分,超棒,景色5,趣味5,性价比5,,特别特别好特别特别好特别特别好,IP属地:陕西,来自订单
M27****2771,黄金贵宾,5分,超棒,景色5,趣味5,性价比5,,古色古香的地方，体会传统文化的美丽,IP属地:四川,来自订单
M23****2011,铂金贵宾,5分,超棒,景色5,趣味5,性价比5,,带着孩子来到了杜甫草堂，了解杜甫的一生，忧国忧民的杜甫，终其一生，全是坎坷，不得志。,IP属地:四川,来自订单
大圆子的碎碎念,黄金贵宾,5分,超棒,景色5,趣味5,性价比5,,对唐诗感兴趣，喜欢杜甫诗的推荐。今天虽然周一，赶上学生研学团，巨吵，特别影响参观讲解。适合人少来参观，建议有1小时人工讲解会更有利于了解。,IP属地:四川,来自订单
M38****5106,铂金贵宾,5分,超棒,景色5,趣味5,性价比5,,带着讲解再次走进杜甫草堂，果真是不同的感受！,IP属地:陕西,来自订单
_WeCh****879765,黄金贵宾,5分,超棒,景色5,趣味5,性价比5,,景色优美，人文气息浓郁,IP属地:四川,来自订单
M22****0122,黄金贵宾,5分,超棒,景色5,趣味5,性价比5,,随便看看。,IP属地:四川,来自订单
M22****489,铂金贵宾,5分,超棒,景色5,趣味5,性价比5,,非常值得去的地方，非常的好，值得推荐，成都来了这么久，感觉是最值得去的地方了。学习了很多知识，天气虽然热，但是，心里很凉快，非常的好！很棒！,IP属地:陕西,来自订单
匿名用户,,5分,超棒,景色5,趣味5,性价比5,,挺好的，有文化氛围,IP属地:广东,来自订单
匿名用户,铂金贵宾,5分,超棒,景色5,趣味5,性价比5,,非常不错，值得一去,IP属地:北京,来自订单
300****001,黄金贵宾,5分,超棒,景色5,趣味5,性价比5,,很棒的一次体验哦,IP属地:江苏,来自订单
M47****5048,,5分,超棒,景色5,趣味5,性价比5,,挺好挺好的,IP属地:贵州,来自订单
_WeCh****656173,钻石贵宾,5分,超棒,景色5,趣味5,性价比5,,景区还是要请导游，讲解有意义,IP属地:甘肃,来自订单
匿名用户,铂金贵宾,5分,超棒,景色5,趣味5,性价比5,,酒店各方面都非常优秀,IP属地:江西,来自订单
乔莘川,钻石贵宾,5分,超棒,景色5,趣味5,性价比5,,第一次来，打卡一下，没啥体验,IP属地:内蒙古,来自订单
匿名用户,,5分,超棒,景色5,趣味5,性价比5,,很遗憾时间不够，没有游完,IP属地:四川,来自订单
匿名用户,钻石贵宾,5分,超棒,景色5,趣味5,性价比5,,杜甫草堂很不错，带小朋友了解大诗人的生平，涨知识啦。里面景色也美，非常出片，拍照美美哒。在里面逛，买了一个讲解，讲解员带着逛一下，比自己逛能懂的更多。建议南门进出，打车也方便。,IP属地:四川,来自订单
138****0659,,5分,超棒,景色5,趣味5,性价比5,,值得去，最后听解说讲解,IP属地:河南,来自订单
婷子111111,铂金贵宾,5分,超棒,景色5,趣味5,性价比5,,去杜甫草堂的时候是阴天，人不是很多，景区不错，推荐！！,IP属地:四川,来自订单
萌狼蓝天,,5分,超棒,景色5,趣味5,性价比5,,拍照出片，还行的。可以去科技,IP属地:重庆,来自订单
M35****9533,铂金贵宾,5分,超棒,景色5,趣味5,性价比5,,虽是寒冬，可是这里古柏苍天，翠竹掩蔽，绿树环绕，蜡梅淡雅的香气扑鼻而来，穿越时空走进杜甫，了解诗人的生活和创作过程，不虚此行，获益匪浅。,IP属地:陕西,来自订单
M19****594,铂金贵宾,5分,超棒,景色5,趣味3,性价比4,,景色宜人，儿子很喜欢,IP属地:广西,来自订单
娜宝儿哈,黄金贵宾,4分,满意,景色4,趣味4,性价比4,,还行。情侣出游，可以考虑去，或者散心也挺好,IP属地:四川,来自订单
天空20190808,钻石贵宾,5分,超棒,景色5,趣味5,性价比5,,杜甫千诗碑是个值得细细观摩的景点，它把杜甫的1455首诗歌用历代书法大家的书法字迹撰写出来，镌刻在碑上，堪称是一部石刻的《杜工部全集》。这里既有杜甫的每一首诗，还汇集了历代书法名家的墨宝，简直是一个诗歌和书法的圣殿。,IP属地:北京,来自订单
悦纳心中的四季,铂金贵宾,5分,超棒,景色5,趣味5,性价比5,,50元的门票，不仅可以看到非常美丽的风景，让心安宁，还能与诗圣进行“神交”，领略文人的精神世界！,IP属地:四川,
M50****5740,铂金贵宾,5分,超棒,景色5,趣味5,性价比5,,景区不大 挺有意义的 可以去 适合孩子去学习,IP属地:重庆,来自订单
M33****3535,黄金贵宾,4分,满意,景色5,趣味5,性价比4,,杜老先生四年多的草堂生活，承载记录了那段跌宕历史中的岁月波澜，所以草堂是成都非常值得探访的所在。,IP属地:湖南,来自订单
M29****0248,铂金贵宾,5分,超棒,景色5,趣味5,性价比5,,不虚此行，孩子收获很多,IP属地:四川,来自订单
M32****491,,5分,超棒,景色5,趣味5,性价比5,,非常不错的体验,IP属地:日本,来自订单
追赶兔子的乌龟,铂金贵宾,5分,超棒,景色5,趣味5,性价比5,,很安静很美的地方,IP属地:新加坡,来自订单
M32****562,黄金贵宾,5分,超棒,景色5,趣味5,性价比5,,环境很好很清幽，喜欢,IP属地:广东,来自订单
M30****3869,黄金贵宾,5分,超棒,景色5,趣味5,性价比5,,"自在·心安·即归处
杜甫草堂在任何天气下都值得去",IP属地:四川,来自订单
你是对的。,黄金贵宾,5分,超棒,景色5,趣味5,性价比5,,环境优美，非常漂亮。“酒店的服务真是无可挑剔！从入住到退房，每一位员工都面带微笑，热情周到。特别感谢前台，他不仅帮我解决了行李问题，还推荐了几个当地的美食景点，让我的旅行更加愉快。”,IP属地:四川,来自订单
匿名用户,铂金贵宾,5分,超棒,景色5,趣味5,性价比5,,疫情前那次到成都，安排紧没来得及。这次补上了，挺好的。尤其兰花展，最惊艳的腊梅，香极了。复习了杜甫等的唐诗，值得推荐。,IP属地:四川,来自订单
有容妳大,铂金贵宾,5分,超棒,景色5,趣味5,性价比5,,挺好的，适合慢慢悠哒,IP属地:新疆,来自订单
M14****173,钻石贵宾,5分,超棒,景色5,趣味5,性价比5,,第二次来,IP属地:北京,来自订单
匿名用户,铂金贵宾,5分,超棒,景色5,趣味5,性价比5,,"非常好，很多人说是新修的，但文化是悠久的，新修的是为了保护文化。
值得参观。",IP属地:四川,来自订单
_WeCh****59347,铂金贵宾,4分,满意,景色4,趣味3,性价比3,,对诗词歌赋感兴趣的可以逛一下。,IP属地:广东,来自订单
匿名用户,黄金贵宾,5分,超棒,景色5,趣味5,性价比5,,值得一去的地方，推荐！,IP属地:四川,来自订单
M35****1449,钻石贵宾,5分,超棒,景色5,趣味5,性价比5,,有种莫名的文化艺术气息，让烦躁的生活平静一下，也让自己不只是停留在部分文字上认识杜甫。,IP属地:安徽,来自订单
Annie吟吟,黑钻贵宾,5分,超棒,景色5,趣味5,性价比5,,還可以 園景很漂亮,IP属地:四川,来自订单
cc58***,,5分,超棒,景色5,趣味5,性价比5,,"知识点太多，感叹诗圣波澜壮阔的一生。根本不够逛。
即可以朱门酒肉臭 路有冻死骨；也可以随风潜入夜润物细无声；还可以国破山河在 城春草木深。",IP属地:上海,来自订单
M44****712,,5分,超棒,景色5,趣味5,性价比5,,不需此行 冬天去也能看到绿叶 环境很好 人文之旅,IP属地:四川,
_M18****4061,钻石贵宾,5分,超棒,景色5,趣味5,性价比5,,值得一去 很漂亮的花园,IP属地:北京,来自订单
M19****156,黄金贵宾,5分,超棒,景色5,趣味5,性价比5,,还行还行还行还行还行还行还行还行还行还行还行还行还行还行还行,IP属地:福建,来自订单
匿名用户,黄金贵宾,5分,超棒,景色5,趣味5,性价比5,,来成都必去的景点之一,IP属地:四川,来自订单
m57****2341,,5分,超棒,景色5,趣味5,性价比5,,非常不错啊,IP属地:广东,来自订单
源满2016,铂金贵宾,5分,超棒,景色5,趣味5,性价比5,,适合夏天去,IP属地:四川,来自订单
匿名用户,黄金贵宾,5分,超棒,景色5,趣味4,性价比5,,好玩好看，遇到了高中生组团出游,IP属地:广西,来自订单
M23****1030,铂金贵宾,5分,超棒,景色5,趣味5,性价比5,,满意 值得一去,IP属地:河南,来自订单
飞翔的远方,钻石贵宾,5分,超棒,景色5,趣味4,性价比4,,"适合悠闲地闲逛
距离四川博物院很近
在青羊宫地铁站附近
即使是冬天里面也绿意盎然
有点像个大公园
里面文化性较高
趣味性稍显不足
票价50也不算便宜
去里面的中年人偏多 大概因为比较符合景区的定位",IP属地:天津,来自订单
匿名用户,铂金贵宾,5分,超棒,景色5,趣味5,性价比5,,带孩子去游玩，感受一下文人墨客的氛围，体验感很棒。,IP属地:湖南,来自订单
南山处士,铂金贵宾,5分,超棒,景色5,趣味5,性价比5,,杜甫草堂位于成都，环境清幽，充满诗意。这里是诗人杜甫的故居，可让人深入了解他的生平和诗作。园内绿树成荫，古建筑与现代园林相得益彰。漫步其中，仿佛能感受到杜甫的忧国忧民之情。茶馆的氛围也让人放松，是文化和自然完美结合的好去处。,IP属地:广东,来自订单
M15****87,铂金贵宾,5分,超棒,景色5,趣味5,性价比5,,带孩子去，值得推荐。在门口可以约讲解员，1-3个人，120元，小姐姐讲的特别好。非常的细致，超赞，门票也不是很贵。交通便利，公交地铁都非常方便,IP属地:四川,来自订单
M42****8815,铂金贵宾,5分,超棒,景色5,趣味5,性价比5,,听得进去还行,IP属地:浙江,来自订单
320****281,黄金贵宾,5分,超棒,景色5,趣味5,性价比5,,很棒。。。,IP属地:四川,来自订单
M58****510,黄金贵宾,5分,超棒,景色5,趣味5,性价比5,,酒店不错前台露露服务好棒棒的,IP属地:陕西,来自订单
羽佳帆,铂金贵宾,5分,超棒,景色5,趣味5,性价比5,,非常好，成都必到景点,IP属地:云南,来自订单
xuych,铂金贵宾,5分,超棒,景色5,趣味5,性价比5,,带孩子来杜甫草堂，请了讲解，6个人团讲了快2小时，很透彻。比官方讲解时间长,IP属地:四川,来自订单
小 云 朵,铂金贵宾,5分,超棒,景色5,趣味5,性价比5,,快捷方便，很不错,IP属地:云南,来自订单
E03****13,铂金贵宾,5分,超棒,景色5,趣味5,性价比5,,草堂外围施工也无减草堂的雅致庄严。非常享受这次参访，了了对诗圣的仰慕之情，穿越历史，无限感慨。但愿下次有时间多逗留一会儿，能感受真正成都的历史,IP属地:浙江,来自订单
M32****674,铂金贵宾,5分,超棒,景色5,趣味3,性价比3,,很不错的地方，嗯嗯嗯！！！,IP属地:河南,来自订单
flyci,,5分,超棒,景色5,趣味5,性价比5,,成都必去景点,IP属地:四川,来自订单
嗜睡失眠患者,,5分,超棒,景色5,趣味5,性价比5,,第二次去了，还可以,IP属地:四川,来自订单
刀手口,铂金贵宾,5分,超棒,景色5,趣味5,性价比5,,环境好，氛围感好,IP属地:辽宁,来自订单
M48****6043,黄金贵宾,5分,超棒,景色5,趣味5,性价比5,,这次就带孩子去！,IP属地:黑龙江,来自订单
边v缘,铂金贵宾,5分,超棒,景色5,趣味5,性价比5,,方便 还可以,IP属地:吉林,来自订单
139****9744,,5分,超棒,景色5,趣味5,性价比5,,每次来成都 都是一定会来的地方 很满意,IP属地:四川,来自订单
元铭2008,铂金贵宾,5分,超棒,景色5,趣味5,性价比5,,环境优美，古朴幽深，静逸雅典。,IP属地:广东,来自订单
阿紫Asia,,4分,满意,,,,,一般版 当作看公园不错 里面没有太多是杜甫居住的地方 只有一点点 其他都是扩建的 很多诗词 还有盆栽 但跟杜甫本人没有太大关系,IP属地:未知,来自Trip.com
_WeCh****95462,黄金贵宾,5分,超棒,景色5,趣味5,性价比5,,环境很好，只是逛一圈就走了,IP属地:辽宁,来自订单
_WeCh****23105,铂金贵宾,5分,超棒,景色5,趣味5,性价比5,,太值得了，可以在里面呆一天🌺，如果我是成都本地人都想买年卡了！线上订票非常方便🌷非常好！,IP属地:山西,来自订单
唐様,黄金贵宾,5分,超棒,景色5,趣味5,性价比5,,环境很好，服务很棒，下次还来,IP属地:四川,来自订单
Lily,黄金贵宾,5分,超棒,景色5,趣味5,性价比5,,身临其境，感觉自己也成了文人墨客了,IP属地:广东,来自订单
M22****6520,铂金贵宾,5分,超棒,景色5,趣味5,性价比5,,感谢江江的精彩讲解，让我们了解了杜甫草堂的深厚底蕴！,IP属地:四川,来自订单
_WeCh****634145,铂金贵宾,5分,超棒,景色5,趣味5,性价比5,,人太多了。学生参观是爱国主义教育，老人旅游也无可厚非，为啥有那种浓妆艳抹的网红也在这里摆拍？,IP属地:新疆,来自订单
匿名用户,铂金贵宾,5分,超棒,景色5,趣味5,性价比5,,挺不错的，挺好的，很有这个氛围感,IP属地:山西,来自订单
yyyrlf,黄金贵宾,5分,超棒,景色5,趣味5,性价比5,,非常不错，环境很好，家人很喜欢，孩子玩得很开心！成都，川蜀之要地，品味历史文人墨客，和古人对话，穿越时空，对杜甫草堂有了更深的了解，推荐大家有时间带孩子去游玩一下。,IP属地:江苏,来自订单
maggie886,钻石贵宾,5分,超棒,景色5,趣味5,性价比5,,带上孩子是非常值得一去的，在门口是要选一个导游陪同讲解，不然进去自己看，是看不出来门道的。里面的绿化很好，进去游览学习到很多知识。,IP属地:江苏,来自订单
M69****5253,黄金贵宾,5分,超棒,景色5,趣味5,性价比5,,值得去，推荐别人去,IP属地:四川,来自订单
匿名用户,,5分,超棒,景色5,趣味5,性价比5,,旅游好地方,IP属地:四川,来自订单
Every day  journey,,5分,超棒,,,,,"这是中国历史文化重要的地方。是杜甫等著名诗人居住和写各种诗的住所。喜欢学习中国历史或文学的人千万不要错过!📖✨
这里的气氛很安静。树木和美丽的花园阴凉这让我感觉就像走进古老,周围有一个花园,里面有树木。还有一个装饰,感觉就像进入诗人自己的房子。🏡🌳 ,我非常喜欢。",IP属地:未知,来自Trip.com
M83****7271,,4分,满意,景色4,趣味3,性价比3,,还行吧。没有想象的那么诗情画意。商业化➕下午去的，环境还是不错的。如果对诗人文化背景感兴趣的话，值得一看。国庆节人太多了哈哈哈哈有条件还是尽量淡季出行。可能遗留了一些地方……嗯嗯整体还不错的。中规中矩嘿嘿😀,IP属地:陕西,来自订单
晶晶2024,黄金贵宾,4分,满意,景色5,趣味4,性价比3,,环境优美，好,IP属地:日本,来自订单
匿名用户,,5分,超棒,景色5,趣味5,性价比5,,环境很好。,IP属地:吉林,来自订单
M22****9276,钻石贵宾,5分,超棒,景色5,趣味4,性价比4,,内容没什么，都是后造的。当个小公园逛逛还是挺不错的，挺漂亮。,IP属地:上海,来自订单
D10****289,铂金贵宾,4分,满意,景色4,趣味4,性价比4,,冬天去的，感觉冷，其他季节应该很美。商业化很严重，走廊两面都是文创店,IP属地:北京,来自订单
匿名用户,铂金贵宾,5分,超棒,景色5,趣味3,性价比4,,"12点打车至南门，抬眼便望见对面的浣花溪公园，那亦是个好逛之处，不仅有文化历史的沉淀，还洋溢着当地人的生活气息。
   踏入杜甫草堂，景色美不胜收，绿植高大且茂密，犹如绿色的华盖，投下一片片阴凉。然而，此处也略显阴冷。漫步其中，仿佛能穿越时空，感受到杜甫当年在此生活的气息。尽管如今的草堂历经历朝历代的修缮，规模已非杜甫当年居住时那般狭小，但依然能让人在这古朴清幽的环境中，追寻到诗圣的足迹。
   这里的一草一木，一砖一瓦，都似乎在诉说着那段久远的历史。我静静地在草堂中徘徊，思绪纷飞，想象着杜甫曾在此处挥毫泼墨，写下那一篇篇千古传颂的诗篇。他的诗歌，如同一盏明灯，照亮了后世的文学道路。
   尽管我回来后就冻感冒了，但这一趟杜甫草堂之行，依然给我留下了深刻的印象。它让我更加深入地了解了杜甫的生平和他的诗歌创作，也让我对中国古代文化有了更深的敬意和热爱。

你可以根据实际情况对内容进行修改，或者告诉我更具体的修改要求和方向。",IP属地:四川,来自订单
jijason,铂金贵宾,5分,超棒,景色5,趣味5,性价比5,,值得一去、环境超赞、有盖碗茶喝,IP属地:四川,来自订单
本来就叫江城子,铂金贵宾,5分,超棒,景色5,趣味5,性价比5,,景点可以理解为，以杜甫草堂遗址为基础，杜甫以后的古人和现代人修的带花园的建筑群。相比现代人修的建筑，古人修的建筑的审美更在线。,IP属地:上海,来自订单
匿名用户,铂金贵宾,5分,超棒,景色5,趣味4,性价比4,,带娃娃可以去，里面人不多，闲逛很合适,IP属地:四川,来自订单
yudanqin,黑钻贵宾,5分,超棒,景色5,趣味5,性价比5,,非常好玩。,IP属地:上海,来自订单
M38****7873,铂金贵宾,5分,超棒,景色5,趣味5,性价比5,,不错，挺大的，好好转下来要2-3个小时，唐诗氛围很浓厚，包括后来修建的茅屋，蛮古朴的，整个屋子的布局和陈设也都是按照《茅屋为秋风所破歌》里面所提到的内容修建的,IP属地:四川,来自订单
deng****aya,钻石贵宾,5分,超棒,景色5,趣味5,性价比5,,非常棒的景点,IP属地:广东,来自订单
M26****7110,黄金贵宾,5分,超棒,景色5,趣味4,性价比5,,虽然不少是新建的，但可以思古怀今，还是可以去的,IP属地:安徽,来自订单
M36****9272,黄金贵宾,5分,超棒,景色5,趣味5,性价比5,,为这难得的氛围和服务，我也必须来个好评，赞赞赞,IP属地:广东,来自订单
m33****7434,铂金贵宾,5分,超棒,景色5,趣味5,性价比4,,很好很好很好,IP属地:北京,来自订单
_TI***5t,,5分,超棒,,,,,"泰国人很容易来旅行,买票,非常方便。",IP属地:未知,来自Trip.com
300****508,铂金贵宾,5分,超棒,景色5,趣味5,性价比5,,还是可以的,IP属地:江苏,来自订单
186****2966,钻石贵宾,5分,超棒,景色5,趣味5,性价比5,,值得去转转看看,IP属地:广东,来自订单
duanduan,铂金贵宾,5分,超棒,景色5,趣味3,性价比3,,环境清幽，去的时候是淡季，感觉舒适。,IP属地:广东,来自订单
匿名用户,黄金贵宾,4分,满意,景色4,趣味4,性价比4,,诗仙诗圣，走马观花,IP属地:四川,来自订单
贩卖快乐的贝儿,,5分,超棒,,,,,从正门进入，首先映入眼帘的是大廨，这里陈列着一些与杜甫相关的文物和书画；接着来到诗史堂，展示了杜甫的生平事迹和诗歌创作历程；再往前是柴门，古朴典雅；穿过柴门便是工部祠，供奉着杜甫的塑像；工部祠东侧是“少陵草堂”碑亭，是杜甫草堂的标志性景点；随后参观茅屋故居，感受杜甫当年的生活场景；最后逛逛盆景园，欣赏各种精美的盆景。,IP属地:江苏,
把苹果博士赶出宇宙,黄金贵宾,4分,满意,景色4,趣味3,性价比3,,人多不好玩,IP属地:陕西,来自订单
206****362,黄金贵宾,5分,超棒,景色5,趣味5,性价比5,,那里有非常多的历史，风景优美，可以与杜甫隔空互动，大家都学到了很多知识，非常有趣，门票价格适中，游玩起来不累，适合大小一家来游玩。,IP属地:四川,来自订单
匿名用户,,5分,超棒,景色5,趣味4,性价比4,,有俩崽崽陪着玩，就是开心😊,IP属地:重庆,来自订单
_WeCh****21308,钻石贵宾,5分,超棒,景色5,趣味5,性价比5,,"杜甫草堂，也是成都的著名景点之一
杜甫在这呆的时间不算多，也算是人们对他的纪念吧
西门进的，因为上午去的金沙，那有公交，直接到西门，官方的讲解，一定要听讲解，不然那么多诗句，简直看不懂",IP属地:四川,来自订单
莱里达不花帖木儿,黄金贵宾,5分,超棒,景色5,趣味5,性价比5,,成都值得打卡的景点,IP属地:四川,来自订单
Ciaotom,铂金贵宾,5分,超棒,景色5,趣味5,性价比5,,杜甫草堂比我想象的要大，这里可以全面的了解杜甫的生平，重新温习杜甫的伟大诗歌，我特别喜欢内部的诗歌长廊，一边读诗，一边欣赏不同风格的书法，很棒！,IP属地:四川,来自订单
tiger1173,钻石贵宾,5分,超棒,景色5,趣味5,性价比5,,值得一看性价比很高,IP属地:上海,来自订单
Akaiwen,黄金贵宾,5分,超棒,景色5,趣味5,性价比5,,非常值得去,IP属地:四川,来自订单
匿名用户,黄金贵宾,5分,超棒,景色5,趣味5,性价比5,,非常好！！！,IP属地:四川,来自订单
_CFT01****0268708,黄金贵宾,5分,超棒,景色5,趣味5,性价比5,,幽幽小道，清清草屋,IP属地:江苏,来自订单
