user_detail_name,user_detail_tags_text,text,text 2,text 3,text 4,text 5,content_wrap,from,iplocation,,,attraction_name
匿名用户,铂金贵宾,1分,不佳,景色2,趣味1,性价比1,订的1点，差不多1点40才开始，时间根本就不够2.5小时，导游也不知道哪里找来的，怀疑是不是专业的，全程2小时，讲了半小时不到，剩下的时间就傻傻带着在景区走了一圈，第一次碰到这样的，无语……,来自订单,IP属地:四川,,,都江堰差评
肖肖大魔王,黄金贵宾,1分,不佳,景色2,趣味1,性价比1,没劲，没啥看头，存包还要钱,来自订单,IP属地:江苏,,,都江堰差评
匿名用户,钻石贵宾,1分,不佳,景色3,趣味2,性价比1,"都江堰不错不要选这家  没有所谓的小吃  
购买后没入园不能退
慎重购买",来自订单,IP属地:四川,,,都江堰差评
匿名用户,铂金贵宾,1分,不佳,景色1,趣味1,性价比1,联系不到导游，比游客中心贵很多,来自订单,IP属地:四川,,,都江堰差评
M36****9462,黄金贵宾,1分,不佳,景色2,趣味2,性价比1,景区很乱，该旅行社有控制景区门票嫌疑，且讲解费用过高,来自订单,IP属地:湖北,,,都江堰差评
M49****3337,黄金贵宾,1分,不佳,景色2,趣味2,性价比1,最糟糕的一次体验，去的时候没有下雨，走半路上下大雨，于是原路折返，带着两个老人一个小孩，打着伞全身被淋湿了，雨太大了，到了吊桥那里，还有大批的人往里进，我们往外出，不明白那么大雨不顾安危还那么多游客往里冲，好多是旅游团，导游根本不管一个劲往里冲，必经之路就是吊桥，本应是双向一个出，一个近，结果无人管理，吊桥又窄，出的方向一直滞留不前，排了几百米的长队，，好多游客都上前起了争执，一路上没有看到一个景区工作人员，这么大的雨也没人疏导和关闭景区，管理和应变实在是太差，太差了，多处积水，都是趟着水过，在吊桥等待的时候，被人流挤散了老人和其中一个孩子，非常危险，景区不作为！不配5A的经典管理！,来自订单,IP属地:福建,,,都江堰差评
320****107,,1分,不佳,景色1,趣味1,性价比1,这个门票是假的，根本进不去园区，跟平台沟通也没有得到妥善解决，大家慎拍。,来自订单,IP属地:广东,,,都江堰差评
M53****3387,,1分,不佳,景色1,趣味1,性价比1,骗子骗钱的！根本没有人和你联系！打电话到携程说是联系后来也没有人和我联系！请需要购买的朋友擦亮双眼！省的上当！网上显示没票可以直接去现场购买！也希望携程能处理下这样的不良商家！！！,来自订单,IP属地:四川,,,都江堰差评
匿名用户,铂金贵宾,2分,一般,景色4,趣味1,性价比1,大运会期间限流，单独购买不了门票，只能买绑定的票，每张都贵一百块，绑定的小吃店根本没有联系方式，更没有主动联系，应该说很失望,来自订单,IP属地:四川,,,都江堰差评
M31****5716,,1分,不佳,景色1,趣味1,性价比1,买的连导游讲解的套票，所以路线是导游选的但是她按照她的路线带我们走了最差的路线从游客中心旁边的大门入是因为从景区门口带到上面去了，以后上面有个出入口，还有几个人等着她再带，还有因为我们没有提前在网上买票导致我自己买的门票加导游就是个大坑，到了景区门口才发现就是你下午去玩在售票中心一样能买到普通门票80的哎真的气死！在这里提醒大家大家！,来自订单,IP属地:四川,,,都江堰差评
M57****3671,,1分,不佳,景色1,趣味1,性价比1,刚进来就下雨，特别大，根本没法玩了，也不给退票,,IP属地:四川,,,都江堰差评
海事笨笨,铂金贵宾,1分,不佳,景色1,趣味1,性价比1,都江堰风景区导游差，讲解差，服务差，千万别去中坑,来自订单,IP属地:重庆,,,都江堰差评
Ccccccc飞,黄金贵宾,1分,不佳,景色1,趣味1,性价比1,讲解体验极差，因为网上没有预约票了，没办法买的票加讲解，后悔。,来自订单,IP属地:四川,,,都江堰差评
130****3298,,2分,一般,景色2,趣味2,性价比3,比较一般化,来自订单,IP属地:安徽,,,都江堰差评
匿名用户,黄金贵宾,1分,不佳,景色1,趣味1,性价比1,别去了，还不如去多看两个熊猫，真没啥好看的，还不如就看看门口的南桥，一点特色也没有，当然如果你热爱水利工程可以去看，不可否认古人的智慧是很牛的，就是当成景点那真没啥看头,来自订单,IP属地:四川,,,都江堰差评
137****8333,钻石贵宾,1分,不佳,景色1,趣味1,性价比1,孩子发烧了，票都没办法退票，垃圾,来自订单,IP属地:四川,,,都江堰差评
百晓生09,铂金贵宾,2分,一般,景色2,趣味3,性价比3,…………..,来自订单,IP属地:重庆,,,都江堰差评
M22****3612,,2分,一般,景色4,趣味4,性价比1,"景区很美毕竟是公元前古人智慧的结晶。
差评给到套票里的，锦宴楼-套票餐饮店。
门票单定80，套票188成人一张，学生148一张，
除去门票价格，餐饮部分108成人，60学生，
晚餐说不含表演，退了我10元一人，
餐饮就是98成人一顿，学生50一顿，
给你们看看吃的啥，文字内容就是一个鱼目混珠，
就是小吃，根本不是晚餐，
不建议订套票，饭店位置偏僻，关键连口热水都喝不上的小吃哈哈哈。
早上人民公园点了一餐也就一百多（不含喝茶），
这家的套票，锦宴楼，千万慎重。（速冻水饺小混沌芝麻汤圆凉拌粉凉拌面指甲盖大小红豆馅儿的小馒头等等）",来自订单,IP属地:四川,,,都江堰差评
匿名用户,,1分,不佳,景色5,趣味1,性价比1,看网上说没有线下售票了，当天公众号上又不能预定了于是就买了这个，结果到了门口可以买票，景区内挺好的。就这附加的100块太不值得了！本来还挺期待川剧表演的，结果下午没有，所以多付100块钱吃了巨难吃巨难吃的菜，本来就是吃的晚饭，下午还没有川剧表演，只配了晚饭却在中午表演，我哭了。哪来的性价比啊，我们两个人，明明可以直接抢我们200块，还给我们上了九个难吃的速食菜（凉面 凉粉 水饺 没味道的鸭子 腊肉 汤圆 速冻馄饨 鸡汤 包子） 饺子也是速冻的，鸡汤没有油，豆沙馅的包子没有豆沙味，还做成这个模样，那两个肉我不愿再评价。成都名小吃……,来自订单,IP属地:四川,,,都江堰差评
风X是雅,钻石贵宾,1分,不佳,景色5,趣味3,性价比3,网上不能预约老人等优惠，景区售票点也很坑，,来自订单,IP属地:山东,,,都江堰差评
M48****5283,黄金贵宾,2分,一般,景色5,趣味3,性价比1,25号下午门口售票处的那个男的 素质教育有待提高 不耐烦不喜欢这份工作可以不干哈,来自订单,IP属地:四川,,,都江堰差评
M33****8371,黄金贵宾,1分,不佳,景色1,趣味1,性价比1,没文化看不懂，真没啥玩的,来自订单,IP属地:河南,,,都江堰差评
M58****067,黄金贵宾,2分,一般,景色3,趣味2,性价比2,很一般，又热，啥都没,来自订单,IP属地:福建,,,都江堰差评
110****797,黄金贵宾,1分,不佳,景色2,趣味1,性价比1,只管收钱，毫无管理,来自订单,IP属地:四川,,,都江堰差评
M43****882,黄金贵宾,2分,一般,景色2,趣味2,性价比1,景区图有虚名，感觉和票价不符，一条江圈起来收费有点坑！,来自订单,IP属地:山东,,,都江堰差评
E03****55,,2分,一般,景色5,趣味3,性价比2,这次是所有旅游中体验最差的，标识不明显。停雨后把一把很有意义文艺伞收起靠内江边的栏杆旁，去拍张相片过来就遗失了。图片是丢失的伞。,来自订单,IP属地:四川,,,都江堰差评
不知道取什么名字的屑GzMXY10,黄金贵宾,1分,不佳,景色2,趣味1,性价比1,人太多了，园内没什么可看的，项目也很无聊，感觉景点太敷衍了，交通非常不方便，不管是去到那里还是离开，都非常的麻烦。不推荐去。,来自订单,IP属地:四川,,,都江堰差评
凤凰涅,铂金贵宾,2分,一般,景色2,趣味2,性价比2,鸡肋景区。无需打卡。,来自订单,IP属地:贵州,,,都江堰差评
M22****913,铂金贵宾,1分,不佳,景色1,趣味1,性价比1,景区管理很差，没有看到一个工作人员，导游不必要，自己随便逛逛就可以,来自订单,IP属地:四川,,,都江堰差评
M22****913,铂金贵宾,1分,不佳,景色1,趣味1,性价比1,景区没有管理，特别差,来自订单,IP属地:四川,,,都江堰差评
M32****314,黄金贵宾,2分,一般,景色3,趣味1,性价比2,人太多了，老是要排队，又没什么地方好看，根本不值80票价和我的一天时间,来自订单,IP属地:四川,,,都江堰差评
631****912,铂金贵宾,1分,不佳,景色4,趣味3,性价比1,管理混乱 景区观光车大热天都在排队 和导游认识的负责排队的就安排那个导游的游客插队 导游就更不用说了根本不排队 游客排三四十分钟 导游直接上车 景区弄几个东倒西歪的围栏 剩下的游客自己挤去吧,,IP属地:四川,,,都江堰差评
炎阳、,铂金贵宾,1分,不佳,景色3,趣味1,性价比1,真的很普通，失望。,来自订单,IP属地:四川,,,都江堰差评
M54****3403,黄金贵宾,2分,一般,景色3,趣味2,性价比2,1.导游讲解的很差没有耐心全程都在敷衍 这是来自孩子的真心评价 因为前一天刚去了武侯祠那位小姐姐讲的非常有耐心 相当专业 服务有好 孩不懂的都会耐心讲解,来自订单,IP属地:江苏,,,都江堰差评
320****654,,1分,不佳,景色5,趣味2,性价比2,导游知识储备量很差，讲的很多地方都不对，也讲的不详细，秦昭王，都讲成了秦始皇,来自订单,IP属地:四川,,,都江堰差评
M50****9379,,1分,不佳,景色5,趣味1,性价比1,都江堰去旅游，你不给钱就看不到风景.河的两边两岸修了很多围墙，高山上也修了很多围墙.钻到钱眼里面去了穷游的人不要去都江堰.你是一点风景也看不到.都江堰的政府一点胸怀都没有.,,IP属地:四川,,,都江堰差评
惠先生66,黄金贵宾,2分,一般,景色5,趣味4,性价比3,不推荐套票，这两个地方相差太远，想一天玩两个地方，基本不可能，而且套票不能退，体验感极差,来自订单,IP属地:甘肃,,,都江堰差评
M50****1378,铂金贵宾,2分,一般,景色2,趣味2,性价比2,一次很不好的体验，请了个讲解，讲一半丢下我们，接别的单，实在无语,来自订单,IP属地:四川,,,都江堰差评
M55****3101,,2分,一般,景色3,趣味2,性价比2,人多，天热，没看明白,来自订单,IP属地:重庆,,,都江堰差评
_M18****8011,,2分,一般,景色4,趣味1,性价比2,说好的2.5小时的导游讲解时间，1个半小时就结束了。感觉一点不值！,来自订单,IP属地:四川,,,都江堰差评
M54****0685,黄金贵宾,1分,不佳,景色1,趣味1,性价比1,没意思很差劲,来自订单,IP属地:重庆,,,都江堰差评
M26****8735,,1分,不佳,景色5,趣味1,性价比1,交通太差 停车场附近的路真窄.车堵半天。,,IP属地:四川,,,都江堰差评
M22****785,铂金贵宾,1分,不佳,景色5,趣味1,性价比1,景区很好，但设计很差造成拥挤严重，来回都要过很窄的桥,来自订单,IP属地:北京,,,都江堰差评
M33****6237,钻石贵宾,1分,不佳,景色1,趣味1,性价比1,差评必须差评，换车不通知，司机也没有任何提示，白白等了半小时，到达都江堰只有不到两小时，走马观花都看不全；发车晚点，导游代订青城山观光车票说好不用排队，还是自己正常排队，浪费时间山顶都没上去，气愤,来自订单,IP属地:四川,,,都江堰差评
M47****5767,,1分,不佳,景色1,趣味1,性价比1,携程是真的垃圾,来自订单,IP属地:陕西,,,都江堰差评
155****9851,铂金贵宾,2分,一般,景色4,趣味1,性价比1,"性价比低，除了景色之外
服务根本没有，里面都是各种收费，
排队人这么多，电瓶车司机竟然都在闲着看手机，不去接乘客，乘客排队那么长了。不值得80块钱，最多30",来自订单,IP属地:湖北,,,都江堰差评
大头头大呀,,2分,一般,景色5,趣味4,性价比2,整体还是挺好，节假日多能理解，就是第一次去不小心以为秦堰楼出口就是单单这个楼的出口，出去后就不让我们再进去了，只能打车自己下去，出口也没人提醒，出去就不能进了，本来还想从另一个寺庙下去 …,来自订单,IP属地:四川,,,都江堰差评
冷眼看烟花,铂金贵宾,2分,一般,景色5,趣味2,性价比2,以后不来了,来自订单,IP属地:四川,,,都江堰差评
早餐喝粥不放糖,钻石贵宾,1分,不佳,景色1,趣味1,性价比1,**景区 弄个吊桥进来 排队半小时进去 坐个观光车也是疯狂排队 别来了 景色*音上都能看到,来自订单,IP属地:四川,,,都江堰差评
M26****2915,黄金贵宾,1分,不佳,景色1,趣味1,性价比1,被导游坑了，导游极差,来自订单,IP属地:贵州,,,都江堰差评
M29****3777,,2分,一般,景色3,趣味1,性价比2,水好看，其他也没什么意思。这种地方去一次就够了。,来自订单,IP属地:四川,,,都江堰差评
M51****349,黄金贵宾,2分,一般,景色5,趣味5,性价比1,景区挺大的！各种小吃都有！风景也不错！但是！！！！转完了一圈才意识到根本不用门票的！所以这个费用是专门坑外地过来旅游的人吗????????,来自订单,IP属地:四川,,,都江堰差评
M28****7372,黑钻贵宾,1分,不佳,景色5,趣味4,性价比1,好好的心情被一个素质低下的停车场保安弄得一团糟，态度恶劣面目可憎！千万要提高服务从业人员的专业素质！,来自订单,IP属地:湖北,,,都江堰差评
M38****2557,黄金贵宾,1分,不佳,景色1,趣味1,性价比1,太差 环境差 政策差 服务差 态度差 南桥可以直接进入 还要收取门票 谁来谁后悔,来自订单,IP属地:北京,,,都江堰差评
臭屁小宝贝,,1分,不佳,景色1,趣味1,性价比1,啥破玩意儿，玉垒阁完有一条诱导去做20块钱电梯的路，如果不坐电梯就要从山顶原路返回，坐不坐吧,来自订单,IP属地:四川,,,都江堰差评
风不见了,黄金贵宾,1分,不佳,景色1,趣味1,性价比1,太垃圾了而且偏贵不值这个价,来自订单,IP属地:四川,,,都江堰差评
M27****5575,钻石贵宾,1分,不佳,景色1,趣味1,性价比1,根本不是12:30发车，是下午13:00，白白在太阳底下晒了1个多小时，之后还有迟到的，只要旅行社打个电话都会等。路程的话要是堵车1.5小时根本到不了,来自订单,IP属地:上海,,,都江堰差评
