user_detail_name,user_detail_tags_text,text,text 2,text 3,text 4,text 5,content_wrap,from,iplocation,,,attraction_name
bing****ege,铂金贵宾,1分,不佳,景色5,趣味1,性价比1,"久负盛名的地方，但，第一次到访，体验感很差（纯自助游，跟团游可跳过）。
具体如下，
1，线上联系不方便。
景区客服中心电话，网上查不到，查不到！查到的也打不通，度娘都没有正解，现在提倡的大数据时代，貌似这里我们没有感受到。想咨询、想退票都无法。
至少没有清晰的网上预订票的介绍，说明，提示，景区人数动态信息。相比较贵州黄果树景区大数据管理，体验感差的不是一点半点。
2，通往安澜索桥等交通关键点通行管理不科学。
景区索桥排队时间长、太长。不是一般的长，上下山原本就很累了，还要站着排队几个小时，无论是东北门进入还是南门进入，不管是先下山过桥还是过桥再上山，20-30岁小伙子转一圈下来，都喊遭不住哦！
建议排队就排单排，双向鱼贯而过，不要扎堆，保障大家都在走，三四人一排，看似队伍不长，但是通过效率太低。
3，景区内外部人车管理不科学。
自驾游停车难、客流疏导不科学。
都江堰原本就是依山而建的5A级景区，但是周边人车混行，单向通行管制少，上下客不方便，停车难，自驾车体验很差。与其这样半开放式管理，不如适当予以集中封闭管理，统一设置景区内部交通，除滑杆自费外，剩余景区内外各点到游客中心停车场，均采用景区电瓶车，凭身份证免费乘坐，对于年轻人，老弱病残孕等，丰俭由人。
4，水利科普严重缺位。
作为古今闻名的水利枢纽设施，仅有的水利文化馆，内容几何？，科学价值几何？，科普意义几何？这么大人流，这么多青年人，未成年，水利文化缺位啊！！
5，景区宏观的服务管理欠缺。
如，没有总体游览图。",,IP属地:四川,,,都江堰差评
187****6867,钻石贵宾,1分,不佳,景色3,趣味1,性价比1,下单预定的是2.5小时的讲解，实际仅讲解1个小时，然后导游说剩下的1.5小时是陪同往返走路的，在携程预定了多次讲解服务，这是最最最最最差的一次，没有之一，仅有唯一，强烈建议携程把这种无良商家清除出平台，简直是影响携程的整体,来自订单,IP属地:四川,,,都江堰差评
大江大河我要去看一看,铂金贵宾,1分,不佳,景色1,趣味1,性价比1,真的是被携程和*****恶心到了，支付了讲解费用，结果到了讲解处告诉我不可以，让我找携程，互相推诿，**,来自订单,IP属地:四川,,,都江堰差评
小袋鼠小老鼠,钻石贵宾,1分,不佳,景色1,趣味1,性价比1,人挤人，过桥排队要 3 小时，表演都看不到,来自订单,IP属地:四川,,,都江堰差评
匿名用户,铂金贵宾,1分,不佳,景色4,趣味3,性价比1,真对不起这5A级的名声。一路上的路线图真不知道是什么人设计的，看的一头雾水，总是看到一堆人围着研究半天，而且路线图有的已经破旧模糊了，也不及时更换。另外，非要把停车场搞的那样远，而且还要花每人20元坐观光车到山门，不会再推荐朋友来这里，你不尊重游客，游客为啥要来支持你。,来自订单,IP属地:四川,,,都江堰差评
匿名用户,铂金贵宾,2分,一般,景色4,趣味3,性价比2,一般，人太多了，导游也没跟完两岸，说话也听不太清,来自订单,IP属地:四川,,,都江堰差评
M25****9428,黄金贵宾,1分,不佳,景色4,趣味1,性价比1,"买了门票加演出票，结果进门后，问了好多人，包括服务人员，竟然不知演出地点。按给的导航走，竟然不是的，没看成，还没法退票。
门票加演出票，慎买！",来自订单,IP属地:四川,,,都江堰差评
,,1分,不佳,景色1,趣味1,性价比1,这个破地方景色非常一般，说是耍人文，结果景区管理差的要死，各种堵塞，出景区吃饭也是一样拥堵，整个行程基本靠走，停车不是一般的困难！这破地方下次给我钱我也不来，结果2大1小门票200，人文讲解120，但都是狗屎,来自订单,IP属地:四川,,,都江堰差评
大江大河我要去看一看,铂金贵宾,2分,一般,景色4,趣味1,性价比1,千万不能买这个套票，讲解是散拼一定都不好,来自订单,IP属地:四川,,,都江堰差评
,,1分,不佳,景色1,趣味1,性价比1,太差太差太差,来自订单,IP属地:四川,,,都江堰差评
M44****6393,铂金贵宾,1分,不佳,,,,堵死了，调度分流完全跟不上，交警还不让进路口，只能坐黑车上，赶紧倒闭,,IP属地:四川,,,都江堰差评
匿名用户,黄金贵宾,2分,一般,景色5,趣味3,性价比1,景区无序化管理 秦宴楼入口进出人员相互拥挤 进景区一验票小时 进来下到景区一小时 过桥两小时 太没有体验感了 差评,来自订单,IP属地:四川,,,都江堰差评
,,1分,不佳,景色1,趣味1,性价比1,就是来看人，排队做观光车50分钟，走路都只要20分钟。也没人引导一下队伍过长，排队不划算，就给你排着赚那个观光车费吗。5A真没啥意思。还80门票，真对不起这门票钱。也没啥可玩的。不推荐，没几分钟就逛完了,来自订单,IP属地:四川,,,都江堰差评
,,1分,不佳,景色1,趣味1,性价比1,没什么可玩的,来自订单,IP属地:四川,,,都江堰差评
匿名用户,铂金贵宾,2分,一般,景色4,趣味2,性价比1,特意买的两个半小时讲解 实际讲解一个半小时都不到 多次确认我下的两个半小时的单 讲解一直说景点很小 一个小时足够  非常不值 讲解很敷衍 潦草  都江堰景点本身很值得来,来自订单,IP属地:江苏,,,都江堰差评
203****100,铂金贵宾,1分,不佳,景色4,趣味4,性价比3,自己包团导游，已经多次确定时间，临时进行导游替换，不同意更改后导游让我们多等了近40分钟。非常差的一次体验。建议大家擦亮选择携程代理的旅行社。,来自订单,IP属地:四川,,,都江堰差评
,,1分,不佳,景色4,趣味1,性价比1,两个半小时的讲解，一个小时完事，帮买景区的小交通还加价了，自己买的15往返，帮买15单程，不好,来自订单,IP属地:四川,,,都江堰差评
匿名用户,黄金贵宾,1分,不佳,景色1,趣味1,性价比1,因临时有事不能去了，平台退不了票，白白损失了,来自订单,IP属地:四川,,,都江堰差评
tim****5765,铂金贵宾,1分,不佳,景色1,趣味1,性价比1,携程靠抢劫诈骗发家致富！,来自订单,IP属地:浙江,,,都江堰差评
匿名用户,,1分,不佳,景色1,趣味1,性价比1,不值得千万不要去，宣传的夜景只有南桥，景区5点半就闭园，景区东西很贵,来自订单,IP属地:四川,,,都江堰差评
M43****4367,,1分,不佳,景色1,趣味1,性价比1,性价比不高,来自订单,IP属地:湖南,,,都江堰差评
博博ovo。,铂金贵宾,1分,不佳,景色1,趣味1,性价比1,不好玩没意思 纯浪费时间，并且门口一堆黑导游很不满意 一点看不出五星景区,来自订单,IP属地:四川,,,都江堰差评
匿名用户,铂金贵宾,2分,一般,景色5,趣味2,性价比2,原本为了更好的体验特地订了一个贵的VIP小团2.5小时讲解，结果全程半小时结束。一路上匆匆忙忙，带我们坐了景区游览车，结束时候还收了钱。半小时就讲了半边景区。我们自己从鱼嘴过桥以后发现从秦堰楼进来的讲解景区全部景区都会讲解。景区是值得看，但是花了更高价钱却没有享受到更好地服务，太减分了。,来自订单,IP属地:陕西,,,都江堰差评
匿名用户,黄金贵宾,1分,不佳,景色1,趣味1,性价比1,"一如途中某个导游说的：这儿的工作人员拿的是死工资，到点就下班，厕所都卷帘门拉上！
事实正是如此，外加天黑沿途无照明路灯！
多数都是后造的人工景点，看着就没美感，，，宝瓶口和鱼嘴2个水利景点相对较好的拍摄位置，都被景区卖给了私人拍摄小店。

80元门票，景点风景最多5元，剩下的都是情怀。
最差的5A景点，没有之一！",来自订单,IP属地:江苏,,,都江堰差评
匿名用户,铂金贵宾,2分,一般,景色3,趣味3,性价比3,果真套餐都…,来自订单,IP属地:上海,,,都江堰差评
一个人的路在路灯,黄金贵宾,1分,不佳,景色4,趣味1,性价比1,纯垃圾，没入园到期了门票还不给退。。。。。。。。。。。。。。。。。。。。。。。。。。。。。。。。。。。。。。。。。。。。。,来自订单,IP属地:河北,,,都江堰差评
小胖,钻石贵宾,1分,不佳,景色5,趣味5,性价比1,携程上明确注明2.5小时，而我们从停车场到景点结束正好一小时。,来自订单,IP属地:四川,,,都江堰差评
M54****2790,,1分,不佳,景色1,趣味1,性价比1,不给退票。。,来自订单,IP属地:四川,,,都江堰差评
李楠的评论,黄金贵宾,2分,一般,景色3,趣味2,性价比3,没什么意思,来自订单,IP属地:重庆,,,都江堰差评
201****126,铂金贵宾,2分,一般,景色2,趣味2,性价比2,周润发我们的发哥是不是去了都江堰啊！好像遇到了呢，他手帕是蓝色的毛巾帕，掉地上了。哈哈。我一看，这不就是可爱的发哥吗？哈哈，风景没啥看的，好失望。,来自订单,IP属地:重庆,,,都江堰差评
M30****1321,钻石贵宾,1分,不佳,景色3,趣味1,性价比1,这辈子不可能再来了，等个观光车等一个多小时,来自订单,IP属地:四川,,,都江堰差评
shuaifei PEI,铂金贵宾,1分,不佳,景色1,趣味1,性价比1,在都江堰被坑了，我对都江堰商家真的服了,来自订单,IP属地:陕西,,,都江堰差评
M39****560,铂金贵宾,1分,不佳,景色3,趣味2,性价比1,订票信息客服和导游没有核对清楚，导致门票差价不能退，事后未协调处理，没有责任心，服务很差,来自订单,IP属地:浙江,,,都江堰差评
M22****9291,铂金贵宾,1分,不佳,景色1,趣味1,性价比1,最差的一次旅游体验，没有之一。各位朋友记住了，千万不要买携程推出的都江堰讲解服务，真是太坑人了！我们在下午2点半到达了集合地点，拿到了耳机，但没想到人越来越多，一个导游竟然带了黑压压一堆人，得有好几十。然后一个非常恶俗的穿着牛仔服的短头发女人带着队伍出发，这让人很膈应，觉得这种街溜子似的人竟然能当导游？更不可思议的是这个导游竟然丝毫不管队伍有没有跟上，自己进了景区就急急忙忙往前赶了，丝毫不顾有好多人还堵在检票口。等我们进去了导游早就没影了，五六个人面面相觑不知何去何从。电话联系卖票方，面对我们的愤怒给的解决方案是让我们在门口等下一个导游，那好那就等吧，等了一会儿终于来了，一个光头油腻男，边解说边发表自己的评论，很不专业，而且也是着急忙慌往前赶，整个队伍都听得一知半解，走着走着都放弃了对解说的期待，只想尽快结束这恶心的旅程。最后终于结束了，大家都迫不及待地还耳机退押金，如释重负。总体就是这样，真不知道这种野生导游团体是怎样登录携程平台的，这些天用这么劣质的服务坑了多少钱？,来自订单,IP属地:甘肃,,,都江堰差评
水獭麻麻,铂金贵宾,1分,不佳,景色1,趣味1,性价比1,景点疏散人流能力不行，就过个桥人都排到出口了，出了门还没车，都被管制了，走很远很远才能打车。如果看都江堰，一定避开暑假和大节。,来自订单,IP属地:四川,,,都江堰差评
神农架州吁,,1分,不佳,景色1,趣味1,性价比2,不是随时自动取消退，容易踩坑,来自订单,IP属地:四川,,,都江堰差评
树清凡,钻石贵宾,1分,不佳,景色3,趣味1,性价比1,人太多了没法玩,来自订单,IP属地:山西,,,都江堰差评
浩钊天下,黄金贵宾,1分,不佳,景色1,趣味1,性价比1,作为一个5A级风景区，景区的道路破损不堪，规划一塌糊涂。停车场外包出去，然后骗我们说进入景区的道路交通管制，不让开车进入。让停在滑雪场内打车过去。幸好没听他的，停了30分钟收费20，游玩出来一台车不是好几百？计时收费。好似提了把砍刀在门口等你！进入景区5.6公里的路程开车一个半小时，到了门口不让转，又让去绕一个大圈，丝毫不会考虑游客的时间成本！由于时间关系，在外面找个停车点，1公里路程，花费10元，步行！进入景区，标识不清，也没有工作人员引导！原本3点就到的景区附近，结果被骗去停车场，然后堵了一个半小时，终于在即将关闭入口时进入，天已经快黑了！又下起了小雨！观光车售票点也下班了！好吧，步行！天越来越黑。景区内居然没有照明灯！过吊桥也没有工作人员指挥或者提示注意事项，有些人就故意在吊桥上晃！一旦发生意外，后果可想而知！总之，如果对水利方面没有知识的话，那这个点，不去也罢！旅游最怕搞得一肚子气！,来自订单,IP属地:四川,,,都江堰差评
M50****0645,铂金贵宾,1分,不佳,景色1,趣味1,性价比1,"请了个1V1导游，全程下来给娃儿讲解内容不超过20分钟左右，太水了，我听很多其他导游讲到的这个导游都没讲。
整体景区很混乱，上个桥都要排队两个小时，太坑爹了",来自订单,IP属地:四川,,,都江堰差评
,,1分,不佳,景色1,趣味1,性价比1,简直无语了，就是倒卖高价门票，讲解差到极致，都不如电子讲解，完全不顾团队人员，一路小跑，就是为了到鱼嘴收麦，别说拍照，压根还没看到要讲解的地方人都走了，一路上追，耳麦因为讲解走太快距离原因根本啥也没听到，团队人员喊着，根本不管不顾。一到经典就说不会带你去，因为人太多，感觉要要么你直接高价卖算了，还整个这噱头，搞得大家没有体验感。,来自订单,IP属地:四川,,,都江堰差评
,,1分,不佳,,,,这里的工作人员太糟糕，一点都不人性,,IP属地:四川,,,都江堰差评
匿名用户,铂金贵宾,1分,不佳,景色1,趣味1,性价比1,体验感极差,来自订单,IP属地:四川,,,都江堰差评
匿名用户,黄金贵宾,1分,不佳,景色3,趣味1,性价比1,游客多，全程都在排队，还有些路不能走，容不了那么多人就不要放那么多人进入，工作人员服务态度差！体验感不好，桥挺有意思的，小朋友喜欢！,来自订单,IP属地:四川,,,都江堰差评
,,1分,不佳,景色1,趣味1,性价比1,最坑的购票，其它平台未使用可退，这个由于途中景区人太多实在赶不及进场申请改期，就赚游客这个钱，不退不改，真的很无语??上次西藏也是商家虚假宣传，定酒店送当天预约布达拉宫门票，结果做不到忽悠我们跑机场浪费一晚还错过了布达拉宫门票，管理太差劲，再也不用这平台，果断卸载了??,来自订单,IP属地:四川,,,都江堰差评
匿名用户,铂金贵宾,1分,不佳,景色1,趣味1,性价比1,买了往返直通车，返程在约定地点约定时间没有车，重新打车回市区，坑，非常不建议订,来自订单,IP属地:四川,,,都江堰差评
,,2分,一般,景色2,趣味2,性价比2,很无聊门票又贵，电瓶车都是老人家坐，搞笑,来自订单,IP属地:福建,,,都江堰差评
,,1分,不佳,景色3,趣味1,性价比2,太小了，一小时逛完,来自订单,IP属地:四川,,,都江堰差评
M34****297,钻石贵宾,2分,一般,景色5,趣味1,性价比1,解说非常不专业，缺乏本地相关的历史、文化知识储备，游客若要咨询到本地有什么好吃的餐馆（旅游景区之外），疑被引导消费（推荐了“周鸡肉”、和南桥旁景区的饭店），没采纳其建议就给脸色、说话很难听。整个行程只讲解了1.5小时。一次极为不好的消费体验,来自订单,IP属地:四川,,,都江堰差评
_CFT0****4046,铂金贵宾,1分,不佳,景色1,趣味1,性价比1,没什么看的,来自订单,IP属地:陕西,,,都江堰差评
M34****4357,,2分,一般,景色4,趣味2,性价比1,这个还是一样，当时网上约的团带讲解！感觉有点坑！我们2大2小，门票不贵，在网上预约下来就多出了2倍的钱！感觉被坑了,来自订单,IP属地:陕西,,,都江堰差评
M35****7106,,1分,不佳,景色1,趣味1,性价比1,自己看图 垃圾景区 垃圾工作人员,来自订单,IP属地:四川,,,都江堰差评
风舞青杨,铂金贵宾,1分,不佳,景色4,趣味1,性价比1,总体来说非常不好！,来自订单,IP属地:辽宁,,,都江堰差评
小傲娇零蛋,黄金贵宾,2分,一般,景色3,趣味3,性价比3,"雨天去的 人特别多  导游一路讲解很好 值得去 
被蚊子叮了一个小包  蓝湖可以去一下 手机上拍照跟网上看到的一样 人超级多",来自订单,IP属地:甘肃,,,都江堰差评
匿名用户,,1分,不佳,景色1,趣味1,性价比1,非常垃圾 跟50块钱大团的讲解内容一样 就是普通当地导游 整个过程只想着怎么多收费 震惊于成都消费行业整体的垃圾水平 避雷吧,来自订单,IP属地:四川,,,都江堰差评
M56****087,铂金贵宾,1分,不佳,景色1,趣味1,性价比1,垃圾景区，有桥不让过,来自订单,IP属地:四川,,,都江堰差评
飞行家摩客,黄金贵宾,2分,一般,景色3,趣味4,性价比4,非常古典和古老的一个景区了，太美了，很好玩的地方,,IP属地:辽宁,,,都江堰差评
M19****469,,2分,一般,景色5,趣味2,性价比1,买的回程缆车要排队一个小时，醉了。更关键的是竟然不给退票，必须差评！,来自订单,IP属地:四川,,,都江堰差评
匿名用户,铂金贵宾,2分,一般,景色2,趣味1,性价比1,去过国内国内那么多景点，都江堰基本可以排在倒数最差的范围…好的是历史文化底蕴，是古人修建的水利工程，和现代人一点屁关系都没有！景点管理混乱，遍地的野导游和质量很差的景点卖货店，人多混乱管理差的无法形容，和四川这个旅游大省一点都不匹配…那可怜的栈桥在超载超负荷下还能坚持真不容易…最差的是景区的观光车，15块往返的价格看着不贵，距离有多远，排队时间有多长有没有人管？景区超载不限流吗？太差了,来自订单,IP属地:四川,,,都江堰差评
_WeCh****36878,铂金贵宾,1分,不佳,景色3,趣味1,性价比1,看了地图看到离堆公园这个出入口有无障碍通道特意找的这个入口去问，推个婴儿车去问买票说买了马上可以用，只字不提婴儿车上不去阶梯，进门只能逛公园，花80看坑坑洼洼的公园，打工作号客服问有没有无障碍通道，人家拽得很说只能逛公园，我说我可以退票出去不，非常拽的说不可以还说啥几A景区都推不到婴儿车，意思还是我的错，垃圾景区垃圾服务，还不如晚上的灯光水,来自订单,IP属地:四川,,,都江堰差评
M57****2267,黄金贵宾,1分,不佳,景色4,趣味3,性价比1,建议不要坐什么观光巴士，自己开车或者高铁过去，时间好掌控在自己手里，游游玩时间不超过两小时,来自订单,IP属地:四川,,,都江堰差评
匿名用户,黄金贵宾,1分,不佳,景色1,趣味1,性价比1,携程紫金花旅游纯属欺骗，奉劝大家谨慎选择,来自订单,IP属地:湖南,,,都江堰差评
小-肥-牛,,1分,不佳,景色3,趣味3,性价比1,人多如牛毛，体验感极差，性价比极低！,来自订单,IP属地:四川,,,都江堰差评
M36****9578,铂金贵宾,2分,一般,景色5,趣味2,性价比2,如果没有导游，真的不建议来，没什么观赏性,来自订单,IP属地:上海,,,都江堰差评
匿名用户,,1分,不佳,景色4,趣味1,性价比1,"1，态度恶劣，游客问的问题，导游都觉得弱智，回答都很粗鲁。
2，提前结束讲解，应该是在二王庙结束，但是以人多需要排队过索桥为由，如果是这样的话，应该退部分钱给我们。
3，旅途过程中，一直提及80元的导游费，本身导游水平就有限，一直提及，反而让人觉得更加不值。
总结，态度极为恶劣，携程可以对平台的导游进行评级和考核。或者进行分级，游客可以根据经济能力进行选择。
说实话，80元一个人的导游费，确实不便宜。
请携程认真考虑。
毕竟，我使用携程快10年了，不要伤害每一个客户的心。",来自订单,IP属地:北京,,,都江堰差评
M50****9342,黄金贵宾,1分,不佳,景色5,趣味5,性价比1,不退票什么意思,来自订单,IP属地:四川,,,都江堰差评
匿名用户,铂金贵宾,2分,一般,景色5,趣味4,性价比2,太塞车了，那么好的地方，交通太拥挤，希望领导重视，管理好交通。,来自订单,IP属地:四川,,,都江堰差评
M21****990,铂金贵宾,2分,一般,景色3,趣味1,性价比1,第四次来这个地方了，一切还是老样子，景区除了网上订票，就没什么服务，这次我是反方向先上青城山再看水利工程的，到了飞沙堰不让走吊桥返回离堆，硬生生让走到远处的停车场，水泥路边杂草丛生，旁边一堵墙，哪像五A景区？完全就是用游客不掏钱的时间去分流，票价和游客那么多就不能再建个吊桥吗？鱼嘴和青城山的吊桥巨堵,来自订单,IP属地:陕西,,,都江堰差评
M50****1534,,2分,一般,景色2,趣味2,性价比2,压根没去，钱也没给退,来自订单,IP属地:四川,,,都江堰差评
来须苍真soma,黄金贵宾,1分,不佳,景色5,趣味1,性价比3,这个地方没有点专业知识，听讲解也不一定能明白到底讲了啥，景点就是都江堰口水利口，景区内其余感觉就没啥可玩的，要不是5a景区不计划去，去了感觉有点不值,来自订单,IP属地:四川,,,都江堰差评
137****2796,铂金贵宾,1分,不佳,景色1,趣味1,性价比1,最坑人景区,来自订单,IP属地:四川,,,都江堰差评
M22****7805,黄金贵宾,1分,不佳,景色1,趣味1,性价比1,性价比很低,来自订单,IP属地:四川,,,都江堰差评
匿名用户,铂金贵宾,2分,一般,景色4,趣味1,性价比1,景区路线设计不合理,来自订单,IP属地:四川,,,都江堰差评
M23****6968,铂金贵宾,1分,不佳,景色3,趣味1,性价比1,"电瓶车正中午的时候，游客都在太阳底下暴晒等候，司机们在轮流吃饭！
一元一根的老冰棍，景区里面是五元。三元一瓶的绿茶，景区里面8元。纯粹宰客！",来自订单,IP属地:重庆,,,都江堰差评
vic****yhj,黄金贵宾,2分,一般,景色4,趣味2,性价比3,景区开发商整体规划太差，应对暑期客流量大，未有动线分流措施，多处游客拥挤，安全隐患多，各方面基础配套不足，且景区内消费太浮夸，一瓶5元的饮料能卖到27元。,来自订单,IP属地:四川,,,都江堰差评
匿名用户,钻石贵宾,2分,一般,景色4,趣味3,性价比1,携程这个讲解真的糟心，导游提前电话嘱咐不要迟到，结果当天出发晚了20分钟连句解释都没有，购票规则写了晚到自行和导游会和，那导游就能随意为了等个别客人整个团晚出发？后面还是电话催了才出发；路上一直赶时间走得飞快，这两天景区人特别多，还那么多打伞的，中途也不管大家跟没跟上，耳机先是杂音后面也没声音，这都算了，打电话问去哪找导游结果先被一通埋怨为什么走得远了叨叨半天才说要去哪里找，见了面又是一顿被指责耳机不好使你先跟他说，我也得能找到你在哪啊，但最重要的是不准时出发，毫无歉意，对守时的客人也不公平，携程作为平台不能只要求客人遵守规定，而对执行方毫无约束！,来自订单,IP属地:四川,,,都江堰差评
AKA阿狼,钻石贵宾,1分,不佳,景色4,趣味1,性价比1,怎么说呢，就是到处都是人，连丫的地图都找不到信号，去看什么？看离堆看鱼嘴？好的地方都圈起来付费拍照了，你去了只能在人群之中找个空隙钻进去赶紧拍两张，本人十年前来过，这次陪对象来没办法，奉劝那种想自己出去玩旅游的人不要选这种，如果我自己我是万万不会来的，在家看纪录片不好吗？有空调有吃个，看看纪录片还有讲解,来自订单,IP属地:四川,,,都江堰差评
匿名用户,钻石贵宾,2分,一般,景色4,趣味2,性价比1,交通组织极差无比，堵车一两个小时。,来自订单,IP属地:四川,,,都江堰差评
300****860,铂金贵宾,1分,不佳,景色1,趣味1,性价比1,这个景区强烈推荐不去,来自订单,IP属地:新疆,,,都江堰差评
匿名用户,,1分,不佳,景色5,趣味2,性价比2,导游估计是临时找来对付的，只是简单介绍了一下是那个景点。典故什么的一概没讲。看着其他旅行社讲的，一对比差的太远了。,来自订单,IP属地:四川,,,都江堰差评
匿名用户,铂金贵宾,1分,不佳,景色5,趣味3,性价比1,景区没有任何问题，都江堰和青城山共160，联票154，如果有临时闭园的情况，单独买可以退票，联票是不行的。客服电话也打不通，各位选择联票慎重。,来自订单,IP属地:四川,,,都江堰差评
